title,date,morphs,tokens
정비사업 물량 줄섰는데…잇단 사고에 건설사도 조합도 '난감',2023-07-11 06:48:01,수주 잇따르 공사비 부담 데일리안 하반기 정비 조합 뉴시스 하반기 정비 조합 부실시공 추진 정비 압구정 재건축 개발 잇따르 시공사 절차 수주 치열 용산구 구역 아파트 개발 삼성물산 뉴타운 구역 역시 수주 공사비 최근 수주 수주 건설사 상반기 수주 들어서 알짜 지만 잇따르 부실시공 붕괴 아파트 지하 주차장 붕괴 사고 역시 교통부 맞물리 발생 중대 재해 지만 여전히 미연 건설업 넘어가 넘어가 악재 수주 재건축 조합 건설사 수주 불안 재건축 시공사 슈가 살펴보 사업장 역시 사업 공사비 아서 시공사 안고 어서 조합원,수주 잇따르 공사비 부담 데일리안 하반기 정비 조합 뉴시스 하반기 정비 조합 부실시공 추진 정비 압구정 재건축 개발 잇따르 시공사 절차 수주 치열 용산구 구역 아파트 개발 삼성물산 뉴타운 구역 수주 공사비 수주 수주 건설사 상반기 수주 들어서 알짜 지만 잇따르 부실시공 붕괴 아파트 지하 주차장 붕괴 사고 교통부 맞물리 발생 중대 재해 지만 여전히 미연 건설업 넘어가 넘어가 악재 수주 재건축 조합 건설사 수주 불안 재건축 시공사 슈가 살펴보 사업장 사업 공사비 아서 시공사 안고 조합원
"또 부실공사, 지하 주차장이 무너졌다 [기자들의 시선]",2023-07-11 07:01:00,발생 정리 ㅂ니다 주의 으로 더불어민주당 제출 넘어서 원리금 숫자 꾸준히 에서 대출자 만원 다는 호서대 아파트 지하 주차장 점검 주의 결정 아파트 지하 주차장 지하 주차장 에서 교통부 붕괴 주요 어야 불구 에서 결정 통감 ㄴ다 주의 위성 시작 오토 시작 선언 이란 나오,발생 정리 주의 더불어민주당 제출 넘어서 원리금 숫자 꾸준히 대출자 만원 호서대 아파트 지하 주차장 점검 주의 결정 아파트 지하 주차장 지하 주차장 교통부 붕괴 주요 어야 불구 결정 통감 주의 위성 시작 오토 시작 선언 이란 나오
"중흥건설·중흥토건, 국토부 상호협력평가 ‘최우수 기업’ 선정",2023-07-11 07:05:01,중흥 연속 우수 중흥 단계 중흥 신혜 기자 중흥 중흥 국토 교통부 에서 실시 최우 기업 중흥 최우 기업 중흥 단계 상승 기업 국토부 산업 제도로 개발 신인도 중흥 중흥 감사패 인센티브 기회 중흥 올해 최우 대기업 중흥 한화,중흥 연속 우수 중흥 단계 중흥 신혜 기자 중흥 중흥 국토 교통부 실시 최우 기업 중흥 최우 기업 중흥 단계 상승 기업 국토부 산업 제도로 개발 신인도 중흥 중흥 감사패 인센티브 기회 중흥 올해 최우 대기업 중흥 한화
"한화증권 ""GS건설 '자이' 브랜드 경쟁력 확인 필요"".. 목표가 하향",2023-07-11 08:15:01,기존 에서 불확실성 보수 투자 아파트 불확실성 연구원 전환 기존 공사비 공사비 입주 관련 아파트 지하 주차장 관련 시공사 계획 계획 연구원 결정 불구 불확실성 행정 부동산 재무 필요 연구원 기존 에서 제시 아파트 이루어지 유효,기존 불확실성 보수 투자 아파트 불확실성 연구원 전환 기존 공사비 공사비 입주 아파트 지하 주차장 시공사 계획 계획 연구원 결정 불구 불확실성 행정 부동산 재무 필요 연구원 기존 제시 아파트 이루어지 유효
"GS건설, 역사적 저평가 구간이나 불확실성 해소 아직…목표가↓-유안타",2023-07-11 08:22:01,이데일리 유안타증권 교통부 중순 해당 조사 행정 유안타증권 연구원 보고서 에서 매수 으로 유안타증권 동기 전년 전환 결정 관련 공시 역시 더불 베트남 개발 사업 실적 연구원 발주 대보 충당금 내다보 이어 결정 계획 있다 이번 인하 사업 수주 위축 부동산 상존 상황,이데일리 유안타증권 교통부 중순 해당 조사 행정 유안타증권 연구원 보고서 매수 유안타증권 동기 전년 전환 결정 공시 더불 베트남 개발 사업 실적 연구원 발주 대보 충당금 내다보 결정 계획 인하 사업 수주 위축 부동산 상존 상황
"롯데건설, 올 상반기 관심도 상승률 1위…현대엔지니어링 호감도 ‘Top’",2023-07-11 08:23:01,상승 실수요자 걸음 데이터 확인 부동산 상승 에서 현대엔지니어링 리서치 뉴스 커뮤니티 카페 유튜브 블로그 트위터 인스타그램 페이스북 카카오스토리 지식인 기업 조직 상반기 국내 정보량 관심도 데이터 교통부 롯데건설 삼성물산 오세철 대우건설 상반기 롯데건설 정보량 관심도 상반기 아파트 청량리 롯데캐슬 올여름 건물 어서 니다 상반기 입주 롯데캐슬 아파트 ㄹ까요 에서 려나 테라스 상반기 정보량 포스코 동기비 상승 부동산 관련 카페 광주광역시 남구 궁금 포스코 많이 세가 아서 포스코 상반기 동기 늘어나 정보량 에서 프로젝트 수주 커뮤니티 채널 다수 커뮤니티 채널 루리웹 현대건설 중동 궁합 티어 현대엔지니어링 상승 건설 상승 랭크 동기 상승 역시 삼성물산 대우건설 동기 발생 온라인 데이터 리서치 실시 소비자 에서 상승 현대엔지니어링 현대엔지니어링 긍정 디시인사이드 부동산 확실히 복이 을걸 괜찮 상승 롯데건설 호감 호감 커뮤니티 채널 뽐뿌 고삐 재해 상반기 호감 상승 포스코 상반기 호감 랭크 호감 대우건설 호감 현대산업개발 차감 현대산업개발 상반기 폭풍 으로 곤두박질치 회복세 호감 호감 삼성물산 호감 상승 상승 실수요자 데이터 있다,상승 실수요자 걸음 데이터 확인 부동산 상승 현대엔지니어링 리서치 뉴스 커뮤니티 카페 유튜브 블로그 트위터 인스타그램 페이스북 카카오스토리 지식인 기업 조직 상반기 국내 정보량 관심도 데이터 교통부 롯데건설 삼성물산 오세철 대우건설 상반기 롯데건설 정보량 관심도 상반기 아파트 청량리 롯데캐슬 올여름 건물 니다 상반기 입주 롯데캐슬 아파트 ㄹ까요 려나 테라스 상반기 정보량 포스코 동기비 상승 부동산 카페 광주광역시 남구 궁금 포스코 세가 아서 포스코 상반기 동기 늘어나 정보량 프로젝트 수주 커뮤니티 채널 다수 커뮤니티 채널 루리웹 현대건설 중동 궁합 티어 현대엔지니어링 상승 건설 상승 랭크 동기 상승 삼성물산 대우건설 동기 발생 온라인 데이터 리서치 실시 소비자 상승 현대엔지니어링 현대엔지니어링 긍정 디시인사이드 부동산 확실히 복이 을걸 괜찮 상승 롯데건설 호감 호감 커뮤니티 채널 뽐뿌 고삐 재해 상반기 호감 상승 포스코 상반기 호감 랭크 호감 대우건설 호감 현대산업개발 차감 현대산업개발 상반기 폭풍 곤두박질치 회복세 호감 호감 삼성물산 호감 상승 상승 실수요자 데이터
"GS건설, 재시공비 5500억원…목표주가 3.1만→1.6만원-한화투자",2023-07-11 08:35:01,정진욱 아파트 지하 주차장 관련 통감 ㄴ다 아파트 한화투자증권 제시 목표 기존 에서 한화투자증권 동기 으로 전환 공사비 공사비 입주 관련 계획 공시 결정 불구 불확실성 아니 행정 있다 부동산 재무 있다 연구원 장기 로서 비관 바라보 섣부르 밝히 경영진 불확실성,정진욱 아파트 지하 주차장 통감 아파트 한화투자증권 제시 목표 기존 한화투자증권 동기 전환 공사비 공사비 입주 계획 공시 결정 불구 불확실성 아니 행정 부동산 재무 연구원 장기 로서 비관 바라보 섣부르 경영진 불확실성
“걸어가면 다 있다” 입주자 마음 사로잡은 조건 1순위,2023-07-11 08:36:01,교육 인프라 상승 이데일리 실수요자 인프라 힐스테이트 사진 현대엔지니어링 데이터 기반 리서치 기업 아파트 중점 ㅂ니까 인프라 내부 수요자 에서 동일 어느 공원 아파트 차지 보안 아파트 커뮤니티 학군 아파트 청약 시장 에서 인프라 쏠리 가구 모집 청약 몰리 어서 운정호수공원 센트럴 모집 청약 인프라 롯데건설 개발 구의역 롯데캐슬 이스트 구의역 강변북로 가구 ㄴ다 현대엔지니어링 일원 에서 힐스테이트 가구 속초 어서 인프라 건설 현대산업개발 에서 아이파크 단지 어서 가구 선호도 있다 부동산 상승 으로,교육 인프라 상승 이데일리 실수요자 인프라 힐스테이트 사진 현대엔지니어링 데이터 기반 리서치 기업 아파트 중점 ㅂ니까 인프라 내부 수요자 동일 어느 공원 아파트 차지 보안 아파트 커뮤니티 학군 아파트 청약 시장 인프라 쏠리 가구 모집 청약 몰리 운정호수공원 센트럴 모집 청약 인프라 롯데건설 개발 구의역 롯데캐슬 이스트 구의역 강변북로 가구 현대엔지니어링 일원 힐스테이트 가구 속초 인프라 건설 현대산업개발 아이파크 단지 가구 선호도 부동산 상승
"한화證 “GS건설, 2분기 대규모 손실 반영으로 적자전환...목표주가 하향”",2023-07-11 08:38:01,결정 아파트 지하 주차장 관련 통감 ㄴ다 아파트 연구원 전년 동기 감소 영업 공사비 공사비 입주 관련 있다 연구원 부동산 재무 장기 ㄴ다 경영진 불확실성 ㄴ다 유효,결정 아파트 지하 주차장 통감 아파트 연구원 전년 동기 감소 영업 공사비 공사비 입주 연구원 부동산 재무 장기 경영진 불확실성 유효
"""GS건설 악재, 업계 주택·건축 원가율 부담 키울수도""-유안타",2023-07-11 08:45:01,아파트 모습 경우 악재 건설업 다는 김기룡 유안타증권 연구원 이번 붕괴 밝히 연구원 이번 교통부 예단 조사 역시 에서 ㄴ다 악의 인하 다고 전망 연구원 다시금 회복세 ㄴ다 라는 수주 경쟁사 있다 인하 불확실성 실적 흐름 프로젝트 포인트 ㄴ다면 해외 모멘텀 소멸 멀티플 영역 ㄴ다 연구원 각각 전년 동기 감소 결정,아파트 모습 경우 악재 건설업 김기룡 유안타증권 연구원 붕괴 연구원 교통부 예단 조사 악의 인하 다고 전망 연구원 다시금 회복세 라는 수주 경쟁사 인하 불확실성 실적 흐름 프로젝트 포인트 ㄴ다면 해외 모멘텀 소멸 멀티플 영역 연구원 각각 전년 동기 감소 결정
한화證 “GS건설 목표주가 하향…'자이' 브랜드 신뢰도 하락”,2023-07-11 08:55:03,의견 매수 아파트 지하 주차장 관련 시공사 계획 아파트 연합뉴스 서울경제 아파트 지하 주차장 붕괴 사고 주가 보고서 에서 기대치 기존 에서 역시 매수 에서 연구원 동기 전환 공사비 공사비 입주 관련 공시 기존 원대 연구원 건설 행정 연구원 재무 장기 필요 라고 연구원 로서 비관 바라보 섣부르 경영진 불확실성,의견 매수 아파트 지하 주차장 시공사 계획 아파트 연합뉴스 서울경제 아파트 지하 주차장 붕괴 사고 주가 보고서 기대치 기존 매수 연구원 동기 전환 공사비 공사비 입주 공시 기존 원대 연구원 건설 행정 연구원 재무 장기 필요 라고 연구원 로서 비관 바라보 섣부르 경영진 불확실성
'이차전지 특화단지 지정' 정치적 나눠먹기 안돼!,2023-07-11 09:08:01,글로벌 패권 전지 라는 신청 최근 김기현 울산 남구 대표 심사 강력 울산 점수 있다 김기현 대표 인터뷰 ㄴ다 논리 이차 전지 글로벌 있다 이차 전지 관련 최고 인프라 시민 국내 인프라 포스코퓨처엠 달성 에너지머티리얼즈건설의 산업단지 전후 기업 과학 연구원 가속기 포항테크노파크 진흥원 폴리텍마이스트고 양성 전지 집약 고도 근거 이루어지 ㄴ다 포항테크노파크 에서 파포먼스를,글로벌 패권 전지 라는 신청 김기현 울산 남구 대표 심사 강력 울산 점수 김기현 대표 인터뷰 논리 이차 전지 글로벌 이차 전지 최고 인프라 시민 국내 인프라 포스코퓨처엠 달성 에너지머티리얼즈건설의 산업단지 전후 기업 과학 연구원 가속기 포항테크노파크 진흥원 폴리텍마이스트고 양성 전지 집약 고도 근거 이루어지 포항테크노파크 파포먼스를
"중흥건설·중흥토건, 국토부 건설사업자 간 상호협력평가 '최우수'",2023-07-11 09:21:11,중흥 중흥 국토 교통부 에서 실시 최우 기업 중흥 최우 기업 중흥 단계 상승 최우 기업 중흥 중흥 감사패 인센티브 기회 중흥 국토부 산업 제도로 개발 신인도 최우 대기업 중흥 한화,중흥 중흥 국토 교통부 실시 최우 기업 중흥 최우 기업 중흥 단계 상승 최우 기업 중흥 중흥 감사패 인센티브 기회 중흥 국토부 산업 제도로 개발 신인도 최우 대기업 중흥 한화
"[특징주] 금양그린파워, 尹 신규 원전 공식화…한수원과 SMR 공동 사업 '강세'",2023-07-11 09:28:01,그린 차세대 소형모듈원전 산업 특징 그린 통상 첨단 공급 원전 윤석열 다고 이번 기존 미래 그린 소형모듈원전 산업 산업 계획 기업 계획 민관 글로벌 한국수력원자력 에너지경제연구원 은행 기관 삼성물산 대우건설,그린 차세대 소형모듈원전 산업 특징 그린 통상 첨단 공급 원전 윤석열 다고 기존 미래 그린 소형모듈원전 산업 산업 계획 기업 계획 민관 글로벌 한국수력원자력 에너지경제연구원 은행 기관 삼성물산 대우건설
"한화 ""GS건설 목표가 '싹뚝'…자이 브랜드 신뢰도 타격""",2023-07-11 09:33:04,보수 투자 아파트 지하 주차장 사고 아파트 불확실성 에서 전환 기존 공사비 공사비 입주 관련 계획 연구원 결정 불구 불확실성 아니 행정 부동산 재무 필요 아파트 이루어지 유효 제보 만들 ㅂ니다 여러분 홈페이지,보수 투자 아파트 지하 주차장 사고 아파트 불확실성 전환 기존 공사비 공사비 입주 계획 연구원 결정 불구 불확실성 아니 행정 부동산 재무 필요 아파트 이루어지 유효 제보 만들 여러분 홈페이지
새마을금고 유탄 맞은 증권주…줄줄이 하락,2023-07-11 09:40:13,전문가 뉴시스 새마을금고 증권사 프로젝트 전문가 관련 충당금 적립 위축 수익률 마이너스 지난달 으나 포인트 세부 키움증권 미래에셋증권 삼성증권 공매도 주요 부동산 ㄴ다 최근 으로 뱅크런 감소 이란 영향 으로 미래에셋증권 투자증권 삼성증권 키움증권 증권사 분기 대비 현대차 연구원 부동산 충당금 신한 연구원 관련 충당금 이탈 결정 부동산 기울이 증권사 다는 연구원 부동산 으나 라며 상대 대출 수도권 강도 심사 절차 다소 ㄴ다 전망,전문가 뉴시스 새마을금고 증권사 프로젝트 전문가 충당금 적립 위축 수익률 마이너스 지난달 으나 포인트 세부 키움증권 미래에셋증권 삼성증권 공매도 주요 부동산 뱅크런 감소 이란 영향 미래에셋증권 투자증권 삼성증권 키움증권 증권사 분기 대비 현대차 연구원 부동산 충당금 신한 연구원 충당금 이탈 결정 부동산 기울이 증권사 연구원 부동산 으나 라며 상대 대출 수도권 강도 심사 절차 다소 전망
"검단 붕괴·'순살·통뼈' 논란에…SH, 고덕강일 건설현장 점검",2023-07-11 10:14:53,점검 철저히 품질 서울 김준태 최근 아파트 지하 주차장 단지 점검 아파트 강동구 강일동 지하 주차장 지하 주차장 점검 콘크리트 별도 철근 콘크리트 아파트 지하 주차장 붕괴 최근 일련 아파트 비아냥 아파트 지하 주차장 붕괴 하반기 계획 관리 편안 공급 입주,점검 철저히 품질 서울 김준태 아파트 지하 주차장 단지 점검 아파트 강동구 강일동 지하 주차장 지하 주차장 점검 콘크리트 별도 철근 콘크리트 아파트 지하 주차장 붕괴 일련 아파트 비아냥 아파트 지하 주차장 붕괴 하반기 계획 관리 편안 공급 입주
"중흥건설·중흥토건, 국토부 상호협력평가 ‘최우수 기업’ 선정",2023-07-11 11:17:05,대기업 건설사 중흥 중흥 중흥 교통부 에서 실시 최우 기업 중흥 교통부 최우 기업 중흥 단계 상승 최우 기업 밝히 국토부 산업 개발 신인도 최우 대기업 중흥 한화 중흥 중흥 감사패 인센티브 기회 중흥,대기업 건설사 중흥 중흥 중흥 교통부 실시 최우 기업 중흥 교통부 최우 기업 중흥 단계 상승 최우 기업 국토부 산업 개발 신인도 최우 대기업 중흥 한화 중흥 중흥 감사패 인센티브 기회 중흥
"[서울] ""붕괴사고 없어""...SH공사·서울시, 고덕강일 2단지 합동점검",2023-07-11 12:07:14,아파트 지하 주차장 아파트 강동구 강일동 ㅂ니다 점검 인천 지하 주차장 지하 주차장 점검 콘크리트 적정 아파트 지하 주차장 붕괴 ㅂ니다 카카오톡 채널 추가,아파트 지하 주차장 아파트 강동구 강일동 점검 인천 지하 주차장 지하 주차장 점검 콘크리트 적정 아파트 지하 주차장 붕괴 카카오톡 채널
예견된 '순살 자이'... 막노동 현장서 목도한 비극적 현실 [이게 이슈],2023-07-11 13:37:01,이슈 오후 에서 국토 교통부 지하 주차장 에서 ㄴ다 대한민국 에서 ㄴ다 당하 ㄴ다면 지난 아파트 지하 주차장 붕괴 총체 사고 지하 주차장 지하 주차장 어야 보강 철근 에서 으로 에서 에서 삼성물산 감독관 무너지 주차장 인하 공사비 공사비 입주 지난 건설의 건수는 허종 건설업 부실시공 부과 라서 부과 국토부 시스템 아파트 지하 주차장 관련 시공사 계획 계획 아파트 연합뉴스 세종 아파트 행정중심복합도시 아파트 행정 ㄴ지 한편 광주시 아파트 신축 콘크리트 바닥 붕괴 붕괴 철거 재건축 늦추 아파트 철거 인터넷 커뮤니티 부동산 스터디 게시판 철근 콘크리트 느냐 밖에 주차장 아파트 허물 건설사 부정 부실시공 먹이사슬 에서 일부 이루어지 ㄴ다 노동자 든가 폭등 든가 호서대 아파트 지하 주차장 점검 있다 건설업 빨리빨리 ㄴ다 전문가 부실시공 주요 하지 이루어지 만들 어야 아파트 아프 벌떡 아파트 마천루 플라멩코 나라 유네스코 알람브라 장장 만들 바르셀로나 성가족 성당 신축 가톨릭 톨레도 성당 보니 국가 하나하나 예술 조각품 상하이 푸둥지구도 빌딩 어서 아름답 밖에 아파트 가나 붕어빵 높이 꾸준히 어야만 폭등 안전 ㅂ니다 ㅂ니다 더군다나 거짓말 에서,이슈 국토 교통부 지하 주차장 대한민국 당하 ㄴ다면 지난 아파트 지하 주차장 붕괴 총체 사고 지하 주차장 지하 주차장 어야 보강 철근 삼성물산 감독관 무너지 주차장 인하 공사비 공사비 입주 지난 건설의 건수는 허종 건설업 부실시공 부과 라서 부과 국토부 시스템 아파트 지하 주차장 시공사 계획 계획 아파트 연합뉴스 세종 아파트 행정중심복합도시 아파트 행정 ㄴ지 한편 광주시 아파트 신축 콘크리트 바닥 붕괴 붕괴 철거 재건축 늦추 아파트 철거 인터넷 커뮤니티 부동산 스터디 게시판 철근 콘크리트 느냐 밖에 주차장 아파트 허물 건설사 부정 부실시공 먹이사슬 일부 이루어지 노동자 든가 폭등 든가 호서대 아파트 지하 주차장 점검 건설업 빨리빨리 전문가 부실시공 주요 하지 이루어지 만들 어야 아파트 아프 벌떡 아파트 마천루 플라멩코 나라 유네스코 알람브라 장장 만들 바르셀로나 성가족 성당 신축 가톨릭 톨레도 성당 보니 국가 하나하나 예술 조각품 상하이 푸둥지구도 빌딩 아름답 밖에 아파트 가나 붕어빵 높이 꾸준히 어야만 폭등 안전 더군다나 거짓말
"[STOCK] GS건설, 주차장 붕괴 사고 여파… 증권사 목표주가 줄하향",2023-07-11 13:43:09,아파트 주차장 증권사 아파트 뉴시스 아파트 주차장 사고 여파 유안타증권 연구원 기존 만원 에서 관련 연구원 교통부 아파트 조사 행정 기존 에서 기대치 연구원 결정 불구 불확실성 아니 부동산 아울러 필요 라고 오후 계획 대통령 인터뷰 에서 보호 다각 마련 에서 지하 주차장 붕괴 피해 지만 지하 주차장 기존 수천억 부실시공 영업정지 부과 건설업 등록 행정,아파트 주차장 증권사 아파트 뉴시스 아파트 주차장 사고 여파 유안타증권 연구원 기존 만원 연구원 교통부 아파트 조사 행정 기존 기대치 연구원 결정 불구 불확실성 아니 부동산 아울러 필요 라고 계획 대통령 인터뷰 보호 다각 마련 지하 주차장 붕괴 피해 지만 지하 주차장 기존 수천억 부실시공 영업정지 부과 건설업 등록 행정
"우리기술, 원전제어시스템 기반 SMR얼라이언스 참여",2023-07-11 14:08:09,서울 뉴시스 우리기술 최근 소형모듈원전 얼라이언스 기업 비즈니스 산업 이번 산업 수원 에너지경제연구원 기관 삼성물산 대우건설 대기업 우리기술 그린 기관 ㄴ다 ㄴ다 기존 에서 소형 출력 인해 발생 발생 우리기술 우리기술 이미 상업 원전 소형 개발 있다 이어 우리기술 시스템 계획 우리기술 국내 원전 제어 시스템 공급 국내 수주 강조,서울 뉴시스 우리기술 소형모듈원전 얼라이언스 기업 비즈니스 산업 산업 수원 에너지경제연구원 기관 삼성물산 대우건설 대기업 우리기술 그린 기관 기존 소형 출력 인해 발생 발생 우리기술 우리기술 이미 상업 원전 소형 개발 우리기술 시스템 계획 우리기술 국내 원전 제어 시스템 공급 국내 수주 강조
"우리기술, 'SMR 얼라이언스' 참여",2023-07-11 14:35:04,우리기술 최근 얼라이언스 기업 비즈니스 산업 이번 산업 수원 에너지경제연구원 기관 삼성물산 대우건설 대기업 우리기술 그린 기관 ㄴ다 ㄴ다 기존 에서 소형 우리기술 우리기술 이미 상업 원전 소형 개발 있다 이어 우리기술 시스템 계획 우리기술 국내 원전 제어 시스템 공급,우리기술 얼라이언스 기업 비즈니스 산업 산업 수원 에너지경제연구원 기관 삼성물산 대우건설 대기업 우리기술 그린 기관 기존 소형 우리기술 우리기술 이미 상업 원전 소형 개발 우리기술 시스템 계획 우리기술 국내 원전 제어 시스템 공급
“붕괴 사고 막아야”…SH 부실 공사 방지 건설 현장 점검,2023-07-11 14:39:01,지하 주차장 붕괴 최근 단지 실시 지하 주차장 여부 콘크리트 촬영 ㅂ니다 별도 철근 콘크리트 아파트 지하 주차장 붕괴 최근 일련 아파트 비아냥 습니다 아파트 지하 주차장 붕괴 있습니다하반기부터는 계획 ㅂ니다 관리 편안 공급 입주 만들 ㅂ니다 여러분 홈페이지,지하 주차장 붕괴 단지 실시 지하 주차장 여부 콘크리트 촬영 별도 철근 콘크리트 아파트 지하 주차장 붕괴 일련 아파트 비아냥 아파트 지하 주차장 붕괴 있습니다하반기부터는 계획 관리 편안 공급 입주 만들 여러분 홈페이지
"우리기술, 원전제어시스템 기반 'SMR 얼라이언스' 참여",2023-07-11 14:41:01,이데일리 우리기술 최근 소형모듈원전 얼라이언스 얼라이언스 기업 비즈니스 산업 개발 에서 산업 한국수력원자력 에너지경제연구원 삼성물산 대우건설 대기업 우리기술 기관 ㄴ다 ㄴ다 기존 에서 설치 소형 에서 출력 사고 발생 우리기술 우리기술 이미 원전 소형 개발 있다 우리기술 시스템 계획 원전 제어 시스템 공급 국내 수주 밝히,이데일리 우리기술 소형모듈원전 얼라이언스 얼라이언스 기업 비즈니스 산업 개발 산업 한국수력원자력 에너지경제연구원 삼성물산 대우건설 대기업 우리기술 기관 기존 설치 소형 출력 사고 발생 우리기술 우리기술 이미 원전 소형 개발 우리기술 시스템 계획 원전 제어 시스템 공급 국내 수주
"[주가동향] GS건설, 2분기 3000억원대 영업적자로 9년만 '적자전환' 전망",2023-07-11 14:47:01,전환 투자 라는 흑자 전환 으로 ㄴ다 한화투자증권 매수 기존 에서 으로 관련 공사비 공사비 입주 관련 기존 원대 밝히 연구원 건설 행정 불확실성 존재 부동산 재무 필요 연구원 유효,전환 투자 라는 흑자 전환 한화투자증권 매수 기존 공사비 공사비 입주 기존 원대 연구원 건설 행정 불확실성 존재 부동산 재무 필요 연구원 유효
