title,date,morphs,tokens
“시공사 바꿔? 말아?”… 공사비 갈등·소송에 골머리 앓는 조합들,2023-07-20 14:16:09,구역 기존 시공사 해지 조합 시공사 잇따르 기존 조합 시공사 미성크로바아파트 재건축 조합 최근 금품 물론 대법원 에서 시공사 조합 시공사 송파구 롯데월드타워 라는 아직 밝히 시공사 해지 구하 대표 시공사 컨소시엄 해지 공사비 만원 에서 기대 기존 시공사 곳도 시공사 해지 조합 기존 만원 으로 산성 부산진구 만원 건설 만원 육박 공사비 해지 그런데 관련 삼성물산 포스코 소위 건설사 부산진구 구역 대표 알짜 계획 부실시공 산곡 개발 재건축 사업 조합 해지 시공사 해지 고려 조합 나오 수주 섣불리 어서 시공사 벌어지 수주 상황 먼저 전문가 시공사 중대 업계 안고 ㄴ다,구역 기존 시공사 해지 조합 시공사 잇따르 기존 조합 시공사 미성크로바아파트 재건축 조합 금품 물론 대법원 시공사 조합 시공사 송파구 롯데월드타워 라는 아직 시공사 해지 구하 대표 시공사 컨소시엄 해지 공사비 만원 기대 기존 시공사 곳도 시공사 해지 조합 기존 만원 산성 부산진구 만원 건설 만원 육박 공사비 해지 그런데 삼성물산 포스코 소위 건설사 부산진구 구역 대표 알짜 계획 부실시공 산곡 개발 재건축 사업 조합 해지 시공사 해지 고려 조합 나오 수주 섣불리 시공사 벌어지 수주 상황 먼저 전문가 시공사 중대 업계 안고
GS건설 광주 상무센트럴자이 무단 설계변경 혐의 검찰 송치(종합),2023-07-20 15:17:52,캠퍼스 아파트 시공사 강력범죄 수사 센트럴 지반 콘크리트 콘크리트 사실 경찰 교통부 ㄴ다 내용 천만 사전 센트럴 자이 청약 자릿수 건설 추후 해명,캠퍼스 아파트 시공사 강력범죄 수사 센트럴 지반 콘크리트 콘크리트 사실 경찰 교통부 내용 천만 사전 센트럴 자이 청약 자릿수 건설 추후 해명
"붕괴사고 '검단아파트', 계약포기하면 청약통장 살아날까[부동산포커스]",2023-07-20 15:25:01,해지 예상 전용 연간 주차장 아파트 부동산 주차장 붕괴 아파트 아파트 철거 으로 입주 계약자 는다 전용 만원 만원 ㄴ다 입주 입주자 모집 는다 교통부 계획 있다 해당 어서 부처 교통부 이다 시장 에서 철거 으로 현행 은행 수분 으로 ㄴ다 전용 최고 만원 지연 보상금 만원 시중금리 대표 변호사 현실 계획 ㄴ다 변호사 관련 동의서 문서 신중 ㄴ다 낭패 있다 지하 주차장 아파트,해지 예상 전용 연간 주차장 아파트 부동산 주차장 붕괴 아파트 아파트 철거 입주 계약자 는다 전용 만원 만원 입주 입주자 모집 는다 교통부 계획 해당 부처 교통부 이다 시장 철거 현행 은행 수분 전용 최고 만원 지연 보상금 만원 시중금리 대표 변호사 현실 계획 변호사 동의서 문서 신중 낭패 지하 주차장 아파트
"HDC현대산업개발, 전국 건설현장 공사 과정 동영상으로 기록",2023-07-20 15:27:06,관리 시스템 에서 실명 서울 뉴시스 홍세희 현대산업개발 관리 기존 품질 시스템 시스템 점검 넘어가 담당자 단계 승인 시스템 현대산업개발 확대 철저히 시스템 관리 계획 시스템 방지 기대 ㄴ다 안전 국내 공사장 모든 확대 오세훈 시공 서울 동대문구 구역 개발 ㄴ다,관리 시스템 실명 서울 뉴시스 홍세희 현대산업개발 관리 기존 품질 시스템 시스템 점검 넘어가 담당자 단계 승인 시스템 현대산업개발 확대 철저히 시스템 관리 계획 시스템 방지 기대 안전 국내 공사장 모든 확대 오세훈 시공 서울 동대문구 구역 개발
"이달의 기자상, 한겨레 '준공영제 버스 삼킨 사모펀드' 등 7편",2023-07-20 16:02:18,서울 뉴시스 한국기자협회 사진 한국기자협회 서울 뉴시스 한국기자협회 이달의 기자상 수상작 공영 버스 에서 이재훈 기자 김지숙 이지은 기자 영상 박강수 이준희 스포츠 기획 신문 에서 내막 사회부 최은 예스 황현 김화영 기자 보도 뉴스타파 국회의원 으로 신문 수상작 기자 지하 시상식 서울 기자회견 에서,서울 뉴시스 한국기자협회 사진 한국기자협회 서울 뉴시스 한국기자협회 이달의 기자상 수상작 공영 버스 이재훈 기자 김지숙 이지은 기자 영상 박강수 이준희 스포츠 기획 신문 내막 사회부 최은 예스 황현 김화영 기자 보도 뉴스타파 국회의원 신문 수상작 기자 지하 시상식 서울 기자회견
"GS건설, 상무센트럴자이 무단 설계 변경...검찰 송치",2023-07-20 16:05:00,캠퍼스 아파트 강력범죄 센트럴 자이 시공사 광주시 콘크리트 지만 콘크리트 에서,캠퍼스 아파트 강력범죄 센트럴 자이 시공사 광주시 콘크리트 지만 콘크리트
‘부동산 우려에도 선방’ SK에코플랜트 회사채에 4배 응찰,2023-07-20 16:32:00,업체 신용등급 가량 최근 에서 조달 밝히 증액 으로 증액 응찰 부동산 투자자 불구 건설사 조달 으로 ㄴ다 혹은 기존 에서 기존 에서 롯데건설 현대산업개발 전망 기존 유지 지훈 한국신용평가 지역 위험 으로 ㄴ다 등급 으로 한편 환경 인공지능 고도,업체 신용등급 가량 조달 증액 증액 응찰 부동산 투자자 불구 건설사 조달 혹은 기존 기존 롯데건설 현대산업개발 전망 기존 유지 지훈 한국신용평가 지역 위험 등급 한편 환경 인공지능 고도
오세훈 '부실 공사와 전쟁' 선포 하루 만에 건설사 동참(종합),2023-07-20 16:40:56,코오롱 연잇 밝히 관리 오세훈 서울시장 서울 개발 부실시공 박지혜 기자 서울 뉴스 전준우 김동규 오세훈 서울시장 부실시공 개발 다고 건설 먼저 기존 품질 시스템 시스템 점검 넘어가 담당자 단계 승인 시스템 더불 보디 확대 서울 박지혜 기자 단계 상관없이 시스템 콘크리트 계획 대우건설 단계 대우건설 시스템 시스템 에서 즉시 실시간 장비 더불 계획 고민 구역 지하 주차장 붕괴 안고 에서 에서,코오롱 연잇 관리 오세훈 서울시장 서울 개발 부실시공 박지혜 기자 서울 뉴스 전준우 김동규 오세훈 서울시장 부실시공 개발 다고 건설 먼저 기존 품질 시스템 시스템 점검 넘어가 담당자 단계 승인 시스템 더불 보디 확대 서울 박지혜 기자 단계 상관없이 시스템 콘크리트 계획 대우건설 단계 대우건설 시스템 시스템 즉시 실시간 장비 더불 계획 고민 구역 지하 주차장 붕괴 안고
"2분기 건설사 실적전망, 현대·대우건설 `맑음` vs GS건설 `흐림`",2023-07-20 16:58:06,지하 주차장 다고 아파트 이른바 사태 전반 부동산 수주 컨센서스 동기 매출액 부진 사우디아라비아 에서 이상 신규 수주 대우건설 동기 현대건설 해외 에서 베트남 개발 자체 리비아 에서 상반기 연간 지하 주차장 아파트 늘어나 최근 이미지 동기 으로 감소 전망 증권업 법인 에서 전반 패키지 리비아 프로젝트 국내 건설사 프로젝트 우크라이나 인프라 신한 김선미 보고서 에서 현대건설 건설사 지만 프로젝트 중동 증액 있다 다수,지하 주차장 다고 아파트 이른바 사태 전반 부동산 수주 컨센서스 동기 매출액 부진 사우디아라비아 이상 신규 수주 대우건설 동기 현대건설 해외 베트남 개발 자체 리비아 상반기 연간 지하 주차장 아파트 늘어나 이미지 동기 감소 전망 증권업 법인 전반 패키지 리비아 프로젝트 국내 건설사 프로젝트 우크라이나 인프라 신한 김선미 보고서 현대건설 건설사 지만 프로젝트 중동 증액 다수
HDC현산 이어 현대건설도…전국 현장 시공과정 동영상으로 기록,2023-07-20 17:01:01,서울경제 오세훈 서울시장 개발 서울시장 현대건설 품질 실시간 사업장 적용 관리자 이번 영상 데이터 고객 현대건설 스마트 연구실 주도 실시간 또한 개발 스마트폰 레미콘 품질 실시간 모니터링 시스템 장비 시스템 콘크리트 모니터링 데이터 개발 다고 최근 건설업 아서 양질 데이터 실시간 영상 모니터링 관리 대우건설 단계 다고,서울경제 오세훈 서울시장 개발 서울시장 현대건설 품질 실시간 사업장 적용 관리자 영상 데이터 고객 현대건설 스마트 연구실 주도 실시간 또한 개발 스마트폰 레미콘 품질 실시간 모니터링 시스템 장비 시스템 콘크리트 모니터링 데이터 개발 다고 건설업 아서 양질 데이터 실시간 영상 모니터링 관리 대우건설 단계 다고
"오세훈 ""부실시공 막자"" 요청에…대형 건설사 동참 릴레이",2023-07-20 17:08:06,구역 개발 아파트 도입 현대건설 관리 시스템 밝히 개발 기존 운영 품질 시스템 다는 보디 확대 실시간 ㄴ다 코오롱글로벌 대우건설 시스템 ㄴ다는 코오롱글로벌 콘크리트 최근 건설업 아서 데이터 실시간 영상 모니터링,구역 개발 아파트 도입 현대건설 관리 시스템 개발 기존 운영 품질 시스템 보디 확대 실시간 코오롱글로벌 대우건설 시스템 ㄴ다는 코오롱글로벌 콘크리트 건설업 아서 데이터 실시간 영상 모니터링
광주 상무센트럴자이 무단 설계변경 GS건설 검찰行,2023-07-20 17:26:03,캠퍼스 아파트 시공사 강력범죄 수사 센트럴 지반 콘크리트 콘크리트 사실 경찰 교통부 ㄴ다 내용,캠퍼스 아파트 시공사 강력범죄 수사 센트럴 지반 콘크리트 콘크리트 사실 경찰 교통부 내용
"오세훈發 '부실공사 전쟁', 건설사들 ""우리도 다 찍을게"" 동참",2023-07-20 17:28:08,동참 부담 서울 뉴스 박지혜 기자 오세훈 서울시장 서울 개발 부실시공 오세훈 의사 밝히 현대건설 대우건설 롯데건설 관리 동대문구 개발 공사장 ㄴ다 첫걸음 다고 강조 건설사 하루만 요청 화답 붕괴 기존 품질 시스템 계획 품질 시스템 점검 넘어가 담당자 단계 승인 시스템 폐쇄 더불 보디 확대 품질 관리 ㄴ다는 건설 단계 대우건설 자사 단계 계획 대우건설 동영상 기존 시스템 유기 사적 현대건설 품질 실시간 사업장 안전 관리자 이번 코오롱글로벌 관리 시스템 밝히 코오롱글로벌 다중 아서 철근 콘크리트 에서 관리 계획 확대 건축법 개정 국토 교통부 긴밀히 추진 다만 매뉴얼 면적 충분히 강조 드라이브 부담 다는 에서 거절 세부 지적 업계 적용 범위 ㄴ데 에서 장비 여력 있다,동참 부담 서울 뉴스 박지혜 기자 오세훈 서울시장 서울 개발 부실시공 오세훈 의사 현대건설 대우건설 롯데건설 관리 동대문구 개발 공사장 첫걸음 다고 강조 건설사 하루만 요청 화답 붕괴 기존 품질 시스템 계획 품질 시스템 점검 넘어가 담당자 단계 승인 시스템 폐쇄 더불 보디 확대 품질 관리 ㄴ다는 건설 단계 대우건설 자사 단계 계획 대우건설 동영상 기존 시스템 유기 사적 현대건설 품질 실시간 사업장 안전 관리자 코오롱글로벌 관리 시스템 코오롱글로벌 다중 아서 철근 콘크리트 관리 계획 확대 건축법 개정 국토 교통부 긴밀히 추진 다만 매뉴얼 면적 충분히 강조 드라이브 부담 거절 세부 지적 업계 적용 범위 장비 여력
보름새 2조 팔아치운 기관 …'전장'은 샀다,2023-07-20 17:48:03,차익 실현 기대감 현대모비스 대한항공 기관 투자자 벌써 하반기 양호 자동차 장비 부품 장비 삼성전기 외국인 거래 연속 기관 불과 거래 치우 대비 기간 외국인 개인 최근 차익 실현 연구원 운송 있다 차익 있다 기관 많이 에코프로비엠억원 현대차 하반기 부터 기관 많이 매수 대한항공 하이닉스 현대모비스 삼성전기 에스엠억원 기관 올해 하반기 삼성전기 현대모비스 수주 가장 많이 밀려나 오르 하반기 기관 많이 으로 성장세 최근 대한항공 ㄴ다 제관 기자,차익 실현 기대감 현대모비스 대한항공 기관 투자자 벌써 하반기 양호 자동차 장비 부품 장비 삼성전기 외국인 거래 연속 기관 불과 거래 치우 대비 기간 외국인 개인 차익 실현 연구원 운송 차익 기관 에코프로비엠억원 현대차 하반기 부터 기관 매수 대한항공 하이닉스 현대모비스 삼성전기 에스엠억원 기관 올해 하반기 삼성전기 현대모비스 수주 가장 밀려나 오르 하반기 기관 성장세 대한항공 제관 기자
오세훈 불호령에 10대 건설사 '동영상 기록관리' 동참(종합2보),2023-07-20 17:48:09,오세훈 서울시장 서울 개발 부실시공 박지혜 기자 서울 뉴스 전준우 오세훈 서울시장 부실시공 개발 다고 삼성물산 현대건설 대우건설 현대엔지니어링 롯데건설 의사 삼성물산 시간 실시간 주요 동영상 단계 현대건설 품질 실시간 사업장 안전 관리자 먼저 기존 품질 시스템 단계 상관없이 시스템 콘크리트 계획 대우건설 단계 대우건설 시스템 시스템 에서 즉시 실시간 장비 더불 계획 고민 구역 지하 주차장 붕괴 안고 에서 에서,오세훈 서울시장 서울 개발 부실시공 박지혜 기자 서울 뉴스 전준우 오세훈 서울시장 부실시공 개발 다고 삼성물산 현대건설 대우건설 현대엔지니어링 롯데건설 의사 삼성물산 시간 실시간 주요 동영상 단계 현대건설 품질 실시간 사업장 안전 관리자 먼저 기존 품질 시스템 단계 상관없이 시스템 콘크리트 계획 대우건설 단계 대우건설 시스템 시스템 즉시 실시간 장비 더불 계획 고민 구역 지하 주차장 붕괴 안고
"서울시 '건설현장 동영상 기록' 요청에 건설사들 ""적극 동참""(종합)",2023-07-20 17:54:04,개발 오세훈 서울 연합뉴스 이지은 오세훈 서울 개발 서울 오세훈 서울시장 다는 기존 적용 건설 일부 선제 하나로 다고 확대 ㄴ다 시스템 대우건설 서울시 삼성물산 역시 추가 계획 롯데건설 ㄴ다 동대문구 구역 시민 불안 ㄴ다,개발 오세훈 서울 연합뉴스 이지은 오세훈 서울 개발 서울 오세훈 서울시장 기존 적용 건설 일부 선제 하나로 다고 확대 시스템 대우건설 서울시 삼성물산 계획 롯데건설 동대문구 구역 시민 불안
오세훈 한마디에…건설사 '공사현장 동영상 기록' 릴레이 동참,2023-07-20 17:54:45,오세훈 서울시장 서울 개발 부실시공 오세훈 회사 품질 품질 점검 넘어가 시공 담당자 단계 승인 시스템 보디 방지 현대건설 삼성물산 롯데건설 단계 실시간 사업장 확대 대우건설 첨단 계획 오세훈 서울 구역 개발 전쟁 에서 ㄴ다 관리 제도 공사비 내년 공사장,오세훈 서울시장 서울 개발 부실시공 오세훈 회사 품질 품질 점검 넘어가 시공 담당자 단계 승인 시스템 보디 방지 현대건설 삼성물산 롯데건설 단계 실시간 사업장 확대 대우건설 첨단 계획 오세훈 서울 구역 개발 전쟁 관리 제도 공사비 내년 공사장
"오세훈 '부실공사와의 전쟁'…현대·GS·대우 등 ""현장 100% 녹화""",2023-07-20 17:54:01,오세훈 부실시공 시스템 만들 어야 이데일리 시장 전면전 모양 오세훈 서울시장 서울 개발 인터뷰 삼성물산 현대건설 대우건설 현대엔지니어링 롯데건설 코오롱글로벌 관리 동대문구 구역 시스템 만들 어야 ㄴ다 강조 에서 는지 회사 지자체 공사장 건축법 세부 촬영 슬래브배근 최근 추진 다고 건설사 화답 현대건설 품질 실시간 사업장 현대건설 데이터 건설업 시스템 ㄴ데 확대 ㄴ다 시스템 감지 건설 단계 대우건설 스마트 단계 다는 대우건설 개발 현대산업개발 역시 ㄴ다 코오롱글로벌 역시,오세훈 부실시공 시스템 만들 어야 이데일리 시장 전면전 모양 오세훈 서울시장 서울 개발 인터뷰 삼성물산 현대건설 대우건설 현대엔지니어링 롯데건설 코오롱글로벌 관리 동대문구 구역 시스템 만들 어야 강조 는지 회사 지자체 공사장 건축법 세부 촬영 슬래브배근 추진 다고 건설사 화답 현대건설 품질 실시간 사업장 현대건설 데이터 건설업 시스템 확대 시스템 감지 건설 단계 대우건설 스마트 단계 대우건설 개발 현대산업개발 코오롱글로벌
"오세훈 요청 하루 만에…건설사들 ""현장 영상 촬영 확대"" 한목소리",2023-07-20 18:10:01,오세훈 서울시장 건설사 전쟁 화답 다는 읽히 ㄴ다 붕괴 삼성물산 코오롱글로벌 관리 서울 개발 건설사 하루만 요청 화답 먼저 기존 품질 시스템 계획 품질 시스템 점검 넘어가 담당자 단계 승인 시스템 폐쇄 더불 보디 확대 품질 관리 ㄴ다는 건설 단계 대우건설 시스템 사진 대우건설 대우건설 자사 단계 계획 대우건설 동영상 기존 시스템 유기 사적 현대건설 품질 실시간 사업장 안전 관리자 이번 코오롱글로벌 관리 시스템 밝히 코오롱글로벌 다중 아서 철근 콘크리트 에서 관리 계획 삼성물산 역시 단계 관리 설치 삼성물산 안전 다각 점검 삼성물산 경영 시스템 추가 재해 실현 시스템 모니터링 시스템 안전 고리 감지 가상 보디 콘크리트 으로써 시공 자리매김 만큼,오세훈 서울시장 건설사 전쟁 화답 읽히 붕괴 삼성물산 코오롱글로벌 관리 서울 개발 건설사 하루만 요청 화답 먼저 기존 품질 시스템 계획 품질 시스템 점검 넘어가 담당자 단계 승인 시스템 폐쇄 더불 보디 확대 품질 관리 ㄴ다는 건설 단계 대우건설 시스템 사진 대우건설 대우건설 자사 단계 계획 대우건설 동영상 기존 시스템 유기 사적 현대건설 품질 실시간 사업장 안전 관리자 코오롱글로벌 관리 시스템 코오롱글로벌 다중 아서 철근 콘크리트 관리 계획 삼성물산 단계 관리 설치 삼성물산 안전 다각 점검 삼성물산 경영 시스템 재해 실현 시스템 모니터링 시스템 안전 고리 감지 가상 보디 콘크리트 으로써 시공 자리매김 만큼
오세훈 '부실공사와의 전쟁' 하루 만에…10대 건설사 동참,2023-07-20 18:23:01,동대문구 구역 개발 오세훈 시장 시스템 만들 어야 ㄴ다 밝히 일제히 붕괴 계획 삼성물산 현대건설 대우건설 현대엔지니어링 롯데건설 의사 치르 ㄴ다는 삼성물산 단계 실시간 단계 계획 관리자 기존 품질 시스템 상관없이 콘크리트 시스템 대우건설 단계 계획,동대문구 구역 개발 오세훈 시장 시스템 만들 어야 일제히 붕괴 계획 삼성물산 현대건설 대우건설 현대엔지니어링 롯데건설 의사 치르 ㄴ다는 삼성물산 단계 실시간 단계 계획 관리자 기존 품질 시스템 상관없이 콘크리트 시스템 대우건설 단계 계획
"SK에코플랜트, 건설 불황 '나몰라'…회사채 발행 '대흥행'",2023-07-20 18:35:03,전환 인정 부동산 평가 서울경제 최근 목표액 확대 시장 ㄴ다 투자 수요 검토 모집 포인트 에서 다만 레고랜드 롯데건설 지훈 유동화 있다 금성 회사채 있다 사업 에서 정다은,전환 인정 부동산 평가 서울경제 목표액 확대 시장 투자 수요 검토 모집 포인트 다만 레고랜드 롯데건설 지훈 유동화 금성 회사채 사업 정다은
[단독]지난해 '하자'에 가장 많은 돈 쓴 건설사는,2023-07-20 18:39:02,건설사 보니 물량 공급 포스코 삼성물산 이데일리 가장 이어 포스코 숫자 분쟁 이미나 적립 ㄹ수록 그해 다는 그해 판매 공급 공급 국토 교통부 조정 에서 으로 업체 포스코 분양 지만 부동산 분쟁 비교 철저히 ㄴ다 대우건설 현대엔지니어링 롯데건설 현대산업개발 대우건설 조정 업체 현대엔지니어링 삼성물산 삼성물산 삼성물산 공급 하자 최근 이다,건설사 보니 물량 공급 포스코 삼성물산 이데일리 가장 포스코 숫자 분쟁 이미나 적립 ㄹ수록 그해 그해 판매 공급 공급 국토 교통부 조정 업체 포스코 분양 지만 부동산 분쟁 비교 철저히 대우건설 현대엔지니어링 롯데건설 현대산업개발 대우건설 조정 업체 현대엔지니어링 삼성물산 삼성물산 삼성물산 공급 하자 이다
오세훈 '부실공사와 전쟁' 선포…건설사 줄줄이 동참,2023-07-20 18:51:01,추가 조처 오세훈 서울시장 최근 잇따르 오세훈 개발 개발 기존 운영 현대산업개발 에서 실명 전경 시스템 점검 넘어가 담당자 단계 승인 시스템 현대산업개발 확대 단계 상관없이 대우건설 단계 대우건설 시스템 모습 사진 대우건설 대우건설 시스템 시스템 에서 즉시 실시간 대우건설 기술 에서 동영상 사업장 계획 동영상 밝히 실시간 사업장 적용 ㄴ다 기업 에서 강화 노력 다는 개발 시스템 데이터 시스템 개발 장비 관리,조처 오세훈 서울시장 잇따르 오세훈 개발 개발 기존 운영 현대산업개발 실명 전경 시스템 점검 넘어가 담당자 단계 승인 시스템 현대산업개발 확대 단계 상관없이 대우건설 단계 대우건설 시스템 모습 사진 대우건설 대우건설 시스템 시스템 즉시 실시간 대우건설 기술 동영상 사업장 계획 동영상 실시간 사업장 적용 기업 강화 노력 개발 시스템 데이터 시스템 개발 장비 관리
대형 건설사 “공사 전과정에 '블랙박스' 도입”…서울시 정책 제안 하루만에 수용,2023-07-20 19:16:03,관리 밝히 오세훈 서울시장 서울 개발 연합뉴스 서울경제 아파트 ㄴ다 오세훈 블랙박스 투입 강화 발생 분명히 운영 대우건설 ㄴ다 이미 에서 삼성물산 롯데건설 현대건설 계획 으로 동영상 동대문구 개발 모든 공사장 모든 계획 업체 시공 내용 공사장 건축법,관리 오세훈 서울시장 서울 개발 연합뉴스 서울경제 아파트 오세훈 블랙박스 투입 강화 발생 분명히 운영 대우건설 이미 삼성물산 롯데건설 현대건설 계획 동영상 동대문구 개발 모든 공사장 모든 계획 업체 시공 내용 공사장 건축법
수색동 `DMC파인시티자이` 입주지연 위기 모면,2023-07-20 19:36:07,유치권 다고 입주 입주 서울 은평구 수색동 개발 증액 공사비 증액 공사비 제한 다고 공사비 분쟁 시공사 중재 초기 들어주 시공사 증액 기존 개발 증액 개발 시작 많이 아서 만들 ㄴ다 건설 양보 은평구 수색동 아파트 입주,유치권 다고 입주 입주 서울 은평구 수색동 개발 증액 공사비 증액 공사비 제한 다고 공사비 분쟁 시공사 중재 초기 들어주 시공사 증액 기존 개발 증액 개발 시작 아서 만들 건설 양보 은평구 수색동 아파트 입주
"""'영상 기록관리'만이 해법"" 오세훈 독려에..건설사 톱30 중 24곳 동참",2023-07-20 20:17:03,오세훈 서울시장 서울 개발 둘러보 코오롱글로벌 롯데건설 삼성물산 현대건설 한화 오세훈 구역 있다 시가 추진 으로 의사 거듭 서울 만들 나가,오세훈 서울시장 서울 개발 둘러보 코오롱글로벌 롯데건설 삼성물산 현대건설 한화 오세훈 구역 시가 추진 의사 거듭 서울 만들 나가
"서울시, 건설현장 동영상 기록 요청...건설사들 “적극 협조”",2023-07-20 20:26:01,오세훈 서울시장 건설사 다는 오세훈 서울시장 서울 개발 부실시공 건설업 기존 역시 ㄴ다는 ㄴ다 대우건설 서울시 삼성물산 추가 롯데건설 ㄴ다 일부 선제 차원 다고 동대문구 구역 시민 불안 ㄴ다 강조,오세훈 서울시장 건설사 오세훈 서울시장 서울 개발 부실시공 건설업 기존 ㄴ다는 대우건설 서울시 삼성물산 롯데건설 일부 선제 차원 다고 동대문구 구역 시민 불안 강조
"상위 30개사 중 24개사 동영상 기록관리 동참…서울시, 25~26일 교육 실시",2023-07-20 20:31:10,오세훈 서울시장 서울 개발 부실시공 최근 있다 공사장 관리 ㄴ데 박지혜 기자 기자 오세훈 서울시장 부실시공 계획 삼성물산 현대건설 대우건설 현대엔지니어링 롯데건설 으로 오세훈 동대문구 구역 점검 있다 강조 건설사 상대로 실시 관리자 실시 내용 관리 영상 의사 거듭 서울 만들 나가,오세훈 서울시장 서울 개발 부실시공 공사장 관리 박지혜 기자 기자 오세훈 서울시장 부실시공 계획 삼성물산 현대건설 대우건설 현대엔지니어링 롯데건설 오세훈 동대문구 구역 점검 강조 건설사 상대로 실시 관리자 실시 내용 관리 영상 의사 거듭 서울 만들 나가
