title,date,morphs,tokens
"브랜드는 물론, 커뮤니티까지…요즘 비싼 아파트의 조건",2023-07-01 08:06:01,진화 수영장 인피니티 커뮤니티 인피니티 커뮤니티 이코노미스트 박지윤 기자 아파트 아파트 당시 유행 최신 커뮤니티 최근 서울 강남구 서초구 송파구 아파트 인피니티 서비스 영화관 고급 서비스 부동산 아파트 만원 에서 커뮤니티 모습 입지 재건축 사업 아파트 선호도 관리비 다양 커뮤니티 대치동 에서 부동산 삼성물산 재건축 현대건설 에이치 힐즈 재건축 재건축 대표 아파트 젊은층 에서 맞벌이 면서 한식 힐즈 역시 오전 오후 만원 에서 브런치 프리미엄 전문점 품질 아크 아크 파크 랜드마크 ㄴ다 아크 파크 하우스 조식 만원 신청 ㄴ다 파크 전경 누리 인피니티 많이 고급 ㄴ다 고급 아파트 고급 수영장 서울 아파트 개포동 아너 힐즈 최근 수영장 인피니티 고급 아파트 커뮤니티 수평선 무한대 ㄴ다 실내 어서 에서 대표 네트워크 인피니티 에서 여유 인기 에서 모습 프레지 국내 아파트 인피니티 부동산 사계절 에서 입주민 다고 아파트 에서 특색 커뮤니티 얼마나 은지 조식 스크린골프 커뮤니티 커뮤니티 고급 뜨거워지 밖에,진화 수영장 인피니티 커뮤니티 인피니티 커뮤니티 이코노미스트 박지윤 기자 아파트 아파트 당시 유행 최신 커뮤니티 서울 강남구 서초구 송파구 아파트 인피니티 서비스 영화관 고급 서비스 부동산 아파트 만원 커뮤니티 모습 입지 재건축 사업 아파트 선호도 관리비 다양 커뮤니티 대치동 부동산 삼성물산 재건축 현대건설 에이치 힐즈 재건축 재건축 대표 아파트 젊은층 맞벌이 면서 한식 힐즈 오전 만원 브런치 프리미엄 전문점 품질 아크 아크 파크 랜드마크 아크 파크 하우스 조식 만원 신청 파크 전경 누리 인피니티 고급 고급 아파트 고급 수영장 서울 아파트 개포동 아너 힐즈 수영장 인피니티 고급 아파트 커뮤니티 수평선 무한대 실내 대표 네트워크 인피니티 여유 인기 모습 프레지 국내 아파트 인피니티 부동산 사계절 입주민 다고 아파트 특색 커뮤니티 얼마나 은지 조식 스크린골프 커뮤니티 커뮤니티 고급 뜨거워지 밖에
후쿠시마 오염수 방류 불안감에…국내산 '육상 양식 연어'에 쏠리는 눈,2023-07-01 08:32:01,최근 육상 연어 꾸준히 지구 온난화 인해 오히려 감소하고 어종 최근 일파만파 기존 비즈니스 부터 국내 으로 국내 순환 연어 있다 부경대학교 사진 에서 연간 테스트 시스템 시스템 테스트 설립 연구소 에서 미세 플라스틱 제거 질병 예방 단계 계획 연어과 연어 연어 연어 노르웨이 수입량 역시 증가세 연어 수입량 꾸준히 모습 해수담수화 보유 바이오 핵심 순환 시스템 ㄴ다 수질 이란 기대 환경 사진 연어 단계 계획 출하 연간 연어 노르웨이 스타트 레볼루션 양식장 설립 양식장 교류 연어 훈제 공급 동원그룹 에서 아시아,육상 연어 꾸준히 지구 온난화 인해 오히려 감소하고 어종 일파만파 기존 비즈니스 부터 국내 국내 순환 연어 부경대학교 사진 연간 테스트 시스템 시스템 테스트 설립 연구소 미세 플라스틱 제거 질병 예방 단계 계획 연어과 연어 연어 연어 노르웨이 수입량 증가세 연어 수입량 꾸준히 모습 해수담수화 보유 바이오 핵심 순환 시스템 수질 이란 기대 환경 사진 연어 단계 계획 출하 연간 연어 노르웨이 스타트 레볼루션 양식장 설립 양식장 교류 연어 훈제 공급 동원그룹 아시아
"파이널키친 음식물 처리기, 2일 롯데홈쇼핑서 라이브 방송 진행",2023-07-01 09:00:00,사진 서울 프리미엄 방송 마련 홈쇼핑 준비 냄비 롯데백화점 상품권 만원 신청 프리미엄 미생물 강력 기로 냄새 모아 두지 깔끔 특징 건설 ㄴ다 레드 에서 키친 준비 ㄴ다,사진 서울 프리미엄 방송 마련 홈쇼핑 준비 냄비 롯데백화점 상품권 만원 신청 프리미엄 미생물 강력 기로 냄새 모아 두지 깔끔 특징 건설 레드 키친 준비
9개월 공사를 1개월만에 ‘뚝딱’…건설업의 미래 먹거리 ‘모듈러’[황재성의 황금알],2023-07-02 09:01:01,건설업 급부상 공사비 환경 생산성 황재성 부동산 정보 부동산 관련 ㅂ니다 부동산 건설업 전경 국가 현대엔지니어링 시공 현대엔지니어링 ㅂ니다 교통부 에서 산업 만큼 지하 지하 ㅂ니다 ㄹ까요 배선 현관문 욕실 ㅂ니다 영어 라고 ㅂ니다 ㅂ니다 현재 이루어지 ㅂ니다 ㅂ니다 에서 작업 사람 ㅂ니다 게다가 강화 ㅂ니다 건설업 인력 상승 상승 습니다 습니다 핀란드 노르웨이 에서 장관 한국 건설업 충북 진천 아파트 사진 현대엔지니어링 ㅂ니다 아파트 에서 거실 거실 이루어지 입주자 고령자 보금자리 ㅂ니다 스포츠 들어서 지하 엘리베이터 아파트 철근 콘크리트 떠안 고려 조치 ㅂ니다 나머지 진천 에서 사전 아파트 철근 콘크리트 전기 실내 단계 에서 신발장 가구 설치 만들 컨테이너 아파트 연결 지붕 ㅂ니다 아파트 나누 습니다 화물 로서 ㅂ니다 용인 파기 부터 아파트 현대엔지니어링 김경수 기존 ㅂ니다 운반 단계 에서 안전 층간소음 버티 층간소음 등급 외면 일반 고급 마감재 전자제품 설치 아파트 건설업 라는 기대 재해 아파트 동아일보 전문가 아파트 개월 에서 ㅂ니다 직접 에서 에서 공사비 ㅂ니다 ㅂ니다 에서 ㅂ니다 기존 철근 콘크리트 만들 ㅂ니다 줄이 ㅂ니다 기존 기대 건설업 생산성 전통 ㄴ데 ㅂ니다 게다가 건설업 에서 시간 ㅂ니다 최근 화두 에서 발생 피해 재해 특히 건설업 습니다 발생 재해 사망자 건설업 사망자 감소 이상인 ㅂ니다 ㄴ다면 습니다 에서 최근 충남 당진 에서 모습 에서 ㅂ니다 성장세 치르 우크라이나 국내 습니다 이번 현대엔지니어링 부터 서울 구로구 가리봉동 에서 사업 ㅂ니다 삼성물산 ㅂ니다 공식 넘어서 콘크리트 만들 습니다 조정 ㅂ니다 콘크리트 많이 만큼 다는 ㅂ니다 고층 ㄴ데 이다 공사비 만큼 있다 극복 ㅂ니다 유행 콘크리트 사전 사전 선수 ㅂ니다 아파트 연결 잇따르 인해 년대 아파트 에서 습니다,건설업 급부상 공사비 환경 생산성 황재성 부동산 정보 부동산 부동산 건설업 전경 국가 현대엔지니어링 시공 현대엔지니어링 교통부 산업 만큼 지하 지하 ㄹ까요 배선 현관문 욕실 영어 라고 현재 이루어지 작업 사람 게다가 강화 건설업 인력 상승 상승 핀란드 노르웨이 장관 한국 건설업 충북 진천 아파트 사진 현대엔지니어링 아파트 거실 거실 이루어지 입주자 고령자 보금자리 스포츠 들어서 지하 엘리베이터 아파트 철근 콘크리트 떠안 고려 조치 나머지 진천 사전 아파트 철근 콘크리트 전기 실내 단계 신발장 가구 설치 만들 컨테이너 아파트 연결 지붕 아파트 나누 화물 로서 용인 파기 부터 아파트 현대엔지니어링 김경수 기존 운반 단계 안전 층간소음 버티 층간소음 등급 외면 일반 고급 마감재 전자제품 설치 아파트 건설업 라는 기대 재해 아파트 동아일보 전문가 아파트 개월 직접 공사비 기존 철근 콘크리트 만들 줄이 기존 기대 건설업 생산성 전통 게다가 건설업 시간 화두 발생 피해 재해 특히 건설업 발생 재해 사망자 건설업 사망자 감소 이상인 ㄴ다면 충남 당진 모습 성장세 치르 우크라이나 국내 현대엔지니어링 부터 서울 구로구 가리봉동 사업 삼성물산 공식 넘어서 콘크리트 만들 조정 콘크리트 만큼 고층 이다 공사비 만큼 극복 유행 콘크리트 사전 사전 선수 아파트 연결 잇따르 인해 년대 아파트
"건설업의 제조업화 '모듈러 건축'…""기업 자구 노력 선행돼야""",2023-07-02 10:01:01,관련 에서 개발 자구 최근 동향 에서 현대엔지니어링 시공 주요 먼저 빠르 영국 주도 이나 일부 적자 재무 일례 제너럴 운영 계획 코로나 영향 임직원 운영 유지 추가 ㄴ다 불확실성 에서 상황 산업 어렵 에서 기업 사용자 에서 최근 석고보드 시스템 사용자 중대 바람직 으로 ㄴ다 기업 자구 노력 선행 한편 국내 모듈 교통부,개발 자구 동향 현대엔지니어링 시공 주요 먼저 빠르 영국 주도 이나 일부 적자 재무 일례 제너럴 운영 계획 코로나 영향 임직원 운영 유지 불확실성 상황 산업 어렵 기업 사용자 석고보드 시스템 사용자 중대 바람직 기업 자구 노력 선행 한편 국내 모듈 교통부
"[사설] 민주노총, 노동자 권익과 무관한 ‘반정부 파업’ 중단해야",2023-07-03 04:04:15,오후 에서 민주노총 노동조합원 운송 ㄴ다 민생 민주 윤석열 정권 총파업 정권 노골적 군부 민주노총 ㄴ다 총파업 밖에 고려 노동자 대통령 는다 하지 총파업 에서 일본 주요 오히려 정권 게다가 민주노총 다음 군사훈련 계획 민주노총 한국전력 포스코 민주노총 노동자 충분히 민주노총 결코 간부 정권 는다,민주노총 노동조합원 운송 민생 민주 윤석열 정권 총파업 정권 노골적 군부 민주노총 총파업 밖에 고려 노동자 대통령 는다 하지 총파업 일본 주요 오히려 정권 게다가 민주노총 다음 군사훈련 계획 민주노총 한국전력 포스코 민주노총 노동자 충분히 민주노총 결코 간부 정권 는다
민주노총 '2주 정치파업' 예고에 시민들 '한숨' 재계는 '긴장',2023-07-03 05:15:00,민주노총 민주노총 윤석열 이어 한국노총 좀처럼 산업 다는 지적 나오 ㄴ다 총파업 최근 총파업 맞물리 대형 보건 공공 ㄴ다 총파업 서울 울산 경기 원주 에서 기업 재계 민주노총 총파업 단협 상견례 기업 상반기 하반기 상황 에서 있다 지적 ㄴ다 탈퇴 노동자 최근 내부 응집력 ㄴ다 서울 뉴스 장수영 조합원 서울 에서 민주 연맹 총파업 직무 쌍용건설 한국전력기술 롯데케미칼 탈퇴 찬성 넘어서 전국 도심 에서 총파업 퇴근 노동자 결정 반갑 잡히 어야 서울 인근 에서 어서 퇴근길 바람 경찰 경찰청장 지난달 서울 서대문구 에서 혼잡 장비 보장 벗어나 에서 ㄴ다 부대 계획 조치 에서 공무 불법행위 주동자 구속영장 신청 다는,민주노총 민주노총 윤석열 한국노총 좀처럼 산업 지적 나오 총파업 총파업 맞물리 대형 보건 공공 총파업 서울 울산 경기 원주 기업 재계 민주노총 총파업 단협 상견례 기업 상반기 하반기 상황 지적 탈퇴 노동자 내부 응집력 서울 뉴스 장수영 조합원 서울 민주 연맹 총파업 직무 쌍용건설 한국전력기술 롯데케미칼 탈퇴 찬성 넘어서 전국 도심 총파업 퇴근 노동자 결정 반갑 잡히 어야 서울 인근 퇴근길 바람 경찰 경찰청장 지난달 서울 서대문구 혼잡 장비 보장 벗어나 부대 계획 조치 공무 불법행위 주동자 구속영장 신청
“시공만 하는 줄 알았는데”... 저개발국 투자·운영까지 나선 국내 건설사들,2023-07-03 06:01:27,주장 인프라 상황 공사비 그런데 프로젝트 일으키 발주 ㄴ다 약정 해당 건설사 해외 개발 국내 건설 에서 전략 카자흐스탄 순환도로 운영 민관 인프라 유지 세금 발주 카자흐스탄 자국 형태 공사비 소유권 운영 카자흐스탄 대출 일으키 유치 ㄴ데 차나칼레 역시 에서 대표 브리즈번 랜드 수주 개발 기회 업무 협약 에서 이자 로서 다는 이른바 건설업 밖에 기반 느냐 유로 베이스 느냐 사업 보다 공기업 기관 뒷받침 절실 다는 카자흐스탄 소형 에서 라는 시티 개발 해외 거치 어야 투자 타이밍 놓치 다는 꾸준히 공기업 준정부기관 개정 시스템 최근 해외 사업 내용 해외건설협회 사업 일례 한국수력원자력 상황 ㄴ다 강조,주장 인프라 상황 공사비 그런데 프로젝트 일으키 발주 약정 해당 건설사 해외 개발 국내 건설 전략 카자흐스탄 순환도로 운영 민관 인프라 유지 세금 발주 카자흐스탄 자국 형태 공사비 소유권 운영 카자흐스탄 대출 일으키 유치 차나칼레 대표 브리즈번 랜드 수주 개발 기회 업무 협약 이자 로서 이른바 건설업 밖에 기반 느냐 유로 베이스 느냐 사업 보다 공기업 기관 뒷받침 절실 카자흐스탄 소형 라는 시티 개발 해외 거치 어야 투자 타이밍 놓치 꾸준히 공기업 준정부기관 개정 시스템 해외 사업 내용 해외건설협회 사업 일례 한국수력원자력 상황 강조
"GS건설, 목표주가 3.2만→2.8만-대신",2023-07-03 06:22:05,아파트 지하 주차장 이곳 주차장 지붕 파이낸셜뉴스 대신증권 에서 이태환 황상 보수 아래 밝히 연구원 체력 으나 진행 성장세 이후,아파트 지하 주차장 이곳 주차장 지붕 파이낸셜뉴스 대신증권 이태환 황상 보수 아래 연구원 체력 으나 진행 성장세 이후
"“100대 기업 CEO, 열에 일곱은 ‘586세대’”",2023-07-03 07:02:01,전성시대 조원태 서울 고려 출신 한경비즈니스 세로 으로 최근 조사 토끼띠 소띠 토끼띠 구자은 삼성전기 한화 일무 한국 토끼띠 삼성디스플레이 박정 고려아연 토끼띠 보다 감소 연속 조원태 대한항공 고려아연 사장 감소 기업 갈등 글로벌 코로나 세대교체 뚜렷 는다 기존 관록 연륜 권오갑 신학 부회장 김교현 롯데케미칼 부회장 경영 학교 많이 고려대 출신 최정우 포스코홀딩스 회장 기계공학 외국인 에서 최희 부회장 애머스트 대표 다양 경영학 전공자 경영학 많이 제일제당 박정 고려대 출신 전공 경영학 경제학 회계학 으로 컴퓨터 기계공학 의사 이색 이력 의학박사 산부인과 의사 부회장 사법연수원 수원지방검찰청 쿠팡 대표 사법연수원 기로 김앤장 법률사무소 변호사 청와대 가까이 고려아연 미국 애머스트 에서 변호사 이마트 대표 경복고 서울고 전통 지금 불리 조원태 최희 부회장 특목고,전성시대 조원태 서울 고려 출신 한경비즈니스 세로 조사 토끼띠 소띠 토끼띠 구자은 삼성전기 한화 일무 한국 토끼띠 삼성디스플레이 박정 고려아연 토끼띠 보다 감소 연속 조원태 대한항공 고려아연 사장 감소 기업 갈등 글로벌 코로나 세대교체 뚜렷 는다 기존 관록 연륜 권오갑 신학 부회장 김교현 롯데케미칼 부회장 경영 학교 고려대 출신 최정우 포스코홀딩스 회장 기계공학 외국인 최희 부회장 애머스트 대표 다양 경영학 전공자 경영학 제일제당 박정 고려대 출신 전공 경영학 경제학 회계학 컴퓨터 기계공학 의사 이색 이력 의학박사 산부인과 의사 부회장 사법연수원 수원지방검찰청 쿠팡 대표 사법연수원 기로 김앤장 법률사무소 변호사 청와대 가까이 고려아연 미국 애머스트 변호사 이마트 대표 경복고 서울고 전통 지금 불리 조원태 최희 부회장 특목고
13층 아파트도 뚝딱 조립…‘해체 이동’까지 가능한 모듈러주택,2023-07-03 07:03:01,급부상 대표 배선 배관 욕실 에서 는데다 부족 건설업 개발 에서 이미지 최근 산업 에서 활발 현대엔지니어링 지난달 경기도 모듈 시간 버티 현대엔지니어링 극복 현대엔지니어링 시공 밝히 회사 서울 구로구 일대 국내 모듈 포스코 ㄴ다 서울 신기초등학교 평창 올림픽 기자단 숙소 미디어 레지던스 국내 사업 포스코그룹 역할 ㄴ다 최근 개발 시스템 개발 에서 학회 기존 석고보드 많이 상용 힘들 다는 최근 설치 층간소음 삼성물산 프로젝트 프로젝트 라인 배치 계획 ㄴ데 삼성물산 설립 가이스트 당진 세종 임대 포스코 현재 국내 모듈 단계 한국철강 공사비 교통부 일본 연간 글로벌 글로벌 에서 빠르 공급 이동 기존 산업 ㄴ다 ㄴ데 해체 용적률 건폐율 택법 개정 콘크리트 인센티브 국토부 마련 계획 발주 전문가 제작 지난달 에서 산업 개선 방안 선임 아서 발주 시공 이루어지 ㄴ다,급부상 대표 배선 배관 욕실 는데다 부족 건설업 개발 이미지 산업 활발 현대엔지니어링 지난달 경기도 모듈 시간 버티 현대엔지니어링 극복 현대엔지니어링 시공 회사 서울 구로구 일대 국내 모듈 포스코 서울 신기초등학교 평창 올림픽 기자단 숙소 미디어 레지던스 국내 사업 포스코그룹 역할 개발 시스템 개발 학회 기존 석고보드 상용 힘들 설치 층간소음 삼성물산 프로젝트 프로젝트 라인 배치 계획 삼성물산 설립 가이스트 당진 세종 임대 포스코 현재 국내 모듈 단계 한국철강 공사비 교통부 일본 연간 글로벌 글로벌 빠르 공급 이동 기존 산업 해체 용적률 건폐율 택법 개정 콘크리트 인센티브 국토부 마련 계획 발주 전문가 제작 지난달 산업 개선 방안 선임 아서 발주 시공 이루어지
무색해진 '고분양가 논란'…인덕원·평촌 줄줄이 '완판',2023-07-03 07:08:01,순위 이데일리 남부 에서 최근 아파트 만원 대가 보편 시작 센트럴 아이파크 역시 승용 건설업 대우건설 롯데건설 컨소시엄 지난달 정당 전용 육박 경자 시아 구역 영향 순위 순위 시작 너도나도 경기도 인덕원 가구 최근 전용 순위 아파트 만원 아파트 이후 최근 계약금 에서 낮추 잔여 최근 동안구 센텀퍼스트총 역시 분위기 청약 에서 양가 만원 역시 오히려 최근 센트럴 아이파크 에서 최근 부동산 이다 수도권 분양 만원 센트럴 아이파크 일반 분양 가구 전용 최고 만원 센트럴 아이파크 김효선 위원,순위 이데일리 남부 아파트 만원 대가 보편 시작 센트럴 아이파크 승용 건설업 대우건설 롯데건설 컨소시엄 지난달 정당 전용 육박 경자 시아 구역 영향 순위 순위 시작 너도나도 경기도 인덕원 가구 전용 순위 아파트 만원 아파트 이후 계약금 낮추 잔여 동안구 센텀퍼스트총 분위기 청약 양가 만원 오히려 센트럴 아이파크 부동산 이다 수도권 분양 만원 센트럴 아이파크 일반 분양 가구 전용 최고 만원 센트럴 아이파크 김효선 위원
"[클릭 e종목]GS건설, 하반기 충당금 반영…목표가 12%↓",2023-07-03 07:42:01,대신증권 사고 대신증권 기존 동기 늘어나 전망 베트남 아파트 국내 연간 세대 이태환 연구원 연간 이라고 연구원 ㄴ다 이라고 사고,대신증권 사고 대신증권 기존 동기 늘어나 전망 베트남 아파트 국내 연간 세대 이태환 연구원 연간 이라고 연구원 이라고 사고
"GS건설, 2분기 실적 전망치 상회 예상…목표주가는 하향-대신",2023-07-03 07:59:51,대신증권 주가 기존 에서 으로 이태환 대신증권 연구원 전년 동기 전망 ㄴ다 ㄴ다 베트남 아파트 국내 연간 세대 연간 목표 있다 황상 이어 으나 보수 아래 ㄴ다 연구원 으나 진행 성장세,대신증권 주가 기존 이태환 대신증권 연구원 전년 동기 전망 베트남 아파트 국내 연간 세대 연간 목표 황상 으나 보수 아래 연구원 으나 진행 성장세
"[정비록] '원조 부촌' 부활 꿈꾸는 방배13구역, 이주 지연에 몸살",2023-07-03 10:01:39,편집 ㅂ니다 재건축 개발 해당 조합 건설업 ㅂ니다 계획 부동산 ㅂ니다 전달 재건축 정비 이른바 삼성 청담 잠실동 방배동 트로이카 압서방이란 방배동 고급 방배동 에서 분위기 전신주 재건축 구역 구역 트럭 다세대 주차공간 분위기 구역 휑하 ㄴ다 사진 정영희 기자 개발 서초구 방배동 아파트 시공 사업 조합 시공사 관리 계획 인가 에서 당시 설립 조합 환경 토지면 어야 구역 신청 서초구 동일 ㄴ다 에서 상고 에서 서초구 방배동 구역 이주 진입 기자 에서 상대로 조합장 밖에 이어 조합원 보니 차라리 다는 이루어지 별도 판결 는다 공사비 한편 개발 동일 조합 이주 꾸준히 재건축 개발 이때 종교 꾸준히 ㄴ다 대표 성북구 구역 재건축 사진 다는 조합 시간 에서 발생 종교 개발 으로 종교 마련 개발 계획 기존 용지 마련 제안 조합 단순 가이드라인 구속력 현실 어렵 종교의 한국 연구원 조합 시설 종교의 있다 신도 신앙 일상 구역 기업 보상금 기업 지법 조합 기업 기업 으나 조합장 기업 이주 해당 감정평가 거절 조합 기업 지하 아직 방사능 원자력 신청 ㄴ다 조합 원자력 어서 라야 대표 변호사 에서 기존 있다 서초구 방배동 구역 개발 전경 사진 추가 에서 지하철역 송승현 대표 ㄴ다 내다보 본래 개발 계획 방배동 개발 프리미엄 많이 만원 만원 아파트 부터 시작 조합원 만원 만원 만원 구역 단점 연립 다세대 ㄹ수록 ㄴ다 조합 계획 신청 소형 가구 에서 줄이 확실히 상승 공사비 조합 추가 철거 공사비 이라고,편집 재건축 개발 해당 조합 건설업 계획 부동산 전달 재건축 정비 이른바 삼성 청담 잠실동 방배동 트로이카 압서방이란 방배동 고급 방배동 분위기 전신주 재건축 구역 구역 트럭 다세대 주차공간 분위기 구역 휑하 사진 정영희 기자 개발 서초구 방배동 아파트 시공 사업 조합 시공사 관리 계획 인가 당시 설립 조합 환경 토지면 어야 구역 신청 서초구 동일 상고 서초구 방배동 구역 이주 진입 기자 상대로 조합장 밖에 조합원 보니 차라리 이루어지 별도 판결 는다 공사비 한편 개발 동일 조합 이주 꾸준히 재건축 개발 이때 종교 꾸준히 대표 성북구 구역 재건축 사진 조합 시간 발생 종교 개발 종교 마련 개발 계획 기존 용지 마련 제안 조합 단순 가이드라인 구속력 현실 어렵 종교의 한국 연구원 조합 시설 종교의 신도 신앙 일상 구역 기업 보상금 기업 지법 조합 기업 기업 으나 조합장 기업 이주 해당 감정평가 거절 조합 기업 지하 아직 방사능 원자력 신청 조합 원자력 라야 대표 변호사 기존 서초구 방배동 구역 개발 전경 사진 지하철역 송승현 대표 내다보 본래 개발 계획 방배동 개발 프리미엄 만원 만원 아파트 부터 시작 조합원 만원 만원 만원 구역 단점 연립 다세대 ㄹ수록 조합 계획 신청 소형 가구 줄이 확실히 상승 공사비 조합 철거 공사비 이라고
‘둔산 자이 아이파크’ 분양 전부터 홍보관에 수요자 '북적',2023-07-03 11:07:01,공급 아이파크 관이 불구 수요자 대전 아이파크 교육 어서 서대전역 갤러리아백화점 롯데백화점 이마트 행정 기관 괴정중고 보니 몰려들 문전성시 아이파크 분양 궁금 꾸준히 재건축 정비 아이파크 분양 분양 커뮤니티 아이파크 커뮤니티 들어서 실내 독서실 카페테리아 카페테리아 친지 반갑 맞이 남구 물놀이 커뮤니티 ㄴ다 기대감 분양 시작 분이 최대어 아이파크 재건축 아파트 지하 가구,공급 아이파크 관이 불구 수요자 대전 아이파크 교육 서대전역 갤러리아백화점 롯데백화점 이마트 행정 기관 괴정중고 보니 몰려들 문전성시 아이파크 분양 궁금 꾸준히 재건축 정비 아이파크 분양 분양 커뮤니티 아이파크 커뮤니티 들어서 실내 독서실 카페테리아 카페테리아 친지 반갑 맞이 남구 물놀이 커뮤니티 기대감 분양 시작 분이 최대어 아이파크 재건축 아파트 지하 가구
호반건설·호반산업 국토부 상호협력평가 ‘최우수’,2023-07-03 11:19:04,호반 교통부 연속 최우 호반 계열 호반 국토 교통부 에서 실시 에서 최우 기업 호반건설 호반 연속 최고 서초구 호반 산업 신인도 최우 대기업 호반 그룹 있다 우수 사내 경영 사전 ㄴ다 원가 절감 인센티브 있다,호반 교통부 연속 최우 호반 계열 호반 국토 교통부 실시 최우 기업 호반건설 호반 연속 최고 서초구 호반 산업 신인도 최우 대기업 호반 그룹 우수 사내 경영 사전 원가 절감 인센티브
