date,Title,Content,tokens
2021-08-30T14:54:00,의료 공사 수주 공사비,지하 지상 단일 병원 건물 최대 규모 의료 재단 발주 학교 의료 공사 계약 체결 공사비 규모 지분 올해 착공 하반기 준공 목표 학교 의료 일반 일대 병상 베드 규모 종합 병원 지하 지상 연면적 단일 병원 건물 전국 최대 규모 진료 심뇌 혈관 센터 센터 센터 감염 호흡기 센터 당뇨 갑상선 센터 권역 응급 의료 센터 구축 위중 환자 응급 환자 치료 의료 건립 중증 치료 지역 의료 시설 이용 시민 불편 해소 전망 의료 건립 이지 일반 생명 특화 조성 의료 관련 업체 입주 배후 산업 시너지 효과 기대 한편 병원 다양 의료 시설 시공 노하우 보유 이번 공사 발판 향후 다양 의료 연구 시설 시공 개발 사업 참여 계획,지하 지상 단일 병원 건물 최대 규모 의료 재단 발주 학교 의료 공사 계약 체결 공사비 규모 지분 착공 하반기 준공 목표 학교 의료 일반 일대 병상 베드 규모 종합 병원 지하 지상 연면적 단일 병원 건물 전국 최대 규모 진료 심뇌 혈관 센터 센터 센터 감염 호흡기 센터 당뇨 갑상선 센터 권역 응급 의료 센터 구축 위중 환자 응급 환자 치료 의료 건립 중증 치료 지역 의료 시설 이용 시민 불편 해소 전망 의료 건립 이지 일반 생명 특화 조성 의료 관련 업체 입주 배후 산업 시너지 효과 기대 한편 병원 다양 의료 시설 시공 노하우 보유 이번 공사 발판 향후 다양 의료 연구 시설 시공 개발 사업 참여 계획
2021-08-06T11:10:00,스타트업 산군 스타트업 시드 투자 유치,건설 데이터 스타트업 산군 기관 투자 유치 소재 글로벌 벤처 스타트업 건설 데이터 플랫 운영 스타트업 산업 역군 이하 산군 투자 산군 대표 건설 종사자 건설 시공 자재 업체 협업 과정 발주 경쟁력 업체 확보 수주 고객 확보 기회 제공 건설 종합 플랫 공급 체인 제조업 건설업 공사 프로젝트 입찰 업체 선정 구조 업체 정보 파악 산군 국내 종합 건설사 전문 건설사 건설 재사 공종 생산 품목 분류 건설 데이터 실시간 제공 출시 주사 협력 상호 평가 플랫 건설 건설 업체 평가 데이터 일정 관리 의사소통 대금 지급 품질 항목 수치 추천 지수 데이터 제공 오픈 현대 엔지니어링 포함 대형 건설사 서비스 이용 산군 대표 건설업 지속 기성 지연 납기 문제 발주 력사 상호 평가 개선 공정 건설 문화 조성 건설 데이터 바탕 입찰 협업 서비스 오픈 건설 종합 플랫폼 거듭나,건설 데이터 스타트업 산군 기관 투자 유치 소재 글로벌 벤처 스타트업 건설 데이터 플랫 운영 스타트업 산업 역군 이하 산군 투자 산군 대표 건설 종사자 건설 시공 자재 업체 협업 과정 발주 경쟁력 업체 확보 수주 고객 확보 기회 제공 건설 종합 플랫 공급 체인 제조업 건설업 공사 프로젝트 입찰 업체 선정 구조 업체 정보 파악 산군 국내 종합 건설사 전문 건설사 건설 재사 공종 생산 품목 분류 건설 데이터 실시간 제공 출시 주사 협력 상호 평가 플랫 건설 건설 업체 평가 데이터 일정 관리 의사소통 대금 지급 품질 항목 수치 추천 지수 데이터 제공 오픈 현대 엔지니어링 포함 대형 건설사 서비스 이용 산군 대표 건설업 지속 기성 지연 납기 문제 발주 력사 상호 평가 개선 공정 건설 문화 조성 건설 데이터 바탕 입찰 협업 서비스 오픈 건설 종합 플랫폼 거듭나
2021-10-28T17:18:00,영업 영업 이익,공시 잠정 이익 발표 주택 부문 안정 원가 구조 유지 분기 연결 기준 매출액 영업 이익 집계 공시 시장 예상 매출액 영업 이익 웃돈 올해 회사 분할 연간 영업 이익 목표 제시 이번 분기 누계 기준 영업 이익 연간 목표 해당 주택 부문 안정 원가 구조 유지 가운데 이번 분기 플랜트 부문 도급 증액 준공 정산 이익 반영 영업 이익 개선 연결 기준 신규 수주 분기 분기 누계 기준 기록 주택 부문 경우 올해 수주 인식 예정 다수 프로젝트 확보 해외 플랜트 부문 분기 규모 해외 플랜트 수주 기대 회사 올해 수주 목표 달성 전망 재무 안정 건설 업종 최고 수준 유지 기준 부채 비율 현금 현금 현금 자산 연초 대비 증가 안정 현금 구조 보이 분기 이익 추세 지속 연간 영업 이익 목표 상회 실적 기록 전망,공시 잠정 이익 발표 주택 부문 안정 원가 구조 유지 연결 기준 매출액 영업 이익 집계 공시 시장 예상 매출액 영업 이익 웃돈 회사 분할 연간 영업 이익 목표 제시 이번 누계 기준 영업 이익 연간 목표 해당 주택 부문 안정 원가 구조 유지 가운데 이번 플랜트 부문 도급 증액 준공 정산 이익 반영 영업 이익 개선 연결 기준 신규 수주 누계 기준 기록 주택 부문 경우 수주 인식 예정 다수 프로젝트 확보 해외 플랜트 부문 규모 해외 플랜트 수주 기대 회사 수주 목표 달성 전망 재무 안정 건설 업종 최고 수준 유지 기준 부채 비율 현금 현금 현금 자산 연초 대비 증가 안정 현금 구조 보이 이익 추세 지속 연간 영업 이익 목표 상회 실적 기록 전망
2021-10-13T13:45:00,기업 택지 개발 임직원 동원 지분 쪼개 논란,국내 기업 택지 개발 사업 추진 사업 구역 토지 임직원 매각 조합원 의결권 확보 기존 지주 반발 임진왜란 당시 장군 왜군 독산 세마 주변 대형 건설사 참여 행사 일대 토지 택지 개발 추진 아파트 가구 공원 조성 기존 지주 개발 토지 돌려주 환지 방식 사업 사업 추진 지지부진 사업 구역 토지 임직원 분할 매각 분할 매각 토지 소유자 절반 이상 동의 사업 추진 방식 동의 사업 구역 토지 포함 기존 지주 자신 권리 침해 반발 분할 매각 임직원 사업 추진 토지 피해 사업 동의 부지 빼놓 시행 부도 사업 장기간 표류 손해 사업 효율 추진 임직원 토지 분할 매각 명의 신탁 감정 평가 현금 매각 해명,국내 기업 택지 개발 사업 추진 사업 구역 토지 임직원 매각 조합원 의결권 확보 기존 지주 반발 임진왜란 당시 장군 왜군 독산 세마 주변 대형 건설사 참여 행사 일대 토지 택지 개발 추진 아파트 가구 공원 조성 기존 지주 개발 토지 돌려주 환지 방식 사업 사업 추진 지지부진 사업 구역 토지 임직원 분할 매각 분할 매각 토지 소유자 절반 이상 동의 사업 추진 방식 동의 사업 구역 토지 포함 기존 지주 자신 권리 침해 반발 분할 매각 임직원 사업 추진 토지 피해 사업 동의 부지 빼놓 시행 부도 사업 장기간 표류 손해 사업 효율 추진 임직원 토지 분할 매각 명의 신탁 감정 평가 현금 매각 해명
2021-08-03T14:02:00,강북 오르 금품 향응 구역 수주 과열,구청 조합원 피해 우려 상시 단속 운영 강력 대응 구역 재건축 선정 앞두 건설 업체 사이 경쟁 과열 관할 구청 단속 건설사 실현 가능 개발 홍보 조합원 금품 향응 제공 이르 이달 예상 결정 구역 건축 대상 지역 건설 건설사 만들 홍보 상당 인테리어 업그레이드 조합원 분양 할인 백화점 연계 커뮤니티 설치 실현 가능 개발 선전 남발 조합원 환심 건네 향응 제공 비일비재 신고 이어지 수주 전이 긴급 대책 회의 행정력 총동원 감독 강화 상시 단속 운영 최근 강북 오르 이권 커지 건설사 과열 경쟁 벌이 입찰 무효 조합원 피해 구청 적극 나서 건설사 과도 사업 공약 선정 계약 단계 반영 바뀌 설명 지난주 건설사 사업 제안서 조합원 분양 할인 추가 분양 수익 확보 백화점 연계 통합 개발 커뮤니티 설치 홍보 금지 조처 조합 조합원 여유 재건축 사업 제안서 비교 검토 예정 합동 보설 명회 보관 운영 일정 최소 이상 늘리 요청 금품 향응 제공 부정행위 관련 부서 직원 자체 단속 신고 센터 운영 서대문 구청장 조합원 개별 홍보 부정행위 적발 입찰 공고 내용 입찰 참가 자격 박탈 금품 수수 적발 건설사 법인 대표 고발 구역 재건축 면적 아파트 가구 사업,구청 조합원 피해 우려 상시 단속 운영 강력 대응 구역 재건축 선정 앞두 건설 업체 사이 경쟁 과열 관할 구청 단속 건설사 실현 가능 개발 홍보 조합원 금품 향응 제공 이르 이달 예상 결정 구역 건축 대상 지역 건설 건설사 만들 홍보 상당 인테리어 업그레이드 조합원 분양 할인 백화점 연계 커뮤니티 설치 실현 가능 개발 선전 남발 조합원 환심 건네 향응 제공 비일비재 신고 이어지 수주 전이 긴급 대책 회의 행정력 총동원 감독 강화 상시 단속 운영 최근 강북 오르 이권 커지 건설사 과열 경쟁 벌이 입찰 무효 조합원 피해 구청 적극 나서 건설사 과도 사업 공약 선정 계약 단계 반영 바뀌 설명 지난주 건설사 사업 제안서 조합원 분양 할인 추가 분양 수익 확보 백화점 연계 통합 개발 커뮤니티 설치 홍보 금지 조처 조합 조합원 여유 재건축 사업 제안서 비교 검토 예정 합동 보설 명회 보관 운영 일정 최소 이상 늘리 요청 금품 향응 제공 부정행위 관련 부서 직원 자체 단속 신고 센터 운영 서대문 구청장 조합원 개별 홍보 부정행위 적발 입찰 공고 내용 입찰 참가 자격 박탈 금품 수수 적발 건설사 법인 대표 고발 구역 재건축 면적 아파트 가구 사업
2021-08-09T06:30:00,분상 적용 세상 강일 분양,거리 두기 단계 심위 연기 설계 변경 접수 구청 설계 변경 처리 분양 일정 재협의 분양 기대 고덕 세상 강일 분양 투명 바이러스 감염증 설계 변경 신청 접수 번지 일대 시공 가구 규모 단지 일반 분양 전용 면적 구성 분양 가상 적용 주변 시세 추첨제 물량 시장 기대 주택 업계 따르 고덕 세상 강일 애초 중순 분양 예정 이달 입주자 모집 공고 연기 정부 사회 거리 두기 단계 지침 분양 심사 위원회 열리 차례 연기 분양 상한 적용 지역 공공 택지 민간 택지 지난해 이후 지자체 설치 분양 심사 위원회 심의 분양 책정 확산 커지 사업 주체 양해 분양 일정 지연 설명 사회 거리 두기 단계 연장 강일 설계 변경 접수 분양 구청 따르 사회 거리 두기 단계 분양 일정 연기 상황 설계 변경 접수 구청 접수 설계 변경 처리 분양 심사 위원회 설명 업계 설계 변경 내용 다르 통상 설계 변경 처리 이유 분양 분양 지연 방지 대책 필요 조언 익명 요구 주택 업계 관계자 사회 거리 두기 단계 공공 기관 회의 지양 경우 사업 일정 연기 경우 사업 주체 입장 손해 발생 청약 준비 예정 일정 늘어지 장단 모르 일정 분양 문제 온라인 회의 대안 필요 대책 촉구 행정 기관 문제 인지 구청 관계자 사회 거리 두기 단계 사업 주체 부담 설계 변경 처리 필요 단계 유지 분양 일정 상의 계획 한편 분양 예고 수도 단지 예정 일정 분양 진행 시공 신성 빌라 재건축 일반 분양 가구 분양 가심 위원회 대상 현대 건설 도시 생활 주택 수도권 분양 민간 택지 공공 택지 대상 제외 광교 퍼스트 분양 심사 위원회,거리 단계 심위 연기 설계 변경 접수 구청 설계 변경 처리 분양 일정 재협의 분양 기대 고덕 세상 강일 분양 투명 바이러스 감염증 설계 변경 신청 접수 번지 일대 시공 가구 규모 단지 일반 분양 전용 면적 구성 분양 가상 적용 주변 시세 추첨제 물량 시장 기대 주택 업계 따르 고덕 세상 강일 애초 중순 분양 예정 이달 입주자 모집 공고 연기 정부 사회 거리 단계 지침 분양 심사 위원회 열리 차례 연기 분양 상한 적용 지역 공공 택지 민간 택지 지난해 이후 지자체 설치 분양 심사 위원회 심의 분양 책정 확산 커지 사업 주체 양해 분양 일정 지연 설명 사회 거리 단계 연장 강일 설계 변경 접수 분양 구청 따르 사회 거리 단계 분양 일정 연기 상황 설계 변경 접수 구청 접수 설계 변경 처리 분양 심사 위원회 설명 업계 설계 변경 내용 다르 통상 설계 변경 처리 이유 분양 분양 지연 방지 대책 필요 조언 익명 요구 주택 업계 관계자 사회 거리 단계 공공 기관 회의 지양 경우 사업 일정 연기 경우 사업 주체 입장 손해 발생 청약 준비 예정 일정 늘어지 장단 모르 일정 분양 문제 온라인 회의 대안 필요 대책 촉구 행정 기관 문제 인지 구청 관계자 사회 거리 단계 사업 주체 부담 설계 변경 처리 필요 단계 유지 분양 일정 상의 계획 한편 분양 예고 수도 단지 예정 일정 분양 진행 시공 신성 빌라 재건축 일반 분양 가구 분양 가심 위원회 대상 현대 건설 도시 생활 주택 수도권 분양 민간 택지 공공 택지 대상 제외 광교 퍼스트 분양 심사 위원회
2021-10-15T22:53:00,플랫폼 혁신 문제 해결 지원,급변 환경 기업 살아남 성장 혁신 진화 중요 플랫 필요 기능 제공 문제 극복 대처 지원 대표 개최 이하 그룹 인터뷰 서비스 전략 비전 소개 대표 생각 플랫 문제 해결 필요 기술 요소 결합 시너지 부족 부분 빠르 개발 대체 환경 설명 전략 반영 플랫 포지 포지 환경 소프트웨어 데이터 연결 지원 플랫 데이터 서비스 구성 건축 건설 엔지니어링 미디어 산업 제작 프로세스 대표 포지 활용 만들 데이터 상호 운용 개발 활용 데이터 중요 자산 지금 시대 데이터 효율 활용 지원 플랫 설명 포지 기반 데이터 시각 분석 통합 카탈로그 설계 자동 제작 최근 주목 데이터 기반 사업 중심 관련 계획 최근 인수 기술 전문 기업 기술 바탕 고객 지원 서비스 확대 지난해 머신 러닝 기반 데이터 자동 추출 처리 파이프 통합 건축 건설 엔지니어링 분야 협업 효율 지원 올해 기반 제공 업체 업체 인수 업체 개방 데이터 접근 방식 자사 통합 데이터 중심 제품 개발 프로세스 손쉽 구현 지원 예정 수자원 인프라 소프트웨어 기업 인수 급수 네트워크 수집 시스템 폐수 처리 플랜트 수자원 인프라 자사 결합 수자원 관리 상하수도 시설 디지털 구현 운영 비용 최적화 지속 가능 설계 지원 대표 수자원 관리 지자체 관심 내년 관련 소식 건설사 아파트 주차장 설계 디자인 사용 제약 조건 설계 대안 생성 기존 설계 방식 대비 시간 비용 설계 주차 공간 가량 주력 사업 제조 디지털 메타 버스 사업 분야 성장 지원 확대 기반 디지털 기술 플랫 상용 전문 기술 지원 확대 메타 버스 기업 애니메이션 캐릭터 구축 사용 마야 관련 서비스 확대 준비 계획 산업 전반 고민 지속 가능 향상 디자인 탄소 배출 폐기물 저감 에너지 자재 활용 회복 탄력 제품 제조 공간 설계 지원 프리뷰 실시간 탄소 분석 카본 카본 데이터 오픈 소스 에너지 분석 결합 설계자 정확 신뢰 실시간 탄소 분석 제공 대표 데이터 자동 지속 가능 핵심 고객 주력 강조,급변 환경 기업 살아남 성장 혁신 진화 중요 플랫 필요 기능 제공 문제 극복 대처 지원 대표 개최 이하 그룹 인터뷰 서비스 전략 비전 소개 대표 생각 플랫 문제 해결 필요 기술 요소 결합 시너지 부족 부분 빠르 개발 대체 환경 설명 전략 반영 플랫 포지 포지 환경 소프트웨어 데이터 연결 지원 플랫 데이터 서비스 구성 건축 건설 엔지니어링 미디어 산업 제작 프로세스 대표 포지 활용 만들 데이터 상호 운용 개발 활용 데이터 중요 자산 지금 시대 데이터 효율 활용 지원 플랫 설명 포지 기반 데이터 시각 분석 통합 카탈로그 설계 자동 제작 최근 주목 데이터 기반 사업 중심 관련 계획 최근 인수 기술 전문 기업 기술 바탕 고객 지원 서비스 확대 지난해 머신 러닝 기반 데이터 자동 추출 처리 파이프 통합 건축 건설 엔지니어링 분야 협업 효율 지원 기반 제공 업체 업체 인수 업체 개방 데이터 접근 방식 자사 통합 데이터 중심 제품 개발 프로세스 손쉽 구현 지원 예정 수자원 인프라 소프트웨어 기업 인수 급수 네트워크 수집 시스템 폐수 처리 플랜트 수자원 인프라 자사 결합 수자원 관리 상하수도 시설 디지털 구현 운영 비용 최적화 지속 가능 설계 지원 대표 수자원 관리 지자체 관심 관련 소식 건설사 아파트 주차장 설계 디자인 사용 제약 조건 설계 대안 생성 기존 설계 방식 대비 시간 비용 설계 주차 공간 가량 주력 사업 제조 디지털 메타 버스 사업 분야 성장 지원 확대 기반 디지털 기술 플랫 상용 전문 기술 지원 확대 메타 버스 기업 애니메이션 캐릭터 구축 사용 마야 관련 서비스 확대 준비 계획 산업 전반 고민 지속 가능 향상 디자인 탄소 배출 폐기물 저감 에너지 자재 활용 회복 탄력 제품 제조 공간 설계 지원 프리뷰 실시간 탄소 분석 카본 카본 데이터 오픈 소스 에너지 분석 결합 설계자 정확 신뢰 실시간 탄소 분석 제공 대표 데이터 자동 지속 가능 핵심 고객 주력 강조
2021-12-30T22:31:00,신문 거침없 질주,다음 일자 신문 주요 기사 거침없 질주 작곡가 안무가 저작 보호 댄서 인터넷 은행 가계 대출 한도 적용 뜨겁 여름 그립 국민주 삼전 전자 권고 교육 교부금 제도 개편 언론 정치 차별 통신 사찰 수처 종합 도전 혁신 환경 만들 경제 단체장 목소리 호소 외환 위기 서대문 통술 폐업 증시 작년 수익 내년 반도체 주목 전지 게임 반도체 지지부진 동학 개미 공모 금액 종합 정치 추경 요구 정부 준비 지원 신속 이행 중요 대출 규제 수도 전세 대출 보증 한도 사리 국민 연금 주총 의결 중립 기권 결정 내년 압박 고민 댄스 신드롬 언어 국경 회당 출연료 현역 수명 세계 댄스 페스티벌 만들 나무 정치 대통령 가혹 심경 직권 남용 집행 오늘 오찬 갈등 봉합 주목 정치 호남 非文 복당 범여 대통 탄력 격차 내년 경제 위기 지속 전망 범상 지지율 양강 구도 뒤흔드 묵묵부답 대통령 경제 생산 투자 선행 지표 내리막 은행 주담 신용 대출 금리 최고 마시 우유 가공 원유 가격 다르 금융 파격 인사 부서장 용자 신용 대출 사고 부담금 마약 운전자 부동산 급등 부담 상속세 종신 보험 대비 글로벌 내년 세계 정치판 볼트 배터리 생산 전지 업계 판도 공룡 내년 투자 역대 광풍 올해 수익 굴욕 스마트 로봇 탄소 중립 기업 지상 최대 가전 공격 스타트업 역대 최다 참가 콘셉트 공개 관객 메타 버스 공간 기술 체험 특별 연사 주제 대담 산업 철강 감산 국내 업계 반사 이익 기대감 보조금 축소 경차 취득세 감면 세계 오미크론 진단 키트 비결 진단 시약 노하우 사업 솔리 다임 래스 효성 한정 판매 한화 안테나 반도체 모듈 시장 진출 소비자 생활 가품 각오 창업 구매 업계 최고 경영 본격 장남 사장 승진 혁신 흑자 전환 진격 연매 탈환 아트 굴러다니 중세 아트 스케일 증권 개미 희망 임인 증시 포효 기대 개형 서비스 비대 계좌 수수료 혜택 올해 마지막 공모주 코스닥 이전 상장 신고식 부동산 신통 기획 재건축 속도 시장 교란 엄벌 집값 하락 최대 낙폭 경신 양도세 폭탄 내년 상가 주택 세금 주의보 플랜트 수주 여행 시름 우림 사막 북극 지구 뱃사람 아침 행복 스포츠 상금 얼굴 작년 실패 충격 올해 내년 정규 투어 신인왕 도전 선수 영향력 평가 상금 시즌 에이스 코리안 노랑 통닭 골프 창단 세계 주류 콘텐츠 홍보 글로벌 소통 주도 플랫 해외 홍보 과장 알리 피니언 규제 혁신 원포 과세 대상 결합 조건부 승인 아쉽 법위 백신 아프 접종 박병 농진청 농업 기술 해결 관점 다양 작품 호불호 예상 그룹 대표 문체 장관 표창 대표 부사장 선임 올해 인상 수중 음파 탐지 전문가 사회 개정 어렵 예산 부족 경찰 현장 대응 대책 공염불 내년 분기 접종 마무리 오미크론 거리 개편 자취 감추 중고 거래 소득 가족 관계,다음 일자 신문 주요 기사 거침없 질주 작곡가 안무가 저작 보호 댄서 인터넷 은행 가계 대출 한도 적용 뜨겁 여름 그립 국민주 삼전 전자 권고 교육 교부금 제도 개편 언론 정치 차별 통신 사찰 수처 종합 도전 혁신 환경 만들 경제 단체장 목소리 호소 외환 위기 서대문 통술 폐업 증시 작년 수익 반도체 주목 전지 게임 반도체 지지부진 동학 개미 공모 금액 종합 정치 추경 요구 정부 준비 지원 신속 이행 중요 대출 규제 수도 전세 대출 보증 한도 사리 국민 연금 주총 의결 중립 기권 결정 압박 고민 댄스 신드롬 언어 국경 회당 출연료 현역 수명 세계 댄스 페스티벌 만들 나무 정치 대통령 가혹 심경 직권 남용 집행 오늘 오찬 갈등 봉합 주목 정치 호남 非文 복당 범여 대통 탄력 격차 경제 위기 지속 전망 범상 지지율 양강 구도 뒤흔드 묵묵부답 대통령 경제 생산 투자 선행 지표 내리막 은행 주담 신용 대출 금리 최고 마시 우유 가공 원유 가격 다르 금융 파격 인사 부서장 용자 신용 대출 사고 부담금 마약 운전자 부동산 급등 부담 상속세 종신 보험 대비 글로벌 세계 정치판 볼트 배터리 생산 전지 업계 판도 공룡 투자 역대 광풍 수익 굴욕 스마트 로봇 탄소 중립 기업 지상 최대 가전 공격 스타트업 역대 최다 참가 콘셉트 공개 관객 메타 버스 공간 기술 체험 특별 연사 주제 대담 산업 철강 감산 국내 업계 반사 이익 기대감 보조금 축소 경차 취득세 감면 세계 오미크론 진단 키트 비결 진단 시약 노하우 사업 솔리 다임 래스 효성 한정 판매 한화 안테나 반도체 모듈 시장 진출 소비자 생활 가품 각오 창업 구매 업계 최고 경영 본격 장남 사장 승진 혁신 흑자 전환 진격 연매 탈환 아트 굴러다니 중세 아트 스케일 증권 개미 희망 임인 증시 포효 기대 개형 서비스 비대 계좌 수수료 혜택 마지막 공모주 코스닥 이전 상장 신고식 부동산 신통 기획 재건축 속도 시장 교란 엄벌 집값 하락 최대 낙폭 경신 양도세 폭탄 상가 주택 세금 주의보 플랜트 수주 여행 시름 우림 사막 북극 지구 뱃사람 아침 행복 스포츠 상금 얼굴 작년 실패 충격 정규 투어 신인왕 도전 선수 영향력 평가 상금 시즌 에이스 코리안 노랑 통닭 골프 창단 세계 주류 콘텐츠 홍보 글로벌 소통 주도 플랫 해외 홍보 과장 알리 피니언 규제 혁신 원포 과세 대상 결합 조건부 승인 아쉽 법위 백신 아프 접종 박병 농진청 농업 기술 해결 관점 다양 작품 호불호 예상 그룹 대표 문체 장관 표창 대표 부사장 선임 인상 수중 음파 탐지 전문가 사회 개정 어렵 예산 부족 경찰 현장 대응 대책 공염불 접종 마무리 오미크론 거리 개편 자취 감추 중고 거래 소득 가족 관계
