date,Title,Content,tokens
2022-03-06,호가 층고 폐지 반색,아파트 층고 폐지 접부 제한 유지 규제 폐지 부동산 가격 상승 우려 제기 용적 상향 우려 기우 아파트 사진 주형 기자 마천루 도시 전망 주거 건축물 일률 적용 층고 규제 없애 시장 내용 도시 기본 계획 발표 도시 기본 계획 플랜 핵심 폐지 재건축 사업 발목 규제 사라지 스카이라인 초고층 아파트 등장 경변 주요 정비 사업 탄력 전망 시장 과거 재임 당시 추진 강변 활성 정책 평가 강변 아파트 트리 마제 시장 과거 시장 재임 시절 재건축 허가 초고층 아파트 탄생 시장 시절 스카이라인 관리 원칙 마련 일반 주거 지역 이하 수변 접부 이하 층고 제한 이후 대부분 강변 아파트 재건축 마무리 추진 강변 단지 최고 이하 주구 마아 파트 당초 높이 계획 심의 사업 진행 기존 플랜 제한 시장 시절 플랜 제한 강변 건축 사업 제동 걸리 최고 건립 역세 종일 주거 준주 거로 상향 가능 최근 맨션 건축 사업 수주 건설 설계안 별도 추후 규제 풀리 전제 설계안 제시 상황 아파트 지구 구역 최근 구역 계획안 공개 강변 정비 사업 도시 기본 계획 최대 수혜 강변 규모 정비 사업 일체 도시 공간 조성 의지 표명 용적 규제 완화 기우 타워 전망대 마아 파트 사진 기자 기준 건물 용적 상향 동일 밀도 연면적 용적률 아래 건물 조화 배치 강변 건너 지금 성냥갑 스카이라인 스카이라인 조성 기대 건물 간격 배치 가능 경관 조망 통경 확보 개방 기대 구체 층수 개별 정비 계획 위원회 심의 지역 여건 고려 결정 강변 아파트 원칙 유지 강변 뒤쪽 위치 합리 배치 생각 강변 제한 권고 사항 적용 시장 도시 기본 계획 대대 규제 정비 나서 부동산 시장 자극 우려 개편 관련 집지 업무 상업 시설 가능 가격 상승 자극 지적 실제 규제 없애 발표 주인 기존 매물 거둬들이 호가 높이 공인 중개업 관계자 기존 매물 취소 호가 주인 문의 공인 중개업 대표 주인 매물 거둬들이 생각 주인 순식간 이상 호가 시장 상황 귀띔 지역 공인 중개사 개발 기대감 주인 반기 당장 매물 거둬들이 움직임 시장 규제 폐지 부동산 가격 상승 우려 폐지 부동산 가격 자극 기우 용적 변화 토지 이용 효율 과거 전제 가격 올라가 부동산 전문가 이번 층고 규제 완화 재건축 부동산 시장 활력 기대 부작용 대책 마련 필요 제언 공급 정상 속도 빠르 국지 혼란 세난 발생 부작용 실행 계획 준비 필요 교수 세계 각국 거대 도시 경우 부동산 개발 주요 추세 고밀 고층 국내 수요 압력 오랫동안 족쇄 작용 규제 풀리 수반 가격 변동 예측 전망 부동산 수석 전문 위원 당장 강변 건축 시장 변화 덩달 이해 당사자 부동산 가치 상승 기대감 반면 용적 증가 재건축 초과 수제 폐지 재건축 속도 향후 추이 필요,아파트 층고 폐지 접부 제한 유지 규제 폐지 부동산 가격 상승 우려 제기 용적 상향 우려 기우 아파트 사진 주형 마천루 도시 전망 주거 건축물 일률 적용 층고 규제 없애 시장 도시 기본 계획 발표 도시 기본 계획 플랜 핵심 폐지 재건축 발목 규제 사라지 스카이라인 초고층 아파트 등장 경변 주요 정비 탄력 전망 시장 과거 재임 당시 추진 강변 활성 정책 평가 강변 아파트 트리 마제 시장 과거 시장 재임 시절 재건축 허가 초고층 아파트 탄생 시장 시절 스카이라인 관리 원칙 마련 주거 지역 이하 수변 접부 이하 층고 제한 대부분 강변 아파트 재건축 마무리 추진 강변 단지 최고 이하 주구 마아 파트 당초 높이 계획 심의 진행 플랜 제한 시장 시절 플랜 제한 강변 건축 제동 걸리 최고 건립 역세 종일 주거 준주 거로 상향 맨션 건축 수주 설계안 별도 추후 규제 풀리 전제 설계안 제시 상황 아파트 지구 구역 구역 계획안 공개 강변 정비 도시 기본 계획 최대 수혜 강변 규모 정비 일체 도시 공간 조성 의지 표명 용적 규제 완화 기우 타워 전망대 마아 파트 사진 기준 건물 용적 상향 동일 밀도 연면적 용적률 아래 건물 조화 배치 강변 건너 지금 성냥갑 스카이라인 스카이라인 조성 기대 건물 간격 배치 경관 조망 통경 확보 개방 기대 구체 층수 개별 정비 계획 위원회 심의 지역 여건 고려 결정 강변 아파트 원칙 유지 강변 뒤쪽 위치 합리 배치 생각 강변 제한 권고 사항 적용 시장 도시 기본 계획 대대 규제 정비 나서 부동산 시장 자극 우려 개편 관련 집지 업무 상업 시설 가격 상승 자극 지적 실제 규제 없애 발표 주인 매물 거둬들이 호가 높이 공인 중개업 관계자 매물 취소 호가 주인 문의 공인 중개업 대표 주인 매물 거둬들이 생각 주인 순식간 이상 호가 시장 상황 귀띔 지역 공인 중개사 개발 기대감 주인 반기 당장 매물 거둬들이 움직임 시장 규제 폐지 부동산 가격 상승 우려 폐지 부동산 가격 자극 기우 용적 변화 토지 이용 효율 과거 전제 가격 올라가 부동산 전문가 층고 규제 완화 재건축 부동산 시장 활력 기대 부작용 대책 마련 필요 제언 공급 정상 속도 빠르 국지 혼란 세난 발생 부작용 실행 계획 준비 필요 교수 세계 각국 거대 도시 경우 부동산 개발 주요 추세 고밀 고층 국내 수요 압력 오랫동안 족쇄 작용 규제 풀리 수반 가격 변동 예측 전망 부동산 수석 전문 위원 당장 강변 건축 시장 변화 덩달 이해 당사자 부동산 가치 상승 기대감 반면 용적 증가 재건축 초과 수제 폐지 재건축 속도 향후 추이 필요
2022-03-06,당첨 기쁨 계약금 신규 아파트 중도금 대란,자금 계획 당첨 낭패 계약 포기 청약 대출 규제 기준 금리 인상 영향 신규 분양 마련 수요자 자금 부담 커지 계약 유지 걱정 기존 계약자 지적 사진 대출 규제 기준 금리 인상 영향 신규 분양 마련 수요자 자금 부담 커지 중도금 대출 가능 아파트 경우 분양 기준 이하 애당초 자금 조달 수요자 청약 포기 대출 금리 인상 이자 부담 곱절 늘어나 계약 유지 걱정 기존 계약자 지적 수도 청약 당첨 계약 경우 청약 제한 패널 감수 계약 포기 당첨자 발생 조기 실패 염려 사업장 공급 주체 시행 중도금 대출 분양 하향 조정 별도 보증 실시 다양 묘책 짜내 판도 옛말 자금 조달 문턱 분양 시장 그래픽 기자 내놓 얘기 나돌 수도 분양 시장 당첨 계약 포기 사례 사업장 청약 통장 순위 미계 약분 발생 경우 부동산업 따르 지난해 단지 경우 순위 청약 몰리 관심 전체 가구 공급 물량 가구 정당 계약 미분양 당첨 시세 차익 마케팅 대량 계약 사태 발생 원인 당첨자 대량 부적격 판정 자금 조달 능력 경우 해당 설명 실제 시공 업체 따르 미계 약자 호수 만족 계약 포기 가량 전체 분양 계약금 마련 지난해 지역 실시 순위 청약 계약 물량 순위 청약 미달 가구 규모 소형 단지 순위 청약 평균 경쟁 보이 미분 양분 발생 현장 분양 가격 불법 전매 당첨자 매수 나타나 포기 경우 얘기 나돌 계약 포기 공사 그래픽 기자 계약 높이 통상 분양 계약금 소액 계약금 정액 도입 사업장 나오 지방 사업장 청약 자이 애서 계약금 분양 나머지 금액 입주자 모집 공고 지구 중흥 퍼스트 계약금 정액 도입 중도금 무이자 적용 사업 파크 분양 중도금 무이자 융자 공급 주체 이자 부분 대납 경기 시티 파크 방식 도입 계약 제고 유도 중도금 잔금 납부 늦추 경기 고덕 오피스텔 분양 중도금 납부 입주 유예 오피스텔 버밀리언 남산 계약금 납부 중도금 잔금 입주 그래픽 기자 행사 자체 중도금 대출 방안 마련 경우 자이 폴라리스 경우 순위 청약 타입 마감 건설 분양 물량 중도금 대출 가능 해당 금융 별도 보증 분양 수유 팰리스 입주자 모집 공고 분양 시장 분위기 취소 공급 가격 공고 농협 은행 부동산 수석 위원 부채 원리금 상환 비율 강화 대출 제한 수요자 부담 늘어나 상황 청약 신중 중요,자금 계획 당첨 낭패 계약 포기 청약 대출 규제 기준 금리 인상 영향 신규 분양 마련 수요자 자금 부담 커지 계약 유지 걱정 계약자 지적 사진 대출 규제 기준 금리 인상 영향 신규 분양 마련 수요자 자금 부담 커지 중도금 대출 아파트 경우 분양 기준 이하 애당초 자금 조달 수요자 청약 포기 대출 금리 인상 이자 부담 곱절 늘어나 계약 유지 걱정 계약자 지적 수도 청약 당첨 계약 경우 청약 제한 패널 감수 계약 포기 당첨자 발생 조기 실패 염려 사업장 공급 주체 시행 중도금 대출 분양 하향 조정 별도 보증 실시 다양 묘책 짜내 판도 옛말 자금 조달 문턱 분양 시장 그래픽 내놓 얘기 나돌 수도 분양 시장 당첨 계약 포기 사례 사업장 청약 통장 순위 미계 약분 발생 경우 부동산업 단지 경우 순위 청약 몰리 관심 전체 가구 공급 물량 가구 정당 계약 미분양 당첨 시세 차익 마케팅 대량 계약 사태 발생 원인 당첨자 대량 부적격 판정 자금 조달 능력 경우 설명 실제 시공 업체 미계 약자 호수 만족 계약 포기 가량 전체 분양 계약금 마련 지역 실시 순위 청약 계약 물량 순위 청약 미달 가구 규모 소형 단지 순위 청약 평균 경쟁 보이 미분 양분 발생 현장 분양 가격 불법 전매 당첨자 매수 나타나 포기 경우 얘기 나돌 계약 포기 공사 그래픽 계약 높이 통상 분양 계약금 소액 계약금 정액 도입 사업장 나오 지방 사업장 청약 자이 애서 계약금 분양 나머지 금액 입주자 모집 공고 지구 중흥 퍼스트 계약금 정액 도입 중도금 무이자 적용 파크 분양 중도금 무이자 융자 공급 주체 이자 부분 대납 경기 시티 파크 방식 도입 계약 제고 유도 중도금 잔금 납부 늦추 경기 고덕 오피스텔 분양 중도금 납부 입주 유예 오피스텔 버밀리언 남산 계약금 납부 중도금 잔금 입주 그래픽 행사 자체 중도금 대출 방안 마련 경우 자이 폴라리스 경우 순위 청약 타입 마감 분양 물량 중도금 대출 금융 별도 보증 분양 수유 팰리스 입주자 모집 공고 분양 시장 분위기 취소 공급 가격 공고 농협 은행 부동산 수석 위원 부채 원리금 상환 비율 강화 대출 제한 수요자 부담 늘어나 상황 청약 신중 중요
2022-03-06,이상 마천 아파트 폐지 용적률 초환 규제 여전,발표 도시 기본 계획 플랜 제한 결정 강변 이상 초고층 마천 아파트 건설 가능 여부 관심 쏠리 일률 높이 풍식 아파트 대신 대다수 주민 염원 초고층 마천 아파트 건설 국내 가능 재건축 사업 탄력 기대 건설업 층수 규제 특색 설계 가능 아파트 가치 기대 현재 용적 상태 층수 폐지 효과 제한 의견 존재 부동산 업계 따르 층고 폐지 발표 이후 수혜 예상 지역 관망세 아파트 지구 경우 구역 최근 구역 재건축 계획안 공개 초고층 가능 여부 타진 최근 맨션 건축 사업 수주 건설 경우 설계안 별개 추후 층수 규제 풀리 전제 설계안 제시 초고층 건설 기대감 부동산업 관계자 발표 이후 주인 매도 보류 정작 매수 문의 대선 지방 선거 이후 실질 정책 변화 지켜보 관계자 층수 규제 풀리 환영 용적 규제 변수 매물 관망세 유지 건설업 층고 제한 용적 규제 별도 손대 결정 상황 입장 고수 이상 초고층 아파트 이하 공사비 증가 용적 풀리 늘리 어렵 일반 분양 확대 분양 수입 증가 어렵 만든 조합원 추가 분담금 상승 초래 시내 일반 주거 지역 강변 아파트 지구 재건축 용적 맨션 재건축 높이 용적 건설 맨션 조합 제시 대안 법정 상한 용적 넘어서 가상 설계안 걸림돌 재건축 초과 수제 분양 상한 건축 초고층 아파트 건설 아파트 상품 가치 재건축 부담금 분양 상한 규제 일반 분양 수입 오롯 조합원 비용 증가 건설사 관계자 이상 증가 공사비 일반 분양 수입 재건축 분담금 고려 득실 조합 결정 전문가 이번 층수 폐지 여야 대선 후보 공언 용적 규제 완화 경우 시장 파장 예상 여야 유력 대선 후보 건축 정비 사업 용적 상향 일반 주거 지역 신설 방식 상향 공약 내놓 상태 공약 시행 층고 폐지 초고층 아파트 건설 가능 업계 예상 민간 정비 사업 지원 제도 신속 통합 기획 일반 주거 지역 주거 지역 상향 용적 높이 층수 제한 방안 추진 정부 주도 정책 한계 정부 공공재 건축 방식 도입 토지 주택 공사 공공 기관 정비 사업 참여 용적 최대 과정 층수 제한 예상 공공 주도 참여 떨어지 상황 건설업 관계자 공공 참여 꼬리표 실제 용적 상향 조합 적극 재건축 추진 차기 정부 재건축 초과 수제 분양 상한 사업 시장 미치 파장 정도 무료 오늘 운세 무단 전재 배포 금지,발표 도시 기본 계획 플랜 제한 결정 강변 이상 초고층 마천 아파트 여부 관심 쏠리 일률 높이 풍식 아파트 대신 대다수 주민 염원 초고층 마천 아파트 국내 재건축 탄력 기대 건설업 층수 규제 특색 설계 아파트 가치 기대 현재 용적 상태 층수 폐지 효과 제한 의견 존재 부동산 업계 층고 폐지 발표 수혜 예상 지역 관망세 아파트 지구 경우 구역 구역 재건축 계획안 공개 초고층 여부 타진 맨션 건축 수주 경우 설계안 별개 추후 층수 규제 풀리 전제 설계안 제시 초고층 기대감 부동산업 관계자 발표 주인 매도 보류 정작 매수 문의 대선 지방 선거 실질 정책 변화 지켜보 관계자 층수 규제 풀리 환영 용적 규제 변수 매물 관망세 유지 건설업 층고 제한 용적 규제 별도 손대 결정 상황 입장 고수 이상 초고층 아파트 이하 공사비 증가 용적 풀리 늘리 어렵 분양 확대 분양 수입 증가 어렵 만든 조합원 추가 분담금 상승 초래 시내 주거 지역 강변 아파트 지구 재건축 용적 맨션 재건축 높이 용적 맨션 조합 제시 대안 법정 상한 용적 넘어서 가상 설계안 걸림돌 재건축 초과 수제 분양 상한 건축 초고층 아파트 아파트 상품 가치 재건축 부담금 분양 상한 규제 분양 수입 오롯 조합원 비용 증가 건설사 관계자 이상 증가 공사비 분양 수입 재건축 분담금 고려 득실 조합 결정 전문가 층수 폐지 여야 대선 후보 공언 용적 규제 완화 경우 시장 파장 예상 여야 유력 대선 후보 건축 정비 용적 상향 주거 지역 신설 방식 상향 공약 내놓 상태 공약 시행 층고 폐지 초고층 아파트 업계 예상 민간 정비 지원 제도 신속 통합 기획 주거 지역 주거 지역 상향 용적 높이 층수 제한 방안 추진 정부 주도 정책 한계 정부 공공재 건축 방식 도입 토지 주택 공사 공공 기관 정비 참여 용적 최대 과정 층수 제한 예상 공공 주도 참여 떨어지 상황 건설업 관계자 공공 참여 꼬리표 실제 용적 상향 조합 적극 재건축 추진 차기 정부 재건축 초과 수제 분양 상한 시장 미치 파장 정도 무료 오늘 운세 무단 전재 배포 금지
2022-03-06,이상 아파트,용적 규제 긍정 효과 미지수 대선 후보 공약 지키 파급 효과 전망대 시민 바라보 사진 발표 도시 기본 계획 플랜 제한 강변 이상 초고층 마천 아파트 건설 가능 주목 크기 아파트 층수 아파트 원하 주민 기대감 시간 커지 건설업 층수 규제 특색 설계 가능 아파트 가치 도시 미관 개선 긍정 영향 기대 지금 용적 상태 층수 폐지 효과 제한 의견 용적 전체 대지 면적 건물 각층 면적 연면적 차지 비율 용적 건축물 아파트 경우 용적 주택 용적 규제 층수 의미 부동산 업계 따르 층고 폐지 발표 이후 수혜 예상 지역 관망세 일각 집값 상승 기대감 매물 거둬들이 움직임 나타나 거래 이어지 아파트 지구 경우 구역 최근 구역 재건축 계획안 공개 초고층 가능 여부 타진 최근 맨션 건축 사업 수주 건설 설계안 별개 추후 층수 규제 풀리 전제 설계안 제시 맨션 일대 중개업 대표 발표 이후 주인 매도 보류 정작 매수 문의 대선 지방 선거 이후 실질 정책 변화 지켜보 아파트 인근 중개업 대표 층수 규제 풀리 환영 용적 규제 변수 매물 관망세 유지 건설업 층고 제한 용적 규제 손대 상황 입장 이상 초고층 아파트 이하 공사비 증가 용적 늘리 어렵 일반 분양 확대 분양 수입 증가 조합원 추가 분담금 상승 시내 일반 주거 지역 강변 아파트 지구 재건축 용적 맨션 재건축 높이 용적 건설 맨션 조합 제시 대안 법정 상한 용적 넘어서 가상 설계안 재건축 초과 수제 분양 상한 걸림돌 재건축 초고층 아파트 건설 아파트 상품 가치 재건축 부담금 분양 상한 규제 일반 분양 수입 오롯 조합원 비용 증가 건설사 관계자 이상 증가 공사비 일반 분양 수입 재건축 분담금 고려 득실 조합 결정 대선 후보 용적 공약 파급 효과 기대 전문가 이번 층수 폐지 여야 대선 후보 공언 용적 규제 완화 다면 시장 파장 예상 여야 유력 대선 후보 건축 정비 사업 용적 상향 일반 주거 지역 신설 방식 상향 공약 내놓 공약 실제 시행 층고 폐지 초고층 아파트 건설 가능 업계 예상,용적 규제 긍정 효과 미지수 대선 후보 공약 지키 파급 효과 전망대 시민 바라보 사진 발표 도시 기본 계획 플랜 제한 강변 이상 초고층 마천 아파트 주목 크기 아파트 층수 아파트 원하 주민 기대감 시간 커지 건설업 층수 규제 특색 설계 아파트 가치 도시 미관 개선 긍정 영향 기대 지금 용적 상태 층수 폐지 효과 제한 의견 용적 전체 대지 면적 건물 각층 면적 연면적 차지 비율 용적 건축물 아파트 경우 용적 주택 용적 규제 층수 의미 부동산 업계 층고 폐지 발표 수혜 예상 지역 관망세 일각 집값 상승 기대감 매물 거둬들이 움직임 나타나 거래 이어지 아파트 지구 경우 구역 구역 재건축 계획안 공개 초고층 여부 타진 맨션 건축 수주 설계안 별개 추후 층수 규제 풀리 전제 설계안 제시 맨션 일대 중개업 대표 발표 주인 매도 보류 정작 매수 문의 대선 지방 선거 실질 정책 변화 지켜보 아파트 인근 중개업 대표 층수 규제 풀리 환영 용적 규제 변수 매물 관망세 유지 건설업 층고 제한 용적 규제 손대 상황 입장 이상 초고층 아파트 이하 공사비 증가 용적 늘리 어렵 분양 확대 분양 수입 증가 조합원 추가 분담금 상승 시내 주거 지역 강변 아파트 지구 재건축 용적 맨션 재건축 높이 용적 맨션 조합 제시 대안 법정 상한 용적 넘어서 가상 설계안 재건축 초과 수제 분양 상한 걸림돌 재건축 초고층 아파트 아파트 상품 가치 재건축 부담금 분양 상한 규제 분양 수입 오롯 조합원 비용 증가 건설사 관계자 이상 증가 공사비 분양 수입 재건축 분담금 고려 득실 조합 결정 대선 후보 용적 공약 파급 효과 기대 전문가 층수 폐지 여야 대선 후보 공언 용적 규제 완화 다면 시장 파장 예상 여야 유력 대선 후보 건축 정비 용적 상향 주거 지역 신설 방식 상향 공약 내놓 공약 실제 시행 층고 폐지 초고층 아파트 업계 예상
2022-03-06,강변 초고층 아파트 폐지 기대감,폐지 그동안 침체 아파트 재건축 사업 탄력 전망 전망대 시민 바라보 기자 전격 폐지 그동안 침체 재건축 사업 탄력 전망 강변 스카이라인 고려 이상 초고층 아파트 관심 커지 일각 용적 상향 층고 폐지 효과 제한 관측 건설업 따르 도시 기본 계획 플랜 제한 삭제 이날 시장 전역 일률 절대 수치 기준 적용 기준 삭제 창의 건축 가능 스카이라인 가이드라인 전환 시장 시절 스카이라인 관리 원칙 마련 일반 주거 지역 이하 수변 접부 이하 층고 제한 시작 이후 대부분 강변 아파트 규제 성냥갑 아파트 만들 지적 이번 규제 완화 강변 주거지 초고층 아파트 등장 가능 강변 일대 건축 아파트 단지 들썩이 맨션 건축 사업 주목 최근 맨션 건축 사업 수주 건설 설계안 별개 추후 층수 규제 풀리 전제 설계안 제시 상태 아파트 지구 구역 최근 구역 계획안 공개 건설업 건물 용적 층고 제한 효과 제한 아쉬움 시내 일반 주거 지역 강변 아파트 지구 재건축 용적 맨션 재건축 높이 용적 건설 맨션 조합 제시 대안 법정 상한 용적 넘어서 가상 설계안 업계 층고 제한 용적 상향 집값 상승 영향 최소 시장 의지 해석 실제 시장 이날 용적 변화 폐지 부동산 가격 올라가 자신 전문가 폐지 도시 품격 미관 업그레이드 기대 직방 데이터 절대 수치 기준 작용 기준 삭제 창의 건축 증가 강변 역세 스카이라인 다변 사업 개선 예상,폐지 그동안 침체 아파트 재건축 탄력 전망 전망대 시민 바라보 전격 폐지 그동안 침체 재건축 탄력 전망 강변 스카이라인 고려 이상 초고층 아파트 관심 커지 일각 용적 상향 층고 폐지 효과 제한 관측 건설업 도시 기본 계획 플랜 제한 삭제 이날 시장 전역 일률 절대 수치 기준 적용 기준 삭제 창의 건축 스카이라인 가이드라인 전환 시장 시절 스카이라인 관리 원칙 마련 주거 지역 이하 수변 접부 이하 층고 제한 시작 대부분 강변 아파트 규제 성냥갑 아파트 만들 지적 규제 완화 강변 주거지 초고층 아파트 등장 강변 일대 건축 아파트 단지 들썩이 맨션 건축 주목 맨션 건축 수주 설계안 별개 추후 층수 규제 풀리 전제 설계안 제시 상태 아파트 지구 구역 구역 계획안 공개 건설업 건물 용적 층고 제한 효과 제한 아쉬움 시내 주거 지역 강변 아파트 지구 재건축 용적 맨션 재건축 높이 용적 맨션 조합 제시 대안 법정 상한 용적 넘어서 가상 설계안 업계 층고 제한 용적 상향 집값 상승 영향 최소 시장 의지 해석 실제 시장 이날 용적 변화 폐지 부동산 가격 올라가 자신 전문가 폐지 도시 품격 미관 업그레이드 기대 직방 데이터 절대 수치 기준 작용 기준 삭제 창의 건축 증가 강변 역세 스카이라인 다변 개선 예상
