date,Title,Content,tokens
2022-05-01,국내 건설사 분기 성적표 희비,건설 부문 사진 건설 부문 기자 국내 건설사 올해 분기 성적표 희비 건설 부문 제외 나머지 건설사 올해 분기 영업 이익 지난해 대비 감소 부진 건설업 따르 건설 부문 연결 기준 올해 분기 영업 이익 지난해 동기 증가 매출 전년 동기 대비 증가 건설 부문 규모 프로젝트 공사 본격 실적 호조 평가 건설 부문 분기 건설 수주 규모 연간 목표치 해당 사진 현대 건설 반면 현대 건설 건설 영업 이익 전년 비교 줄어들 현대 건설 분기 영업 이익 매출 저조 성적표 현대 건설 영업 이익 매출 전년 대비 감소 당기 순이익 지난해 분기 올해 분기 현대 건설 영업 이익 감소 관련 대형 현장 매출 하반기 집중 영향 최근 자재 공사비 증가 이익 설명 현대 건설 분기 이후 공사 정유 공장 공사 공사 해외 대형 현장 공정 매출 영업 이익 증가 기대 건설 사진 건설 건설 영업 이익 지난해 동기 감소 매출 지난해 동기 대비 증가 순이익 착공 물량 가구 달하 원가 산정 영업 이익 감소 신규 수주 확대 올해 분기 신규 수주 규모 지난해 분기 대비 사진 영업 이익 매출 기록 영업 이익 지난해 대비 감소 매출 지난해 동기 업계 시장 예상 뛰어넘 비교 선방 평가 국내 주택 사업 해외 프로젝트 매출 증가 지난해 매출 부문 매출 주택 건축 사업 부문 전체 차지 토목 부문 플랜트 부문 기타 연결 종속 부문 집계 관계자 지난해 분기 주택 건축 현장 원가 개선 요인 해외 플랜트 현장 준공 달하 일시 이익 발생 효과 올해 분기 영업 이익 감소 설명 수익 중심 수주 전략 원가 개선 중흥 그룹 시너지 올해 매출 신규 수주 목표 달성 방침 국내 건설사 원자재 가격 급등 대내외 리스크 커지 건축 주택 부문 경쟁력 신사업 발굴 토대 하반기 성장세 계획 건설사 관계자 여파 대내외 시장 전망 상회 실적 신사업 발굴 성장세 방침,건설 부문 사진 건설 부문 국내 건설사 성적표 희비 건설 부문 제외 나머지 건설사 영업 이익 감소 부진 건설업 건설 부문 연결 기준 영업 이익 동기 증가 매출 전년 동기 증가 건설 부문 규모 프로젝트 공사 본격 실적 호조 평가 건설 부문 건설 수주 규모 연간 목표치 사진 현대 건설 반면 현대 건설 건설 영업 이익 전년 비교 줄어들 현대 건설 영업 이익 매출 저조 성적표 현대 건설 영업 이익 매출 전년 감소 당기 순이익 현대 건설 영업 이익 감소 관련 대형 현장 매출 하반기 집중 영향 자재 공사비 증가 이익 설명 현대 건설 공사 정유 공장 공사 공사 해외 대형 현장 공정 매출 영업 이익 증가 기대 건설 사진 건설 건설 영업 이익 동기 감소 매출 동기 증가 순이익 착공 물량 가구 달하 원가 산정 영업 이익 감소 신규 수주 확대 신규 수주 규모 사진 영업 이익 매출 기록 영업 이익 감소 매출 동기 업계 시장 예상 뛰어넘 비교 선방 평가 국내 주택 해외 프로젝트 매출 증가 매출 부문 매출 주택 건축 부문 전체 차지 토목 부문 플랜트 부문 기타 연결 종속 부문 집계 관계자 주택 건축 현장 원가 개선 요인 해외 플랜트 현장 준공 달하 일시 이익 발생 효과 영업 이익 감소 설명 수익 중심 수주 전략 원가 개선 중흥 그룹 시너지 매출 신규 수주 목표 달성 방침 국내 건설사 원자재 가격 급등 대내외 리스크 커지 건축 주택 부문 경쟁력 신사업 발굴 토대 하반기 성장세 계획 건설사 관계자 여파 대내외 시장 전망 상회 실적 신사업 발굴 성장세 방침
2022-05-01,분양 동향 전국 가구 분양,제천 견본 주택 오픈 예정 이달 전국 세대 분양 물량 공급 앞두 부동산 따르 이달 전국 단지 가구 일반 분양 가구 분양 시작 시청 퍼스트 오피스텔 청약 진행 모델 제천 오픈 앞두 분양 일정 사진 부동산 플랜트 일원 분양 지하 지상 전용 가구 규모 조성 가구 일반 분양 가깝 원동 전역 이동 정초 장산 여고 혜화 여고 교육 시설 백화점 시립 미술관 영화 전당 생활 다양 시설 공유 건설 일원 제천 분양 예정 지하 지상 전용 가구 조성 천시 개발 공공 택지 지구 제천 미니 복합 타운 미니 복합 타운 공공 청사 근린 생활 시설 초등 학교 유치원 업무 복합 시설 다양 생활 인프라 조성 계획 제천 천간 고속도 번국 번국 광역 도로망 이용,제천 견본 주택 오픈 예정 이달 전국 세대 분양 물량 공급 앞두 부동산 이달 전국 단지 가구 분양 가구 분양 시작 시청 퍼스트 오피스텔 청약 진행 모델 제천 오픈 앞두 분양 일정 사진 부동산 플랜트 일원 분양 지하 지상 전용 가구 규모 조성 가구 분양 가깝 원동 전역 이동 정초 장산 여고 혜화 여고 교육 시설 백화점 시립 미술관 영화 전당 생활 다양 시설 공유 건설 일원 제천 분양 예정 지하 지상 전용 가구 조성 천시 개발 공공 택지 지구 제천 미니 복합 타운 미니 복합 타운 공공 청사 근린 생활 시설 초등 학교 유치원 업무 복합 시설 다양 생활 인프라 조성 계획 제천 천간 고속도 번국 번국 광역 도로망 이용
2022-05-01,분양 공사 발주자 시공자 갈등 확산,공사비 인상 사업 차질 정부 민간 공사 계약 대금 증액 가능 오피스텔 규제 상품 아파트 분양 인상 압력 폭등 설자 조정 요구 건설 현장 자료 사진 국기 기자 원자 급등 공사비 인상 현실 최근 규제 상품 분양 오르 정부 분양 가상 대상 아파트 적용 기본 건축비 추가 인상 검토 올해 하반기 신규 분양 아파트 분양 상승도 전망 인상 공사비 인상 여부 발주자 시공자 갈등 커지 정부 민간 공사 계약 대금 증액 가능 유권 해석 오늘 레미콘 가격 인상 자료 사진 공사비 평균 올해 대응 건설사 건설 시공 시행 업계 따르 지난달 기준 공사비 평균 작년 대비 지난해 대비 발표 보고서 작년 분기 건설 자재 가격 오르 본격 인상 조짐 전체 건설 자재 가운데 전년 동기 대비 이상 가격 급등 품목 비중 올해 상승 침공 사태 지난해 계속 글로벌 원자재 급난 심화 가격 상승 영향 철근 골조 가격 작년 대비 이상 철근 지난해 최근 이상 거래 이날 레미콘 단가 인상 레미콘 원재료 시멘트 가격 이상 시멘트 제조 원가 차지 유연탄 공급 사태 경제 제재 시멘트 재고량 줄어들 화물차 철강 제품 자료 사진 영향 오피스텔 건설 공사 경우 지하 지상 기준 평균 공사비 지난해 최근 치솟 인테리어 비용 최근 공사 현장 곳곳 상승 공사비 인상 갈등 확산 건설업 관계자 지난주 상승 전국 현장 공사 중단 주택 건설 현장 시공자 공사비 인상 요구 발주자 계약 해지 사례 속출 공공 공사 경우 물가 변동 계약 금액 조정 가능 착공 이후 물가 상승 공사비 인상 발주 요청 반면 민간 공사 계약 금액 조정 어렵 민간 공사 계약 경우 대부분 물가 변동 배제 특약 상승 변동 인정 아파트 건설 제작 사진 합성 일러스트 국토 지난달 민간 공사 물가 변동 배제 특약 불공정 계약 해당 취지 유권 해석 민간 공사 상승 공사비 늘어나 주사 계약 대금 증액 요구 근거 건설 현대 건설 대형 건설사 최근 현장 주사 공사비 증액 요구 주택 업계 관계자 정부 방침 당장 분양 행사 고통 분담 얘기 공사비 인상 발주자 시공자 갈등 공사 중단 소송 가능 지적 오피스텔 투시도 자이 제공 분양 규제 상품 분양 가격 급등 공사비 인상 현실 분양 상승 코앞 형국 최근 청약 오피스텔 지하철 선과 설선 지나 인접 미만 공급 분양 전매 가능 비교 경쟁 기록 단지 전용 면적 분양 인근 분양 오피스텔 최소 전용 분양 비싸 책정 미만 공급 분양 전매 가능 거리 동북 제기 동역 중앙선 경춘선 우수 역세 입지 분양 당시 청약 경쟁 거리 일대 부동산 중개업 대표 브랜드 교통 입지 측면 분양 얘기 급등 공사비 인상 압력 커지 분양 오피스텔 조감도 현대 건설 제공 부동산 업계 따르 최근 급등 토지 인건비 동시 오르 분양 규제 오피스텔 도시 생활 주택 생활 숙박 시설 분양 가격 오르 공사비 인상 아파트 분양 추가 상승도 예상 국토 일자 공동 주택 기본 건축비 작년 대비 이후 상승 이어지 가격 변동 상황 살펴보 건축비 추가 인상 여부 결정 분양 상한 대상 아파트 적용 기본 건축비 기준 차례 정기 고시 기본 건축비 고시 시점 주요 자재 가격 이상 변동 경우 반영 수시 고시 형태 가격 조정 지난해 고강 철근 가격 급등 기본 건축비 추가 인상 건설 정책 연구원 연구 위원 지금 분양 구성 토지 건축비 상황 분양 주택 공급 확대 정부 정책 방향 저해 요소 설명 분양 상승 압력 제공,공사비 인상 차질 정부 민간 공사 계약 대금 증액 오피스텔 규제 상품 아파트 분양 인상 압력 폭등 설자 조정 요구 건설 현장 자료 사진 국기 원자 급등 공사비 인상 현실 규제 상품 분양 오르 정부 분양 가상 대상 아파트 적용 기본 건축비 추가 인상 검토 하반기 신규 분양 아파트 분양 상승도 전망 인상 공사비 인상 여부 발주자 시공자 갈등 커지 정부 민간 공사 계약 대금 증액 유권 해석 오늘 레미콘 가격 인상 자료 사진 공사비 평균 대응 건설사 건설 시공 시행 업계 지난달 기준 공사비 평균 작년 발표 보고서 작년 건설 자재 가격 오르 본격 인상 조짐 전체 건설 자재 가운데 전년 동기 이상 가격 급등 품목 비중 상승 침공 사태 계속 글로벌 원자재 급난 심화 가격 상승 영향 철근 골조 가격 작년 이상 철근 이상 거래 이날 레미콘 단가 인상 레미콘 원재료 시멘트 가격 이상 시멘트 제조 원가 차지 유연탄 공급 사태 경제 제재 시멘트 재고량 줄어들 화물차 철강 제품 자료 사진 영향 오피스텔 건설 공사 경우 지하 지상 기준 평균 공사비 치솟 인테리어 비용 공사 현장 곳곳 상승 공사비 인상 갈등 확산 건설업 관계자 지난주 상승 전국 현장 공사 중단 주택 건설 현장 시공자 공사비 인상 요구 발주자 계약 해지 사례 속출 공공 공사 경우 물가 변동 계약 금액 조정 착공 물가 상승 공사비 인상 발주 요청 반면 민간 공사 계약 금액 조정 어렵 민간 공사 계약 경우 대부분 물가 변동 배제 특약 상승 변동 인정 아파트 건설 제작 사진 합성 일러스트 국토 지난달 민간 공사 물가 변동 배제 특약 불공정 계약 취지 유권 해석 민간 공사 상승 공사비 늘어나 주사 계약 대금 증액 요구 근거 건설 현대 건설 대형 건설사 현장 주사 공사비 증액 요구 주택 업계 관계자 정부 방침 당장 분양 행사 고통 분담 얘기 공사비 인상 발주자 시공자 갈등 공사 중단 소송 지적 오피스텔 투시도 자이 제공 분양 규제 상품 분양 가격 급등 공사비 인상 현실 분양 상승 코앞 형국 청약 오피스텔 지하철 선과 설선 지나 인접 미만 공급 분양 전매 비교 경쟁 기록 단지 전용 면적 분양 인근 분양 오피스텔 최소 전용 분양 비싸 책정 미만 공급 분양 전매 거리 동북 제기 동역 중앙선 경춘선 우수 역세 입지 분양 당시 청약 경쟁 거리 일대 부동산 중개업 대표 브랜드 교통 입지 측면 분양 얘기 급등 공사비 인상 압력 커지 분양 오피스텔 조감도 현대 건설 제공 부동산 업계 급등 토지 인건비 동시 오르 분양 규제 오피스텔 도시 생활 주택 생활 숙박 시설 분양 가격 오르 공사비 인상 아파트 분양 추가 상승도 예상 국토 일자 공동 주택 기본 건축비 작년 상승 이어지 가격 변동 상황 살펴보 건축비 추가 인상 여부 결정 분양 상한 대상 아파트 적용 기본 건축비 기준 차례 정기 고시 기본 건축비 고시 시점 주요 자재 가격 이상 변동 경우 반영 수시 고시 형태 가격 조정 고강 철근 가격 급등 기본 건축비 추가 인상 건설 정책 연구원 연구 위원 지금 분양 구성 토지 건축비 상황 분양 주택 공급 확대 정부 정책 방향 저해 요소 설명 분양 상승 압력 제공
2022-05-01,자리 건설사 눈독 물밑 경쟁 치열,뉴스 기자 시공 잠실 진주 아파트 재건축 현장 진주 아파트 재건축 조합 이날 정기 총회 공단 계약 해지 의결 논의 조합 잇달 발생 대형 안전사고 관련 계약 해지 요구 조합원 목소리 긴급 안건 추가 뉴스 붕괴 사고 여파 시공 계약 해지 잇따르 주장 사업 규모 노른자 위치 선정 앞두 물밑 경쟁 치열 단지 사업장 계약 건설사 사업 입찰 참여 정비 업계 따르 서금 사재 정비 촉진 구역 개발 조합 빠르 선정 절차 예정 서금 사재 정비 촉진 구역 조합 조합원 총회 건설 컨소시엄 시공 계약 해지 안건 의결 전체 조합원 투표 과반 계약 해제 찬성 사고 여파 시공 계약 해지 정비사 업장 건설 관사 컨소시엄 형태 동시 계약 해지 서금 사재 정비 촉진 구역 사업 개발 가구 단지 사업장 지하철 역세 노른자 선정 당시 주요 건설사 관심 보이 수주 경쟁 건설 플랜트 당시 건설 누르 선정 계약 해지 수주 예정 대형 건설사 관계자 위치 사업 적극 입찰 참여 계획 기존 건설 입찰 참여 계획 건설 관계자 잘못 시공 해지 컨소시엄 금지 여부 조합 지침 단독 입찰 컨소시엄 참여 예정 시민 공원 정비 촉진 구역 개발 조합 주요 건설사 물밑 경쟁 치열 시민 공원 정비 촉진 구역 개발 사업 번지 일원 면적 최고 가구 단지 아파트 진재 개발 구역 규모 시민 공원 세권 아파트 개발 구역 대장 입지 뛰어나 단독 시공 공사비 조합 조합원 총회 계약 해지 여부 결정 계획 조합 관계자 총회 결과 선정 컨소시엄 금지 예정 조합 시공 해지 경우 시일 선정 절차 진행 계획 규모 시공 건설사 경쟁 치열 대형 건설사 관계자 복수 건설사 물밑 작업 벌이 입찰 진행시 참여 건설사 기존 시공 계약 유지 대신 컨소시엄 배제 사업장 운암 주공 주택 건축 정비 사업 조합 대신 건설 관사 선정 공사 제외 건설 컨소시엄 공동 공사 진행 빠지 건설 지분 종전 늘어나 수주 금액 지분 공사 참여 지분 유지,뉴스 시공 잠실 진주 아파트 재건축 현장 진주 아파트 재건축 조합 이날 정기 총회 공단 계약 해지 의결 논의 조합 잇달 발생 대형 안전사고 관련 계약 해지 요구 조합원 목소리 긴급 안건 추가 뉴스 붕괴 사고 여파 시공 계약 해지 잇따르 주장 규모 노른자 위치 선정 앞두 물밑 경쟁 치열 단지 사업장 계약 건설사 입찰 참여 정비 업계 서금 사재 정비 촉진 구역 개발 조합 빠르 선정 절차 예정 서금 사재 정비 촉진 구역 조합 조합원 총회 건설 컨소시엄 시공 계약 해지 안건 의결 전체 조합원 투표 과반 계약 해제 찬성 사고 여파 시공 계약 해지 정비사 업장 건설 관사 컨소시엄 형태 동시 계약 해지 서금 사재 정비 촉진 구역 개발 가구 단지 사업장 지하철 역세 노른자 선정 당시 주요 건설사 관심 보이 수주 경쟁 건설 플랜트 당시 건설 누르 선정 계약 해지 수주 예정 대형 건설사 관계자 위치 적극 입찰 참여 계획 건설 입찰 참여 계획 건설 관계자 잘못 시공 해지 컨소시엄 금지 여부 조합 지침 단독 입찰 컨소시엄 참여 예정 시민 공원 정비 촉진 구역 개발 조합 주요 건설사 물밑 경쟁 치열 시민 공원 정비 촉진 구역 개발 번지 일원 면적 최고 가구 단지 아파트 진재 개발 구역 규모 시민 공원 세권 아파트 개발 구역 대장 입지 뛰어나 단독 시공 공사비 조합 조합원 총회 계약 해지 여부 결정 계획 조합 관계자 총회 결과 선정 컨소시엄 금지 예정 조합 시공 해지 경우 시일 선정 절차 진행 계획 규모 시공 건설사 경쟁 치열 대형 건설사 관계자 복수 건설사 물밑 작업 벌이 입찰 진행시 참여 건설사 시공 계약 유지 대신 컨소시엄 배제 사업장 운암 주공 주택 건축 정비 조합 대신 건설 관사 선정 공사 제외 건설 컨소시엄 공동 공사 진행 빠지 건설 지분 종전 늘어나 수주 금액 지분 공사 참여 지분 유지
2022-05-01,단독 잠실 이문 구역 시공 방어 성공,이문 구역 개발 사업 시공 업계 따르 이문 구역 개발 조합 지난달 총회 시공 배제 안건 조합원 투표 결과 부결 구역 개발 조합 관계자 총회 결과 시공 유지 결정 지난달 진주 아파트 재건축 사업 이문 구역 지역 시공 방어 성공 건설 컨소시엄 이문 구역 개발 사업 참여 지하 지상 개동 가구 대형 프로젝트 공사 현장 파내 터파 작업 진행 당초 올해 분양 시작 입주 목표 붕괴 사고 시공 배제 조합원 요구 분양 일정 지연,이문 구역 개발 시공 업계 이문 구역 개발 조합 지난달 총회 시공 배제 안건 조합원 투표 결과 부결 구역 개발 조합 관계자 총회 결과 시공 유지 결정 지난달 진주 아파트 재건축 이문 구역 지역 시공 방어 성공 건설 컨소시엄 이문 구역 개발 참여 지하 지상 개동 가구 대형 프로젝트 공사 현장 파내 터파 작업 진행 당초 분양 시작 입주 목표 붕괴 사고 시공 배제 조합원 요구 분양 일정 지연
2022-05-01,이문 구역 시공 유지 시공 배제 투표 부결,사진 이날 본사 모습 뉴스 조태 기자 뉴스 금준 기자 이문 구역 개발 사업 시공 유지 업계 따르 이문 구역 개발 조합 지난달 총회 시공 배제 안건 조합원 투표 결과 부결 관계자 시공 가져가 지난달 진주 아파트 재건축 사업 이문 구역 지역 시공 방어 성공 구역 개발 사업 일대 지하 지상 가구 프로젝트 건설 컨소시엄 이문 구역 개발 사업 참여 한편 이문 구역 올해 상반기 분양 예정 설계 변경 이유 분양 일정,사진 이날 본사 모습 뉴스 조태 뉴스 금준 이문 구역 개발 시공 유지 업계 이문 구역 개발 조합 지난달 총회 시공 배제 안건 조합원 투표 결과 부결 관계자 시공 가져가 지난달 진주 아파트 재건축 이문 구역 지역 시공 방어 성공 구역 개발 일대 지하 지상 가구 프로젝트 건설 컨소시엄 이문 구역 개발 참여 한편 이문 구역 분양 예정 설계 변경 이유 분양 일정
2022-05-02,현장 세어 현대 주택 사업 성적,전국 이르 주택 사업 확장 기반 현장 집중 건설사 전국 운영 현장 착공 준공 현대 건설 전국 넘어서 현장 운영 반면 간판 공사 현장 현대 건설 주택 사업 적극 확장 무게 평가 건설업 따르 시공 능력 평가 기준 건설사 전국 주택 현장 현장 방배 구역 재건축 디에이치 방배 재건축 디에이치 한남 구역 개발 디에이치 한남 대표 그래픽 올해 분기 신규 수주 규모 전년 대비 성장 연간 수주 계획 대비 달성 업계 디에이치 아파트 교보 증권 연구원 건설 시황 자체 현대 건설 작년 공격 수주 주택 부문 성장 기반 현대 건설 다음 자이 건설 전국 현장 이외 전국 플랜트 경우 전국 사업장 대비 사업장 전국 주택 현장 현장 반포 용두 구역 이문 구역 진주 주택 현장 절반 현장 과반수 업계 집중 평가 나오 수익 보장 입찰 향서 주구 수주 참여 부활 기대 수주 공격 재건축 시장 투명 기업 이미지 타격 이유 내세우 건설업 부회장 부당 합병 회계 부정 혐의 관련 재판 의식 행보 예전 구석구석 타운 이유 건설 정책 연구원 책임 연구원 주택 사업 재개 현장 향후 주택 사업 확대 수주 집중 변하,전국 이르 주택 확장 기반 현장 집중 건설사 전국 운영 현장 착공 준공 현대 건설 전국 넘어서 현장 운영 반면 간판 공사 현장 현대 건설 주택 적극 확장 무게 평가 건설업 시공 능력 평가 기준 건설사 전국 주택 현장 현장 방배 구역 재건축 디에이치 방배 재건축 디에이치 한남 구역 개발 디에이치 한남 대표 그래픽 신규 수주 규모 전년 성장 연간 수주 계획 달성 업계 디에이치 아파트 교보 증권 연구원 건설 시황 자체 현대 건설 작년 공격 수주 주택 부문 성장 기반 현대 건설 다음 자이 건설 전국 현장 이외 전국 플랜트 경우 전국 사업장 사업장 전국 주택 현장 현장 반포 용두 구역 이문 구역 진주 주택 현장 절반 현장 과반수 업계 집중 평가 나오 수익 보장 입찰 향서 주구 수주 참여 부활 기대 수주 공격 재건축 시장 투명 기업 이미지 타격 이유 내세우 건설업 부회장 부당 합병 회계 부정 혐의 관련 재판 의식 행보 예전 구석구석 타운 이유 건설 정책 연구원 책임 연구원 주택 재개 현장 향후 주택 확대 수주 집중 변하
2022-05-02,역자 스타 초기 정당 계약 눈길,역자 스타 예비 당첨 선착순 추첨 모습 건설 제공 경제 기자 분양 시장 정당 계약 단지 눈길 건설 따르 역자 스타 지난달 정당 계약 예비 당첨자 계약 진행 결과 전체 세대 계약 지역 주택 부동산업 얼어붙 부동산 시장 정당 계약 돌파 의미 결과 평가 내놓 공급 수성 세대 특별 공급 제외 모집 순위 청약 신청 전체 모집 세대 분양 단지 시지 프라이빗 세대 모집 세대 신청 청약 모집 인원 채우 분양 일정 자체 미루 단지 늘어나 지역 업계 역자 스타 계약 요인 분양 가격 단지 전용 면적 타입 타입 공급 타입 평균 분양 최근 원자재 가격 급등 인건비 상승 신규 아파트 분양 가격 상승 심리 강하 작용 요인 분석 건설 산업 연구원 따르 철근 가격 지난해 분기 비교 시멘트 국토 주요 자재 가격 이상 오르 원자재 급등 추세 지속 이후 정기 조정 고시 기본 건축비 인상 검토 국토 건설 자재 무비 가격 변동 고려 공동 주택 기본 건축비 상한 인상 지역 부동산 관계자 분양 시장 관망세 보이 분양 여건 아파트 수요자 조정 대상 지역 해제 실수요자 대출 규제 완화 정부 부동산 정책 신규 분양 시장 기대감 높이,역자 스타 예비 당첨 선착순 추첨 모습 건설 제공 경제 분양 시장 정당 계약 단지 눈길 건설 역자 스타 지난달 정당 계약 예비 당첨자 계약 진행 결과 전체 세대 계약 지역 주택 부동산업 얼어붙 부동산 시장 정당 계약 돌파 의미 결과 평가 내놓 공급 수성 세대 특별 공급 제외 모집 순위 청약 신청 전체 모집 세대 분양 단지 시지 프라이빗 세대 모집 세대 신청 청약 모집 인원 채우 분양 일정 자체 미루 단지 늘어나 지역 업계 역자 스타 계약 요인 분양 가격 단지 전용 면적 타입 타입 공급 타입 평균 분양 원자재 가격 급등 인건비 상승 신규 아파트 분양 가격 상승 심리 강하 작용 요인 분석 건설 산업 연구원 철근 가격 비교 시멘트 국토 주요 자재 가격 이상 오르 원자재 급등 추세 지속 정기 조정 고시 기본 건축비 인상 검토 국토 건설 자재 무비 가격 변동 고려 공동 주택 기본 건축비 상한 인상 지역 부동산 관계자 분양 시장 관망세 보이 분양 여건 아파트 수요자 조정 대상 지역 해제 실수요자 대출 규제 완화 정부 부동산 정책 신규 분양 시장 기대감 높이
