date,Title,Content,tokens
2023-01-19,신성 빌라 공사 재개 조합 공사비 협의,공사비 갈등 합의 보도 사실 방배 프리 조감도 사진 신성 빌라 주택 건축 정비 사업 조합 신성 빌라 건축 방배 프리 현장 공사 재개 전망 최근 설계 변경 물가 상승 반영 이유 요구 공사비 증액 조합 받아들이 갈등 최근 협상 마무리 단계 신성 빌라 주택 건축 정비 사업 조합 따르 신성 빌라 건축 방배 프리 현장 이달 공사 진행 중단 공사 재개 구체 공사비 금액 공사 재개 시점 공개 신성 빌라 주택 건축 조합 집행부 관계자 공사비 관련 협의 마무리 단계 공사 재개 예정 관계자 협상 자체 조합 긍정 원만 합의 공사 재개 해당 수주 지상 가구 일반 분양 가구 규모 재건축 단지 현장 착공 돌입 입주 예정 공사 진행 수준 공사 신성 빌라 건축 조합 공사비 계약 최근 설계 변경 물가 상승 반영 이유 요구 공사비 증액 조합 받아들이 갈등 이날 일부 언론 보도 양측 공사비 증액 범위 협상 진행 타협점 파악 보도 취재 결과 양측 협의 찾아가 공사 재개 입장 조합 집행부 관계자 현재 언론 보도 조합 집행부 전체 의견 상황 내용 일반 분양 해당 기사 걱정 연락 사실 최근 인상 물가 상승 건축 조합 공사비 갈등 곳곳 나오 가운데 재건축 사업 결국 공사 중단 초유 사태 주목 실제 방배 신성 빌라 현장 최근 전국 곳곳 공사비 증액 건축 조합 갈등 격화 지난해 시멘트 레미콘 인상 인건비 추가 비용 불어나 공사 차질 현장 최근 베일리 사업 상당 공사비 증액 협상 지지부진 조합 조합 통장 사업비 인출 공문 보내 공기 연장 요청 자이 지구 현장 상당 공사비 증액 문제 조합 건설 갈등 계속,공사비 갈등 합의 보도 사실 방배 프리 조감도 사진 신성 빌라 주택 건축 정비 사업 조합 신성 빌라 건축 방배 프리 현장 공사 재개 전망 최근 설계 변경 물가 상승 반영 이유 요구 공사비 증액 조합 받아들이 갈등 최근 협상 마무리 단계 신성 빌라 주택 건축 정비 사업 조합 따르 신성 빌라 건축 방배 프리 현장 이달 공사 진행 중단 공사 재개 구체 공사비 금액 공사 재개 시점 공개 신성 빌라 주택 건축 조합 집행부 관계자 공사비 관련 협의 마무리 단계 공사 재개 예정 관계자 협상 자체 조합 긍정 원만 합의 공사 재개 해당 수주 지상 가구 일반 분양 가구 규모 재건축 단지 현장 착공 돌입 입주 예정 공사 진행 수준 공사 신성 빌라 건축 조합 공사비 계약 최근 설계 변경 물가 상승 반영 이유 요구 공사비 증액 조합 받아들이 갈등 이날 일부 언론 보도 양측 공사비 증액 범위 협상 진행 타협점 파악 보도 취재 결과 양측 협의 찾아가 공사 재개 입장 조합 집행부 관계자 현재 언론 보도 조합 집행부 전체 의견 상황 내용 일반 분양 해당 기사 걱정 연락 사실 최근 인상 물가 상승 건축 조합 공사비 갈등 곳곳 나오 가운데 재건축 사업 결국 공사 중단 초유 사태 주목 실제 방배 신성 빌라 현장 최근 전국 곳곳 공사비 증액 건축 조합 갈등 격화 시멘트 레미콘 인상 인건비 추가 비용 불어나 공사 차질 현장 최근 베일리 사업 상당 공사비 증액 협상 지지부진 조합 조합 통장 사업비 인출 공문 보내 공기 연장 요청 자이 지구 현장 상당 공사비 증액 문제 조합 건설 갈등 계속
2023-01-19,주택 배신 건설사 이익 위태,경기 침체 원가 부담 발목 상단 건설사 영업 이익 위태 앵커 오늘 현대 건설 시작 건설사 지난해 분기 연간 실적 발표 부동산 경기 얼어붙 건설사 실적 내용 취재 기자 산업 방서 기자 기자 오늘 주요 건설사 실적 전망 기자 장사 증권가 현대 건설 건설 주요 건설사 지난해 분기 매출 전년 동기 대비 평균 전망 한편 기간 영업 이익 감소 연간 매출 영업 이익 지난해 연간 매출 증가 반면 기간 영업 이익 감소 전망 매출 영업 이익 의미 앵커 이유 기자 주택 사업 뒤통수 건설사 부동산 경기 호황 영업 이익 주택 사업 집중 이후 부동산 경기 꺾이 원자재 가격 상승 원가 부담 영업 이익 지난해 건설사 건축 주택 부문 원가 최고 포인트 이상 상승 추정 영업 이익 평균 전망 앵커 주택 비중 건설사 타격 기자 부동산 황기 지나 건설사 매출 기준 주택 사업 비중 정도 건설사 주택 사업 비중 그렇 우열 상황 계획 분양 영업 감소 그렇 영업 감소 원가 부담 일감 수익 만회 금리 인상 청약 시장 분위기 분양 미루 분양 대금 기회 주요 건설사 지난해 분양 목표치 가구 분양 가구 가운데 지난해 가구 분양 목표 대비 절반 미치 분양 목표 달성 건설사 저조 영업 이익 영업 이익 토막 추정 앵커 연초 부동산 시장 고음 강하 나오 건설사 올해 실적 예상 기자 올해 청약 시장 지속 건설사 주택 사업 벌기 전망 우세 지난해 전국 아파트 청약 경쟁 청약 불패 지역 꼽히 기간 경쟁 쪼그라들 건설사 유동 영향 미치 미분양 아파트 위험 수위 가구 추정 올해 전국 아파트 분양 예정 물량 가구 지난해 대비 전망 아파트 공급 대형 건설사 연간 분양 목표치 지난해 절반 이상 착공 실적 반영 건설업 특성 분양 감소 실적 저하 이어지 증권가 주요 건설사 올해 실적 눈높이 낮추 앵커 청약 시장 이야기 이야기 최대 재건축 약설 주인공 뚜껑 청약 경쟁 계약 발생 사업 참여 건설사 걱정 기자 정당 계약 마지막 추산 초기 계약 정도 나머지 계약 부동산 호황 초기 계약 달성 어렵 감안 초기 계약 자체 선방 평가 문제 초기 계약 최종 분양 다르 건설사 실적 영향 미치 미분양 악성 미분양 준공 미분양 준공 이후 계약 물량 팔리 건설사 외상 공사 지난해 조합 갈등 공사비 분양 공사비 현대 건설 건설 공단 청구 공사 금액 건설사 정도 상태 준공 미분양 건설사 대손 충당 건설사 수익 타격 앵커 건설사 대응 전략 올해 주택 힘들 실적 방어 수단 기자 올해 플랜트 부문 약진 기대 유가 장기간 지속 글로벌 화공 플랜트 발주 증가 전망 현대 건설 수주 소식 기다리 도심 항공 교통 건설사 성장 동력 자리 잡아가 신규 수주 실제 실적 반영 시간 걸리 건설 업종 추세 회복 어렵 전문가 앵커,경기 침체 원가 부담 발목 상단 건설사 영업 이익 위태 앵커 오늘 현대 건설 시작 건설사 분기 연간 실적 발표 부동산 경기 얼어붙 건설사 실적 내용 취재 산업 방서 오늘 주요 건설사 실적 전망 장사 증권가 현대 건설 건설 주요 건설사 분기 매출 전년 동기 대비 평균 전망 한편 기간 영업 이익 감소 연간 매출 영업 이익 연간 매출 증가 반면 기간 영업 이익 감소 전망 매출 영업 이익 의미 앵커 이유 주택 사업 뒤통수 건설사 부동산 경기 호황 영업 이익 주택 사업 집중 이후 부동산 경기 꺾이 원자재 가격 상승 원가 부담 영업 이익 건설사 건축 주택 부문 원가 최고 포인트 이상 상승 추정 영업 이익 평균 전망 앵커 주택 비중 건설사 타격 부동산 황기 지나 건설사 매출 기준 주택 사업 비중 정도 건설사 주택 사업 비중 그렇 우열 상황 계획 분양 영업 감소 그렇 영업 감소 원가 부담 일감 수익 만회 금리 인상 청약 시장 분위기 분양 미루 분양 대금 기회 주요 건설사 분양 목표치 가구 분양 가구 가운데 가구 분양 목표 대비 절반 미치 분양 목표 달성 건설사 저조 영업 이익 영업 이익 토막 추정 앵커 연초 부동산 시장 고음 강하 나오 건설사 실적 예상 청약 시장 지속 건설사 주택 사업 벌기 전망 우세 전국 아파트 청약 경쟁 청약 불패 지역 꼽히 기간 경쟁 쪼그라들 건설사 유동 영향 미치 미분양 아파트 위험 수위 가구 추정 전국 아파트 분양 예정 물량 가구 대비 전망 아파트 공급 대형 건설사 연간 분양 목표치 절반 이상 착공 실적 반영 건설업 특성 분양 감소 실적 저하 이어지 증권가 주요 건설사 실적 눈높이 낮추 앵커 청약 시장 이야기 이야기 최대 재건축 약설 주인공 뚜껑 청약 경쟁 계약 발생 사업 참여 건설사 걱정 정당 계약 마지막 추산 초기 계약 정도 나머지 계약 부동산 호황 초기 계약 달성 어렵 감안 초기 계약 자체 선방 평가 문제 초기 계약 최종 분양 다르 건설사 실적 영향 미치 미분양 악성 미분양 준공 미분양 준공 이후 계약 물량 팔리 건설사 외상 공사 조합 갈등 공사비 분양 공사비 현대 건설 건설 공단 청구 공사 금액 건설사 정도 상태 준공 미분양 건설사 대손 충당 건설사 수익 타격 앵커 건설사 대응 전략 주택 힘들 실적 방어 수단 플랜트 부문 약진 기대 유가 장기간 지속 글로벌 화공 플랜트 발주 증가 전망 현대 건설 수주 소식 기다리 도심 항공 교통 건설사 성장 동력 자리 잡아가 신규 수주 실제 실적 반영 시간 걸리 건설 업종 추세 회복 어렵 전문가 앵커
2023-01-19,건설 공사비 올리 공사 자이 협상,원자재 가격 인상 물가 상승 여파 건축 조합 공사비 갈등 공사 멈추 현장 최근 베일리 현장 자이 지구 공사비 증액 갈등 공사 원활 진행 신성 빌라 건축 현장 이름 작년 재건축 파크 사업 공사비 증액 문제 정도 공사 건설업 따르 신성 빌라 건축 방배 프리 공사 이달 중단 주한 지상 가구 일반 분양 가구 규모 규모 착공 올해 입주 예정 공사비 인상 문제 조합 합의 공사 진행 수준 상태 신성 빌라 건축 조합 공사비 계약 최근 설계 변경 자재 가격 상승 물가 상승 이유 공사비 인상 요구 조합 협상 진행 공사 중단 전날 진행 협상 양측 합의 이루 공사비 증액 문제 건축 조합 갈등 현장 최근 베일리 공사 관련 공사비 증액 요구 협상 진행 조합 통장 사업비 인출 공문 보내 공기 연장 요청 건설 현대 건설 마포 공덕 구역 조합 공단 공사비 증액 요구 응하 반년 착공 당초 작년 착공 일반 분양 예정 건설 시공 자이 지구 상당 공사비 증액 조합 달째 협상 건설 조합 당초 규모 공사비 공사 기간 연장 입주 시기 하반기 요구,원자재 가격 인상 물가 상승 여파 건축 조합 공사비 갈등 공사 멈추 현장 최근 베일리 현장 자이 지구 공사비 증액 갈등 공사 원활 진행 신성 빌라 건축 현장 이름 작년 재건축 파크 사업 공사비 증액 문제 정도 공사 건설업 따르 신성 빌라 건축 방배 프리 공사 이달 중단 주한 지상 가구 일반 분양 가구 규모 규모 착공 입주 예정 공사비 인상 문제 조합 합의 공사 진행 수준 상태 신성 빌라 건축 조합 공사비 계약 최근 설계 변경 자재 가격 상승 물가 상승 이유 공사비 인상 요구 조합 협상 진행 공사 중단 전날 진행 협상 양측 합의 이루 공사비 증액 문제 건축 조합 갈등 현장 최근 베일리 공사 관련 공사비 증액 요구 협상 진행 조합 통장 사업비 인출 공문 보내 공기 연장 요청 건설 현대 건설 마포 공덕 구역 조합 공단 공사비 증액 요구 응하 반년 착공 당초 작년 착공 일반 분양 예정 건설 시공 자이 지구 상당 공사비 증액 조합 달째 협상 건설 조합 당초 규모 공사비 공사 기간 연장 입주 시기 하반기 요구
2023-01-19,건설 장위 계약 비상 계약 인근 장주 아파트 급락,장위 조감도 건설 제공 장위 계약 가운데 장위 장주 아파트 가격 최근 순위 계약 비상 건설업 따르 일대 분양 장위 계약 물량 가구 대상 순위 청약 진행 일반 분양 물량 가구 고려 정당 계약 정당 계약 업계 예상 하회 평가 주거 여건 장위 단지 가구 강북 대어 단지 건설 장위 수요자 금융 혜택 제공 주택 중도금 전액 대출 가능 이자 후불제 적용 소비자 초기 자금 비용 단지 금융 혜택 제공 분양 단지 장위 유일 건설사 금융 마케팅 정당 계약 정부 부동산 규제 완화 종전 파트 가능 중도금 대출 전면 허용 정당 계약 높이 가운데 최근 일대 신축 아파트 가격 급락 아파트 순위 계약 부정 영향 일대 공인 중개업 따르 장위 대장 평가 전용 타입 이달 거래 아파트 거래 아파트 고점 비교 하락 장위 타입 분양 수준 고려 인근 아파트 가격 메리트 어렵 동북 아파트 지역 장위 부정 작용 산원 아파트 가격 동향 조사 따르 지난해 아파트 거래 지수 조사 최대 낙폭 기록 동북 권역 동남 하락 공인 중개업 관계자 장위 상품 우수 계약 기간 장위 아파트 가격 지속 하향세 장위 순위 계약 악재 작용,장위 조감도 건설 제공 장위 계약 가운데 장위 장주 아파트 가격 최근 순위 계약 비상 건설업 따르 일대 분양 장위 계약 물량 가구 대상 순위 청약 진행 일반 분양 물량 가구 고려 정당 계약 정당 계약 업계 예상 하회 평가 주거 여건 장위 단지 가구 강북 대어 단지 건설 장위 수요자 금융 혜택 제공 주택 중도금 전액 대출 가능 이자 후불제 적용 소비자 초기 자금 비용 단지 금융 혜택 제공 분양 단지 장위 유일 건설사 금융 마케팅 정당 계약 정부 부동산 규제 완화 종전 파트 가능 중도금 대출 전면 허용 정당 계약 높이 가운데 최근 일대 신축 아파트 가격 급락 아파트 순위 계약 부정 영향 일대 공인 중개업 따르 장위 대장 평가 전용 타입 이달 거래 아파트 거래 아파트 고점 비교 하락 장위 타입 분양 수준 고려 인근 아파트 가격 메리트 어렵 동북 아파트 지역 장위 부정 작용 산원 아파트 가격 동향 조사 따르 아파트 거래 지수 조사 최대 낙폭 기록 동북 권역 동남 하락 공인 중개업 관계자 장위 상품 우수 계약 기간 장위 아파트 가격 지속 하향세 장위 순위 계약 악재 작용
2023-01-19,건설 지난해 결산 실적 발표,기자 건설 공시 지난해 결산 실적 발표 공시 관련 자료 공정 공시 회사 홈페이지 게재 예정,건설 공시 결산 실적 발표 공시 관련 자료 공정 공시 회사 홈페이지 게재 예정
2023-01-19,국가 첨단 전략 기술 전지 특화 유치 총력,지난해 지사 왼쪽 웨이 회장 왼쪽 왼쪽 투자 양해 각서 체결 제공 뉴스 뉴스 기자 글로벌 전지 산업 핵심 허브 도시 도약 국가 첨단 전략 사업 전지 특화 유치 총력전 펼치 따르 국가 첨단 전략 사업 특화 단지 지정 분야 국가 첨단 전략 사업 위원회 전지 반도체 디스플레이 전략 산업 전략 기술 선정 이중 전지 분야 유치 행정력 집중 부시장 단장 포스 공대 전지 관련 기업 전지 특화 무추 진단 구성 기술 센터 국가 첨단 전략 사업 특화 합동 명회 애서 참석 지역 산업 생태 홍보 특화 선정 국가 전략 기술 관련 사업 시설 투자 연구 개발 지원 예비 조사 면제 입주 기업 국공 유재 사용료 감면 파격 해택 유치 지자체 경쟁 치열 관계자 프로 건설 기업 전지 소재 배터리 활용 사업 특자 산단 이상 관련 기업 입주 전지 특화 산단 입지 지차 안정 입지 조건 갖추 최근 전지 핵심 소재 전구체 세계 기업 규모 투자 양해 각서 체결 이상 전지 기업 투자 포스 산업 과학 연구원 가속기 연구소 파크 금속 소재 산업 직접 기관 연구 인력 공정 폴리 공정 현장 인력 양성 기반 갖추 포항 최적지 산업 광역 시도 지사 기업 관계 중앙 행정 기관 국가 첨단 특화 지정 수요 확인 계획 특화 후보 지역 대상 수요 공급 기업 협력 생태 구축 전략 국내외 기업 유치 계획 선도 기업 투자 계획 종합 평가 올해 상반기 개최 국가 첨단 특화 단지 지정,지사 왼쪽 웨이 회장 왼쪽 왼쪽 투자 양해 각서 체결 제공 뉴스 뉴스 글로벌 전지 산업 핵심 허브 도시 도약 국가 첨단 전략 사업 전지 특화 유치 총력전 펼치 따르 국가 첨단 전략 사업 특화 단지 지정 분야 국가 첨단 전략 사업 위원회 전지 반도체 디스플레이 전략 산업 전략 기술 선정 이중 전지 분야 유치 행정력 집중 부시장 단장 포스 공대 전지 관련 기업 전지 특화 무추 진단 구성 기술 센터 국가 첨단 전략 사업 특화 합동 명회 애서 참석 지역 산업 생태 홍보 특화 선정 국가 전략 기술 관련 사업 시설 투자 연구 개발 지원 예비 조사 면제 입주 기업 국공 유재 사용료 감면 파격 해택 유치 지자체 경쟁 치열 관계자 프로 건설 기업 전지 소재 배터리 활용 사업 특자 산단 이상 관련 기업 입주 전지 특화 산단 입지 지차 안정 입지 조건 갖추 최근 전지 핵심 소재 전구체 세계 기업 규모 투자 양해 각서 체결 이상 전지 기업 투자 포스 산업 과학 연구원 가속기 연구소 파크 금속 소재 산업 직접 기관 연구 인력 공정 폴리 공정 현장 인력 양성 기반 갖추 포항 최적지 산업 광역 시도 지사 기업 관계 중앙 행정 기관 국가 첨단 특화 지정 수요 확인 계획 특화 후보 지역 대상 수요 공급 기업 협력 생태 구축 전략 국내외 기업 유치 계획 선도 기업 투자 계획 종합 평가 상반기 개최 국가 첨단 특화 단지 지정
2023-01-19,글로벌 산업 핵심 전지 특화 유치 총력 최적 인프라 강조,부시장 단장 특화 실무 구성 운영 본격 돌입 사진 지난해 지사 좌측 웨이 회장 좌측 좌측 투자 양해 각서 체결 제공 전후방 기업 연구 기관 전문 인력 양성 항만 수출입 모두 유리 조건 산업 통상 추진 국가 첨단 전략 사업 전지 특화 유치 총력 기울이 국가 첨단 전략 사업 특화 단지 정부 첨단 전략 사업 육성 전진 기지 구축 정책 격차 경쟁력 글로벌 전지 산업 핵심 허브 도시 도약 부시장 단장 포스 전지 관련 기업 구성 전지 특화 무추 진단 구성 공모 신청 체계 준비 돌입 국가 첨단 특화 단지 지정 분야 국가 첨단 위원회 전지 반도체 디스플레이 분야 전략 기술 분야 전지 분야 최적 인프라 구축 산업 생태 적극 홍보 전지 분야 유치 총력전 펼치 프로 건설 기업 전지 소재 배터리 활용 사업 투자 산단 이상 전후방 관련 기업 입주 전지 특화 산단 입지 다지 유치 유리 조건 갖추 포스 산업 과학 연구원 가속기 연구소 파크 금속 소재 산업 집적 기관 연구 인력 폴리 공정 현장 인력 양성 기반 갖추 전지 산업 생태계 스케일 지난해 특화 조성 연구 용역 착수 기술 센터 국가 첨단 특화 합동 명회 참석 산업 통상 자원 정식 공모 일정 유치 전략 펼치 특화 단지 선정 국가 전략 기술 관련 사업 시설 투자 연구 개발 지원 예비 조사 면제 입주 기업 국공 유재 사용료 감면 파격 혜택 전국 지자체 치열 경쟁 예상 최근 전지 핵심 소재 전구체 세계 기업 투자 양해 각서 이상 전지 기업 투자 이끌 배터리 컨퍼런스 개최 중점 적극 육성 지난해 기관 전지 산학 연관 혁신 출범 전지 특화 지정 혁신 역량 결집 유일 컨테이너 항인 영일 만항 보유 수출입 유리 이어지 자동차 산업 밸류 체인 출발점 산업 역량 결집 이번 공모 사업 선정 차세대 발전 견인 교두보 역할 기대 전지 특화 단지 지정 최적 여건 갖추 전지 특화 단지 국가 첨단 전략 기술 육성 요람 격차 기술 경쟁력 확보 발전 기여 지방 소멸 시대 성장 동력 지역 모범 한편 산업 공모 신청 종합 평가 올해 상반기 개최 국가 첨단 위원회 특화 단지 지정 예정,부시장 단장 특화 실무 구성 운영 본격 돌입 사진 지사 좌측 웨이 회장 좌측 좌측 투자 양해 각서 체결 제공 전후방 기업 연구 기관 전문 인력 양성 항만 수출입 모두 유리 조건 산업 통상 추진 국가 첨단 전략 사업 전지 특화 유치 총력 기울이 국가 첨단 전략 사업 특화 단지 정부 첨단 전략 사업 육성 전진 기지 구축 정책 격차 경쟁력 글로벌 전지 산업 핵심 허브 도시 도약 부시장 단장 포스 전지 관련 기업 구성 전지 특화 무추 진단 구성 공모 신청 체계 준비 돌입 국가 첨단 특화 단지 지정 분야 국가 첨단 위원회 전지 반도체 디스플레이 분야 전략 기술 분야 전지 분야 최적 인프라 구축 산업 생태 적극 홍보 전지 분야 유치 총력전 펼치 프로 건설 기업 전지 소재 배터리 활용 사업 투자 산단 이상 전후방 관련 기업 입주 전지 특화 산단 입지 다지 유치 유리 조건 갖추 포스 산업 과학 연구원 가속기 연구소 파크 금속 소재 산업 집적 기관 연구 인력 폴리 공정 현장 인력 양성 기반 갖추 전지 산업 생태계 스케일 특화 조성 연구 용역 착수 기술 센터 국가 첨단 특화 합동 명회 참석 산업 통상 자원 정식 공모 일정 유치 전략 펼치 특화 단지 선정 국가 전략 기술 관련 사업 시설 투자 연구 개발 지원 예비 조사 면제 입주 기업 국공 유재 사용료 감면 파격 혜택 전국 지자체 치열 경쟁 예상 최근 전지 핵심 소재 전구체 세계 기업 투자 양해 각서 이상 전지 기업 투자 이끌 배터리 컨퍼런스 개최 중점 적극 육성 기관 전지 산학 연관 혁신 출범 전지 특화 지정 혁신 역량 결집 유일 컨테이너 항인 영일 만항 보유 수출입 유리 이어지 자동차 산업 밸류 체인 출발점 산업 역량 결집 이번 공모 사업 선정 차세대 발전 견인 교두보 역할 기대 전지 특화 단지 지정 최적 여건 갖추 전지 특화 단지 국가 첨단 전략 기술 육성 요람 격차 기술 경쟁력 확보 발전 기여 지방 소멸 시대 성장 동력 지역 모범 한편 산업 공모 신청 종합 평가 상반기 개최 국가 첨단 위원회 특화 단지 지정 예정
