date,Title,Content,tokens
2022-05-15,종합 식품 기업 회장 영면,창회 기자 오전 병원 장례식장 회장 영결식 엄수 기자 구인회 그룹 창업주 아들 회장 향년 영면 별세 회장 영결식 오전 병원 장례식장 엄수 이날 영결식 영정 위패 입장 고인 묵념 약력 소개 추모 추모 영상 헌화 분향 진행 영결식 배우자 장남 구본 부회장 장녀 차녀 구미 막내딸 구지 부회장 참석 회장 부회장 그룹 회장 명예 회장 영결식 참석 고인 마지막 애도 고인 구인회 그룹 창업주 아들 진주 고등학교 마치 진학 소령 전역 군복 시절 전쟁 참전 호국 영웅 기장 다수 훈장 수여 은행 시작 중앙 개발 화학 전자 일렉트론 건설 건설 근무 이후 유통 사업 푸드 서비스 사업 분리 독립 회장 취임 이끌 지난해 경영 일선 슬하 장남 부회장 장녀 구미 차녀 막내 구지 부회장 창회 기자 구지 부회장 오전 병원 장례식장 엄수 회장 영결식 눈물 창회 기자 신세계 회장 부회장 오전 병원 장례식장 엄수 회장 영결식 참석 창회 기자 오전 병원 장례식장 회장 영결식 엄수 창회 기자 오전 병원 장례식장 회장 영결식 엄수 창회 기자 오전 병원 장례식장 회장 영결식 엄수 구독 유명 미술 작품 가격 공개 데이터 주가 시세표,창회 오전 병원 장례식장 회장 영결식 엄수 구인회 그룹 창업주 아들 회장 향년 영면 별세 회장 영결식 오전 병원 장례식장 엄수 이날 영결식 영정 위패 입장 고인 묵념 약력 소개 추모 추모 영상 헌화 분향 진행 영결식 배우자 장남 구본 부회장 장녀 차녀 구미 막내딸 구지 부회장 참석 회장 부회장 그룹 회장 명예 회장 영결식 참석 고인 마지막 애도 고인 구인회 그룹 창업주 아들 진주 고등학교 마치 진학 소령 전역 군복 시절 전쟁 참전 호국 영웅 기장 다수 훈장 수여 은행 시작 중앙 개발 화학 전자 일렉트론 건설 건설 근무 유통 푸드 서비스 분리 독립 회장 취임 이끌 경영 일선 슬하 장남 부회장 장녀 구미 차녀 막내 구지 부회장 창회 구지 부회장 오전 병원 장례식장 엄수 회장 영결식 눈물 창회 신세계 회장 부회장 오전 병원 장례식장 엄수 회장 영결식 참석 창회 오전 병원 장례식장 회장 영결식 엄수 창회 오전 병원 장례식장 회장 영결식 엄수 창회 오전 병원 장례식장 회장 영결식 엄수 구독 유명 미술 작품 가격 공개 데이터 주가 시세표
2022-05-15,기업 조건 이공 사장 컨설턴트 출신 리포트,기술 이공 사장 전략 컨설턴트 출신 그룹 사장 집중 분석 사진 출처 뱅크 공학 박사 키우 글로벌 기업 경험 리더 지주사 사장 입파 경제 그룹 사장 분석 그룹 한화 현대 중공업 신세계 그룹 사장 자산 기준 재계 순위 일치 사장 직책 대표 이사 부문장 사업 부장 그룹 사장 평균 나이 노종 사장 추형 사장 오너 제외 그룹 최연소 최고령 신세계 인터 내셔날  사업 부문 대표 이사 한화 평균 한화 첨단 소재 부문 미래 전략 사업 부장 화자 산운 사장 입파 경영 준비 유능 사장 중용 지주 디자인 경영 센터 호텔 총괄 대표 사장 외부 합류 사장 나이 평균 평균 나이 그룹 신세계 그룹 주력 장단 절반 회장 체제 출범 그룹 핵심 회사 장단 추세 지주사 사장 회장 보좌 모습 현대 중공업 그룹 정기선 사장 제외 사장 평균 나이 사장 공대 전체 공대 출신 차지 이공 반면 상경 인수 합병 사업 포트폴리오 확대 그룹 관련 전문 사장 회사 이끌 의미 해석 사장 배출 사관 학교 분기 매출 올리 세계 기업 사장 그룹 장단 그룹 장단 규모 대표 디스플레이 대표 대표 엔지니어 출신 대표 대표 무통 글로벌 리서치 사장 경력 출신 계열사 사장 고려 그룹 장단 차지 비율 재계 관계자 나머지 회사 대부분 각사 사장 사장 디스플레이 현대 자동차 그룹 사장 나머지 회사 사장 대표 이사 연구 개발 본부 기획 조정 실장 전략 기획 담당 이노베이션 담당 글로벌 최고 운영 책임자 본부 본부 주요 계열사 사장 출신 차지 대표 대표 대표 대표 대표 대표 증권 대표 그룹 사장 회사 집중 에너지 통신 주축 이노베이션 출신 장단 포진 이노베이션 출신 사장 대표 에너지 대표 지오 센트 대표 대표 사장 추구 협의회 위원장 대표 대표 사장 사장 플랜트 대표 그룹 사장 회사 전자 디스플레이 대표 디스플레이 중소형 사업 부장 최고 책임자 전자 출신 대표 이사 사장 쇼핑 대표 부사장 정도 부사장 전무 대표 사장 지주 식품군 총괄 호텔 총괄 그룹 대표 공채 입사 나머지 인수 대우 인터내셔널 인터내셔널 출신 사장 한화 소속 한화 한화 한화 첨단 소재 한화 갤러리 한화 도시 개발 회사 장단 가운데 한화 출신 그룹 사장 텍스 경력자 대표 텍스 생산 본부 텍스 사업 본부 파워 대표 대표 건설 사장 텍스 입사 테일 대표 대표 증권 투자 증권 직장 현대 중공업 그룹 사장 현대 중공업 입사 현대 중공업 사장 현대 해양 인프라 코어 현대 글로벌 서비스 주요 계열사 사장 현대 중공업 출신 외부 영입 강화 그룹 입파 약진 사장 가운데 경력직 부문 미주 총괄 시스템 사업 부장 서비스 비즈 팀장 구글 리서치 연구 소장 네트워크 사업 부장 포스 피스 대표 외부 출신 사장 공채 입사 연구 개발 본부 기획 조정 실장 대표 이노베이션 담당 글로벌 본부 본부 해외 대학 학위 글로벌 기업 경력 모빌리티 기업 전환 회장 의지 인사 해석 대표 자회사 가스 대표 공채 출신 손자 회사 사이언스 대표 경력 입사 자다 대주주 부회장 컨설팅 출신 주목 사장 사장 컨설팅 가스 사장 컨설팅 사장 앤드 컴퍼니 사장 앤드 컴퍼니 호텔 사장 사장 앤드 컴퍼니 사장 한화 사장 한화 사장 부사장 대우 출신 대표 대표 시보 인터내셔널 대표 에너지 대표 한화 에너지 대표 추구 협의회 사장 대표 경영 경제 연구 소장 정보 통신 정책 연구원 실장 역임 지주 사장 산업 디자인 학과 교수 출신 디자인 전문가 고위 관료 출신 조석 사장 지식 경제 차관 자본 시장 연구원 선임 연구 위원 빠르 변화 세계 비즈니스 트렌드 선도 산업 경험 전문가 역할 중요 회장 회장 대생 총수 그룹 지휘봉 추세 설명,기술 이공 사장 전략 컨설턴트 출신 그룹 사장 집중 분석 사진 출처 뱅크 공학 박사 키우 글로벌 기업 경험 리더 지주사 사장 입파 경제 그룹 사장 분석 그룹 한화 현대 중공업 신세계 그룹 사장 자산 기준 재계 순위 일치 사장 직책 대표 이사 부문장 부장 그룹 사장 평균 나이 노종 사장 추형 사장 오너 제외 그룹 최연소 최고령 신세계 인터 내셔날 부문 대표 이사 한화 평균 한화 첨단 소재 부문 미래 전략 부장 화자 산운 사장 입파 경영 준비 유능 사장 중용 지주 디자인 경영 센터 호텔 총괄 대표 사장 외부 합류 사장 나이 평균 평균 나이 그룹 신세계 그룹 주력 장단 절반 회장 체제 출범 그룹 핵심 회사 장단 추세 지주사 사장 회장 보좌 모습 현대 중공업 그룹 정기선 사장 제외 사장 평균 나이 사장 공대 전체 공대 출신 차지 이공 반면 상경 인수 합병 포트폴리오 확대 그룹 관련 전문 사장 회사 이끌 의미 해석 사장 배출 사관 학교 매출 올리 세계 기업 사장 그룹 장단 그룹 장단 규모 대표 디스플레이 대표 대표 엔지니어 출신 대표 대표 무통 글로벌 리서치 사장 경력 출신 계열사 사장 고려 그룹 장단 차지 비율 재계 관계자 나머지 회사 대부분 각사 사장 사장 디스플레이 현대 자동차 그룹 사장 나머지 회사 사장 대표 이사 연구 개발 본부 기획 조정 실장 전략 기획 담당 이노베이션 담당 글로벌 최고 운영 책임자 본부 본부 주요 계열사 사장 출신 차지 대표 대표 대표 대표 대표 대표 증권 대표 그룹 사장 회사 집중 에너지 통신 주축 이노베이션 출신 장단 포진 이노베이션 출신 사장 대표 에너지 대표 지오 센트 대표 대표 사장 추구 협의회 위원장 대표 대표 사장 사장 플랜트 대표 그룹 사장 회사 전자 디스플레이 대표 디스플레이 중소형 부장 최고 책임자 전자 출신 대표 이사 사장 쇼핑 대표 부사장 정도 부사장 전무 대표 사장 지주 식품군 총괄 호텔 총괄 그룹 대표 공채 입사 나머지 인수 대우 인터내셔널 인터내셔널 출신 사장 한화 소속 한화 한화 한화 첨단 소재 한화 갤러리 한화 도시 개발 회사 장단 가운데 한화 출신 그룹 사장 텍스 경력자 대표 텍스 생산 본부 텍스 본부 파워 대표 대표 건설 사장 텍스 입사 테일 대표 대표 증권 투자 증권 직장 현대 중공업 그룹 사장 현대 중공업 입사 현대 중공업 사장 현대 해양 인프라 코어 현대 글로벌 서비스 주요 계열사 사장 현대 중공업 출신 외부 영입 강화 그룹 입파 약진 사장 가운데 경력직 부문 미주 총괄 시스템 부장 서비스 비즈 팀장 구글 리서치 연구 소장 네트워크 부장 포스 피스 대표 외부 출신 사장 공채 입사 연구 개발 본부 기획 조정 실장 대표 이노베이션 담당 글로벌 본부 본부 해외 대학 학위 글로벌 기업 경력 모빌리티 기업 전환 회장 의지 인사 해석 대표 자회사 가스 대표 공채 출신 손자 회사 사이언스 대표 경력 입사 자다 대주주 부회장 컨설팅 출신 주목 사장 사장 컨설팅 가스 사장 컨설팅 사장 앤드 컴퍼니 사장 앤드 컴퍼니 호텔 사장 사장 앤드 컴퍼니 사장 한화 사장 한화 사장 부사장 대우 출신 대표 대표 시보 인터내셔널 대표 에너지 대표 한화 에너지 대표 추구 협의회 사장 대표 경영 경제 연구 소장 정보 통신 정책 연구원 실장 역임 지주 사장 산업 디자인 학과 교수 출신 디자인 전문가 고위 관료 출신 조석 사장 지식 경제 차관 자본 시장 연구원 선임 연구 위원 빠르 변화 세계 비즈니스 트렌드 선도 산업 경험 전문가 역할 중요 회장 회장 대생 총수 그룹 지휘봉 추세 설명
2022-05-15,분양 시장 찬바람 분양 단지 청약,분양 유망 단지 주변 시세 공공 택지 적용 평균 분양 공급 고양 지축 세상 입주 분양 세상 지축 가든 최근 아파트 청약 시장 분양 분상 적용 단지 관심 원자재 상승 여파 분양 오르 추세 금리 인상 대출 규제 자금 부담 커지 분양 주변 시세 분상 적용 단지 수요자 몰리 이자 부담 분상 청약 인기 분상 신규 아파트 분양 지비 건축비 건설사 적정 이윤 금액 이하 분양 책정 공공 택지 적용 경기 수도 일부 지역 민간 택지 확대 통상 분상 적용 아파트 분양 주변 시세 수준 책정 주택 수요 감소 아파트 분양 시장 찬바람 분상 적용 단지 청약 경쟁 기록 완전 판매 행진 지난달 당첨자 발표 검단 순위 가구 모집 신청 평균 경쟁 기록 전용 면적 당첨 커트라인 가구 최고점 정도 청약 열기 아파트 전용 분양 최고 인근 신축 아파트 검단 도시 전용 지난달 거래 가량 분양 경기 영지 정신 도시 순위 청약 평균 경쟁 마감 고양 분양 영통 분양 성수기 내달 경기 분상 적용 아파트 가구 공급 영통 영통 지하 지상 최고 가구 규모 지하 지상 최고 가구 규모 평균 분양 수준 분양 관계자 최근 철근 원자재 고려 합리 분양 설명 디지털 시티 직주 근접 직장 단지 당첨자 발표 중복 청약 가능 경기 세상 지축 가든 분양 지하 지상 최고 가구 전용 규모 입주 분양 단지 분양 인근 신축 아파트 최근 거래 가량 책정 전망 주택 검단 가구 경기 세상 옥정 가든 가구 지방 분양 건설 제천 분양 예정 처음 선보이 자이 브랜드 아파트 대부분 중대 가구 구성 델타 시티 친환경 수변 도시 강서 델타 건설 델타 세상 델타 센터 포인트 델타 시티 블록 대성 건설 분양 분상 양극 제천 전문가 분상 적용 단지 청약 수요 서도 입지 조건 분양 청약 미달 계약 단지 나오 양극 전망 대출 규제 금리 인상 추세 지속 수도 일반 분양 시장 흥행 보장 분상 적용 상황 부동산 인포 관계자 과거 시세 차익 과도 기대 분상 청약 도전 조언,분양 유망 단지 주변 시세 공공 택지 적용 평균 분양 공급 고양 지축 세상 입주 분양 세상 지축 가든 아파트 청약 시장 분양 분상 적용 단지 관심 원자재 상승 여파 분양 오르 추세 금리 인상 대출 규제 자금 부담 커지 분양 주변 시세 분상 적용 단지 수요자 몰리 이자 부담 분상 청약 인기 분상 신규 아파트 분양 지비 건축비 건설사 적정 이윤 금액 이하 분양 책정 공공 택지 적용 경기 수도 일부 지역 민간 택지 확대 통상 분상 적용 아파트 분양 주변 시세 수준 책정 주택 수요 감소 아파트 분양 시장 찬바람 분상 적용 단지 청약 경쟁 기록 완전 판매 행진 지난달 당첨자 발표 검단 순위 가구 모집 신청 평균 경쟁 기록 전용 면적 당첨 커트라인 가구 최고점 정도 청약 열기 아파트 전용 분양 최고 인근 신축 아파트 검단 도시 전용 지난달 거래 가량 분양 경기 영지 정신 도시 순위 청약 평균 경쟁 마감 고양 분양 영통 분양 성수기 내달 경기 분상 적용 아파트 가구 공급 영통 영통 지하 지상 최고 가구 규모 지하 지상 최고 가구 규모 평균 분양 수준 분양 관계자 철근 원자재 고려 합리 분양 설명 디지털 시티 직주 근접 직장 단지 당첨자 발표 중복 청약 경기 세상 지축 가든 분양 지하 지상 최고 가구 전용 규모 입주 분양 단지 분양 인근 신축 아파트 거래 가량 책정 전망 주택 검단 가구 경기 세상 옥정 가든 가구 지방 분양 건설 제천 분양 예정 처음 선보이 자이 브랜드 아파트 대부분 중대 가구 구성 델타 시티 친환경 수변 도시 강서 델타 건설 델타 세상 델타 센터 포인트 델타 시티 블록 대성 건설 분양 분상 양극 제천 전문가 분상 적용 단지 청약 수요 서도 입지 조건 분양 청약 미달 계약 단지 나오 양극 전망 대출 규제 금리 인상 추세 지속 수도 분양 시장 흥행 보장 분상 적용 상황 부동산 인포 관계자 과거 시세 차익 과도 기대 분상 청약 도전 조언
2022-05-15,실적 배당주 금융,빛나 호실 배당 기업 변동 장세 주가 하락 제한 배당 리스크 올해 기대 배당 수익 금융 지주 영업 증가 전망 금융 실적 배당 매력 국내외 증시 변동성 출렁이 지수 밀려나 증시 인플레이션 경기 둔화 우려 급락 상황 전문가 섣부르 매수 나서 배당주 투자 위험 대비 수익 방법 조언 실적 개선 배당 매력 기업 안정 수익 분석 실적 개선 고배 당주 주목 거래소 따르 고배 지수 하락 기간 지수 하락 비교 선방 평가 금융 소재 필수 소비재 업종 상당수 배당주 통상 배당주 밸류 실적 대비 주가 수준 종목 변동성 장세 주가 하락 제한 배당 수익 위험 관리 가능 금융 투자 연구원 올해 지수 기대 배당 수익 만기 금리 올해 기대 배당 수익 상위 종목 은행 보험 증권 금융 대부분 차지 금융 정보 업체 에프 가이드 따르 기대 배당 수익 종목 금융 지주 금융 지주 투자 증권 배당 수익 위험 성장 둔화 주가 하락 배당 수익 종목 분기 실적 부진 주가 신저 수준 추락 증권 주가 대표 실적 개선 동시 배당 매력 종목 선별 중요 전문가 조언 고배 지수 구성 종목 가운데 올해 영업 이익 전년 대비 증가 최근 주당 순이익 전망 상향 조정 기대 배당 수익 이상 자본 이익 이상 종목 금융 지주 금융 지주 종목 올해 기대 배당 수익 종목 금융 지주 금융 올해 영업 이익 전년 대비 증가 기록 증권사 최근 전망 상향 조정 금융 지주 기대 배당 수익 고배 유망 종목 선별 어렵 펀드 투자 방법 대표 배당주 고배 당주 고배 기간 지수 하락 대비 선방 분배 배당 수익 감안 올해 수익 고배 당주 투자 구성 종목 차이 고배 당주 포트폴리오 상위 종목 은행 보험 증권 금융 대부분 고배 인프라 주철관 비중,빛나 호실 배당 기업 변동 장세 주가 하락 제한 배당 리스크 기대 배당 수익 금융 지주 영업 증가 전망 금융 실적 배당 매력 국내외 증시 변동성 출렁이 지수 밀려나 증시 인플레이션 경기 둔화 우려 급락 상황 전문가 섣부르 매수 나서 배당주 투자 위험 수익 방법 조언 실적 개선 배당 매력 기업 안정 수익 분석 실적 개선 고배 당주 주목 거래소 고배 지수 하락 기간 지수 하락 비교 선방 평가 금융 소재 필수 소비재 업종 상당수 배당주 통상 배당주 밸류 실적 주가 수준 종목 변동성 장세 주가 하락 제한 배당 수익 위험 관리 금융 투자 연구원 지수 기대 배당 수익 만기 금리 기대 배당 수익 상위 종목 은행 보험 증권 금융 대부분 차지 금융 정보 업체 에프 가이드 기대 배당 수익 종목 금융 지주 금융 지주 투자 증권 배당 수익 위험 성장 둔화 주가 하락 배당 수익 종목 실적 부진 주가 신저 수준 추락 증권 주가 대표 실적 개선 동시 배당 매력 종목 선별 중요 전문가 조언 고배 지수 구성 종목 가운데 영업 이익 전년 증가 주당 순이익 전망 상향 조정 기대 배당 수익 이상 자본 이익 이상 종목 금융 지주 금융 지주 종목 기대 배당 수익 종목 금융 지주 금융 영업 이익 전년 증가 기록 증권사 전망 상향 조정 금융 지주 기대 배당 수익 고배 유망 종목 선별 어렵 펀드 투자 방법 대표 배당주 고배 당주 고배 기간 지수 하락 선방 분배 배당 수익 감안 수익 고배 당주 투자 구성 종목 차이 고배 당주 포트폴리오 상위 종목 은행 보험 증권 금융 대부분 고배 인프라 주철관 비중
2022-05-15,건설 주상 복합 범어 자이 가구,건설 번지 일대 범어 자이 분양 선보이 자이 브랜드 범어 자이 아파트 주거 오피스텔 구성 주상 복합 아파트 지하 지상 최고 가구 규모 조성 아파트 전용 면적 주거 오피스텔 전용 면적 구성 아파트 판상 위주 설계 채광 통풍 주거 오피스텔 역시 판상 아파트 동일 구조 설계 지하철 인근 복합 환승 센터 동대구 광역 교통망 활용 동대구 이면 위치 주거 환경 시골 공원 자리 세권 자연 친화 일상,건설 번지 일대 범어 자이 분양 선보이 자이 브랜드 범어 자이 아파트 주거 오피스텔 구성 주상 복합 아파트 지하 지상 최고 가구 규모 조성 아파트 전용 면적 주거 오피스텔 전용 면적 구성 아파트 판상 위주 설계 채광 통풍 주거 오피스텔 판상 아파트 동일 구조 설계 지하철 인근 복합 환승 센터 동대구 광역 교통망 활용 동대구 이면 위치 주거 환경 시골 공원 자리 세권 자연 친화 일상
