date,Title,Content,tokens
2022-05-23,아파트 급식 업체 입주민 조식,기사 내용 요약 신세계 푸드 아파트 뷔페 사업 적극 진출 단체 급식 시장 위축 활로 모색 차원 최근 온라인 커뮤니티 위치 개포 미안 단지 입주민 대상 식사 제공 식당 모습 사진 출처 온라인 커뮤니티 기자 최근 아파트 입주민 제공 아침 식사 사진 인터넷 화제 된장국 불고기 채소 나물 한식 샌드위치 샐러드 각종 케이크 주스 코너 이르 식단 눈길 관련 업계 따르 개포 아파트 신규 입주 아파트 중심 호텔 뷔페 콘셉트 식사 입주민 제공 서비스 인기 신세계 푸드 지난해 아파트 조식 중식 뷔페 서비스 제공 가격 단돈 수준 입주민 입주민 동반 뷔페 이용 신세계 푸드 아파트 이달 서초 아파트 뷔페 운영 규모 시설 아침 점심 한식 중식 양식 메뉴 구성 뷔페 아파트 최초 석식 제공 가격 동일 입주민 신세계 푸드 트리 마제 시작 지난해 개포 세상 스퀘어 서초 이르 아파트 입주민 전용 뷔페 제공 아파트 식음 서비스 사업 적극 포트 아파트 커뮤니티 센터 식음 서비스 제공 시작 반응 아파트 평일 주말 조식 중식 카페 서비스 건설 협업 자이 아파트 전문 식음 서비스 제공 예정 개포 자이 아파트 식음료 사업 수주 상태 송도 자이 아파트 마지막 입주민 동의 절차 급식 업체 프리미엄 아파트 식음 사업 돌리 장기 학교 직장 급식 시장 위축 반면 가구 맞벌이 가구 노인 가구 빠르 증가 아파트 입주민 상대 식음 사업 수요 급식 업체 적극 아파트 입주민 식음 사업 나서 이유 관계자 아파트 나가 고품질 식사 디저트 입주민 만족도 시장 초기 단계 아파트 커뮤니티 시설 식음 서비스 각광 현대 푸드 관계자 최근 입주 예정 아파트 식음 사업 문의 들어오 시장 진출 적극 검토 급식 업체 아파트 식음 서비스 프리미엄 아파트 중심 커뮤니티 시설 조리 공간 식사 공간 규모 마련 기존 아파트 서비스 경우 현재 커뮤니티 시설 구비 아파트 전국 입주 예정 입주민 식음 서비스 사업 조짐 업계 관계자 염두 사업 진행 입주민 수요 아파트 중심 사업 전국 사업 확대 아파트 식음 서비스 평가 아파트 주민 이용 일정 급식 특성 시간 지나 질리 결국 외식 배달 음식 이용 사례 증가 분석 관리비 식비 일정 부분 의무 포함 불만 아파트 주민 지적,신세계 푸드 아파트 뷔페 적극 진출 단체 급식 시장 위축 활로 모색 차원 온라인 커뮤니티 위치 개포 미안 단지 입주민 대상 식사 제공 식당 모습 사진 출처 온라인 커뮤니티 아파트 입주민 제공 아침 식사 사진 인터넷 화제 된장국 불고기 채소 나물 한식 샌드위치 샐러드 각종 케이크 주스 코너 이르 식단 눈길 관련 업계 개포 아파트 신규 입주 아파트 중심 호텔 뷔페 콘셉트 식사 입주민 제공 서비스 인기 신세계 푸드 아파트 조식 중식 뷔페 서비스 제공 가격 단돈 수준 입주민 입주민 동반 뷔페 이용 신세계 푸드 아파트 이달 서초 아파트 뷔페 운영 규모 시설 아침 점심 한식 중식 양식 메뉴 구성 뷔페 아파트 최초 석식 제공 가격 동일 입주민 신세계 푸드 트리 마제 시작 개포 세상 스퀘어 서초 이르 아파트 입주민 전용 뷔페 제공 아파트 식음 서비스 적극 포트 아파트 커뮤니티 센터 식음 서비스 제공 시작 반응 아파트 평일 주말 조식 중식 카페 서비스 건설 협업 자이 아파트 전문 식음 서비스 제공 예정 개포 자이 아파트 식음료 수주 상태 송도 자이 아파트 마지막 입주민 동의 절차 급식 업체 프리미엄 아파트 식음 돌리 장기 학교 직장 급식 시장 위축 반면 가구 맞벌이 가구 노인 가구 빠르 증가 아파트 입주민 상대 식음 수요 급식 업체 적극 아파트 입주민 식음 나서 이유 관계자 아파트 나가 고품질 식사 디저트 입주민 만족도 시장 초기 단계 아파트 커뮤니티 시설 식음 서비스 각광 현대 푸드 관계자 입주 예정 아파트 식음 문의 들어오 시장 진출 적극 검토 급식 업체 아파트 식음 서비스 프리미엄 아파트 중심 커뮤니티 시설 조리 공간 식사 공간 규모 마련 아파트 서비스 경우 현재 커뮤니티 시설 구비 아파트 전국 입주 예정 입주민 식음 서비스 조짐 업계 관계자 염두 진행 입주민 수요 아파트 중심 전국 확대 아파트 식음 서비스 평가 아파트 주민 이용 일정 급식 특성 시간 지나 질리 결국 외식 배달 음식 이용 사례 증가 분석 관리비 식비 일정 부분 의무 포함 불만 아파트 주민 지적
2022-05-24,신사업 교두보 스마트 시티 건설사,에너지 친환경 사업 시험대 전력 자립 도시 구축 현대 건설 에너지 건축 기술 도입 건설 도시 개발 공략 플랜트 참여 시티 조성 사업 조감도 플랜트 제공 대형 건설사 스마트 시티 사업 진출 스마트 시티 정보 기술 모빌리티 에너지 친환경 기술 종합 적용 도시 건설사 건축 토목 시도 신사업 성장 상용 교두보 스마트 시티 주목 건설업 따르 최근 플랜트 건설 건설 국내외 스마트 시티 사업 진출 계획 스마트 시티 기술 역량 중심 기업 사업 주도 건설사 단순 시공 역할 평가 건설사 자사 신사업 역량 바탕 사업 주도 확보 사활 주도 플랜트 참여 컨소시엄 최근 시티 조성 사업 협상 대상자 선정 시티 사업비 국내 스마트 시티 최대 규모 가구 입주 예정 플랜트 건설 에너지 부문 사업자 참여 가구 사용 전기 신재 에너지 공급 도시 만들 사업 청사진 실현 컨소시엄 플랜트 관련 신재 에너지 인프라 구축 운영 전담 회사 관계자 구체 수치 이번 사업 에너지 부문 차지 비중 이번 사업 친환경 분산 에너지 전력 소비 지역 인근 발전 방식 급사 거듭나 계획 플랜트 제조사 에너지 합작사 세우 구미 공장 고체 산화물 생산 올해 이날 누적 수주 전력 기준 국내 시장 점유 달리 이번 사업 비중 역할 현대 건설 컨소시엄 건설 부문 사업자 참여 단순 주택 시공 자사 기술 연구원 연구 개발 태양광 기반 에너지 기술 에너지 자체 생산 소비량 만드 기술 적극 도입 회사 관계자 미래 첨단 도시 인프라 구축 경쟁력 확보 성장 동력 창출 기대 건설 개발 예정 조감도 건설 제공 건설 건설 해외 스마트 시티 개발 건설 당국 협력 불리 투티 지구 부지 시티 개발 추진 사업비 건설 행사 나서 시공 첨단 인프라 구축 운영 계획 그룹 계열사 정보 통신 손잡 역량 보완 건설 관계자 사업 초기 단계 자사 기술 연구원 정보 통신 공동 로봇 활용 시스템 호텔 적용 기반 접객 고객 편의 기술 개발 건설 나베 도시 시티 개발 진행 건설 관계자 처리 중심 확장 친환경 사업 해외 스마트 시티 사업 적극 접목 예정 최근 벤처 투자 펀드 펀드 전략 투자자 참여 현지 정부 추진 스마트 시티 조성 사업 적극 계획 해남군 시도 태양광 발전소 제공 중견 건설사 한양 현대 건설 시티 사업 건설 부문 국내 최대 규모 태양광 발전소 해남군 시도 태양광 발전소 건설 유일 민간 사업자 참여 기반 조성 시도 스마트 시티 사업 참여 태양광 포함 바이오매스 에너지 사업 확대 추진 스마트 시티 정의 통일 정확 시장 규모 파악 어렵 해외 시장 조사 업체 글로벌 시장 규모 성장 추산 업계 관계자 최근 정부 스마트 시티 육성 의지 국내 시장 성장도 기대 국토 장관 장관 취임사 모빌리티 혁명 기본 인프라 스마트 시티 구축 역점 추진 스마트 시티 산업 진흥 국민 편안 일상 미래 현재 청사진,에너지 친환경 시험대 전력 자립 도시 구축 현대 건설 에너지 건축 기술 도입 건설 도시 개발 공략 플랜트 참여 시티 조성 조감도 플랜트 제공 대형 건설사 스마트 시티 진출 스마트 시티 정보 기술 모빌리티 에너지 친환경 기술 종합 적용 도시 건설사 건축 토목 시도 신사업 성장 상용 교두보 스마트 시티 주목 건설업 플랜트 건설 건설 국내외 스마트 시티 진출 계획 스마트 시티 기술 역량 중심 기업 주도 건설사 단순 시공 역할 평가 건설사 자사 신사업 역량 바탕 주도 확보 사활 주도 플랜트 참여 컨소시엄 시티 조성 협상 대상자 선정 시티 사업비 국내 스마트 시티 최대 규모 가구 입주 예정 플랜트 건설 에너지 부문 사업자 참여 가구 사용 전기 신재 에너지 공급 도시 만들 청사진 실현 컨소시엄 플랜트 관련 신재 에너지 인프라 구축 운영 전담 회사 관계자 구체 수치 에너지 부문 차지 비중 친환경 분산 에너지 전력 소비 지역 인근 발전 방식 급사 거듭나 계획 플랜트 제조사 에너지 합작사 세우 구미 공장 고체 산화물 생산 이날 누적 수주 전력 기준 국내 시장 점유 달리 비중 역할 현대 건설 컨소시엄 건설 부문 사업자 참여 단순 주택 시공 자사 기술 연구원 연구 개발 태양광 기반 에너지 기술 에너지 자체 생산 소비량 만드 기술 적극 도입 회사 관계자 미래 첨단 도시 인프라 구축 경쟁력 확보 성장 동력 창출 기대 건설 개발 예정 조감도 건설 제공 건설 건설 해외 스마트 시티 개발 건설 당국 협력 불리 투티 지구 부지 시티 개발 추진 사업비 건설 행사 나서 시공 첨단 인프라 구축 운영 계획 그룹 계열사 정보 통신 손잡 역량 보완 건설 관계자 초기 단계 자사 기술 연구원 정보 통신 공동 로봇 활용 시스템 호텔 적용 기반 접객 고객 편의 기술 개발 건설 나베 도시 시티 개발 진행 건설 관계자 처리 중심 확장 친환경 해외 스마트 시티 적극 접목 예정 벤처 투자 펀드 펀드 전략 투자자 참여 현지 정부 추진 스마트 시티 조성 적극 계획 해남군 시도 태양광 발전소 제공 중견 건설사 한양 현대 건설 시티 건설 부문 국내 최대 규모 태양광 발전소 해남군 시도 태양광 발전소 건설 유일 민간 사업자 참여 기반 조성 시도 스마트 시티 참여 태양광 포함 바이오매스 에너지 확대 추진 스마트 시티 정의 통일 정확 시장 규모 파악 어렵 해외 시장 조사 업체 글로벌 시장 규모 성장 추산 업계 관계자 정부 스마트 시티 육성 의지 국내 시장 성장도 기대 국토 장관 장관 취임사 모빌리티 혁명 기본 인프라 스마트 시티 구축 역점 추진 스마트 시티 산업 진흥 국민 편안 일상 미래 현재 청사진
2022-05-24,오피스텔 시장 바람 실수요자 위주 재편,뉴스 오피스텔 시장 슬리퍼 단지 인기 편리 추구 신혼 부부 세대 오피스텔 돌리 통계청 인구 총조사 자료 따르 세대 가구 돌파 청약 가점 경쟁 불리 세대 비교 규제 오피스텔 이동 오피스텔 시장 실수요자 위주 재편 오피스텔 마련 돌파구 떠오르 인프라 신규 오피스텔 인기 두드러지 일원 분양 오피스텔 모집 접수 평균 경쟁 기록 검단 도시 일원 단역 오피스텔 역시 모집 접수 평균 경쟁 인근 다수 인프라 자리 신규 오피스텔 공급 현대 건설 일원 라보니 분양 인근 백화점 대학교 병원 먹자골목 생활 편의 시설 오피스텔 건설 일원 범어 자이 공급 도보 네거리 상권 이용 편리 단지 주변 현대 시티 아울렛 범어 먹거리 타운 주요 생활 편의 시설 자리 업계 관계자 이후 수요자 머무 시간 우선시 경향 강하 나타나 주택 선택 기준 통하 우수 인프라 오피스텔 인기 상황,뉴스 오피스텔 시장 슬리퍼 단지 인기 편리 추구 신혼 부부 세대 오피스텔 돌리 통계청 인구 총조사 자료 세대 가구 돌파 청약 가점 경쟁 불리 세대 비교 규제 오피스텔 이동 오피스텔 시장 실수요자 위주 재편 오피스텔 마련 돌파구 떠오르 인프라 신규 오피스텔 인기 두드러지 일원 분양 오피스텔 모집 접수 평균 경쟁 기록 검단 도시 일원 단역 오피스텔 모집 접수 평균 경쟁 인근 다수 인프라 자리 신규 오피스텔 공급 현대 건설 일원 라보니 분양 인근 백화점 대학교 병원 먹자골목 생활 편의 시설 오피스텔 건설 일원 범어 자이 공급 도보 네거리 상권 이용 편리 단지 주변 현대 시티 아울렛 범어 먹거리 타운 주요 생활 편의 시설 자리 업계 관계자 수요자 머무 시간 우선시 경향 강하 나타나 주택 선택 기준 통하 우수 인프라 오피스텔 인기 상황
2022-05-24,급매 청약 포기 고민 무주택자,세상 제천 프라임 주택 전시관 모습 건설 자재 인상 여파 전국 정비 사업 곳곳 공사비 관련 갈등 공급 차질 발생 청약 손꼽 기다리 무주택자 지금 청약 포기 급매물 가격 조정 기존 아파트 구입 셈법 분양 공사비 반영 분양 인상 보이 정부 분양 가상 제도 개선 예고 민간 물량 공급 숨통 트이 청약 부담 전망 건설사 공사비 입지 개발 입찰 포기 속출 공급 감소 부동산 인포 취합 자료 따르 이달 민간 일반 분양 예정 물량 가구 기준 상반기 분양 계획 물량 이날 상반기 분양 계획 물량 가구 상황 다르 가구 계획 현재 가구 예상 공사비 인상 분양 일정 연기 영향 무주택자 청약 지금 구축 아파트 고민 온라인 부동산 커뮤니티 청약 기다리 분양 청약 포기 문의 공급 감소 추세 가능 최근 건설사 입지 지여 공사 입찰 포기 선정 정비 사업 조합 건설사 공사비 괴리 좁히 선정 상태 우동 구역 개발 입찰 건설사 참여 유찰 현장 명회 현대 건설 건설 플랜트 참여 결과 대형 개발 사업장 건설사 입찰 참여 이례 우동 구역 개발 세대 규모 단지 해운대 해수욕장 근처 대표 개발 사업장 장설 명회 참석 대형 건설 관계자 조합 브랜드 원하 조합 건설사 생각 공사비 이상 차이 입찰 포기 배경 설명 신흥 구역 개발 선정 장설 명회 참여 건설사 건설 글로벌 건설 입찰 참가 신청서 제출 결국 입찰 참여 포기 공동 주택 가구 단지 사업 도급 공사비 세금 제외 상한선 입찰 참가 신청서 제출 대형 건설사 관계자 기본 설계 공사비 가격 나오 입찰 자체 포기 대형 건설사 관계자 조합 자재 인상 반영 예전 단가 기준 입찰 진행 자재 인상 진행 이슈 수주 자재 현실 요구 업체 목소리 계속 수지 타산 상황 선정 정비 사업 분양 향후 일정 지연 정부 분양 가상 개선 예고 공급 측면 긍정 일반 분양 종전 책정 공사비 인상 반영 생기 가격 현실 가능 민간 공급 탄력 공사비 인상 분과 분양 가상 개선 일반 분양 종전 상승 청약 예비자 부담 늘어나 딜레마,세상 제천 프라임 주택 전시관 모습 건설 자재 인상 여파 전국 정비 곳곳 공사비 관련 갈등 공급 차질 발생 청약 손꼽 기다리 무주택자 지금 청약 포기 급매물 가격 조정 아파트 구입 셈법 분양 공사비 반영 분양 인상 보이 정부 분양 가상 제도 개선 예고 민간 물량 공급 숨통 트이 청약 부담 전망 건설사 공사비 입지 개발 입찰 포기 속출 공급 감소 부동산 인포 취합 자료 이달 민간 분양 예정 물량 가구 기준 분양 계획 물량 이날 분양 계획 물량 가구 상황 다르 가구 계획 현재 가구 예상 공사비 인상 분양 일정 연기 영향 무주택자 청약 지금 구축 아파트 고민 온라인 부동산 커뮤니티 청약 기다리 분양 청약 포기 문의 공급 감소 추세 건설사 입지 지여 공사 입찰 포기 선정 정비 조합 건설사 공사비 괴리 좁히 선정 상태 우동 구역 개발 입찰 건설사 참여 유찰 현장 명회 현대 건설 건설 플랜트 참여 결과 대형 개발 사업장 건설사 입찰 참여 이례 우동 구역 개발 세대 규모 단지 해운대 해수욕장 근처 대표 개발 사업장 장설 명회 참석 대형 건설 관계자 조합 브랜드 원하 조합 건설사 생각 공사비 이상 차이 입찰 포기 배경 설명 신흥 구역 개발 선정 장설 명회 참여 건설사 건설 글로벌 건설 입찰 참가 신청서 제출 결국 입찰 참여 포기 공동 주택 가구 단지 도급 공사비 세금 제외 상한선 입찰 참가 신청서 제출 대형 건설사 관계자 기본 설계 공사비 가격 나오 입찰 자체 포기 대형 건설사 관계자 조합 자재 인상 반영 예전 단가 기준 입찰 진행 자재 인상 진행 이슈 수주 자재 현실 요구 업체 목소리 계속 수지 타산 상황 선정 정비 분양 향후 일정 지연 정부 분양 가상 개선 예고 공급 측면 긍정 분양 종전 책정 공사비 인상 반영 생기 가격 현실 민간 공급 탄력 공사비 인상 분과 분양 가상 개선 분양 종전 상승 청약 예비자 부담 늘어나 딜레마
2022-05-24,철근 원자재 직격탄 건설사 분기 영업 이익 빨간불,분기 건설사 영업 이익 포인트 하락 건설사 자금 조달 창구 기사 게재 기사 건설사 분기 수익 악화 신용 평가 조사 결과 철근 원자재 빠르 상승 건설사 수익 먹구름 분석 기업 평가 발표 건설업 분기 실적 점검 결과 따르 현대 건설 건설 주요 건설 업체 올해 분기 합산 영업 이익 집계 전년 동기 대비 포인트 발생 붕괴 사고 손실 제외 분기 합산 영업 이익 철근 주요 원자재 급등 철근 매입 금액 늘어나 건설사 부담 확대 풀이 기평 따르 주요 원자재 매입 금액 공시 건설사 경우 분기 매출액 대비 철근 매입 금액 집계 전년 동기 대비 포인트 철근 가격 작년 최근 안팎 치솟 철근 레미콘 가격 상승 추세 레미콘 업계 판매가 기업 평가 수석 연구원 원자재 가격 상승 비용 증가 건설사 부담 가능 주택 사업 경우 분양 상한 분양 관리 강화 기조 공사비 원가 부담 전가 상황 건설사 원가 비용 부담 급증 자금 조달 창구 금리 인상 여파 회사채 시장 얼어붙 금융 투자 협회 따르 우량 건설사 자금 조달 기준 만기 회사채 신용 등급 기준 금리 마감 올해 비교 포인트 이상 자금 조달 이자 부담 의미 공사비 건설사 자금 유동 줄어들 구하 사업 속출 우동 구역 건축 조합 이달 차례 입찰 참여 건설사 유찰 경기 구역 개발 사업 명회 건설사 참석 확인 건설업 관계자 수지 타산 일부 사업 시공 포기 검토 건설사 나타나,건설사 영업 이익 포인트 하락 건설사 자금 조달 창구 게재 건설사 수익 악화 신용 평가 조사 결과 철근 원자재 빠르 상승 건설사 수익 먹구름 분석 기업 평가 발표 건설업 실적 점검 결과 현대 건설 건설 주요 건설 업체 합산 영업 이익 집계 전년 동기 포인트 발생 붕괴 사고 손실 제외 합산 영업 이익 철근 주요 원자재 급등 철근 매입 금액 늘어나 건설사 부담 확대 풀이 기평 주요 원자재 매입 금액 공시 건설사 경우 매출액 철근 매입 금액 집계 전년 동기 포인트 철근 가격 작년 안팎 치솟 철근 레미콘 가격 상승 추세 레미콘 업계 판매가 기업 평가 수석 연구원 원자재 가격 상승 비용 증가 건설사 부담 주택 경우 분양 상한 분양 관리 강화 기조 공사비 원가 부담 전가 상황 건설사 원가 비용 부담 급증 자금 조달 창구 금리 인상 여파 회사채 시장 얼어붙 금융 투자 협회 우량 건설사 자금 조달 기준 만기 회사채 신용 등급 기준 금리 마감 비교 포인트 이상 자금 조달 이자 부담 의미 공사비 건설사 자금 유동 줄어들 구하 속출 우동 구역 건축 조합 이달 차례 입찰 참여 건설사 유찰 경기 구역 개발 명회 건설사 참석 확인 건설업 관계자 수지 타산 일부 시공 포기 검토 건설사 나타나
2022-05-24,해수 담수화 시설 올해 해수 담수화 플랜트 수상,타마 해수 담수화 시설 수상 경제 영경 기자 건설 자회사 니마 해수 담수화 시설 올해 담수 플랜트 선정 건설 산업 조사 기관 개최 글로벌 워터 성과 세계 담수 플랜트 회사 대상 플랜트 계약 기업 부문 부문 평가 해수 담수화 시설 전경 건설 제공 타마 해수 담수화 플랜트 세계 건조 사막 악명 지역 자리 북부 아타카 강수량 제로 정도 내리 만성 부족 문제 시달리 지역 니마 식수 공급 담수화 생산 시설 완공 공급 시작 선정 배경 설계 혁신 에너지 효율 현대 해수 담수화 플랜트 해수 펌프 효율 극대 에너지 소모 해수 담수화 시설 벤치마크 대상 평가 바위 절벽 해안가 바닷물 끌어오 어려움 마이크 터널 기술 첨단 해저 시설 극복 고품질 담수 제공 성공 법인 업체 산업 용수 사업 부문 인수 시장 진출 오만 운영 계약 금액 이르 단계 단계 민자 담수 발전 사업 프로젝트 수주 시장 처음 진출 올해 남부 안성 공업용수 공급 업체 지분 인수 시장 확대 건설 관계자 니마 이번 수상 해수 담수화 기술 세계 최고 수준 인정받 해수 담수화 사업 시대 대표 친환경 사업 분야 글로벌 리더 위상,타마 해수 담수화 시설 수상 경제 영경 건설 자회사 니마 해수 담수화 시설 담수 플랜트 선정 건설 산업 조사 기관 개최 글로벌 워터 성과 세계 담수 플랜트 회사 대상 플랜트 계약 기업 부문 부문 평가 해수 담수화 시설 전경 건설 제공 타마 해수 담수화 플랜트 세계 건조 사막 악명 지역 자리 북부 아타카 강수량 제로 정도 내리 만성 부족 문제 시달리 지역 니마 식수 공급 담수화 생산 시설 완공 공급 시작 선정 배경 설계 혁신 에너지 효율 현대 해수 담수화 플랜트 해수 펌프 효율 극대 에너지 소모 해수 담수화 시설 벤치마크 대상 평가 바위 절벽 해안가 바닷물 끌어오 어려움 마이크 터널 기술 첨단 해저 시설 극복 고품질 담수 제공 성공 법인 업체 산업 용수 부문 인수 시장 진출 오만 운영 계약 금액 이르 단계 단계 민자 담수 발전 프로젝트 수주 시장 처음 진출 남부 안성 공업용수 공급 업체 지분 인수 시장 확대 건설 관계자 니마 수상 해수 담수화 기술 세계 최고 수준 인정받 해수 담수화 시대 대표 친환경 분야 글로벌 리더 위상
