date,Title,Content,tokens
2023-01-10,장위 자이 정오 가구 공급,장위 순위 청약 실시 정당 계약 당첨자 계약 장위 조감도 사진 제공 건설 경제 건설 공급 장위 이달 이틀 순위 청약 진행 건설 따르 진행 순위 청약 평균 경쟁 기록 장위 이날 오전 일반 공급 물량 순위 청약 돌입 순위 청약 접수 마감 정오 당첨자 발표 오후 당초 건설 당첨자 발표 시기 오후 순위 청약 순위 청약 실시 수분 양자 물량 진행 청약 관련 규정 바뀌 이번 순위 청약 무주택자 요건 충족 거주 지역 요건 관련 규정 바뀌 해당 지역 거주 사람 이날 공개 입주자 모집 공고 따르 장위 일반 분양 물량 가구 가운데 계약 물량 가구 순위 청약 내놓 정당 계약 전용 면적 최다 물량 가구 가운데 물량 공급 주택 가구 주력 평형 꼽히 가구 순위 청약 공급 소형 평형 분류 가구 공급 순위 청약 당첨 이달 입주 대상자 자격 확인 서류 제출 계약 순위 청약 발생 예비 당첨자 추첨 계약 양일 진행 전용 면적 분양 계약금 분양 중도금 잔금 건설 해당 단지 수분 양자 중도금 대출 금리 이상 올라가 상향 조정 이자 부담 사업 주체 조합 부담 중도금 대출 안심 금리 보장 시행 설명,장위 순위 청약 실시 정당 계약 당첨자 계약 장위 조감도 사진 제공 건설 경제 건설 공급 장위 이달 이틀 순위 청약 진행 건설 따르 진행 순위 청약 평균 경쟁 기록 장위 이날 오전 일반 공급 물량 순위 청약 돌입 순위 청약 접수 마감 정오 당첨자 발표 오후 당초 건설 당첨자 발표 시기 오후 순위 청약 순위 청약 실시 수분 양자 물량 진행 청약 관련 규정 바뀌 이번 순위 청약 무주택자 요건 충족 거주 지역 요건 관련 규정 바뀌 해당 지역 거주 사람 이날 공개 입주자 모집 공고 따르 장위 일반 분양 물량 가구 가운데 계약 물량 가구 순위 청약 내놓 정당 계약 전용 면적 최다 물량 가구 가운데 물량 공급 주택 가구 주력 평형 꼽히 가구 순위 청약 공급 소형 평형 분류 가구 공급 순위 청약 당첨 이달 입주 대상자 자격 확인 서류 제출 계약 순위 청약 발생 예비 당첨자 추첨 계약 양일 진행 전용 면적 분양 계약금 분양 중도금 잔금 건설 해당 단지 수분 양자 중도금 대출 금리 이상 올라가 상향 조정 이자 부담 사업 주체 조합 부담 중도금 대출 안심 금리 보장 시행 설명
2023-01-10,구하 대책 설주 연초,오늘 포인트 연초 건설 뜨겁 지난해 정권 초기 혜주 부각 정작 주가 연중 하락 설주 흐름 보이 역사 저점 수준 건설 업종 정부 부동산 대책 효과 연일 상승 올해 미분양 급증 전망 우세 주가 시장 관심 집중 오전 시장 건설 전일 대비 거래 강세 보이 강세 현대 건설 상승 건설 상승 국토 송파 서초 자치구 제외 규제 지역 해제 분양 매제 기간 줄이 거래 절벽 미분양 해소 주택 시장 연착륙 업무 계획 대통령 부동산 대책 매제 기간 최대 수도 매제 기간 최대 수도 시행령 개정 시행 계획 대책 따르 수도 분양 가상 주택 적용 실거 의무 폐지 중도금 대출 특공 배정 분양 상한 기준 폐지 설정 중도금 대출 보증 분양 기준 폐지 특공 배정 분양 상한 기준 폐지 청약 당첨 주택 부과 기존 주택 처분 무도 폐지 순위 청약 주택 신청 허용 내용 포함 부동산 대책 구하 아파트 재건축 단지 파크 선물 규제 완화책 골자 실거 폐지 중도금 대출 규제 폐지 매제 축소 계약 고민 당첨자 기다리 소식 증권 연구원 대책 훈풍 전국 주간 아파트 매매 가격 낙폭 반등 매매 수급 지수 소폭 개선 이후 정부 정책 투자 심리 영향 판단 역대 최저 자산 비율 경신 주가 부진 설주 호재 작용 주가 이끌 설명 건설업 종이 단기 반등 부동산 시장 침체 우려 지적 건설사 악재 꼽히 미분양 올해 미분양 증가 전망 미래 증권 연구 위원 기준 미분양 아파트 기록 미분양 아파트 작년 대비 만호 증가 예상 일반 아파트 분양 물량 만호 지역 예상 분양 적용 도출 올해 건설 업종 미분양 아파트 증가 확대 최근 부동산 정책 규제 주가 상승 한계 미분양 아파트 최고점 달성 주가 회복 가시 부동산 경기 최악 금융 위기 당시 전국 미분양 아파트 역대 최고 기록 건설사 재무 상황 악화 다수 건설사 워크아웃 법정 관리 당시 쇼핑 아파트 판매 정도 아파트 구매 무이자 대출 파격 조건 연구 위원 과거 건설 미분양 아파트 증가 시점 주가 하락 미분양 아파트 물량 최고점 기록 이후 주가 회복 부연 연구원 정부 의지 미분양 수치 줄어들 건설 단기 분양 시장 양극 심화 국면 전국 미분양 진단 정부 정책 부동산 시장 연착륙 가능 바닥 분석,오늘 포인트 연초 건설 뜨겁 정권 초기 혜주 부각 정작 주가 연중 하락 설주 흐름 보이 역사 저점 수준 건설 업종 정부 부동산 대책 효과 연일 상승 미분양 급증 전망 우세 주가 시장 관심 집중 오전 시장 건설 전일 대비 거래 강세 보이 강세 현대 건설 상승 건설 상승 국토 송파 서초 자치구 제외 규제 지역 해제 분양 매제 기간 줄이 거래 절벽 미분양 해소 주택 시장 연착륙 업무 계획 대통령 부동산 대책 매제 기간 최대 수도 매제 기간 최대 수도 시행령 개정 시행 계획 대책 따르 수도 분양 가상 주택 적용 실거 의무 폐지 중도금 대출 특공 배정 분양 상한 기준 폐지 설정 중도금 대출 보증 분양 기준 폐지 특공 배정 분양 상한 기준 폐지 청약 당첨 주택 부과 기존 주택 처분 무도 폐지 순위 청약 주택 신청 허용 내용 포함 부동산 대책 구하 아파트 재건축 단지 파크 선물 규제 완화책 골자 실거 폐지 중도금 대출 규제 폐지 매제 축소 계약 고민 당첨자 기다리 소식 증권 연구원 대책 훈풍 전국 주간 아파트 매매 가격 낙폭 반등 매매 수급 지수 소폭 개선 이후 정부 정책 투자 심리 영향 판단 역대 최저 자산 비율 경신 주가 부진 설주 호재 작용 주가 이끌 설명 건설업 종이 단기 반등 부동산 시장 침체 우려 지적 건설사 악재 꼽히 미분양 미분양 증가 전망 미래 증권 연구 위원 기준 미분양 아파트 기록 미분양 아파트 작년 대비 만호 증가 예상 일반 아파트 분양 물량 만호 지역 예상 분양 적용 도출 건설 업종 미분양 아파트 증가 확대 최근 부동산 정책 규제 주가 상승 한계 미분양 아파트 최고점 달성 주가 회복 가시 부동산 경기 최악 금융 위기 당시 전국 미분양 아파트 역대 최고 기록 건설사 재무 상황 악화 다수 건설사 워크아웃 법정 관리 당시 쇼핑 아파트 판매 정도 아파트 구매 무이자 대출 파격 조건 연구 위원 과거 건설 미분양 아파트 증가 시점 주가 하락 미분양 아파트 물량 최고점 기록 이후 주가 회복 부연 연구원 정부 의지 미분양 수치 줄어들 건설 단기 분양 시장 양극 심화 국면 전국 미분양 진단 정부 정책 부동산 시장 연착륙 가능 바닥 분석
2023-01-10,지역 신규 아파트 세대 건축 예정 분양 경기 활성,지역 단지 세대 규모 아파트 신축 공사 진행 세대 착공 세대 사업 계획 승인 신청 심의 번지 일원 시공 령자 청년 복지 주택 건립 사업 조감도 지역 세대 신규 아파트 시공 착공 앞두 사업 계획 승인 진행 건축 예정 아파트 분양 경기 활성 주목 지역 건설업 따르 지역 단지 세대 규모 아파트 신축 공사 진행 세대 착공 세대 사업 계획 승인 심의 생활 부지 착공 최고 높이 개동 세대 건립 올해 준공 예정 지역 단지 세대 규모 아파트 신축 공사 진행 세대 착공 세대 사업 계획 승인 신청 심의 일원 시공 공사 현장 모습 토지 신탁 시행 건설 시공 골조 공사 공정 보이 세대 세대 세대 세대 세대 세대 분양 완료 번지 일원 부지 최고 개동 세대 규모 건립 자이 세대 세대 세대 세대 자산 신탁 시행 건설 지난해 공사 시작 토사 반출 파일 공사 진행 전체 공정 보이 자이 준공 예정 지난해 분양 당시 경쟁 정도 인기 지역 단지 세대 규모 아파트 신축 공사 진행 세대 착공 세대 사업 계획 승인 신청 심의 번지 일원 지난해 준공 미아 퍼스트 아파트 전경 번지 일원 부지 지난해 국비 착공 령자 청년 복지 주택 건립 사업 가구 준공 복지 아파트 영구 임대 고령자 맞춤 주택 세대 청년 신혼 부부 고령자 행복 주택 세대 임대 제공 자산 신탁 사업 승인 금리 인상 대출 금융 여건 어려움 착공 지연 설계 변경 진행 공동 주택 신축 공사 당초 신세계 건설 시공 설계 변경 승인 완료 시공자 브랜드 선정 분양 이루 진후 올해 착공 전망 번지 일원 부지 지상 높이 건립 공동 주택 신축 공사 세대 세대 세대 덕윤 개발 번지 일원 세대 분양 공동 주택 신축 공사 사업 계획 승인 관련 부서 협의 지역 단지 세대 규모 아파트 신축 공사 진행 세대 착공 세대 사업 계획 승인 신청 심의 번지 아파트 야경 당초 계획 층수 축소 지상 지하 개동 건립 내용 사업 계획 승인 검토 공동 주택 지난해 사업 계획 승인 신청 인근 아람 기존 아파트 도로 기반 시설 확충 필요 설계 보완 이유 반려 이후 덕윤 개발 층수 조정 일부 설계 변경 지난해 건축 사업 계획 승인 신청 접수 부서 협의 심의 절차 진행 지역 주민 아파트 건립 요구 문제 상반기 승인 전망 최근 금리 인상 대출 어렵 건축 자재 가격 건설 경기 상황 착공 시기 선정 분양 상황 금융 여건 전반 건설 경기 결정 대광 건설 번지 일원 지하 지상 개동 규모 건립 세대 분양 가온 팰리스 아파트 신축 공사 사업 계획 승인 신청 현재 관심 보완 행정 절차 진행 이외 지역 아파트 신규 건축 사업자 토지 매입 동시 건축 사업 계획 승인 사전 상담 움직이 사업 계획 승인 착공 건설 경기 여건 시기 저울질 전망 지역 단지 세대 규모 아파트 신축 공사 진행 세대 착공 세대 사업 계획 승인 신청 심의 번지 일원 시공 자이 건축 현장 모습 지역 주택 건설 사업 전면 제한 신축 아파트 공급 조절 수급 관리 미분양 관리 지역 해제 주택 분양 시장 부동산 경기 안정 추세 분석 최근 금리 인상 원자재 가격 상승 건설 물가 상승 부동산 경기 하락 부동산 대출 민간 주택 사업자 재원 조달 사업 안정 위험 실정 신축 아파트 공급 개통 주거 밀집 실질 정주 여건 향상 주거 교육 환경 개선 전체 인구 증가 기여 판단 지속 주택 시장 안정 신규 공급 주택 단지 주택 공급 시기 조절 공동 주택 정주 여건 조성 방침 한편 주택 지역 주택 보급 지난해 기준 증가 예상 단독 주택 가구 주택 포함 공동 주택 거주 시민 아파트 단독 주택 연립 주택 다세대 주택 가구 주택 거주,지역 단지 세대 규모 아파트 신축 공사 진행 세대 착공 세대 사업 계획 승인 신청 심의 번지 일원 시공 령자 청년 복지 주택 건립 사업 조감도 지역 세대 신규 아파트 시공 착공 앞두 사업 계획 승인 진행 건축 예정 아파트 분양 경기 활성 주목 지역 건설업 따르 지역 단지 세대 규모 아파트 신축 공사 진행 세대 착공 세대 사업 계획 승인 심의 생활 부지 착공 최고 높이 개동 세대 건립 준공 예정 지역 단지 세대 규모 아파트 신축 공사 진행 세대 착공 세대 사업 계획 승인 신청 심의 일원 시공 공사 현장 모습 토지 신탁 시행 건설 시공 골조 공사 공정 보이 세대 세대 세대 세대 세대 세대 분양 완료 번지 일원 부지 최고 개동 세대 규모 건립 자이 세대 세대 세대 세대 자산 신탁 시행 건설 공사 시작 토사 반출 파일 공사 진행 전체 공정 보이 자이 준공 예정 분양 당시 경쟁 정도 인기 지역 단지 세대 규모 아파트 신축 공사 진행 세대 착공 세대 사업 계획 승인 신청 심의 번지 일원 준공 미아 퍼스트 아파트 전경 번지 일원 부지 국비 착공 령자 청년 복지 주택 건립 사업 가구 준공 복지 아파트 영구 임대 고령자 맞춤 주택 세대 청년 신혼 부부 고령자 행복 주택 세대 임대 제공 자산 신탁 사업 승인 금리 인상 대출 금융 여건 어려움 착공 지연 설계 변경 진행 공동 주택 신축 공사 당초 신세계 건설 시공 설계 변경 승인 완료 시공자 브랜드 선정 분양 이루 진후 착공 전망 번지 일원 부지 지상 높이 건립 공동 주택 신축 공사 세대 세대 세대 덕윤 개발 번지 일원 세대 분양 공동 주택 신축 공사 사업 계획 승인 관련 부서 협의 지역 단지 세대 규모 아파트 신축 공사 진행 세대 착공 세대 사업 계획 승인 신청 심의 번지 아파트 야경 당초 계획 층수 축소 지상 지하 개동 건립 내용 사업 계획 승인 검토 공동 주택 사업 계획 승인 신청 인근 아람 기존 아파트 도로 기반 시설 확충 필요 설계 보완 이유 반려 이후 덕윤 개발 층수 조정 일부 설계 변경 건축 사업 계획 승인 신청 접수 부서 협의 심의 절차 진행 지역 주민 아파트 건립 요구 문제 상반기 승인 전망 최근 금리 인상 대출 어렵 건축 자재 가격 건설 경기 상황 착공 시기 선정 분양 상황 금융 여건 전반 건설 경기 결정 대광 건설 번지 일원 지하 지상 개동 규모 건립 세대 분양 가온 팰리스 아파트 신축 공사 사업 계획 승인 신청 현재 관심 보완 행정 절차 진행 이외 지역 아파트 신규 건축 사업자 토지 매입 동시 건축 사업 계획 승인 사전 상담 움직이 사업 계획 승인 착공 건설 경기 여건 시기 저울질 전망 지역 단지 세대 규모 아파트 신축 공사 진행 세대 착공 세대 사업 계획 승인 신청 심의 번지 일원 시공 자이 건축 현장 모습 지역 주택 건설 사업 전면 제한 신축 아파트 공급 조절 수급 관리 미분양 관리 지역 해제 주택 분양 시장 부동산 경기 안정 추세 분석 최근 금리 인상 원자재 가격 상승 건설 물가 상승 부동산 경기 하락 부동산 대출 민간 주택 사업자 재원 조달 사업 안정 위험 실정 신축 아파트 공급 개통 주거 밀집 실질 정주 여건 향상 주거 교육 환경 개선 전체 인구 증가 기여 판단 지속 주택 시장 안정 신규 공급 주택 단지 주택 공급 시기 조절 공동 주택 정주 여건 조성 방침 한편 주택 지역 주택 보급 기준 증가 예상 단독 주택 가구 주택 포함 공동 주택 거주 시민 아파트 단독 주택 연립 주택 다세대 주택 가구 주택 거주
2023-01-10,계약 장위 내일 정오,전용 최다 당첨 서류 접수 순위 전량 소진 문제 분양 장위 예상 모형 사진 기자 장위 장위 구역 불리 순위 청약 진행 건설 따르 장위 이날 정오 잔여 물량 가구 순위 청약 진행 일반 분양 물량 가구 가구 계약 계약 순위 청약 순위 순위 청약 실시 수분 양자 진행 청약 관련 규정 바뀌 이번 순위 청약 무주택자 요건 충족 거주 지역 관련 규정 거주 실수요자 잔여 물량 전용 가구 전용 가구 전용 가구 가구 가구 가구 가구 가구 가구 가구 가구 가구 전용 면적 분양 계약금 분양 중도금 잔금 순위 청약 당첨 이달 입주 대상자 자격 확인 서류 계약 순위 청약 발생 예비 당첨자 추첨 계약 진행 전문가 순위 청약 진행 물량 소진 월용 청약 연구소 대표 예비 당첨자 추첨 부동산 대책 이후 진행 규제 완화 방안 이후 계약 저조 순위 청약 기대 물량 가구 절반 정도 소진 분양 발목 전망 지난해 순위 청약 진행 장위 평균 경쟁 일부 주택 미달 발생 순위 청약 진행 청약 가점 당첨자 가구 무주택 기간 채우 기본 점수 해당,전용 최다 당첨 서류 접수 순위 전량 소진 문제 분양 장위 예상 모형 사진 장위 장위 구역 불리 순위 청약 진행 건설 따르 장위 이날 정오 잔여 물량 가구 순위 청약 진행 일반 분양 물량 가구 가구 계약 계약 순위 청약 순위 순위 청약 실시 수분 양자 진행 청약 관련 규정 바뀌 이번 순위 청약 무주택자 요건 충족 거주 지역 관련 규정 거주 실수요자 잔여 물량 전용 가구 전용 가구 전용 가구 가구 가구 가구 가구 가구 가구 가구 가구 가구 전용 면적 분양 계약금 분양 중도금 잔금 순위 청약 당첨 이달 입주 대상자 자격 확인 서류 계약 순위 청약 발생 예비 당첨자 추첨 계약 진행 전문가 순위 청약 진행 물량 소진 월용 청약 연구소 대표 예비 당첨자 추첨 부동산 대책 이후 진행 규제 완화 방안 이후 계약 저조 순위 청약 기대 물량 가구 절반 정도 소진 분양 발목 전망 순위 청약 진행 장위 평균 경쟁 일부 주택 미달 발생 순위 청약 진행 청약 가점 당첨자 가구 무주택 기간 채우 기본 점수 해당
2023-01-10,브랜드 다르 브랜드 평가 자이 관심 신규 공급지,부동산 닥터 아파트 설문 조사서 자이 브랜드 평판 종합 브랜드 인지도 자이 아파트 분양 앞두 관심 고조 복대 투시도 시장 건설 브랜드 위상 건설 자이 각종 아파트 브랜드 평가 달성 그간 자이 차별 브랜드 위상 확인 자이 브랜드 적용 신규 분양 단지 관심 쏠리 브랜드 평가 인정받 설명 자이 브랜드 부동산 리서치 공동 진행 베스트 아파트 브랜드 설문 조사 닥터 아파트 주관 아파트 브랜드 파워 설문 조사 브랜드 스타 아파트 부문 차지 소비자 풀이 조경 예술 감각 최고 콘텐츠 기업 제휴 입주민 커뮤니티 콘텐츠 제공 기존 아파트 서비스 제공 후속 분양 단지 관심 설명 상품 기반 지역 자리 사례 브랜드 가치 검증 바탕 인지도 선호도 실제 산원 청약 따르 지난해 분양 시장 환경 순위 청약 접수 경쟁 지난해 분양 단지 가운데 최고 경쟁 기록 스카이라인 관심 커지 건설 일원 복대 분양 예정 복대 지하 지상 전용 면적 가구 규모 전용 면적 가구 최근 수요자 선호도 중대 구성 생활 인프라 강점 백화점 아울렛 대학교 병원 예술 전당 문화 인프라 이용 신율 공원 서원 어린이 공원 복대 공원 다수 공원 도보 고교 학교 시설 통학 교통 여건 갖추 설명 가로수 순환로 인접 지역 이동 분기점 접근성 우수 사통팔달 광역 교통망 전자 화학 생활 건강 푸드 기업 달하 기업 입주 일반 인근 커뮤니티 시설 클럽 피트 니스 실내 골프 연습장 남여 센터 목적 조성 입주민 편의 지상 별동 조성 도서관 큐레이션 인기 도서 스테디셀러 예정 입주민 커피 추출 향미 체험 오픈 커피 스테이션 조성 마시 독서 복대 견본 주택 경동 일원 개관 예정,부동산 닥터 아파트 설문 조사서 자이 브랜드 평판 종합 브랜드 인지도 자이 아파트 분양 앞두 관심 고조 복대 투시도 시장 건설 브랜드 위상 건설 자이 각종 아파트 브랜드 평가 달성 그간 자이 차별 브랜드 위상 확인 자이 브랜드 적용 신규 분양 단지 관심 쏠리 브랜드 평가 인정받 설명 자이 브랜드 부동산 리서치 공동 진행 베스트 아파트 브랜드 설문 조사 닥터 아파트 주관 아파트 브랜드 파워 설문 조사 브랜드 스타 아파트 부문 차지 소비자 풀이 조경 예술 감각 최고 콘텐츠 기업 제휴 입주민 커뮤니티 콘텐츠 제공 기존 아파트 서비스 제공 후속 분양 단지 관심 설명 상품 기반 지역 자리 사례 브랜드 가치 검증 바탕 인지도 선호도 실제 산원 청약 따르 분양 시장 환경 순위 청약 접수 경쟁 분양 단지 가운데 최고 경쟁 기록 스카이라인 관심 커지 건설 일원 복대 분양 예정 복대 지하 지상 전용 면적 가구 규모 전용 면적 가구 최근 수요자 선호도 중대 구성 생활 인프라 강점 백화점 아울렛 대학교 병원 예술 전당 문화 인프라 이용 신율 공원 서원 어린이 공원 복대 공원 다수 공원 도보 고교 학교 시설 통학 교통 여건 갖추 설명 가로수 순환로 인접 지역 이동 분기점 접근성 우수 사통팔달 광역 교통망 전자 화학 생활 건강 푸드 기업 달하 기업 입주 일반 인근 커뮤니티 시설 클럽 피트 니스 실내 골프 연습장 남여 센터 목적 조성 입주민 편의 지상 별동 조성 도서관 큐레이션 인기 도서 스테디셀러 예정 입주민 커피 추출 향미 체험 오픈 커피 스테이션 조성 마시 독서 복대 견본 주택 경동 일원 개관 예정
2023-01-10,장위 무더기 계약 순위 청약,일반 분양 가구 계약 계약 뉴스 기자 장위 장위 구역 개발 순위 청약 진행 건설 분양 업계 따르 장위 이날 정오 잔여 물량 순위 청약 진행 계약 마치 물량 전용 가구 전용 가구 상당 전용 가구 장위 일반 분양 물량 가구 가운데 계약 가구 가구 계약 장위 지난달 청약 순위 평균 경쟁 기록 일부 주택 순위 모집 가구 청약 당첨 가점 정도 흥행 저조 순위 청약 자격 거주 무주택 세대 구성원 이상 세대 주인 미성년자 당초 정부 이달 순위 청약 거주 지역 제한 예정 적용 시점 단지 혜택 정부 대책 단지 규제 지역 해제 전매 제한 완화 실거 규제 적용 순위 청약 일정 당첨자 발표 계약,일반 분양 가구 계약 계약 뉴스 장위 장위 구역 개발 순위 청약 진행 건설 분양 업계 따르 장위 이날 정오 잔여 물량 순위 청약 진행 계약 마치 물량 전용 가구 전용 가구 상당 전용 가구 장위 일반 분양 물량 가구 가운데 계약 가구 가구 계약 장위 지난달 청약 순위 평균 경쟁 기록 일부 주택 순위 모집 가구 청약 당첨 가점 정도 흥행 저조 순위 청약 자격 거주 무주택 세대 구성원 이상 세대 주인 미성년자 당초 정부 이달 순위 청약 거주 지역 제한 예정 적용 시점 단지 혜택 정부 대책 단지 규제 지역 해제 전매 제한 완화 실거 규제 적용 순위 청약 일정 당첨자 발표 계약
