date,Title,Content,tokens
2023-01-01,에너지 안보 묘수 에너지 냉전,민관 합동 비전 맞춤 시장 공략 전략 태양광 수소 에너지 호재 배터리 활로 모색 정유 업계 비상 정부 지원 자회사 미션 에너지 본사 모습 제공 경제 대근 기자 에너지 안보 선점 각국 정부 글로벌 기업 경쟁 노골화 지난해 의회 통과 인플레이션 감축 변화 상징 사례 재무 하위 세부 규정 만들 본격 시행 일정 제시 정부 기업 정부 의회 설득 맞춤 현지 대응 전략 묘수 돌입 상황 재계 따르 국내 피해 최소 민관 합동 총력전 펼쳐지 정부 업계 간담회 통상 전문가 법조 자문 폭넓 의견 수렴 작성 의견서 차례 지난해 제출 재계 관계자 장기 시각 가지 정부 의회 설득 성과 지금 재무 집중 기업 최대한 혜택 확보 에너지 분야 특성 맞춤 현지 대응 속도 핵심 목적 산업 일자리 보호 동시 기후 위기 대응 저탄소 에너지 활용 늘리 향후 투입 가운데 기후 변화 대응 에너지 안보 당장 최대 수혜 업종 지목 태양광 업계 입장 자국 태양광 패널 설치 최대 세액 공제 내용 포함 무역 협회 따르 지난해 태양광 모듈 수출액 전년 동기 대비 글로벌 공급 배제 의도 현실 호재 국내 태양광 기업 최대 경쟁자 기업 업계 관계자 기업 현지 공장 생산 원칙 규제 적용 변수 현지 상황 지켜보 대응 국내 해상 풍력 모습 수소 에너지 주요 신재 에너지 업계 현지 투자 기술 개발 다방면 공동 대응 시장 자체 전망 파이 기대감 대표 계열사 한화 임팩트 한화 에너지 고려 아연 신재 에너지 수소 시장 진출 공동 추진 그룹 에너지 전문 사업 지주 회사 에너지 경우 수소 기업 투자 청정 수소 사업 강화 건설 신사업 부문 에너지 기업 에너지 수소 플랜트 사업 추진 배터리 업계 에너지 원천 핵심 광물 글로벌 쟁탈전 주시 따르 내년 배터리 체결 국가 제조 조립 부품 연도 상향 사용 세액 공제 배터리 들어가 핵심 광물 이상 연도 상향 체결 국가 채굴 가공 나머지 규정 정의 체결 국가 기업 배터리 광물 조달 국가 채굴 광물 최종 가공 경우 세액 공제 조건 충족 부품 의존도 우려 부분 무역 협회 조사 결과 기준 국내 배터리 업계 음극 의존도 달하 반제품 양극 비중 원자재 가격 치솟 광산 매장 빗장 잠그 최근 리튬 원광 수출 통제 정책 전격 시행 사례 대표 가공 리튬 단순 수출 판단 글로벌 원자재 공급 균열 관련 국내 배터리 업체 공급 다각화 배터리 활용 장기 대응 방안 모색 반면 정유 업계 비상 자국 친환경 항공 세액 공제 혜택 항공 국내 유사 효자 수출 상품 업계 관련 연구 개발 대부분 초기 단계 업계 관계자 친환경 항공 기존 항공 가격 비싸 항공사 수요 성장 동력 키우 세액 보조 정부 지원 상황 호소 공장 사유 고도 시설 전경 제공,민관 합동 비전 맞춤 시장 공략 전략 태양광 수소 에너지 호재 배터리 활로 모색 정유 업계 비상 정부 지원 자회사 미션 에너지 본사 모습 제공 경제 대근 에너지 안보 선점 각국 정부 글로벌 기업 경쟁 노골화 의회 통과 인플레이션 감축 변화 상징 사례 재무 하위 세부 규정 만들 본격 시행 일정 제시 정부 기업 정부 의회 설득 맞춤 현지 대응 전략 묘수 돌입 상황 재계 따르 국내 피해 최소 민관 합동 총력전 펼쳐지 정부 업계 간담회 통상 전문가 법조 자문 폭넓 의견 수렴 작성 의견서 차례 제출 재계 관계자 장기 시각 가지 정부 의회 설득 성과 지금 재무 집중 기업 최대한 혜택 확보 에너지 분야 특성 맞춤 현지 대응 속도 핵심 목적 산업 일자리 보호 동시 기후 위기 대응 저탄소 에너지 활용 늘리 향후 투입 가운데 기후 변화 대응 에너지 안보 당장 최대 수혜 업종 지목 태양광 업계 입장 자국 태양광 패널 설치 최대 세액 공제 내용 포함 무역 협회 따르 태양광 모듈 수출액 전년 동기 대비 글로벌 공급 배제 의도 현실 호재 국내 태양광 기업 최대 경쟁자 기업 업계 관계자 기업 현지 공장 생산 원칙 규제 적용 변수 현지 상황 지켜보 대응 국내 해상 풍력 모습 수소 에너지 주요 신재 에너지 업계 현지 투자 기술 개발 다방면 공동 대응 시장 자체 전망 파이 기대감 대표 계열사 한화 임팩트 한화 에너지 고려 아연 신재 에너지 수소 시장 진출 공동 추진 그룹 에너지 전문 사업 지주 회사 에너지 경우 수소 기업 투자 청정 수소 사업 강화 건설 신사업 부문 에너지 기업 에너지 수소 플랜트 사업 추진 배터리 업계 에너지 원천 핵심 광물 글로벌 쟁탈전 주시 따르 내년 배터리 체결 국가 제조 조립 부품 연도 상향 사용 세액 공제 배터리 들어가 핵심 광물 이상 연도 상향 체결 국가 채굴 가공 나머지 규정 정의 체결 국가 기업 배터리 광물 조달 국가 채굴 광물 최종 가공 경우 세액 공제 조건 충족 부품 의존도 우려 부분 무역 협회 조사 결과 기준 국내 배터리 업계 음극 의존도 달하 반제품 양극 비중 원자재 가격 치솟 광산 매장 빗장 잠그 최근 리튬 원광 수출 통제 정책 전격 시행 사례 대표 가공 리튬 단순 수출 판단 글로벌 원자재 공급 균열 관련 국내 배터리 업체 공급 다각화 배터리 활용 장기 대응 방안 모색 반면 정유 업계 비상 자국 친환경 항공 세액 공제 혜택 항공 국내 유사 효자 수출 상품 업계 관련 연구 개발 대부분 초기 단계 업계 관계자 친환경 항공 기존 항공 가격 비싸 항공사 수요 성장 동력 키우 세액 보조 정부 지원 상황 호소 공장 사유 고도 시설 전경 제공
2023-01-01,단전 사고 차질 정상 운임 인권,승강장 고속 열차 정차 모습 운행 에스 운행 차질 지난달 열차 이용 승객 운임 인권 지급 이번 운행 차질 열차 지나 터널 천장 부직포 차선 떨어지 전기 공급 차단 운행 이틀 지연 에스 보도 자료 이틀 열차 이용 불편 고객 지연 배상금 별도 운임 인권 지급 인권 지급 대상 지난달 오후 에스 이용 고객 열차 정상 이용 승객 포함 에스 대표 전차선 단전 사고 장시간 열차 이용 불편 머리 안전 운행 저해 문제점 근본 안전 관리 대책 마련 지연 지난달 오후 경기 사이 터널 상행선 차선 전기 공급 중단 발생 전기 공급 복구 열차 지연 복구 상행선 구간 막히 하행선 열차 하행선 선로 사용 지연 운행 까닭 에스 철도 공사 코레 고속 열차 케이티엑스 지연 운행 지연 열차 시간 초동 조사 결과 전기 공급 중단 터널 누수 공사 부직포 터널 천장 차선 파악 에스 열차 가운데 주력 변환 장치 모터 블록 선로 부직포 조각 열차 추정 구간 공사 국가 철도 공단 발주 건설 지난해 열차 정상 운행 에스 경우 대체 열차 투입 예약 승객 좌석 변경 고장 차량 사고 발생 직후 코레 외부 전문 인력 제작사 합동 밤샘 복구 작업 에스 자체 차량 정비 역량 투입 에스 차량 부족 코레 케이티엑스 기준 긴급 지원 국토 민간 문단 점검 터널 보수 공사 책임 소재 열차 지연 원인 파악 과정 철도 안전 규정 위반 확인 경우 관계자 조처 예정,승강장 고속 열차 정차 모습 운행 에스 운행 차질 지난달 열차 이용 승객 운임 인권 지급 이번 운행 차질 열차 지나 터널 천장 부직포 차선 떨어지 전기 공급 차단 운행 이틀 지연 에스 보도 자료 이틀 열차 이용 불편 고객 지연 배상금 별도 운임 인권 지급 인권 지급 대상 지난달 오후 에스 이용 고객 열차 정상 이용 승객 포함 에스 대표 전차선 단전 사고 장시간 열차 이용 불편 머리 안전 운행 저해 문제점 근본 안전 관리 대책 마련 지연 지난달 오후 경기 사이 터널 상행선 차선 전기 공급 중단 발생 전기 공급 복구 열차 지연 복구 상행선 구간 막히 하행선 열차 하행선 선로 사용 지연 운행 까닭 에스 철도 공사 코레 고속 열차 케이티엑스 지연 운행 지연 열차 시간 초동 조사 결과 전기 공급 중단 터널 누수 공사 부직포 터널 천장 차선 파악 에스 열차 가운데 주력 변환 장치 모터 블록 선로 부직포 조각 열차 추정 구간 공사 국가 철도 공단 발주 건설 열차 정상 운행 에스 경우 대체 열차 투입 예약 승객 좌석 변경 고장 차량 사고 발생 직후 코레 외부 전문 인력 제작사 합동 밤샘 복구 작업 에스 자체 차량 정비 역량 투입 에스 차량 부족 코레 케이티엑스 기준 긴급 지원 국토 민간 문단 점검 터널 보수 공사 책임 소재 열차 지연 원인 파악 과정 철도 안전 규정 위반 확인 경우 관계자 조처 예정
2023-01-02,올해 분양 시장 어렵 작년 가구 공급,작년 가구 분양 올해 계획 미분양 시장 침체 지속 물량 축소 올해 전국 가구 분양 예정 지난해 분양 계획 이월 물량 가구 포함 지난해 연초 계획 물량 감소 지난해 실제 분양 물량 가구 지난해 기준 금리 인상 부동산 시장 침체 청약 시장 위축 금리 집값 추가 하락 우려감 청약 경쟁 미분양 정부 부동산 시장 활성 규제 완화책 내놓 올해 청약 시장 열기 미지수 가구 분양 작년 감소 부동산 따르 올해 전국 단지 가구 분양 예측 물량 기준 가구 이후 지난해 가구 규모 지난해 실제 분양 물량 가구 올해 수도 가구 분양 예정 가구 분양 정비 사업 물량 건설 구역 개발 가구 분양 단지 지하 지상 최고 전용 면적 규모 이문 구역 개발 래미 안라 가구 공급 시공 지하 최고 전용 면적 전용 규모 대조 구역 개발 단지 가구 공급 지하 최고 개동 규모 현대 건설 시공 대조 구역 공사비 책정 분양 산정 과정 갈등 착공 방배 구역 건축 세상 문정 진주 건축 단지 가구 공급 가구 분양 광명 구역 광명 광명 구역 광명 구역 개발 가구 공급 예정 맨션 삼호 가구 구역 가구 권선 구역 가구 공급 예정 가구 공급 예정 작년 검단 도시 물량 도시 개발 물량 검단 가구 용현 학익 도시 개발 가구 공급 예정 지방 가구 물량 조사 가구 가구 가구 가구 가구 가구 부동산 관계자 지방 수도 상대 주택 대기 수요 미분양 적체 지역 상당수 사업 공급 시기 조정 예상 작년 분양 지연 올해 어렵 지난해 아파트 분양 시장 계획 물량 가구 실제 분양 수도권 계획 물량 가구 가구 공급 아파트 분양 실적 가구 연초 계획 물량 가구 대비 수준 지방 계획 물량 가구 가구 가구 분양 기준 금리 인상 경기 침체 우려 매수세 위축 상당수 분양 예정 물량 연기 고금리 분양 집값 추가 하락 우려감 맞물리 청약 시장 이탈 수요자 분위기 정부 연말 전방 부동산 규제 완화책 발표 청약 당첨자 기존 주택 처분 기한 연장 중도금 대출 보증 확대 주택 세금 대출 부담 줄이 방안 올해 수도 추가 규제 지역 해제 부동산 관계자 규제 완화 알짜 가격 경쟁력 상품 청약 수요자 관심 수요자 선별 청약 나서 입지 공급 과잉 지역 미분양 우려 전망 분석 금리 인상 부동산 시장 침체 해소 어렵 전망 우세 공급 물량 올해 축소 전망 부동산 관계자 경기 둔화 미분양 우려 분양 물량 축소 계획 사업 계획 수립 건설사 상당수 예정 물량 실제 실적 연결 필요,작년 가구 분양 계획 미분양 시장 침체 지속 물량 축소 전국 가구 분양 예정 분양 계획 이월 물량 가구 포함 연초 계획 물량 감소 실제 분양 물량 가구 기준 금리 인상 부동산 시장 침체 청약 시장 위축 금리 집값 추가 하락 우려감 청약 경쟁 미분양 정부 부동산 시장 활성 규제 완화책 내놓 청약 시장 열기 미지수 가구 분양 작년 감소 부동산 따르 전국 단지 가구 분양 예측 물량 기준 가구 이후 가구 규모 실제 분양 물량 가구 수도 가구 분양 예정 가구 분양 정비 사업 물량 건설 구역 개발 가구 분양 단지 지하 지상 최고 전용 면적 규모 이문 구역 개발 래미 안라 가구 공급 시공 지하 최고 전용 면적 전용 규모 대조 구역 개발 단지 가구 공급 지하 최고 개동 규모 현대 건설 시공 대조 구역 공사비 책정 분양 산정 과정 갈등 착공 방배 구역 건축 세상 문정 진주 건축 단지 가구 공급 가구 분양 광명 구역 광명 광명 구역 광명 구역 개발 가구 공급 예정 맨션 삼호 가구 구역 가구 권선 구역 가구 공급 예정 가구 공급 예정 작년 검단 도시 물량 도시 개발 물량 검단 가구 용현 학익 도시 개발 가구 공급 예정 지방 가구 물량 조사 가구 가구 가구 가구 가구 가구 부동산 관계자 지방 수도 상대 주택 대기 수요 미분양 적체 지역 상당수 사업 공급 시기 조정 예상 작년 분양 지연 어렵 아파트 분양 시장 계획 물량 가구 실제 분양 수도권 계획 물량 가구 가구 공급 아파트 분양 실적 가구 연초 계획 물량 가구 대비 수준 지방 계획 물량 가구 가구 가구 분양 기준 금리 인상 경기 침체 우려 매수세 위축 상당수 분양 예정 물량 연기 고금리 분양 집값 추가 하락 우려감 맞물리 청약 시장 이탈 수요자 분위기 정부 연말 전방 부동산 규제 완화책 발표 청약 당첨자 기존 주택 처분 기한 연장 중도금 대출 보증 확대 주택 세금 대출 부담 줄이 방안 수도 추가 규제 지역 해제 부동산 관계자 규제 완화 알짜 가격 경쟁력 상품 청약 수요자 관심 수요자 선별 청약 나서 입지 공급 과잉 지역 미분양 우려 전망 분석 금리 인상 부동산 시장 침체 해소 어렵 전망 우세 공급 물량 축소 전망 부동산 관계자 경기 둔화 미분양 우려 분양 물량 축소 계획 사업 계획 수립 건설사 상당수 예정 물량 실제 실적 연결 필요
2023-01-02,그룹 올해 위기 시작 비상 경영 개시,그룹 유례 장기 침체 위기 시작 규정 위기 극복 현장 인재 역할 강조 회장 세계 경기 하락 유가 환율 물가 변동 일련 사업 환경 변화 유례없 장기 침체 시작 예고 위기 극복 지혜 기업 생존 자발 혁신 현장 인재 강조 회장 올해 위기 시작 규정 최근 그룹 전반 체질 개선 우수 성과 주요 사업 선행 지표 하강 장기 침체 전조 나타나 판단 조직 전반 긴장감 불어넣 조치 일자 단행 정기 임원 인사 주요 계열사 대표 이사 대부분 유임 경영 연속 위기 대응 체계 방점 이번 신년 메시지 회장 장기 침체 대비 현장 직원 위기 대응 강조 그룹 최고 경영진 현장 직원 이르 사실 비상 경영 체제 전환 의미 회장 최근 기간 동안 디지털 혁신 기술 투자 지속 미래 성장 토대 새해 투자 혁신 씨앗 연결 성장 신사업 발전 만들 강조 동안 그룹 추진 디지털 혁신 기술 스타트업 투자 사업 생태 유례없 장기 침체기 기업 생존 높이 신사업 창출 절호 기회 판단 에너지 전환 신사업 가속 전망 텍스 추진 수소 연료 사이클 신사업 에너지 중심 암모니아 개발 유통 배터리 사이클 소형 원자 충전 신사업 예상 테일 온라인 오프라인 연계 쇼핑 경험 제공 신사업 건설 친환경 스마트 건축 신사업 속도 전망 벤처 투자 전문 회사 벤처 경쟁력 유망 스타트업 발굴 투자 지속 동시 미래 성장 잠재력 기업 적극 계획 투자 협력 사업 연결 그룹 미래 성장 전략 위기 기회 공존 새해 가속 기대 한편 회장 동안 축적 디지털 오픈 이노베이션 업무 혁신 기반 우수 인재 자발 창의 조직 문화 만들 그룹 장단 임원 당부,그룹 유례 장기 침체 위기 시작 규정 위기 극복 현장 인재 역할 강조 회장 세계 경기 하락 유가 환율 물가 변동 일련 사업 환경 변화 유례없 장기 침체 시작 예고 위기 극복 지혜 기업 생존 자발 혁신 현장 인재 강조 회장 위기 시작 규정 최근 그룹 전반 체질 개선 우수 성과 주요 사업 선행 지표 하강 장기 침체 전조 나타나 판단 조직 전반 긴장감 불어넣 조치 일자 단행 정기 임원 인사 주요 계열사 대표 이사 대부분 유임 경영 연속 위기 대응 체계 방점 이번 신년 메시지 회장 장기 침체 대비 현장 직원 위기 대응 강조 그룹 최고 경영진 현장 직원 이르 사실 비상 경영 체제 전환 의미 회장 최근 기간 동안 디지털 혁신 기술 투자 지속 미래 성장 토대 새해 투자 혁신 씨앗 연결 성장 신사업 발전 만들 강조 동안 그룹 추진 디지털 혁신 기술 스타트업 투자 사업 생태 유례없 장기 침체기 기업 생존 높이 신사업 창출 절호 기회 판단 에너지 전환 신사업 가속 전망 텍스 추진 수소 연료 사이클 신사업 에너지 중심 암모니아 개발 유통 배터리 사이클 소형 원자 충전 신사업 예상 테일 온라인 오프라인 연계 쇼핑 경험 제공 신사업 건설 친환경 스마트 건축 신사업 속도 전망 벤처 투자 전문 회사 벤처 경쟁력 유망 스타트업 발굴 투자 지속 동시 미래 성장 잠재력 기업 적극 계획 투자 협력 사업 연결 그룹 미래 성장 전략 위기 기회 공존 새해 가속 기대 한편 회장 동안 축적 디지털 오픈 이노베이션 업무 혁신 기반 우수 인재 자발 창의 조직 문화 만들 그룹 장단 임원 당부
2023-01-02,신년사 회장 위기 시작 현장 인재 역할 중요,그룹 회장 기자 그룹 회장 올해 유례없 장기 침체 위기 시작 규정 위기 극복 현장 인재 역할 회장 배포 신년사 세계 경기 하락 유가 환율 물가 변동 일련 사업 환경 변화 유례없 장기 침체 시작 예고 위기 극복 지혜 기업 생존 자발 혁신 현장 인재 강조 올해 위기 시작 규정 최근 그룹 전반 체질 개선 우수 성과 주요 사업 선행 지표 하강 장기 침체 전조 나타나 판단 조직 전반 긴장감 불어넣 조치 일자 단행 정기 임원 인사 주요 계열사 대표 이사 대부분 유임 경영 연속 위기 대응 체계 방점 이번 신년 메시지 회장 장기 침체 대비 현장 직원 위기 대응 강조 그룹 최고 경영진 현장 직원 이르 사실 비상 경영 체제 전환 의미 회장 최근 기간 동안 디지털 혁신 기술 투자 지속 미래 성장 토대 투자 혁신 씨앗 연결 성장 신사업 발전 만들 강조 동안 그룹 추진 디지털 혁신 기술 스타트업 투자 사업 생태 유례없 장기 침체기 기업 생존 높이 신사업 창출 절호 기회 판단 에너지 전환 신사업 가속 방침 텍스 추진 수소 연료 사이클 신사업 에너지 중심 암모니아 개발 유통 배터리 사이클 소형 원자 충전 신사업 예상 테일 온라인 오프라인 연계 쇼핑 경험 제공 신사업 건설 친환경 스마트 건축 신사업 속도 전망 회장 동안 축적 디지털 오픈 이노베이션 업무 혁신 기반 우수 인재 자발 창의 조직 문화 만들 그룹 장단 임원 당부,그룹 회장 그룹 회장 유례없 장기 침체 위기 시작 규정 위기 극복 현장 인재 역할 회장 배포 신년사 세계 경기 하락 유가 환율 물가 변동 일련 사업 환경 변화 유례없 장기 침체 시작 예고 위기 극복 지혜 기업 생존 자발 혁신 현장 인재 강조 위기 시작 규정 최근 그룹 전반 체질 개선 우수 성과 주요 사업 선행 지표 하강 장기 침체 전조 나타나 판단 조직 전반 긴장감 불어넣 조치 일자 단행 정기 임원 인사 주요 계열사 대표 이사 대부분 유임 경영 연속 위기 대응 체계 방점 이번 신년 메시지 회장 장기 침체 대비 현장 직원 위기 대응 강조 그룹 최고 경영진 현장 직원 이르 사실 비상 경영 체제 전환 의미 회장 최근 기간 동안 디지털 혁신 기술 투자 지속 미래 성장 토대 투자 혁신 씨앗 연결 성장 신사업 발전 만들 강조 동안 그룹 추진 디지털 혁신 기술 스타트업 투자 사업 생태 유례없 장기 침체기 기업 생존 높이 신사업 창출 절호 기회 판단 에너지 전환 신사업 가속 방침 텍스 추진 수소 연료 사이클 신사업 에너지 중심 암모니아 개발 유통 배터리 사이클 소형 원자 충전 신사업 예상 테일 온라인 오프라인 연계 쇼핑 경험 제공 신사업 건설 친환경 스마트 건축 신사업 속도 전망 회장 동안 축적 디지털 오픈 이노베이션 업무 혁신 기반 우수 인재 자발 창의 조직 문화 만들 그룹 장단 임원 당부
2023-01-02,회장 위기 극복 지혜 혁신 기대 응체 방점,회장 유례없 경기 침체 비상 경영 개시 신사업 창출 가속 주문 그룹 회장 그룹 유례 장기 침체 위기 시작 규정 위기 극복 현장 인재 역할 강조 그룹 회장 세계 경기 하락 유가 환율 물가 변동 일련 사업 환경 변화 유례없 장기 침체 시작 예고 위기 극복 지혜 기업 생존 자발 혁신 현장 인재 강조 회장 위기 시작 규정 최근 그룹 전반 체질 개선 우수 성과 주요 사업 선행 지표 하강 장기 침체 전조 나타나 판단 조직 전반 긴장감 불어넣 조치 일자 단행 정기 임원 인사 주요 계열사 대표 이사 대부분 유임 경영 연속 위기 대응 체계 방점 이번 신년 메시지 회장 장기 침체 대비 현장 직원 위기 대응 강조 그룹 최고 경영진 현장 직원 이르 사실 비상 경영 체제 전환 의미 회장 최근 동안 디지털 혁신 기술 투자 지속 미래 성장 토대 갖추 평가 투자 혁신 씨앗 연결 성장 신사업 발전 만들 강조 동안 그룹 추진 디지털 혁신 기술 스타트업 투자 사업 생태 유례없 장기 침체기 기업 생존 높이 신사업 창출 절호 기회 판단 에너지 전환 신사업 가속 전망 텍스 추진 수소 연료 사이클 신사업 에너지 중심 암모니아 개발 유통 배터리 사이클 소형 원자 충전 신사업 예상 테일 온라인 오프라인 연계 쇼핑 경험 제공 신사업 건설 친환경 스마트 건축 신사업 속도 전망 벤처 투자 전문 회사 벤처 경쟁력 유망 스타트업 발굴 투자 지속 동시 미래 성장 잠재력 기업 적극 계획 투자 협력 사업 연결 그룹 미래 성장 전략 위기 기회 공존 새해 가속 기대 회장 동안 축적 디지털 오픈 이노베이션 업무 혁신 기반 우수 인재 자발 창의 조직 문화 만들 그룹 장단 임원 당부,회장 유례없 경기 침체 비상 경영 개시 신사업 창출 가속 주문 그룹 회장 그룹 유례 장기 침체 위기 시작 규정 위기 극복 현장 인재 역할 강조 그룹 회장 세계 경기 하락 유가 환율 물가 변동 일련 사업 환경 변화 유례없 장기 침체 시작 예고 위기 극복 지혜 기업 생존 자발 혁신 현장 인재 강조 회장 위기 시작 규정 최근 그룹 전반 체질 개선 우수 성과 주요 사업 선행 지표 하강 장기 침체 전조 나타나 판단 조직 전반 긴장감 불어넣 조치 일자 단행 정기 임원 인사 주요 계열사 대표 이사 대부분 유임 경영 연속 위기 대응 체계 방점 이번 신년 메시지 회장 장기 침체 대비 현장 직원 위기 대응 강조 그룹 최고 경영진 현장 직원 이르 사실 비상 경영 체제 전환 의미 회장 최근 동안 디지털 혁신 기술 투자 지속 미래 성장 토대 갖추 평가 투자 혁신 씨앗 연결 성장 신사업 발전 만들 강조 동안 그룹 추진 디지털 혁신 기술 스타트업 투자 사업 생태 유례없 장기 침체기 기업 생존 높이 신사업 창출 절호 기회 판단 에너지 전환 신사업 가속 전망 텍스 추진 수소 연료 사이클 신사업 에너지 중심 암모니아 개발 유통 배터리 사이클 소형 원자 충전 신사업 예상 테일 온라인 오프라인 연계 쇼핑 경험 제공 신사업 건설 친환경 스마트 건축 신사업 속도 전망 벤처 투자 전문 회사 벤처 경쟁력 유망 스타트업 발굴 투자 지속 동시 미래 성장 잠재력 기업 적극 계획 투자 협력 사업 연결 그룹 미래 성장 전략 위기 기회 공존 새해 가속 기대 회장 동안 축적 디지털 오픈 이노베이션 업무 혁신 기반 우수 인재 자발 창의 조직 문화 만들 그룹 장단 임원 당부
