date,Title,Content,tokens
2022-02-27,잠실 재건축 시계,얼어붙 재건축 시장 훈풍 부나 정비 계획안 도시 계획 위원회 소위원회 통과 재건축 시장 기대감 부풀 정비 계획안 수립 도계 넘어서 지지부진 재건축 급물살 가구 잠실 주공 최고 가구 단지 아파트 탈바꿈 역세 일부 용지 일반 주거 지역 주거 지역 용도 상향 주상 복합 최고 건립 가능 상향 층수 규제 의미 시장 시절 르네상스 정책 건립 트리 마제 이후 아파트 등장 고수 폐기 본격 추진 건축 단지 호재 아파트 주상 복합 제외 최고 층수 이하 제한 건축 시장 최대 걸림돌 시장 공약 폐기 내걸 층수 제한 삭제 내용 도시 기본 계획 상반기 발표 예정 수혜 예상 재건축 단지 들썩거리 맨션 수주 건설 설계안 제시 구역 최고 건축 움직임 지구 재건축 계획 구역 추진 문턱 층수 규제 완화 건축 시장 호재 틀림없 전진단 초과 수제 분양 상한 정부 재건축 규제 걸림돌 조합원 이상 이익 최고 부담금 초과 이익 환수 부담금 폭탄 우려 대통령 후보 건축 개발 규제 완화 목소리 청신호 재건축 활성 방안 도시 특별법 용적 상향 안전 진단 완화 공약 더불 후보 일반 주거 지역 신설 최고 용적 적용 국민 후보 민간 재건축 용적 상향 초과 수제 후보 온도 분양 상한 후보 확대 후보 완화 의견 재건축 시계 속도 대선 이후 규제 완화,얼어붙 재건축 시장 훈풍 부나 정비 계획안 도시 계획 위원회 소위원회 통과 재건축 시장 기대감 부풀 정비 계획안 수립 도계 넘어서 지지부진 재건축 급물살 가구 잠실 주공 최고 가구 단지 아파트 탈바꿈 역세 일부 용지 주거 지역 주거 지역 용도 상향 주상 복합 최고 건립 상향 층수 규제 의미 시장 시절 르네상스 정책 건립 트리 마제 아파트 등장 고수 폐기 본격 추진 건축 단지 호재 아파트 주상 복합 제외 최고 층수 이하 제한 건축 시장 최대 걸림돌 시장 공약 폐기 내걸 층수 제한 삭제 도시 기본 계획 발표 예정 수혜 예상 재건축 단지 들썩거리 맨션 수주 설계안 제시 구역 최고 건축 움직임 지구 재건축 계획 구역 추진 문턱 층수 규제 완화 건축 시장 호재 틀림없 전진단 초과 수제 분양 상한 정부 재건축 규제 걸림돌 조합원 이상 이익 최고 부담금 초과 이익 환수 부담금 폭탄 우려 대통령 후보 건축 개발 규제 완화 목소리 청신호 재건축 활성 방안 도시 특별법 용적 상향 안전 진단 완화 공약 더불 후보 주거 지역 신설 최고 용적 적용 국민 후보 민간 재건축 용적 상향 초과 수제 후보 온도 분양 상한 후보 확대 후보 완화 의견 재건축 시계 속도 대선 규제 완화
2022-02-27,건설 산수 시공 확보 분기,뉴스 건설 구역 공공재 건축 산수 구역 개발 선정 건설 분기 주고 건설 따르 구역 건축 조합 전날 총회 건설 최종 선정 구역 재건축 지하 지상 가구 사업 공사비 건설 산수 구역 개발 시공 확보 사업 지하 지상 가구 규모 사업비 건설 올해 도시 정비 사업 수주 성공 공사비 규모 맨션 건축 사업 수주 달하 구역 규모 구서 구역 건축 사업 연달 수주 이번 구역 산수 구역 시공 확보 건설 분기 주액 기록,뉴스 구역 공공재 건축 산수 구역 개발 선정 주고 구역 건축 조합 전날 총회 최종 선정 구역 재건축 지하 지상 가구 공사비 산수 구역 개발 시공 확보 지하 지상 가구 규모 사업비 도시 정비 수주 성공 공사비 규모 맨션 건축 수주 달하 구역 규모 구서 구역 건축 연달 수주 구역 산수 구역 시공 확보 주액 기록
2022-02-27,현대 건설 정비 사업 수주 돌파 시공 따내,장대 구역 개발 수주 건설 따내 정비 수주 붕괴 사고 재건축 건설 아파트 가로 주택 사업 수주 경제 주말 시공 따내 올해 도시 정비 사업 수주 달성 건설 정비 사업 수주 주액 자리 아파트 붕괴 사고 아파트 재건축 사업 수주 건축 사업 수주 성공 현대 건설 강촌 아파트 사업 장대 구역 개발 사업 시공 확보 올해 주고 달성 강촌 아파트 증축 모델링 지하 지상 가구 가구 증가 변모 추진 현대 건설 디에이치 지명 제안 장대 구역 현대 건설 지방 광역시 최초 디에이치 적용 디에이치 아트 제안 공동 주택 가구 규모 공사비 건설 산수 구역 개발 구역 재건축 연달 선정 올해 누적 주액 도시 정비 수주 지키 이날 아파트 재건축 사업 조합원 총회 선정 발생 아파트 붕괴 사고 여파 입지 위축 연달 시공 따내 한숨 돌리 미분양 사업 촉진 가구 지원 파격 사업 조건 내걸 사업 회사 핵심 사업 지인 역세 개발 시너지 이루 목표 호반 건설 가구 규모 대호 아파트 주변 가로 주택 정비 사업 선정 수인 인하 병원 도보 위치,장대 구역 개발 수주 따내 정비 수주 붕괴 사고 재건축 아파트 가로 주택 수주 경제 주말 시공 따내 도시 정비 수주 달성 정비 수주 주액 자리 아파트 붕괴 사고 아파트 재건축 수주 건축 수주 성공 현대 강촌 아파트 장대 구역 개발 시공 확보 주고 달성 강촌 아파트 증축 모델링 지하 지상 가구 가구 증가 변모 추진 현대 디에이치 지명 제안 장대 구역 현대 지방 광역시 최초 디에이치 적용 디에이치 아트 제안 공동 주택 가구 규모 공사비 산수 구역 개발 구역 재건축 연달 선정 누적 주액 도시 정비 수주 지키 이날 아파트 재건축 조합원 총회 선정 발생 아파트 붕괴 사고 여파 입지 위축 연달 시공 따내 한숨 돌리 미분양 촉진 가구 지원 파격 조건 내걸 회사 핵심 지인 역세 개발 시너지 이루 목표 호반 가구 규모 대호 아파트 주변 가로 주택 정비 선정 수인 인하 병원 도보 위치
2022-02-28,안전 경영 무재 운동 기술 활용 안전망 강화,체어 시험 도입 탑재 유해 가스 점검 계열사 안전 보건 전담 조직 신설 선임 안전 업무 강화 지난해 국내 공장 테스트 의자 로봇 모습 반복 작업 통증 골격계 질환 예방 로봇 근로자 안전 보건 기술 적용 예정 사진 현대 자동차 중대 재해 처벌 본격 시행 안전 경영 매진 기업 환경 안전 과하 정도 투자 선제 대응 궁극 효율 투자 국내 기업 최고 경영자 임직원 지난달 시행 중대 재해 처벌 염두 발언 중대 재해 발생 기업 감당 처벌 손실 생각 안전 관련 투자 산업 최근 안전 경영 매진 변이 확산 안전 경영 리스크 대응 필요 데이터 사물 인터넷 스마트 기술 적용 안전망 강화 기업 안전 사업장 만들 안전 규정 시행 시작 보행 휴대폰 사용 금지 자전거 이용 헬멧 착용 미착용 도보 셔틀 이용 임직원 방문객 적용 작업 위험 상황 신고 작업 중지 손들 활동 활성 제조 공정 인간 공학 분석 인간 공학 라인 인증 운영 건강 부담 작업 환경 개선 현대 자동차 주요 공장 기술 접목 체어 시험 도입 반복 작업 통증 고령 작업자 골격계 질환 예방 지난해 안전 보건 관련 예산 전년 대비 증액 전담 조직 확대 인력 충원 안전사고 중대 재해 발생 위험 사항 평가 항목 구성 평가 결과 핵심 지표 반영 안전망 강화 스마트 기술 활용 탑재 도입 도시 가스관 주변 탐색 메탄 누출 여부 체크 검침원 검침 수고 사고 위험 이노베이션 공간 무인 가스 측정기 설치 측정 유해 가스 관제 센터 전달 장치 운영 계열사 안전 보건 전담 조직 세우 디스플레이 안전 환경 사고 근절 지난해 최고 안전 환경 책임자 직제 만들 올해 직속 안전 보건 전담 조직 신설 전자 원칙 안전 임직원 의무 권리 동료 안전 배려 일상 기본 안전 작업 안전 기준 준수 위험 요소 점검 개선 위험 요소 사고 발견 신고 일상 기본 안전 계단 이용 핸드 레일 지정 흡연 금지 세부 조항 내년 안전사고 예방 디지털 전환 기술 개발 사업장 적용 계획 화학 중대 사고 핵심 원인 분석 절대 준수 환경 안전 수칙 내놓 화재 폭발 위험 작업 가스 농도 측정 작업장 비상 통로 확보 부회장 업무 기한 무리 설정 해내 목표 환경 안전 임직원 인식 필수 강조 지주 산하 안전 관리 사무국 신설 회장 화재 인명 사고 발생 최선 협력 업체 안전 지원 주문 안전 환경 투자 중대 재해 발생 사업장 성과 인정 제도 도입 건설 력사 안전 보건 역량 평가 도입 신용 평가 연계 평가 부실 등급 파트너 입찰 참여 제한 부생 가스 질식 가스 누출 모니터링 시스템 화재 감시 로봇 활용 시스템 지능 도입 현장 작업 환경 개선 향후 투자 안전 통로 방호 울타리 작업 발판 안전 시설물 점검 안전 교육 훈련 강화 한화 센서 활용 기반 데이터 수집 분석 위험 요인 사전 차단 스마트 방재 플랫 준비 대표 이사 직속 최고 안전 책임자 직책 신설 화토 공장 무선 통신망 기반 방폭형 설비 점검 촬영 도입 주요 계열사 선임 안전 업무 강화 테일 점포 센터 안전 점검 건설 안전 혁신 학교 텐트 도입 안전 보건 교육 텍스 산업재 안전사고 자연재해 대응 조직 구성 비상 대응 훈련 이상 자체 실시 위험 질소 분위기 촉매 교체 작업 로봇 대체 작업자 질식사 위험 줄이 작업 시간 단축 비용 절감 예상 그룹 환경 보건 세션 실시 주요 계열사 최고 운영 책임자 부문장 참석 중공업 유해 위험 요인 평가 대책 마련 작업자 교육 효성 중공업 무재 달성 일수 인센티브 제공 무재 운동 전개 효성 대응 관련 공장 자체 검사소 출장 복귀 숙소 마련 방역 시스템 정비 제품 생산 주변 환경 미치 영향 관련 전담 조직 중심 환경 경영 추진 온실가스 감축 폐기물 저감 환경 리스크 전반 관리 백화점 자체 발생 폐기물 회수 원료 활용 재활용품 생산 자원 순환 시스템 적용 시작 미래형 마트 표방 푸드,체어 시험 도입 탑재 유해 가스 점검 계열사 안전 보건 전담 조직 신설 선임 안전 업무 강화 국내 공장 테스트 의자 로봇 모습 반복 작업 통증 골격계 질환 예방 로봇 근로자 안전 보건 기술 적용 예정 사진 현대 자동차 중대 재해 처벌 본격 시행 안전 경영 매진 기업 환경 안전 과하 정도 투자 선제 대응 궁극 효율 투자 국내 기업 최고 경영자 임직원 지난달 시행 중대 재해 처벌 염두 발언 중대 재해 발생 기업 감당 처벌 손실 생각 안전 관련 투자 산업 안전 경영 매진 변이 확산 안전 경영 리스크 대응 필요 데이터 사물 인터넷 스마트 기술 적용 안전망 강화 기업 안전 사업장 만들 안전 규정 시행 시작 보행 휴대폰 사용 금지 자전거 이용 헬멧 착용 미착용 도보 셔틀 이용 임직원 방문객 적용 작업 위험 상황 신고 작업 중지 손들 활동 활성 제조 공정 인간 공학 분석 인간 공학 라인 인증 운영 건강 부담 작업 환경 개선 현대 자동차 주요 공장 기술 접목 체어 시험 도입 반복 작업 통증 고령 작업자 골격계 질환 예방 안전 보건 관련 예산 전년 증액 전담 조직 확대 인력 충원 안전사고 중대 재해 발생 위험 사항 평가 항목 구성 평가 결과 핵심 지표 반영 안전망 강화 스마트 기술 활용 탑재 도입 도시 가스관 주변 탐색 메탄 누출 여부 체크 검침원 검침 수고 사고 위험 이노베이션 공간 무인 가스 측정기 설치 측정 유해 가스 관제 센터 전달 장치 운영 계열사 안전 보건 전담 조직 세우 디스플레이 안전 환경 사고 근절 최고 안전 환경 책임자 직제 만들 직속 안전 보건 전담 조직 신설 전자 원칙 안전 임직원 의무 권리 동료 안전 배려 일상 기본 안전 작업 안전 기준 준수 위험 요소 점검 개선 위험 요소 사고 발견 신고 일상 기본 안전 계단 이용 핸드 레일 지정 흡연 금지 세부 조항 내년 안전사고 예방 디지털 전환 기술 개발 사업장 적용 계획 화학 중대 사고 핵심 원인 분석 절대 준수 환경 안전 수칙 내놓 화재 폭발 위험 작업 가스 농도 측정 작업장 비상 통로 확보 부회장 업무 기한 무리 설정 해내 목표 환경 안전 임직원 인식 필수 강조 지주 산하 안전 관리 사무국 신설 회장 화재 인명 사고 발생 최선 협력 업체 안전 지원 주문 안전 환경 투자 중대 재해 발생 사업장 성과 인정 제도 도입 력사 안전 보건 역량 평가 도입 신용 평가 연계 평가 부실 등급 파트너 입찰 참여 제한 부생 가스 질식 가스 누출 모니터링 시스템 화재 감시 로봇 활용 시스템 지능 도입 현장 작업 환경 개선 향후 투자 안전 통로 방호 울타리 작업 발판 안전 시설물 점검 안전 교육 훈련 강화 한화 센서 활용 기반 데이터 수집 분석 위험 요인 사전 차단 스마트 방재 플랫 준비 대표 이사 직속 최고 안전 책임자 직책 신설 화토 공장 무선 통신망 기반 방폭형 설비 점검 촬영 도입 주요 계열사 선임 안전 업무 강화 테일 점포 센터 안전 점검 안전 혁신 학교 텐트 도입 안전 보건 교육 텍스 산업재 안전사고 자연재해 대응 조직 구성 비상 대응 훈련 이상 자체 실시 위험 질소 분위기 촉매 교체 작업 로봇 대체 작업자 질식사 위험 줄이 작업 시간 단축 비용 절감 예상 그룹 환경 보건 세션 실시 주요 계열사 최고 운영 책임자 부문장 참석 중공업 유해 위험 요인 평가 대책 마련 작업자 교육 효성 중공업 무재 달성 일수 인센티브 제공 무재 운동 전개 효성 대응 관련 공장 자체 검사소 출장 복귀 숙소 마련 방역 시스템 정비 제품 생산 주변 환경 미치 영향 관련 전담 조직 중심 환경 경영 추진 온실가스 감축 폐기물 저감 환경 리스크 전반 관리 백화점 자체 발생 폐기물 회수 원료 활용 재활용품 생산 자원 순환 시스템 적용 시작 미래형 마트 표방 푸드
2022-02-28,자금 경영 전략 지원 협력 체질 개선,상생 경영 텍스 직원 공장 협력 업체 직원 업무 협의 사진 제공 협력 회사 동반 성장 파트너 바라보 상생 경영 활동 체계 전개 회장 변화 빠르 시대 미래 성장 나아가 비즈니스 파트너 협력 사업 생태계 확장 강조 계열사 협업 외부 스타트업 벤처 캐피털 사모 펀드 사업 생태 조성 내다보 움직이 지난해 국내외 스타트업 벤처 캐피털 이르 전략 투자 활동 에너지 커머스 디지털 친환경 접목 신사업 방향 구체 텍스 력사 경쟁력 향상 자금 지원 기술 개발 지원 교육 훈련 다양 상생 프로그램 운영 구매 대금 경우 현금 결제 세금 계산서 수취 이내 지급 재정 부담 동반성 협약 체결 력사 대상 금융 공동 규모 상생 펀드 조성 대출 지원 건설 건설 산업 특성 전략 육성 필요 고려 협력 회사 선정 입찰 공정 관리 업무 전반 상생 경영 정착 투명 공정 동반자 협력 체계 만들 최고 경영자 위원장 최고 경영진 구성 건설 동반 성장 위원회 운영 실질 동반성 확산 동반성 협의회 자이 포럼 협력 단순 지원 경영 금융 지원 체제 강화 공사 수행 강화 구조 시공 문화 체질 개선 생산 향상 소통 강화 신뢰 증진 역량 강화 초점 프로그램 테일 중소 파트너 자금 유동 확보 도움 단위 대금 지급 단위 현금 지급 원칙 업계 최초 본부 가맹 경영주 상생 협력 협약 전기료 지원 경영주 무료 법률 자문 서비스 다양 상생 제도 운영,상생 경영 텍스 직원 공장 협력 업체 직원 업무 협의 사진 제공 협력 회사 동반 성장 파트너 바라보 상생 경영 활동 체계 전개 회장 변화 빠르 시대 미래 성장 나아가 비즈니스 파트너 협력 생태계 확장 강조 계열사 협업 외부 스타트업 벤처 캐피털 사모 펀드 생태 조성 내다보 움직이 국내외 스타트업 벤처 캐피털 이르 전략 투자 활동 에너지 커머스 디지털 친환경 접목 신사업 방향 구체 텍스 력사 경쟁력 향상 자금 지원 기술 개발 지원 교육 훈련 다양 상생 프로그램 운영 구매 대금 경우 현금 결제 세금 계산서 수취 이내 지급 재정 부담 동반성 협약 체결 력사 대상 금융 공동 규모 상생 펀드 조성 대출 지원 산업 특성 전략 육성 필요 고려 협력 회사 선정 입찰 공정 관리 업무 전반 상생 경영 정착 투명 공정 동반자 협력 체계 만들 최고 경영자 위원장 최고 경영진 구성 동반 성장 위원회 운영 실질 동반성 확산 동반성 협의회 자이 포럼 협력 단순 지원 경영 금융 지원 체제 강화 공사 수행 강화 구조 시공 문화 체질 개선 생산 향상 소통 강화 신뢰 증진 역량 강화 초점 프로그램 테일 중소 파트너 자금 유동 확보 도움 단위 대금 지급 단위 현금 지급 원칙 업계 최초 본부 가맹 경영주 상생 협력 협약 전기료 지원 경영주 무료 법률 자문 서비스 다양 상생 제도 운영
