date,Title,Content,tokens
2022-03-23,건설 시장 진출 신재 에너지 모듈 사업 선도,건설 본사 진행 결식 조성 건설 플랜트 부문 대표 왼쪽 볼슨 재생 에너지 영업 대표 기념 촬영 사진 건설 건설 생산 기술 업체 생산 설비 모듈 사업 수소 분야 모듈 사업 확장 신재 에너지 모듈 사업 경쟁력 강화 계획 건설 본사 생산 설비 표준 모듈 조성 건설 플랜트 부문 대표 볼슨 재생 에너지 영업 대표 참석 식물 기름 동물 지방 원료 무공 연료 건설 생산 기술 선두 주자 보유 핵심 공정 하이드로 기술 표준 모듈 생산 기술 정보 제공 건설 규모 정유 화학 플랜트 사업 축적 모듈 기술력 설계 시공 표준 투자 절감 공사 기간 최소 플랜트 모듈 현장 별도 제작 핵심 플랜트 공정 표준 모듈 제작 현장 설치 사전 제작 기후 작업 환경 변수 비용 낮추 공기 기술 집약 친환경 플랜트 사업 주목 건설 이번 협약 표준 모듈 개발 국내 해외 시장 진출 전략 건설 수소 플랜트 모듈 신재 에너지 모듈 사업 선두 주자 자리매김 목표 한편 화학 석유 사업 세계 탄소 저감 기술력 보유 기업 시장 신재 에너지 전환 기술 독보 우위 선점 회사 보유 하이드로 식물 기름 콩기름 재생 가능 공급 원료 제트 원료유 변화 기술 건설 관계자 향후 지속 성장 예상 분야 선도 기업 구축 친환경 에너지 모듈 사업 확대 발판 마련 친환경 신사업 확대 지속 가능 경영,본사 진행 결식 조성 플랜트 부문 대표 왼쪽 볼슨 재생 에너지 영업 대표 기념 촬영 사진 생산 기술 업체 생산 설비 모듈 수소 분야 모듈 확장 신재 에너지 모듈 경쟁력 강화 계획 본사 생산 설비 표준 모듈 조성 플랜트 부문 대표 볼슨 재생 에너지 영업 대표 참석 식물 기름 동물 지방 원료 무공 연료 생산 기술 선두 주자 보유 핵심 공정 하이드로 기술 표준 모듈 생산 기술 정보 제공 규모 정유 화학 플랜트 축적 모듈 기술력 설계 시공 표준 투자 절감 공사 기간 최소 플랜트 모듈 현장 별도 제작 핵심 플랜트 공정 표준 모듈 제작 현장 설치 사전 제작 기후 작업 환경 변수 비용 낮추 공기 기술 집약 친환경 플랜트 주목 협약 표준 모듈 개발 국내 해외 시장 진출 전략 수소 플랜트 모듈 신재 에너지 모듈 선두 주자 자리매김 목표 한편 화학 석유 세계 탄소 저감 기술력 보유 기업 시장 신재 에너지 전환 기술 독보 우위 선점 회사 보유 하이드로 식물 기름 콩기름 재생 공급 원료 제트 원료유 변화 기술 관계자 향후 지속 성장 예상 분야 선도 기업 구축 친환경 에너지 모듈 확대 발판 마련 친환경 신사업 확대 지속 경영
2022-03-23,건설 생산 설비 모듈 사업 추진 맞손,건설 투자 절감 효과 플랜트 모듈 건설 본사 진행 상호 협력 양해 각서 결식 왼쪽 건설 플랜트 부문 대표 볼슨 재생 에너지 영업 대표 기념 촬영 사진 제공 건설 경제 건설 생산 기술 기업 생산 설비 모듈 사업 건설 이날 본사 조성 건설 플랜트 부문 대표 볼슨 재생 에너지 영업 대표 참석 가운데 생산 설비 표준 모듈 체결 플랜트 모듈 핵심 공정 표준 모듈 제작 현장 설치 투자 절감 공사 기간 최소 생산 기술 선두 주자 식물 기름 콩기름 재생 가능 공급 원료 제트 연료유 변환 하이드로 기술 보유 회사 석유 사업 세계 탄소 저감 기술력 보유 기업 이번 협약 생산 기술 정보 제공 건설 핵심 기술 하이드로 공정 설계 시공 표준 건설 관계자 표준 모듈 개발 국내외 시장 동반 진출 계획,투자 절감 효과 플랜트 모듈 본사 진행 상호 협력 양해 각서 결식 왼쪽 플랜트 부문 대표 볼슨 재생 에너지 영업 대표 기념 촬영 사진 제공 경제 생산 기술 기업 생산 설비 모듈 이날 본사 조성 플랜트 부문 대표 볼슨 재생 에너지 영업 대표 참석 가운데 생산 설비 표준 모듈 체결 플랜트 모듈 핵심 공정 표준 모듈 제작 현장 설치 투자 절감 공사 기간 최소 생산 기술 선두 주자 식물 기름 콩기름 재생 공급 원료 제트 연료유 변환 하이드로 기술 보유 회사 석유 세계 탄소 저감 기술력 보유 기업 협약 생산 기술 정보 제공 핵심 기술 하이드로 공정 설계 시공 표준 관계자 표준 모듈 개발 국내외 시장 동반 진출 계획
2022-03-23,건설 소와 업무 협약 생산 설비 표준 모듈,핵심 공정 모듈 세계 시장 동반 진출 신재 에너지 모듈 선두 주자 자리매김 오희 기자 건설 생산 기술 업체 생산 설비 모듈 사업 수소 분야 모듈 사업 확장 신재 에너지 모듈 사업 경쟁력 강화 계획 건설 본사 진행 상호 협력 양해 각서 체결 조성 건설 플랜트 부문 대표 왼쪽 볼슨 재생 에너지 영업 대표 오른쪽 기념 촬영 자료 건설 제공 건설 본사 조성 건설 플랜트 부문 대표 볼슨 재생 에너지 영업 대표 관계자 참석 가운데 생산 설비 표준 모듈 체결 이번 건설 생산 기술 선두 주자 보유 핵심 공정 하이드로 기술 표준 모듈 생산 기술 정보 제공 건설 규모 정유 화학 플랜트 사업 축척 모듈 기술력 설계 시공 표준 투자 절감 공사 기간 최소 플랜트 모듈 현장 별도 제작 핵심 플랜트 공정 표준 모듈 제작 현장 설치 사전 제작 기후 작업 환경 변수 비용 낮추 공기 기술 집약 친환경 플랜트 사업 주목 건설 이번 협약 표준 모듈 개발 국내 해외 시장 동반 진출 계획 건설 수소 플랜트 모듈 신재 에너지 모듈 사업 선두 주자 자리매김 기대 한편 기업 화학 석유 사업 세계 탄소 저감 기술력 보유 기업 최근 시장 신재 에너지 전환 기술 독보 우위 선점 하이드로 기술 식물 기름 콩기름 재생 가능 공급 원료 제트 연료유 변환 기술 건설 담당자 향후 지속 성장 예상 분야 선도 기업 구축 친환경 에너지 모듈 사업 확대 발판 마련 이번 사업 계기 건설 선도 기업 친환경 신사업 확대 지속 가능 경영,핵심 공정 모듈 세계 시장 동반 진출 신재 에너지 모듈 선두 주자 자리매김 오희 생산 기술 업체 생산 설비 모듈 수소 분야 모듈 확장 신재 에너지 모듈 경쟁력 강화 계획 본사 진행 상호 협력 양해 각서 체결 조성 플랜트 부문 대표 왼쪽 볼슨 재생 에너지 영업 대표 오른쪽 기념 촬영 자료 제공 본사 조성 플랜트 부문 대표 볼슨 재생 에너지 영업 대표 관계자 참석 가운데 생산 설비 표준 모듈 체결 생산 기술 선두 주자 보유 핵심 공정 하이드로 기술 표준 모듈 생산 기술 정보 제공 규모 정유 화학 플랜트 축척 모듈 기술력 설계 시공 표준 투자 절감 공사 기간 최소 플랜트 모듈 현장 별도 제작 핵심 플랜트 공정 표준 모듈 제작 현장 설치 사전 제작 기후 작업 환경 변수 비용 낮추 공기 기술 집약 친환경 플랜트 주목 협약 표준 모듈 개발 국내 해외 시장 동반 진출 계획 수소 플랜트 모듈 신재 에너지 모듈 선두 주자 자리매김 기대 한편 기업 화학 석유 세계 탄소 저감 기술력 보유 기업 시장 신재 에너지 전환 기술 독보 우위 선점 하이드로 기술 식물 기름 콩기름 재생 공급 원료 제트 연료유 변환 기술 담당자 향후 지속 성장 예상 분야 선도 기업 구축 친환경 에너지 모듈 확대 발판 마련 계기 선도 기업 친환경 신사업 확대 지속 경영
2022-03-23,시장 공시 건설 에스,건설 규모 안양 데이터 센터 개발 공사 수주 규모 지식 산업 센터 신축 사업 공사 수주 현대 에프 규모 발전 천연가스 공급 계약 체결 한화 시스템 방위 사업 청과 규모 중앙 방공 통제 성능 개량 사업 계약 체결,규모 안양 데이터 센터 개발 공사 수주 규모 지식 산업 센터 신축 공사 수주 현대 에프 규모 발전 천연가스 공급 계약 체결 한화 시스템 방위 청과 규모 중앙 방공 통제 성능 개량 계약 체결
2022-03-23,건설 생산 설비 표준 모듈,맞손 신재 에너지 모듈 선두 주자 건설 식물 기름 동물 지방 원료 무공 연료 생산 기술 업체 생산 설비 모듈 사업 사진 건설 건설 식물 기름 동물 지방 원료 무공 연료 생산 기술 업체 생산 설비 모듈 사업 건설 본사 조성 건설 플랜트 부문 대표 볼슨 재생 에너지 영업 대표 관계자 참석 가운데 생산 설비 표준 모듈 체결 플랜트 모듈 현장 별도 제작 핵심 플랜트 공정 표준 모듈 제작 현장 설치 사전 제작 기후 작업 환경 변수 비용 절감 공기 단축 장점 기술 집약 친환경 플랜트 사업 주목 건설 생산 기술 선두 주자 보유 핵심 공정 하이드로 기술 표준 모듈 활용 건설 이번 협약 표준 모듈 개발 국내 해외 시장 동반 진출 계획 회사 수소 플랜트 모듈 신재 에너지 모듈 사업 선두 주자 자리매김 기대 건설 관계자 향후 지속 성장 예상 분야 선도 기업 구축 친환경 에너지 모듈 사업 확대 발판 마련 이번 사업 계기 건설 환경 사회 지배 구조 선도 기업 친환경 신사업 확대 지속 가능 경영 한편 기업 화학 석유 사업 세계 탄소 저감 기술력 보유 최근 시장 신재 에너지 전환 기술 독보 우위 선점 하이드로 기술 식물 기름 콩기름 재생 가능 공급 원료 제트 연료유 변환 기술,맞손 신재 에너지 모듈 선두 주자 식물 기름 동물 지방 원료 무공 연료 생산 기술 업체 생산 설비 모듈 사진 식물 기름 동물 지방 원료 무공 연료 생산 기술 업체 생산 설비 모듈 본사 조성 플랜트 부문 대표 볼슨 재생 에너지 영업 대표 관계자 참석 가운데 생산 설비 표준 모듈 체결 플랜트 모듈 현장 별도 제작 핵심 플랜트 공정 표준 모듈 제작 현장 설치 사전 제작 기후 작업 환경 변수 비용 절감 공기 단축 장점 기술 집약 친환경 플랜트 주목 생산 기술 선두 주자 보유 핵심 공정 하이드로 기술 표준 모듈 활용 협약 표준 모듈 개발 국내 해외 시장 동반 진출 계획 회사 수소 플랜트 모듈 신재 에너지 모듈 선두 주자 자리매김 기대 관계자 향후 지속 성장 예상 분야 선도 기업 구축 친환경 에너지 모듈 확대 발판 마련 계기 환경 사회 지배 구조 선도 기업 친환경 신사업 확대 지속 경영 한편 기업 화학 석유 세계 탄소 저감 기술력 보유 시장 신재 에너지 전환 기술 독보 우위 선점 하이드로 기술 식물 기름 콩기름 재생 공급 원료 제트 연료유 변환 기술
2022-03-23,건설 무공 설비 모듈 사업 진출 소와 협력,생산 설비 표준 모듈 체결 건설 핵심 공정 모듈 해외 동반 진출 수소 재생 에너지 사업 경쟁력 건설 생산 기술 업체 생산 설비 모듈 사업 수소 분야 모듈 사업 확장 신재 에너지 모듈 사업 경쟁력 강화 방침 건설 소재 본사 생산 설비 표준 모듈 체결 결식 조성 건설 플랜트 부문 대표 볼슨 재생 에너지 영업 대표 주요 관계자 참석 식물 기름 동물 지방 원료 무공 연료 자동차 경유 혼합 사용 순수 연료 사용 관련 품질 기준 마련 상태 국내 경유 연료 판매 이번 건설 생산 기술 선도 업체 보유 핵심 공정 하이드로 기술 표준 모듈 계획 생산 기술 정보 제공 건설 규모 정유 화학 플랜트 사업 축적 모듈 기술력 설계 시공 표준 투자 공사 기간 복안 플랜트 모듈 현장 별도 제작 핵심 플랜트 공정 표준 모듈 제작 현장 설치 구현 사전 제작 기후 작업 환경 변수 비용 낮추 공사 기간 기술 집약 친환경 플랜트 사업 주목 건설 이번 협약 표준 모듈 개발 국내 해외 시장 진출 병행 계획 수소 플랜트 모듈 신재 에너지 모듈 사업 분야 선두 주자 자리매김 방침 석유 사업 세계 탄소 저감 기술력 보유 업체 최근 시장 신재 에너지 전환 기술 독보 우위 선점 하이드로 기술 식물 기름 콩기름 재생 가능 공급 원료 제트 연료유 변환 기술 건설 관계자 향후 지속 성장 예상 분야 선도 업체 구축 친환경 에너지 모듈 사업 확대 발판 마련 이번 사업 계기 건설 선도 기업 친환경 신사업 확대 지속 가능 경영,생산 설비 표준 모듈 체결 핵심 공정 모듈 해외 동반 진출 수소 재생 에너지 경쟁력 생산 기술 업체 생산 설비 모듈 수소 분야 모듈 확장 신재 에너지 모듈 경쟁력 강화 방침 소재 본사 생산 설비 표준 모듈 체결 결식 조성 플랜트 부문 대표 볼슨 재생 에너지 영업 대표 주요 관계자 참석 식물 기름 동물 지방 원료 무공 연료 자동차 경유 혼합 사용 순수 연료 사용 관련 품질 기준 마련 상태 국내 경유 연료 판매 생산 기술 선도 업체 보유 핵심 공정 하이드로 기술 표준 모듈 계획 생산 기술 정보 제공 규모 정유 화학 플랜트 축적 모듈 기술력 설계 시공 표준 투자 공사 기간 복안 플랜트 모듈 현장 별도 제작 핵심 플랜트 공정 표준 모듈 제작 현장 설치 구현 사전 제작 기후 작업 환경 변수 비용 낮추 공사 기간 기술 집약 친환경 플랜트 주목 협약 표준 모듈 개발 국내 해외 시장 진출 병행 계획 수소 플랜트 모듈 신재 에너지 모듈 분야 선두 주자 자리매김 방침 석유 세계 탄소 저감 기술력 보유 업체 시장 신재 에너지 전환 기술 독보 우위 선점 하이드로 기술 식물 기름 콩기름 재생 공급 원료 제트 연료유 변환 기술 관계자 향후 지속 성장 예상 분야 선도 업체 구축 친환경 에너지 모듈 확대 발판 마련 계기 선도 기업 친환경 신사업 확대 지속 경영
2022-03-24,공공 하수 처리장 증설 탄력 입찰 경쟁 본격화,하수 처리장 의회 제공 차례 유찰 공공 하수 처리 시설 현대 사업 본궤도 기대 도두 하수 처리장 규모 확장 공공 하수 처리 시설 입찰 공고 건설 컨소시엄 컨소시엄 입찰 참가 자격 사전 심사 신청서 제출 입찰 참가 자격 사전 심사 심사 결과 적격 업체 대상 현장 명회 본격 설계 시작 계획 기술 자문 위원회 기본 설계 격심 평가 설계 점수 가격 점수 합산 가중치 기준 방식 종합 점수 업체 실시 설계 적격자 선정 예정 공공 하수 처리장 현대 사업 지난해 공사 입찰 재입찰 차례 유찰,하수 처리장 의회 제공 차례 유찰 공공 하수 처리 시설 현대 본궤도 기대 도두 하수 처리장 규모 확장 공공 하수 처리 시설 입찰 공고 컨소시엄 컨소시엄 입찰 참가 자격 사전 심사 신청서 제출 입찰 참가 자격 사전 심사 심사 결과 적격 업체 대상 현장 명회 본격 설계 시작 계획 기술 자문 위원회 기본 설계 격심 평가 설계 점수 가격 점수 합산 가중치 기준 방식 종합 점수 업체 실시 설계 적격자 선정 예정 공공 하수 처리장 현대 공사 입찰 재입찰 차례 유찰
2022-03-24,스타트업 벤처 캐피털 협업 미래 사업 생태 확장 주력,선진국 미래 에너지 혁신 스타트업 발굴 챌린지 임직원 스타트업 최고 경영자 스타트업 캠프 참여 사진 제공 그룹 그룹 장기 사태 어려움 극복 경영 방침 대응 사업 생태 확장 제시 회장 변이 바이러스 출현 안정 글로벌 정세 인플레이션 우려 사업 환경 높이 변화 빠르 시대 미래 성장 나아가 비즈니스 파트너 협력 사업 생태계 확장 회장 강조 사업 생태 비즈니스 시스템 그룹 계열사 협업 외부 스타트업 벤처 캐피털 사모 펀드 영역 경쟁력 기업 교류 협력 관계 구축 위험 기회 대응 의미 그룹 사업 생태 구축 사례 그동안 계열사 디지털 친환경 중심 신사업 투자 사업 제휴 확보 협력 네트워크 소개 화학 산업용 재료 생산 협력 관계 국내외 전문 벤처 캐피털 스타트업 투자 최근 의료 분야 네트워크 확장 더불 탄소 중립 기업 협력 분야 충전 배터리 사이클 분야 유망 에너지 기업 분야 커머스 반려 동물 관련 분야 친환경 스마트 건축 분야 다양 사업 생태계 지속 확장 전략 회장 회장 지난해 국내외 스타트업 벤처 캐피털 이르 전략 투자 활동 에너지 커머스 디지털 친환경 접목 신사업 방향 구체 평가 생태 구축 올해 구체 궁극 그룹 미래 신사업 발전 임직원 모두 관심 중요 강조 그룹 테일 통합 테일 비전 선포 올해 경영 전략 데이터 중심 고객 만족 최우선 경영 제시 오프라인 채널 수집 데이터 통합 활용 개인 마케팅 역량 강화 테일 채널 생애 주기 고객 경험 제공 중요 다음 상품 강화 경쟁사 차별 고객 경험 제공 핵심 경쟁력 편조 리식 키트 차별 맞춤 상품 개발 확대 쇼핑 비즈니스 유닛 인기 독점 상품 사전 예약 판매 채널 역량 결집 건설 급변 세계 도전 변신 의지 다지 올해 경영 방침 사업 구상 리더십 확립 신사업 역량 강화 집중 변화 대응 체계 확립 조직 역량 강화 지속 가능 인프라스트럭처 구축 제시 그룹 스타트업 투자 미래 성장 전략 중요 천명 투자 생태 확장 본격 자본 출자 기업 주도 벤처 캐피털 전문 회사 벤처 설립 벤처 국내 기후 변화 대응 자원 순환 유통 에너지 분야 투자 대상 발굴 계획,선진국 미래 에너지 혁신 스타트업 발굴 챌린지 임직원 스타트업 최고 경영자 스타트업 캠프 참여 사진 제공 그룹 그룹 장기 사태 어려움 극복 경영 방침 대응 생태 확장 제시 회장 변이 바이러스 출현 안정 글로벌 정세 인플레이션 우려 환경 높이 변화 빠르 시대 미래 성장 나아가 비즈니스 파트너 협력 생태계 확장 회장 강조 생태 비즈니스 시스템 그룹 계열사 협업 외부 스타트업 벤처 캐피털 사모 펀드 영역 경쟁력 기업 교류 협력 관계 구축 위험 기회 대응 의미 그룹 생태 구축 사례 그동안 계열사 디지털 친환경 중심 신사업 투자 제휴 확보 협력 네트워크 소개 화학 산업용 재료 생산 협력 관계 국내외 전문 벤처 캐피털 스타트업 투자 의료 분야 네트워크 확장 더불 탄소 중립 기업 협력 분야 충전 배터리 사이클 분야 유망 에너지 기업 분야 커머스 반려 동물 관련 분야 친환경 스마트 건축 분야 다양 생태계 지속 확장 전략 회장 회장 국내외 스타트업 벤처 캐피털 이르 전략 투자 활동 에너지 커머스 디지털 친환경 접목 신사업 방향 구체 평가 생태 구축 구체 궁극 그룹 미래 신사업 발전 임직원 모두 관심 중요 강조 그룹 테일 통합 테일 비전 선포 경영 전략 데이터 중심 고객 만족 최우선 경영 제시 오프라인 채널 수집 데이터 통합 활용 개인 마케팅 역량 강화 테일 채널 생애 주기 고객 경험 제공 중요 다음 상품 강화 경쟁사 차별 고객 경험 제공 핵심 경쟁력 편조 리식 키트 차별 맞춤 상품 개발 확대 쇼핑 비즈니스 유닛 인기 독점 상품 사전 예약 판매 채널 역량 결집 급변 세계 도전 변신 의지 다지 경영 방침 구상 리더십 확립 신사업 역량 강화 집중 변화 대응 체계 확립 조직 역량 강화 지속 인프라스트럭처 구축 제시 그룹 스타트업 투자 미래 성장 전략 중요 천명 투자 생태 확장 본격 자본 출자 기업 주도 벤처 캐피털 전문 회사 벤처 설립 벤처 국내 기후 변화 대응 자원 순환 유통 에너지 분야 투자 대상 발굴 계획
2022-03-24,건설 업계 최초 가상 인간 견본 주택 큐레이터 도입,이달 자이 공개 러닝 기술 현실 건설 업계 최초 가상 인간 자이 아파트 견본 주택 기술 탑재 가상 인간 마련 꿈꾸 사람 분양 정보 제공 건설 자사 아파트 브랜드 자이 가상 인간 도입 가상 인간 역자 스타 견본 주택 오픈 일인 건설 채널 자이 공개 예정 자이 신규 분양 견본 주택 등장 가상 인간 실존 인물 촬영 사람 목소리 표정 행동 데이터 학습 가상 인간 구현 고도 러닝 기반 영상 합성 기술 이용 현실 부여 영상 고객 공간 실제 정보 전달 가상 인간 사진 건설 가상 인간 역자 스타 위치 기본 사업 개요 조경 커뮤니티 시설 외관 디자인 이르 단지 적용 중요 정보 고객 전달 입력 인근 주거 편의 시설 학군 도로 대중교통 정보 청약 일정 자격 조건 정보 제공 한편 자이 구독자 돌파 디지털 선도 기업 자리 건설 시도 가상 인간 주거 트렌드 혁신 이끌,이달 자이 공개 러닝 기술 현실 업계 최초 가상 인간 자이 아파트 견본 주택 기술 탑재 가상 인간 마련 꿈꾸 사람 분양 정보 제공 자사 아파트 브랜드 자이 가상 인간 도입 가상 인간 역자 스타 견본 주택 오픈 일인 채널 자이 공개 예정 자이 신규 분양 견본 주택 등장 가상 인간 실존 인물 촬영 사람 목소리 표정 행동 데이터 학습 가상 인간 구현 고도 러닝 기반 영상 합성 기술 이용 현실 부여 영상 고객 공간 실제 정보 전달 가상 인간 사진 가상 인간 역자 스타 위치 기본 개요 조경 커뮤니티 시설 외관 디자인 이르 단지 적용 중요 정보 고객 전달 입력 인근 주거 편의 시설 학군 도로 대중교통 정보 청약 일정 자격 조건 정보 제공 한편 자이 구독자 돌파 디지털 선도 기업 자리 시도 가상 인간 주거 트렌드 혁신 이끌
