title,date,media,content,url
축구장 23개규모 대형체육공원 내 조성,2022-09-23 04:05:04,매일경제,"GS건설 '아산자이 그랜드파크'◆ 가을 분양시장 ◆  GS건설은 충남 아산시 용화동 137-1, 133-2 일원에 '아산자이 그랜드파크'를 10월 분양할 예정이다.아산자이 그랜드파크는 아산시 최초 민간공원 특례사업인 아산시 용화체육공원 조성사업 내 공동주택 용지에 총 2개 단지로 구성된다. 1단지는 지하 3층~지상 35층, 5개 동, 전용면적 74~149㎡, 739가구 규모, 2단지는 지하 4층~지상 37층, 6개 동, 전용 84~149㎡, 849가구 규모다. 단지는 민간공원 특례사업을 통해 용화체육공원(예정)과 함께 조성되는 만큼 쾌적한 자연환경을 갖추고 있다. 용화체육공원은 축구장 23개 규모인 약 16만㎡에 달하는 대형 공원으로 조성되며 실내체육관, 어린이체육놀이터 등 체육시설은 물론 생태체험장, 숲속건강쉼터 등 휴식·문화공간이 함께 지어진다. 우수한 교통망이 눈길을 끈다. 인근으로 지하철 1호선 온양온천역이 가깝고 KTX천안아산역도 손쉽게 이용할 수 있다. 이 밖에 당진~천안고속도로가 예정된 것을 비롯해 서부내륙고속도로(예정), 서해선복선전철(예정) 등 다양한 교통망을 이용할 수 있을 것으로 기대된다. 아산시는 현재 조성 중인 아산 삼성디스플레이시티를 비롯해 현대모터스밸리, 인주일반산업단지, 스마트밸리, 테크노밸리 등 다양한 산업단지가 밀집한 곳이다. 아산자이 그랜드파크의 주변 지역 근무자는 약 9만명에 달할 것으로 보인다. 특히 아산시는 수도권과 가까워 기업 유치가 꾸준히 이뤄질 것으로 보여 이 단지의 배후수요도 보다 풍부해질 것으로 예상된다. 또 단지는 아산초, 용화초, 온양중, 용화중, 용화고 등 학교가 밀집해 있어 안심 통학이 가능하고 아산시 중앙도서관 등 교육시설을 이용할 수 있다. 단지 인근에 이마트, 롯데마트, 전통시장 등이 있고 시청, 법원, 종합운동장, 롯데시네마 등도 편리하게 이용할 수 있어 주거 여건이 뛰어나다. 아산자이 그랜드파크는 혁신 설계를 적용했다. 먼저 4베이 판상형, 타워형 등 다양한 평면 설계를 통해 선택지를 넓혔으며 타입별로 팬트리, 드레스룸 등 공간 특화로 활용도를 높였다. 특히 전용 84㎡A는 대형 드레스룸에 다용도실, 팬트리를 더했을 뿐 아니라 주방부터 거실까지 공간이 이어져 와이드다이닝 공간이 만들어진다. 기존 주방은 4인 가구가 식탁을 두어도 비좁았는데 홈파티까지 열 수 있는 공간으로 마련돼 수요자들의 호응이 예상된다. 또 전용 149㎡는 다양한 타입의 대형 펜트하우스를 선보일 예정으로 공통적으로 테라스가 적용되는 등 희소성 있는 특화 평면을 제공한다.단지 내 커뮤니티센터 '클럽자이안'에는 스카이라운지, 게스트하우스, 피트니스, 어린이집, 작은도서관, 공유오피스 및 영어도서관과 대형 문화콘텐츠 기업이 제공하는 독서 문화공간 등 다양한 시설이 조성된다. 여기에 아산자이 그랜드파크는 방과 후 돌봄이 필요한 초등학생 아동에게 돌봄 서비스를 제공하는 다함께돌봄센터를 단지 내에 조성해 맞벌이 부부들이 안심하고 아이를 맡길 수 있다. GS건설과 자이S&D가 공동 개발한 공기청정 시스템 '시스클라인'도 도입된다. 시스클라인은 환기 장치인 전열교환기와 공기청정기가 결합돼 자동으로 공기질을 관리하는 토털 에어솔루션 시스템으로, 천장에 빌트인돼 있어 공간 활용이 효율적이다.아산자이 그랜드파크 1순위 청약 자격은 청약통장 가입기간이 6개월 이상 지나고, 면적·지역별 예치 기준금액을 충족하면 얻을 수 있다. 아울러 유주택자와 가구원도 청약을 신청할 수 있다. 또 비규제 지역으로 재당첨 제한이 해당되지 않으며, 분양권 전매는 입주 시점까지 가능하다.",https://n.news.naver.com/mnews/article/009/0005021083?sid=101
뛰는 금리에 이자 갚기 빠듯…떨고 있는 종목은?,2022-09-23 04:34:02,이데일리,"코스피 상장종목 25% 이자보상배율 1미만대형주보다 소형주에 쏠려하나투어·한전·제주항공 등 이자부담 커져""이자율 상승에 디스플레이·운송 등 영향""[이데일리 양지윤 기자] 고물가로 미국, 유럽 등 주요국 중앙은행이 가파른 금리 인상에 나서면서 기업들의 이자비용 부담이 커지게 됐다. 코스피 상장종목의 20~25%가 이자보상배율이 1배 미만인 ‘취약기업’으로 나타났다.  취약기업인 코스피 소형주와 이자보상배율 변동 요인이 악화된 기업에 유의하며 접근해야 한다는 조언이 나온다.[이데일리 문승용 기자]22일 금융정보업체 에프엔가이드와 메리츠증권에 따르면 올해 코스피 이자보상배율은 6배로 추정된다. 지난해 12배 대비 절반 수준으로 떨어졌다. 이자보상배율은 기업이 벌어들인 영업이익에서 이자비용이 차지하는 비율을 일컫는다. 이자보상배율이 1보다 작으면 영업이익으로 이자도 갚지 못한다는 의미다. 일반적으로 3년 연속 이자보상배율이 1 미만이면 재무부실 기업인 한계기업으로 분류된다. 코스피 전체 상장종목 가운데 이자보상배율 1을 하회하는 취약기업은 20~25%를 차지한 것으로 나타났다. 대형주 내 취약기업 종목 비중이 10% 이하인 반면 소형주는 30%를 차지했다. 취약기업 가운데 80%는 영업적자로 이자를 지불할 수 없고, 20%는 연간 영업이익이 연간 이자비용을 밑도는 수준이다.올해 이자보상배율이 1을 밑돌 것으로 예상되는 기업은 하나투어(039130)(-13.0), 한국전력(015760)(-8.5), 대교(019680)(-7.5), 제주항공(089590)(-5.0) 대우조선해양(042660)(-3.5) 순으로 나타났다. 이 중 하나투어의 경우 일본 여행 수요가 회복세로 돌아섰지만 매출 비중이 10%대에 그쳐 큰 폭의 실적 개선을 기대하기 어렵다는 게 중론이다. 한국전력 역시 에너지 수입 가격 급등으로 올해 약 35조원의 영업적자를 기록할 것으로 전망된다. 이자보상배율 변동 요인 악화 종목으로는 롯데케미칼(011170), 쌍용C&E(003410), 포스코인터내셔널(047050), GS리테일(007070), GS건설(006360), DL(000210), 코오롱인더(120110) 등이 꼽혔다. 이자보상배율 5배 미만 종목 가운데 전년 대비 수익성이 악화하고, 차입금 의존도가 높아진 종목들이다. 또 이자발생부채비율도 10% 이상이다. 롯데케미칼의 경우 화학산업이 다운사이클(업황부진) 속에 놓여 있는 가운데 중국의 석유화학 제품 수요 부진으로 2분기 연속 적자를 낼 것으로 전망된다. 시멘트 제조사인 쌍용C&E 역시 판매량 감소로 인한 가동률 하락, 원재료 값 상승 여파로 연간 영업이익이 전년 대비 10% 이상 줄어들 것으로 보인다. 이정연 메리츠증권 연구원은 “올해는 이자율 상승에 따른 이자부담이 가중됐기 때문에 과거 대비 취약기업 비중이 늘어날 가능성이 있다”면서 “디스플레이, 호텔·레저서비스, 운송, 소매 유통 업종은 이자보상배율이 낮아지면서 취약기업 비중이 예년 수준을 크게 웃돌 것”이라고 말했다.",https://n.news.naver.com/mnews/article/018/0005323412?sid=101
"[과학게시판] 지질연, 탐사연구선 탐해3호 용골거치식 개최 外",2022-09-23 09:01:01,동아사이언스,"21일 국내 유일 최첨단 물리탐사연구선 탐해3호의 용골거치식이 열렸다. 지질연 제공   ■ 한국지질자원연구원(KIGAM)은 21일 국내 유일 최첨단 물리탐사연구선 탐해3호의 건조 시작을 알리는 용골거치식을 개최했다고 22일 밝혔다. 탐해3호는 6926t(톤)급 내빙등급 적용으로 국내 대륙붕은 물론 극지 및 대양까지 탐사가 가능하다. 6km 길이의 탄성파 수신 스트리머 8조를 탑재했다. 시간에 따른 해저 지층의 변화를 탐지하고 예측하는 4D 모니터링 기술이 적용돼 해저자원 탐사의 효율성을 높였다.  2023년 4월에 바다에 처음 띄워질 예정이며 2024년 건조완료 및 시운전을 거쳐 공식 취항할 계획이다. 본 임무인 해저자원 개발 외에도 국내 해저단층의 조사·분석을 통한 해저지진의 대비, 원전 등 위험시설 입지 결정, 이산화탄소(CO2) 지중저장 모니터링 등 다양한 영역에서 활용된다.   ■ 과학기술정보통신부는 ‘국가마우스표현형분석사업 2회 성과전시회’를 서울 엘타워에서 개최한다고 23일 밝혔다. 과기정통부는 이 사업을 통해 국제마우스표현형컨소시엄(IMPC)’에 가입하고 미국, 유럽연합과 함께 2만 여종의 유전자변형마우스 정보를 공유했다. 또 국내 최초로 국내·외 유전자변형마우스 자원 정보를 원스톱으로 제공하는 마우스 종합 서비스 포탈(MOP)을 구축해 운영하고 있다. 세계 최초로 4세대 유전자 가위(Cpf1)를 이용해 마우스 유전자 편집 기술을 확보하고 신규 마우스 모델 300여종을 제작·제공했다. 신종 코로나바이러스 감염증(COVID-19·코로나19) 백신과 치료제 개발을 지원하기 위해 자체 개발한 마우스 4종의 대량 생산체계를 확립했다.   ■ 한국원자력연구원은 오는 11월 전국 중·고등학생 대상 '제8회 원자력 창의력 대회'를 개최한다고 22일 밝혔다. 이 대회에서는 학생 2∼3명이 팀을 이뤄 원자력 이슈를 해결하는 창의적인 아이디어를 제시하게 된다. 학생들이 문제 해결 과정을 경험하면서 원자력에 대한 이해도를 높이고 창의·융합적 사고력을 함양할 수 있도록 기획됐다. 예선 참가 신청은 10월 26일까지 소속 학교장 추천을 통해 받는데, 예선에서 우수한 성적을 거둔 참가자들은 11월 12일 한국원자력연구원에 모여 본선을 치른다.   ■ 국가과학기술연구회(NST)는 연구개발전략위원회(연전위)를 출범했다고 22일 밝혔다. 연전위는 연구개발전략에 대한 연구자들의 소통과 공감대 형성을 촉진하고 정부출연연구기관의 협력 전략 수립을 지원한다. 연전위는 총괄위원회와 하위 자문분과인 '기술분과', '혁신분과'로 구성된다. 총괄위원회는 과학기술과 관련한 국가·사회 현안이 발생했을 때 대응 방향을 논의하고, 기관별·주제별 R&R(역할과 책임)을 자문하는 등의 업무를 한다. 총괄위원장은 문길주 고려대학교 에너지환경대학원 석좌교수가 맡고 출연연 연구 동향에 이해도가 높은 산학연전문가 11명이 위원이 된다. NST는 전략기획연구조직을 신설해 연전위 활동을 지원할 계획이다.  ■ 울산과학기술원(UNIST)은 인공지능(AI)과 탄소중립 분야 기술 교류를 위해 CJ 센터, GS 건설과 잇달아 업무 협약을 체결했다고 22일 밝혔다. CJ AI센터와는 '산학협력 협약'을 맺었다. 두 기관은 인공지능 분야 경쟁력 강화를 위한 공동 연구 과제 발굴과 추진에 협력하기로 했다. 또 연구 시설과 장비 공동 활용, 연구 인력과 기술·정보 교류 확대, 맞춤형 전문 인재 양성, 협업 공간 활용을 통한 두 기관 협력 사업 운영과 교류 활성화 등도 추진한다. UNIST 탄소중립실증화연구센터는 GS건설과 '탄소중립 실증화 연구와 기술 교류 업무 협력' 협약을 맺었다. 협약에 따라 양측은 탄소 포집과 활용 및 저장 관련 핵심 기술을 공동으로 연구하고, 기술 교류를 추진하게 된다. 특히 원천설계기술 기반의 실증화를 통한 사업화 모델을 확보하고, 향후 수소와 신재생에너지 등 분야에서도 협력을 확대할 계획이다.",https://n.news.naver.com/mnews/article/584/0000020281?sid=105
"조정대상지역 해제 '양정자이더샵SK뷰', 23일 견본주택 오픈",2022-09-23 10:02:01,한국경제,"GS건설·포스코건설·SK에코플랜드 컨소시엄, 2276가구 대단지 공급21일 발표한 조정대상지역 해제 영향으로 부산 부동산시장이 관심을 받고있는 가운데 하반기 최대 분양단지인 ‘양정자이더샵SKVIEW’가 이달 분양을 앞두고 오는 23일 견본주택을 오픈한다.조정대상지역에서 해제되면 취득세는 2주택까지 기본 세율이 적용되고, 양도세 비과세 조건도 2년만 보유하면 비과세가 가능해진다. 또한 주택담보대출 비율도 70%까지 높아져 대출 여력이 증가하고 중도금대출 보증도 세대당 2건으로 늘어난다.양정자이더샵SKVIEW는 GS건설·포스코건설·SK에코플랜트가 컨소시엄으로 공급하는 총 2276가구의 대규모 아파트다. 지하 5층~지상 최고 34층, 3개 단지, 22개 동 규모로 공급한다. 22개 동 모든 주택이 판상형을 적용해 동 사이 간섭을 피하고 조망을 확보하도록 설계되었다. 46㎡ 타입을 제외하고 모든 타입에는 4 bay 시스템을 적용했다. 건폐율도 평균 17.71%로 낮은 편이다.주택형은 △39㎡(115가구) △46㎡(31가구) △59㎡(415가구) △72㎡A(392가구) △72㎡B(274가구) △72㎡C(102가구) △84㎡A(663가구) △84㎡B(118가구) △84㎡C(46가구) △100㎡(120가구)의 총 10개 타입으로 구성되었다. 총 2276가구 중 1162가구가 일반 분양한다. 일반분양 주택형은 △46㎡(20가구) △59㎡(218가구) △72㎡A(297가구) △72㎡B(260가구) △72㎡C(97가구) △84㎡A(166가구) △84㎡B(87가구) △84㎡C(17가구)로 구성된다.중부산 중심에 위치한 양정은 교통 환경이 좋은 편이다. 도시철도 1호선 양정역을 걸어서 이용할 수 있고, 3호선 물만곡역도 가까운 거리에 있다. 부산시청 등 행정기관이 밀집해있다.대형마트인 이마트 연제점과 부산 최대 다이소 매장을 걸어서 이용할 수 있으며, 롯데백화점, NC백화점과 이마트트레이더스서면점, 홈플러스아시아드점, 홈플러스연산점, 코스트코 등은 차량으로 가깝게 이용할 수 있다.양동초와 양정초가 근거리에 있고 양동여중, 동의중, 양정고, 부산진여고, 부산여대, 동의대 양정캠퍼스 등도 가깝다.GS건설 분양관계자는 “부산에서도 각종 행정기관이 밀집되고 9000여세대 신흥주거타운 중심지역에 공급하는 대단지 브랜드아파트라서 관심이 높다”고 말했다.양정자이더샵SKVIEW 견본주택은 부산광역시 연제구 거제천로 인근에 마련될 예정이며, 입주는 2025년 3월 예정이다.한경닷컴 뉴스룸 open@hankyung.com",https://n.news.naver.com/mnews/article/015/0004753370?sid=101
“청약 숨통”...규제풀리는 지역에 분양 앞둔 건설사들 기대 ↑,2022-09-23 11:14:04,헤럴드경제,"충청·대구·부산 등 해제 지역연내 10만3292가구 분양 채비건설사들 청약 수요 확대 기대감불확실성 여전 분위기 전환 ‘글쎄’부산 해운대구 일대 아파트와 고층빌딩 모습. [연합]정부가 지방 광역시도와 수도권 일부지역의 조정대상지역을 해제하기로 하면서 이들 지역에서 분양을 앞둔 건설사를 중심으로 분양여건 개선에 대한 기대감이 나오고 있다. 연내 기준금리 추가 인상이 예고돼 있어 시장 침체 분위기가 급변하긴 어렵겠지만 전매제한, 재당첨제한은 물론 가계대출에 대한 규제가 풀리면 수요자의 청약시장 진입이 활발해지는 등 규제지역으로 지정돼 있을 때보다는 상황이 나아지지 않겠느냐는 게 건설업계의 공통된 의견이다.23일 부동산R114에 따르면 오는 26일부터 조정대상지역에서 해제되는 지역에서 연말까지 총가구수 기준 10만3292가구가 분양될 예정이다. 공급 예정 물량은 경기 안성·양주·파주·평택 등 수도권이 1만3651가구이며 나머지 8만9641가구는 지방에서 나온다. 시도별로 보면 대구가 2만285가구로 가장 많으며 ▷부산 1만9491가구 ▷광주 1만2459가구 ▷대전 1만629가구 ▷충남 8597가구 ▷충북 7176가구 ▷울산 4330가구 등이다.주요 건설사별로는 다음달 대우건설이 양주시에서 ‘양주 푸르지오 디에디션’을, 한화건설이 평택시에서 ‘포레나 평택 화양’을 각각 분양하며 현대건설이 오는 12월 파주시에서 ‘힐스테이트 더 운정(아파트)’을 선보인다. HDC현대산업개발은 10월 충남 논산시에서 ‘논산 아이파크’를 분양할 계획이다. GS건설은 부산에서 포스코건설·SK에코플랜트와 함께 ‘양정자이더샵SK뷰’를 공급한다. DL이앤씨는 울산에서 ‘e편한세상 번영로 리더스포레’, ‘e편한세상 신정 스카이하임’ 등 2개 단지를 분양할 예정이다.업계에선 조정대상지역 해제에 따른 청약 수요 확대 효과를 기대하는 분위기다. 일단 비규제지역으로 전환되면 다주택 세대주의 1순위 청약이 가능해지고 재당첨 제한이 사라진다. 청약통장 가입 6개월 또는 12개월 이상, 만 19세 이상이면 누구나 청약할 수 있게 된다. 특히 추첨제 비율이 전용면적 85㎡ 이하 60~100%, 전용 85㎡ 초과 100%로 바뀌어 가점이 낮은 수요자도 당첨 기회가 생긴다. 분양권 전매제한 기간도 계약 직후 또는 6개월 이내로 줄어 투자수요가 유입될 가능성이 있다.LTV(주택담보인정비율) 상향을 포함한 가계대출 규제 완화의 경우 중도금 대출과 무관해 직접적인 영향을 미치진 않지만 다주택자의 자금 운용 폭을 넓히는 등 시장 분위기 전환의 불씨가 될 수 있다는 의견이 나온다.한 건설사 관계자는 “실수요자들이 금리 상승에 따른 이자 부담을 느끼겠으나 LTV 여건 개선 등으로 자금 조달 여력이 상승하며 투자수요가 일부 회복될 것으로 기대된다”고 말했다. 또 다른 건설사 관계자는 “규제가 상당히 넓은 범위에서 해제됐기에 분양 여건이 개선될 것으로 보인다”고 전했다.다만 청약수요가 얼마나 뒷받침될지는 미지수다. 금리 상승에 대한 부담감, 불확실한 경제 상황, 주택가격 하락세 전환 등이 맞물려 있어 시장 불확실성이 해소됐다고 보기 어려워서다. 주택산업연구원 조사에 따르면 9월 아파트분양전망지수는 43.7로 분양시장 전망은 전국적으로 극히 부정적이다.게다가 수도권 해제예정지 가운데 파주, 평택, 동두천 등은 성장관리권역으로 전매제한이 유효하고 양주 내 신도시 지역의 경우 분양가 상한제가 적용돼 조정대상지역 해제 효과가 나타나기 역부족이라는 분석이다. 여기에 대구 등 지방 광역시의 경우 최근 공급이 쏟아지며 미분양이 쌓이고 있어 분위기가 반전되기 어렵다고 봤다.권지혜 주산연 연구원은 “정책보다는 금리 등 시장 환경에 따른 영향력이 큰 상황”며 “규제지역 해제로 전망이 소폭 상승할 수 있겠지만 엄청난 회복을 기대하기 힘들 것”이라고 내다봤다. 임병철 부동산R114 리서치팀장도 “이번 규제 개선이 수요 측면에서 긍정적이긴 하지만 시장 전반이 위축돼 있는 상황에서 분양만 따로 호황이 될 수는 없다”고 전망했다.김은희 기자",https://n.news.naver.com/mnews/article/016/0002044321?sid=101
대구 두류역 초역세권에 초고층 ‘마천루’ 아파트,2022-09-23 11:14:02,헤럴드경제,"GS건설, 최고 49층 ‘두류역자이’아파트 117가구 이달 일반분양오피스텔·상가 높은 경쟁률 마감GS건설이 대구광역시 서구 내당동 220-1번지 일원에서 ‘두류역자이’(조감도)를 이달 분양할 예정이다. ‘두류역자이’는 아파트, 오피스텔, 상업시설이 결합된 복합단지로 지난해 11월 분양한 ‘두류역자이 오피스텔’은 86실 모집에 5만8000여건의 청약접수를 받아 평균 경쟁률 677.5대 1의 높은 경쟁률로 청약을 마감한 바 있다.직후 이어진 두류역자이의 90호실로 구성된 대규모 상업시설 ‘두류역자이 세븐스 스퀘어’는 최고 82대 1의 경쟁률로 공급을 마쳤다. 이에 남은 분양 물량인 아파트 일반분양 117가구가 이달 공급된다.두류역자이는 대구광역시 서구 내당동 220-1번지 외 120필지에 들어선다. 판매시설 지하 1층을 포함해 최고 지상 49층으로 구성돼 대구광역시의 새로운 마천루이자 랜드마크로 자리매김 할 전망이다. 클럽클라우드(스카이라운지), 골프연습장, 피트니스, 사우나, 게스트하우스, 북라운지 등 대규모 커뮤니티 시설이 예정되어 있으며, 호텔 혹은 고급 오피스텔에서 제공하는 조식서비스도 운영할 예정이다.단지 바로 앞에 대구지하철 2호선이 위치해 도보 1분 내 도달 가능한 ‘초역세권’ 단지인 데다 달구벌대로, 경부고속도로, 중앙고속도로, 지난 3월 개통된 KTX서대구역 등을 통해 시·내외 접근이 용이하다. 또한 두류역에는 4차 순환선도 예정되어 있다.단지 반경 1km 내에는 초·중·고등학교 9개가 산재해 있어 우수한 학군을 형성하고 인근에 대구시립 두류도서관도 위치하고 있다. ‘두류역자이’는 최고 49층 초고층에 남향 위주로 배치되어 막힘 없는 전망과 개방감을 갖추고 있다. 양영경 기자",https://n.news.naver.com/mnews/article/016/0002044319?sid=101
한남2구역 재개발 사업 놓고 롯데건설·대우건설 맞대결,2022-09-23 11:56:18,연합뉴스,"서울 용산구 한남2구역 재정비촉진구역 조감도 [서울시 제공. 재판매 및 DB 금지] (서울=연합뉴스) 홍국기 기자 = 서울 용산구 보광동 한남2구역 재개발 사업을 놓고 롯데건설과 대우건설이 맞대결을 벌인다.    23일 건설업계에 따르면 롯데건설은 지난 19일 한남2구역 시공사 입찰 보증금으로 800억원(현금 400억원·이행보증보험증권 400억원)을 조합에 냈고, 대우건설도 입찰 마감날인 이날 보증금을 납부했다.    한남2구역은 서울 용산구 보광동 일대 11만5천5㎡ 규모의 부지에 지하 6층∼지상 14층, 아파트 30개 동, 총 1천537가구(임대 238가구 포함) 규모의 공동주택과 근린생활시설을 조성하는 사업이다.    3.3㎡당 공사비는 770만원, 총공사비는 약 7천900억원에 달한다.    한남2구역은 2009년 정비구역 지정, 2012년 조합설립인가를 거쳐 지난해 11월 사업시행인가를 취득했다.    조합은 오는 11월 중에 시공사 선정 총회를 마무리한다는 계획이다. 준공·입주는 2027년 말에서 2028년 초로 예상된다.    한남재개발 5개 구역 가운데 3구역에 이어 두 번째로 사업 속도가 빠른 것으로, 일반분양 비율이 45%에 달해 사업성이 좋은 것으로 평가된다.    조합 측은 입찰 조건으로 단독 입찰을 내걸었다.    업계 관계자는 ""지난달 현장 설명회에 삼성물산, 현대건설, GS건설, 포스코건설 등도 참여했으나 오래전부터 수주를 준비해온 롯데건설과 대우건설이 대결하는 2파전""이라고 전했다.    redflag@yna.co.kr",https://n.news.naver.com/mnews/article/001/0013458370?sid=101
