title,date,media,content,url
"GS ""외부 파트너와 함께 신사업 창출…미래성장 전략의 핵심""",2022-09-07 13:09:01,SBS Biz,"[허태수 GS 회장(GS 제공)]GS는 오늘(7일) 허태수 회장을 비롯해 주요 계열사 신사업 부문을 맡고 있는 임원진 50여명이 모여 사업 환경 변화와 GS의 미래성장을 주제로 하는 'GS 신사업 전략 보고회'를 개최했습니다.이 자리에서 허태수 회장은 ""GS 가 추구하는 미래성장 전략의 핵심은 협력사, PE, VC, 스타트업 등 다양한 역량을 가진 외부 파트너와 함께 신사업을 창출해 나가는 것""이라고 강조했습니다.이번 보고회에서는 GS가 신사업 분야로 꼽아 온 바이오, 순환경제, 에너지전환 등 분야를 중심으로 그동안 투자한 회사의 기술과 비즈니스 모델, GS와의 협업 기회 등을 공유했습니다.우선, '에너지 전환기 선제 대응'이라는 전략 방향 하에 GS칼텍스가 수소, 바이오연료, 플라스틱 리사이클, 전기차 충전 등의 추진 현황을 소개했고, GS에너지는 블루암모니아 개발유통, 배터리 리사이클, SMR 소형원자로, 전기차 충전 등의 사업화 전략을 발표했습니다.또한, GS리테일은 온라인과 오프라인을 연계하여 새로운 쇼핑 경험을 제공하는 퀵커머스, HMR 간편식, 반려동물 시장을 주도하고 있는 펫 사업 등의 추진 성과를 공유했으며, GS글로벌은 해외 네트워크 역량을 통해 친환경 연료 수급 등 그룹사 전반의 신사업 추진을 적극 지원하기로 했습니다.GS건설은 기존 주택과 플랜트 건설 역량에 친환경 신기술을 접목하여 프리패브 등 친환경 건축과 수처리, 스마트 양식업, 데이터센터 건설, 배터리 재활용 등으로의 사업확장 전략을 밝혔습니다.GS벤처스, 한달 만에 5개 스타트업 투자GS 지주사 산하의 기업형벤처캐피탈인 GS벤처스와 GS퓨처스는 국내와 북미 지역의 신기술 벤처 동향과 최근 투자 활동을 브리핑했습니다. 특히, GS벤처스는 올해 초 법인 설립 이후 신기술사업금융업 등록, 1호 펀드 조성에 이어 한달 여만에 모두 5개에 이르는 스타트업에 투자를 실행한 사실을 처음 공개했습니다.GS벤처스가 첫 투자로 낙점한 스타트업은 친환경 대체가죽을 개발하는 '마이셀', 탄소나노튜브 기술을 가진 '어썸레이' 등 입니다.GS벤처스는 앞으로 바이오, 기후변화대응, 자원순환, 퓨처커머스, 딥테크, 스마트건축 등의 투자영역에서 초기 단계의 우수한 스타트업을 발굴한다는 방침입니다.각 계열사들이 신사업 개발을 목적으로 실행한 M&A, 사업제휴, 벤처투자 현황을 통해 GS그룹이 추구하고 있는 신사업 생태계의 큰 그림도 발표됐습니다.최근 GS 가 컨소시엄을 이뤄 M&A에 성공한 바이오 헬스케어 기업 휴젤과 배달 플랫폼 요기요 사례를 통해 향후에도 GS의 신성장 동력 확보를 위해 필요한 경우 적극적인 M&A를 추진하겠다는 방침입니다.또한, 서로 다른 핵심역량을 가진 기업과 손 잡고 신사업을 공동 창출하는 사업 제휴도 신사업 생태계를 확장하는 중요한 방안으로 꼽혔습니다. 대표적으로 GS칼텍스는 포스코인터내셔널과 함께 바이오연료 사업을 확장하고, LG화학과 함께 3-HP 양산기술을 공동개발하고 있습니다.		",https://n.news.naver.com/mnews/article/374/0000301888?sid=101
용화체육공원 품은 '아산자이 그랜드파크' 공급,2022-09-07 13:31:01,조세일보,"			아산시 용화동 일원에 문화, 자연, 여가를 한 공간에서 즐길 수 있는 용화체육공원이 지난 4월 착공식을 갖고 추진 중이다. 용화체육공원 조성사업은 민간공원 특례사업으로 공원 부지 중 약 30%를 민간 사업자가 아파트, 상가 등으로 개발해 수익을 남기는 대신 나머지 약 70%는 공원으로 조성해 기부 채납하는 방식이다.   용화체육공원은 전체 부지인 약 23만㎡ 중 70% 수준인 16만㎡ 부지에 조성된다. 공원 조성에 들어가는 비용은 약 400억원으로 다목적잔디마당과 실내체육관, 어린이체험놀이터 등 체육활동 공간과 숲속 힐링원, 피톤치드길 등 기존 지형을 이용한 다양한 여가시설이 들어설 예정이다.   오세현 아산시장은 착공식에서 ""나무만 있는 공원이 아니라, 자연을 품은 그린 스포츠 파크라고 명명했다""며 ""넓은 녹지공간은 기본이며 복합 시설까지 다양하게 조성해 지역민이 모여드는 공원이자 아산을 대표하는 휴식 공간으로 만들겠다""고 밝혔다.    ◆…아산자이 그랜드파크 투시도. 사진=GS건설비 공원시설 부지인 약 6만 8000㎡에 대해선 GS건설이 용화체육공원을 품은 단지인 '아산자이 그랜드파크'를 이달 분양한다고 밝혔다.   KB부동산 시세 자료에 따르면 경기도 의정부시 의정부동에서 국내 첫 민간공원 특례사업으로 조성된 '의정부 롯데캐슬 골드파크' 단지의 3.3㎡당 시세는 2164만원으로 의정부시 평균(1370만원)보다 58% 높게 나타났다. 전용 60㎡ 초과~85㎡ 이하 면적이 존재하는 의정부시의 모든 단지 중 시세 상위 3위에 이름을 올렸다. 지난 9월 수원 첫 민간공원 특례사업으로 공급된 '영흥공원 푸르지오 파크비엔' 역시 1순위 청약에서 평균 15.19대 1의 경쟁률을 기록한 바 있다.   이번 단지는 지하철 1호선 온양온천역, KTX천안아산역 등이 가깝고 향후 당진~천안고속도로의 1단계 구간인 아산~천안고속도로(예정), 서부내륙고속도로(예정), 서해선복선전철(예정) 등을 통한 교통여건 개선이 기대된다.   가까운 교육시설로 용화초, 온양중, 용화고, 아산시 중앙도서관 등이 있으며 주변 생활인프라는 이마트, 롯데마트, 아산시청, 대전지방법원 천안지원 아산시법원, 아산시보건소, 아산충무병원 등이 구성한다.   주변으로 현대모터스밸리, 인주산단, 스마트밸리, 테크노밸리 등의 산업단지가 위치하고 아산삼성디스플레이시티도 조성 중으로 직주근접 입지를 갖출 전망이다.   아산자이 그랜드파크는 충남 아산시 용화동 일원에 2개 단지로 구성된다. 1단지는 지하 3층~지상 35층, 5개동, 전용 74~149㎡, 739가구 규모이며 2단지는 지하 4층~지상 37층, 6개동, 전용 84~149㎡, 849가구로 조성된다. 1·2단지가 구분돼 동시청약이 가능하며 동시청약 인증 고객을 대상으로 벤츠 E-Class 250 등의 경품을 추첨으로 증정하는 이벤트도 진행한다.   견본주택은 아산시 일원에 마련된다. 견본주택 개관 전 사전예약제로 분양 홍보관이 운영 중이며 홈페이지를 통한 사전 예약 이벤트도 진행 중이다.		",https://n.news.naver.com/mnews/article/123/0002285294?sid=101
"GS그룹 첫 신사업 보고회…허태수 회장 ""불황은 기회""",2022-09-07 14:14:01,비즈워치,"신사업만 다룬 보고회, 창립 이후 처음SMR부터 스타트업 투자까지 '협업 강조'GS그룹이 창립 후 처음으로 신사업을 주제로 한 보고회를 개최했다. 이번 보고회는 급변하는 사업 환경 변화와 미래 성장 방안을 논의하기 위해 마련됐다.GS그룹은 경기 둔화 우려 속에서도 오히려 투자에 속도를 내겠다는 계획을 내놨다. 이를 위해 M&A(인수합병), 벤처 투자, 사업 제휴 등을 적극 추진키로 했다.GS가 찜한 미래 사업은?허태수 GS그룹 회장. /그래픽=비즈니스 워치GS그룹은 7일 경기도 포천 GS리테일 워크샵센터에서 'GS신사업 전략보고회'를 개최했다고 밝혔다. 이날 보고회엔 허태수 GS 회장을 비롯한 주요 계열사 신사업 담당 임원 50여명이 참석했다. GS그룹이 신사업만을 주제로 보고회를 개최한 건 이번이 처음이다. 그동안 GS그룹은 상반기 사업 전략, 하반기 사업 실적을 주제로 한 보고회만 개최해왔다.이날 보고회는 주요 계열사별 신사업 전략과 추진현황, 인수·합병(M&A)과 사업제휴 및 벤처투자 현황을 공유하는 순서로 진행됐다.GS그룹의 주력 계열사인 GS칼텍스는 수소, 바이오연료, 플라스틱 리사이클, 전기차 충전 등의 추진 현황을 소개했다. 특히 바이오연료 사업 확장을 위해 포스코인터내셔널과 LG화학과 손을 잡았다. GS에너지는 소형모듈원자로(SMR), 블루암모니아 개발 유통, 배터리 리사이클, 전기차 충전 등의 사업화 전략을 공개하며 전력 생산부터 판매까지 아우르는 종합전력회사로 발돋움하겠다고 밝혔다.최근 화두가 되고 있는 SMR 사업 확장을 위해 미국의 뉴스케일파워와 협력하기로 했다. 뉴스케일파워는 세계 SMR 1위 기업이다. 블루암모니아 개발 도입을 위해선 중동 최대 석유기업인 아드녹(ADNOC)과 손을 잡았다.GS리테일은 온라인과 오프라인을 연계해 새로운 쇼핑 경험을 제공하는 퀵커머스, 가정간편식(HMR), 펫 사업 등의 추진성과를 공유했다. GS글로벌은 해외 네트워크 역량을 통해 친환경 연료수급 등 그룹사 전반의 신사업 추진을 적극 지원하기로 했다.GS건설은 기존 주택과 플랜트 건설 역량에 친환경 신기술을 접목해 친환경 건축, 스마트 양식업, 배터리 재활용 등으로의 사업 확장 전략을 공개했다.GS그룹 관계자는 ""이번 보고회는 계열사의 신사업 추진 현황을 점검하고, M&A(인수합병)와 사업제휴 및 벤처투자 등의 과정에서 날로 확장하고 있는 신사업 생태계의 전체 모습을 조망하였다는 의미가 크다""고 평가했다. GS벤처스, 5개 스타트업에 투자 중GS그룹은 이번 보고회를 통해 벤처 스타트업의 투자 현황도 함께 공개했다. GS그룹은 대기업 지주회사로는 처음으로 기업형 벤처케피탈(CVC)를 지난 5월 설립했다. CVC는 유망한 벤처기업을 발굴해 신사업에 진출하거나, 기존 사업의 가치를 높이기 위해 설립한 기업형 벤처캐피탈을 말한다. GS벤처스가 투자하고 있는 스타트업은 친환경 대체가죽을 개발하는 마이셀, 탄소나노튜브 기술을 가진 어썸레이 등 5개다. 이 기업들은 스타트업으로 회사 규모가 크지 않지만 높은 성장 잠재력을 가진 만큼 적극적으로 투자에 나서겠단 목표다. GS벤처스는 향후에도 바이오, 기후변화대응, 자원순환, 퓨처커머스, 딥테크, 스마트건축 등의 투자영역에서 초기 단계의 우수한 스타트업을 발굴하겠단 계획이다.허태수 회장은 ""GS가 추구하는 미래성장 전략의 핵심은 협력사, PE, VC, 스타트업 등 다양한 역량을 가진 외부 파트너와 함께 신사업을 창출해 나가는 것""이라며 ""최근 불황과 경기 위축 시기가 GS에게 더 좋은 투자 환경을 제공하고 있으므로 적극적인 투자와 사업 협력, 개방형 혁신으로 신사업 생태계를 확장해 나가자""고 강조했다.",https://n.news.naver.com/mnews/article/648/0000010293?sid=101
"서대구 하·폐수처리장 통합 지하화, GS컨소시엄이 추진",2022-09-07 14:31:06,파이낸셜뉴스,"염색산단 이전과 병행 추진, 서대구 역세권 개발 시너지 기대 대구시가 서대구 하·폐수처리장 통합 지하화 민간투자사업의 협상 대상자로 GS컨소시엄을 선정, 사업을 본격 추진한다. 사진은 조감도. 사진=대구시 제공 【파이낸셜뉴스 대구=김장욱 기자】 대구시가 '서대구 하·폐수처리장 통합 지하화 민간투자사업'(이하 통합 지하화사업)의 협상 대상자로 GS컨소시엄을 선정, 사업을 본격 추진한다.   특히 염색산업단지 이전과 병행 추진으로 서대구 역세권 개발 시너지 효과가 기대된다.   통합 지하화사업은 서대구역 인근 4개의 하·폐수처리시설(북부하수처리장, 달서천하수처리장 염색 1·2 폐수처리장)을 통합해 지하화하고, 상부를 공원화하는 서대구 역세권 개발의 핵심적인 사업이다.   그동안 시는 민자사업 시행자 선정을 위한 행정절차를 추진해왔다.   이에 따라 시는 GS컨소시엄과 기술, 재무 분야에 대한 전문적인 협상을 본격적으로 시작한다. 내년까지 협상을 마무리하고 실시협약 체결, 사업시행자 지정, 실시 계획 승인 등 착공을 위한 행정절차를 마무리해 오는 2028년까지 준공 및 운영 개시를 목표로 차질 없이 사업을 추진할 예정이다.   또 통합 지하화사업이 민선 8기 공약인 염색산업단지 이전과 병행해 추진됨에 따라 서대구 역세권 개발여건을 한층 획기적으로 개선할 수 있을 것으로 기대된다.   그동안 서대구역 일원에 염색산업단지가 위치해 성공적인 역세권 개발의 한계점으로 지적돼 왔다. 하지만 민선 8기 염색산업단지 이전 추진이 확정됨에 따라 장기적이고 전체적인 개발여건의 개선과 민간투자를 더욱 촉진할 수 있는 계기가 될 것으로 전망된다.   민간의 운영 기간 중 염색산단 이전 시 감소되는 염색 폐수 처리량에 대해 운영 기간 연장, 하수처리 분구 조정을 통한 하수처리량 확보 등 방안을 검토해 시 재정비용 부담 없이 민간투자자의 손실을 해소하는 등 염색산업단지 이전의 영향에 문제없도록 대응할 계획이다.   홍준표 시장은 ""통합 지하화사업 협상자 선정을 시작으로 서대구 역세권 개발이 본격적으로 추진될 것이다""면서 ""서대구 역세권 개발 사업들을 차질 없이 추진해 서대구 지역을 대구 미래 50년의 새로운 성장거점으로 조성하는데 최선을 다하겠다""라고 강조했다.   한편 GS컨소시엄은 미래에셋자산운용을 비롯해 GS건설, 현대엔지니어링, 화성산업, 서한, 코오롱글로벌, 신흥건설, 태왕이앤씨, 테크로스워터앤에너지, 유성건설, 신광종합건설, 신행, 삼보건설, 해냄건설, 성원건설로 구성돼 있다.		",https://n.news.naver.com/mnews/article/014/0004895483?sid=102
"허태수 GS 회장 ""불황·경기 위축이 기회…신사업 확장하자""",2022-09-07 14:53:38,뉴시스,"기사내용 요약GS그룹, '신사업 전략 보고회'에서 미래성장 전략 공유[서울=뉴시스] GS그룹 허태수 회장. (사진=GS그룹 제공) *재판매 및 DB 금지[서울=뉴시스] 최희정 기자 = 허태수 GS그룹 회장이 7일 ""최근 불황과 경기 위축 시기가 GS에게 더 좋은 투자 환경을 제공하고 있다""며 ""적극적인 투자와 사업 협력, 개방형 혁신으로 신사업 생태계를 확장해 나가자""고 밝혔다. GS에 따르면, 허 회장은 이날 경기도 포천시 GS리테일 워크샵센터에서 'GS 신사업 전략 보고회'를 열고 ""GS가 추구하는 미래성장 전략의 핵심은 협력사, PE(사모펀드 운용사), VC(벤처캐피털), 스타트업 등 다양한 역량을 가진 외부 파트너와 함께 신사업을 창출해 가는 것""이라며 이같이 강조했다. GS는 그동안 상반기에 사업 전략과 하반기에 사업 실적을 주제로 보고회를 열어왔지만, 신사업을 주제로 보고회를 개최하는 것은 이번이 처음이다. 이 보고회에서는 GS가 신사업 분야로 꼽아 온 바이오, 순환경제, 에너지전환 등 분야를 중심으로 그동안 투자한 회사의 기술과 비즈니스 모델, GS와의 협업 기회를 공유했다. 이는 GS와 투자 기업 간 협업을 통해 투자 기업의 가치와 GS의 신사업 역량을 함께 키워야 한다는 허 회장의 지론에 따른 것이다. 먼저 GS칼텍스가 '에너지 전환기 선제 대응' 측면에서 수소, 바이오연료, 플라스틱 리사이클, 전기차 충전 등의 추진 현황을 소개했다. GS에너지는 블루암모니아 개발유통, 배터리 리사이클, SMR 소형원자로, 전기차 충전 등의 사업화 전략과 함께 전력 생산부터 판매까지 아우르는 종합전력회사로 발돋움한다는 구상이다.GS리테일은 온라인과 오프라인을 연계한 퀵커머스, HMR 간편식, 펫 사업 등의 추진 성과를 공유했다. GS글로벌은 해외 네트워크 역량을 통해 친환경 연료 수급 등 그룹사 전반의 신사업 추진 전략을 소개했다. GS건설은 기존 주택과 플랜트 건설 역량에 친환경 신기술을 접목해 프리패브(Prefab) 등 친환경 건축과 수처리, 스마트 양식업, 데이터센터 건설, 배터리 재활용 등으로의 사업 확장 전략을 밝혔다. 이와 함께 M&A와 사업제휴, 벤처투자 현황을 통해 GS그룹이 추구하는 신사업 생태계의 큰 그림도 조망했다.최근 GS가 컨소시엄을 이뤄 M&A에 성공한 바이오 헬스케어 기업 휴젤과 배달 플랫폼 요기요 사례를 통해 향후에도 GS의 신성장 동력 확보를 위해 필요한 경우 적극적인 M&A를 추진하겠다는 방침을 공유했다.사업 제휴도 신사업 생태계를 확장하는 중요한 방안으로 꼽혔다. GS칼텍스가 포스코인터내셔널과 함께 바이오연료 사업을 확장하고, LG화학과 함께 3-HP 양산기술을 공동개발하고 있다. GS에너지는 수소경제 시대의 석유로 불리는 블루암모니아 개발 도입을 위해 중동 최대 석유기업(ADNOC)과 협력한데 이어 배터리 리사이클 사업을 위해 포스코와 손 잡았다.",https://n.news.naver.com/mnews/article/003/0011409356?sid=101
연말까지 아파트 '공급 가뭄'… 쪼그라든 물량 속 주목 단지는,2022-09-07 14:58:03,더팩트,"추석 이후 연말까지 아파트 4만9348가구 분양 예정, 전년 대비 30% 수준추석 이후부터 연말까지 전국 분양 물량이 지난해의 3분의 1 수준에 그칠 것으로 전망된다. /더팩트 DB추석 이후부터 연말까지 전국 분양 물량이 지난해의 3분의 1 수준으로 쪼그라들 전망이다. 다만 하반기 들어 신규 주택 공급 끊겼던 서울 강남3구 지역에선 신축 아파트 단지가 청약 통장을 받을 예정이다.7일 부동산R114의 조사 결과에 따르면 추석 이후부터 오는 12월까지 전국에 분양 예정인 아파트는 4만9348가구로 집계됐다. 이는 지난해 같은 기간 분양 물량 16만1008가구의 30% 수준에 불과하다. 분양 예정 물량에는 민간분양, 공공분양, 민간임대, 공공임대가 모두 포함됐다.전체 물량의 절반 이상인 2만9372가구가 수도권에 공급된다. 수도권 물량 역시 지난해 8만2132가구의 절반도 미치지 못하는 규모다.서울에 분양 예정된 물량은 6831가구, 6개 단지다. 이는 올해 서울에 공급된 아파트 5944가구를 상회하는 물량다. 그러나 최근 분양시장 침체기가 이어지고 있어 실제 공급으로 이어질지는 미지수다.강남구 대치구마을3지구 재건축 아파트인 '대치 디에이치 에델루이'는 오는 12월 분양 예정이다. 현대건설 프리미엄 브랜드인 디에이치가 붙는 이 단지는 지하 3층~지상 16층, 282가구 규모로 이 중 79가구가 일반분양 물량이다. 단지는 지난 5월 분양될 것으로 예상됐지만 정부의 분양가 상한제 조정 등 정책 변화가 예고되며 일정이 연기됐다.내달에는 송파구 문정동 힐스테이트e편한세상문정, 마포구 아현동 마포더클래시(1419 가구), 동대문구 휘경동 휘경3구역주택재개발 등 서울 주요 주거지에 1000가구 이상 대단지 물량이 풀릴 것으로 보인다.GS건설은 서울 동대문구 휘경3구역 재개발 사업을 통해 1806가구(전용 39~84㎡)를 분양한다. 문정동 136 일대 주택 재건축으로 공급되는 힐스테이트e편한세상문정은 1265가구 중 296가구가 일반분양될 전망이다. 시공사는 현대엔지니어링과 DL이앤씨다.특히 광명시에 3000가구를 넘나드는 대단지 3곳이 분양을 진행할 전망이다. 연내 분양 예정 단지 가운데 가장 큰 경기 광명시 광명동 광명1R구역 주택개발 아파트가 내달 분양을 앞두고 있다. 단지는 3585가구에 달한다. 광명5R구역주택재개발 지역에는 오는 11월 2878가구가 공급될 예정이다. 이어 12월에는 3344가구에 달하는 광명동 베르몬트로광명의 분양 일정이 잡혀있다.발로 뛰는 더팩트는 24시간 여러분의 제보를 기다립니다.▶카카오톡: '더팩트제보' 검색▶이메일: jebo@tf.co.kr▶뉴스 홈페이지: http://talk.tf.co.kr/bbs/report/write",https://n.news.naver.com/mnews/article/629/0000171407?sid=101
서대구 하·폐수처리장 통합지하화사업’에 GS컨소시엄,2022-09-07 14:58:02,한국경제,"서대구 역세권 개발 핵심선도사업으로 대구의 관문 환경개선 기대대구의 4개 하폐수처리장이 통합되는 북부하수처리장 상부 조감도. 대구시 제공대구시는 대구의 관문인 북대구와 서대구 지역에 위치해 도시 미관은 물론 발전의 걸림돌로 작용해왔던 대구 하·폐수처리장의 통합지하화(이하 통합지하화사업) 민간투자사업 협상 대상자로 GS컨소시엄이 선정됐다고 7일 발표했다. 컨소시엄은 GS건설(시공비율 39.5%)을 비롯헤현대엔지니어링(12.0%), 화성산업(10.0%), 서한(8.5%), 코오롱글로벌(5.0%) 등 14개 기업이 참가했다. 사업방식은 민간투자사업(BTO-a)으로 운영기간은 2028년부터 2048년까지다. 총 사업비는 6000억원으로 하폐수처리 최대용량은  하루 통합하수 32만2000t, 간이공공하수 40만t이다. 이 사업은 서대구 역세권 개발여건을 개선하고  노후 하·폐수처리시설을 현대화하기위해 2018년부터 추진해온 사업이다. 통합지하화사업은 서대구역 인근 북부· 달서천하수처리장과 염색1·2 폐수처리장 등 4개의 하·폐수처리시설을 통합해 지하화하고 상부를 공원화하는 서대구 역세권 개발의 핵심 사업이다. 대구시는 2018년 12월 최초로 민간의 제안서를 접수해 민간투자법에 따라 민투사업적격성조사(2020년 3월, PIMAC), 시의회 동의절차(2021년 9월), 지방·중앙 민투심의(2021년12월)를 완료했다. 올해 1월에 제3자 제안공고를 해 제출된 사업제안서에 대해 기술능력 및 가격점수 등을 평가한 결과에 따라 7일 GS컨소시엄을 협상대상자로 최종 선정했다. 대구시는 앞으로 GS컨소시엄과 기술, 재무분야에 대한 전문적인 협상을 본격적으로 시작한다. 내년까지 협상을 마무리하고 실시협약 체결, 사업시행자 지정, 실시계획 승인 등 착공을 위한 행정절차를 마무리해 2028년까지 준공 및 운영개시를 목표로 하고 있다. 통합지하화 사업이 민선8기 공약인 염색산업단지 이전과 병행해 추진됨에 따라 서대구 역세권 개발여건을 한층 획기적으로 개선할 수 있을 것으로 대구시는 내다봤다. 그동안 서대구역 일원에 염색산업단지가 위치해 성공적인 역세권 개발의 한계로 지적돼 왔으나, 민선8기 염색산업단지 이전 추진이 확정됨에 따라 장기적이고 전체적인 개발여건의 개선과 민간투자를 더욱 촉진할 수 있는 계기가 마련됐다.민간의 운영기간 중 염색산단이 이전 할 경우에는 감소되는 염색 폐수처리량에 대해 운영기간 연장, 하수처리 분구 조정을 통한 하수처리량 확보 등을 검토해 시 재정비용 부담 없이 민간투자자의 손실을 해소하는 등 염색산업단지 이전의 영향에 문제없도록 대응할 계획이다.홍준표 대구시장은 “이번 통합지하화사업 협상자 선정을 시작으로 서대구 역세권 개발이 본격적으로 추진될 것”이라며 “서대구 역세권 개발 사업들을 차질없이 추진해 서대구 지역을 대구 미래 50년의 새로운 성장거점으로 조성하는 데 최선을 다하겠다”고 말했다.오경묵 기자",https://n.news.naver.com/mnews/article/015/0004747278?sid=102
