title,date,media,content,url
"차 마시며 교보문고가 고른 도서 읽는다! ‘음성자이 센트럴시티’, 차별화된 작은 도서관 선보여",2022-09-16 09:01:01,서울경제,"단지 내 작은 도서관, 교보문고의 북큐레이션 통해 엄선한 도서들 채워져[서울경제] 서울에 사는 주부 김모(37세)씨는 7살짜리 딸과 함께 지난 여름방학기간 단지 내 작은 도서관에서 북캉스를 즐겼다. 이번 북캉스를 통해 딸이 책 읽는 재미에 푹 빠져 딸만 보면 대견스러움을 느낀다. 단지 내에 도서관이 자리해 시간에 구애 없이 이용할 수 있고, 대형서점을 방불케 하는 다양한 신작 도서와 전자책을 만나볼 수 있어 딸은 물론, 자신까지 TV나 핸드폰보다 책을 더 가까이 하게 됐다. 이처럼 아파트 커뮤니티에 국내 대형서점을 들여온 단지가 등장해 주목을 받고 있다. GS건설이 이달 충북 음성군 금왕읍 일대에 분양 예정인 ‘음성자이 센트럴시티’다. ‘음성자이 센트럴시티’의 작은 도서관은 국내 대형서점을 방불케 한다. 커뮤니티센터인 클럽자이안에 마련되는 작은 도서관은 국내 대형서점인 교보문고와의 협약을 체결, 교보문고의 북큐레이션을 통해 입주민의 취향과 트렌드에 적합한 엄선된 도서들이 채워진다. 교보문고를 상징하는 향기와 조명도 갖춰져 일반 도서관과 차별화된 쾌적한 독서환경도 누릴 수 있다. 마치 대형서점을 연상하게 만드는 다양한 도서와 특유의 독서 분위기, 입주민들의 시간과 비용을 절감해준다는 점에서 어린 자녀와 독서가 취미인 입주민 사이에 큰 인기를 얻을 전망이라는 것이 관계자의 전언이다. 또한, 작은 도서관은 SPC그룹 파리크라상이 운영하는 카페테리아와 오픈스페이스 공간으로 연결돼 있다. 이를 통해 입주민들은 차를 마시면서 여유로운 독서를 즐길 수 있게 됐다. 분양 관계자는 “단순한 구색 맞추기가 아닌 더욱 효과적으로 입주민들이 이용할 수 있도록 다양한 전문 업체들과 협약을 통해 커뮤니티의 퀄리티를 한층 높이는데 신경을 썼다”며 “그간 음성 일원에서 경험하지 못했던 커뮤니티 서비스를 제공해 입주민들의 삶의 질도 더욱 높아질 것으로 기대하고 있다”고 전했다. 한편, 음성자이 센트럴시티는 지하 3층~지상 27층 16개동 전용면적 59~116㎡ 총 1505가구로 음성군 첫 자이(Xi) 브랜드인데다 음성군 최대 규모로 조성된다. 특히 소형부터 대형까지 총 11개의 다양한 주택형으로 구성되고, 단독형 테라스하우스와 펜트하우스 등 희소성 높은 특화 평면들도 조성될 예정이다. 단지 내에는 음성군 최초로 스카이라운지가 조성돼 병막산과 도심 등 탁트인 경관을 바라보며 여유로움을 즐길 수 있으며, 지상에 게스트하우스 3개실도 조성돼 손님을 위한 숙소나 파티장소 등으로 활용 가능하다. 특히 스카이라운지에서는 푸드테크 스타트업 ‘비욘드 허니컴’이 제공하는 인공지능(AI) 다이닝 서비스가 제공될 예정이다. 유명셰프가 만드는 음식을 분자 단위로 분석하여, AI 셰프로봇이 맛의 편차 없이 동일한 맛과 질감까지 완벽하게 재현하는 다양한 음식을 맛볼 수 있다. 커뮤니티센터인 ‘클럽자이안’에는 피트니스, GX룸, 필라테스, 골프연습장(GDR), 남녀사우나, 작은도서관, 독서실, 다목적실, 키즈놀이터, 카페테리아 등의 놀이와 라이프를 동시에 누릴 수 있는 다채로운 입주민 커뮤니티시설들이 들어선다. 커뮤니티통합 서비스인 ‘자이안 비’가 적용돼 고품격 커뮤니티 라이프를 즐길 수 있다. 음성자이 센트럴시티는 비규제 민간택지에서 공급되는 만큼 계약 이후 바로 전매가 가능하다. 여기에 유주택자 및 세대원도 청약 신청이 가능하고, 재당첨제한이나 자금조달 신고 등도 없다. 특히 중도금 무이자 혜택과 발코니 확장 무상 제공, 1차 계약금 1천만원 정액제 등을 통해 수요자들의 부담을 낮췄다.  현재 충북 음성군 맹동면 원중로에서 홍보관을 운영 중이며, 견본주택은 충북 음성군 맹동면 두성리에서 9월 개관할 예정이다.",https://n.news.naver.com/mnews/article/011/0004099468?sid=101
"‘메가시티’ 조성 속도내는 충청권, 연내 2만8000여 가구 공급",2022-09-16 09:06:03,파이낸셜뉴스,"충남 천안·아산에 공급량 약 65% 집중논산에서는 3년 만에 아파트 나와 관심 충청권 신규분양 아파트 지도[파이낸셜뉴스] 연내 충청권에서 2만8000여 가구가 분양 예정이라 관심이 쏠린다. 천안·아산에 분양이 다수 몰려있고, 논산에서는 3년 만에 새 아파트가 선보여 눈길을 끈다. 특히 충청권을 하나의 생활권으로 묶는 ‘충청권 메가시티’ 조성에 속도가 붙었고, 지역별로 기반산업 조성이 활발해 새 아파트의 미래가치도 높다는 평가다.   16일 부동산시장 분석업체 부동산인포에 따르면 연내 충청권에서 총 2만8527가구가 분양을 앞둔 것으로 나타났다. 올해 1~8월까지 분양된 2만2618가구 보다 늘어날 전망이다. 시장 관망세와 원자재값 상승 등으로 미뤄졌던 분양이 연말까지 몰린 것으로 분석된다.   지역별로 ‘천안·아산’에 전체 공급량의 약 65%가 집중된 충남이 1만8300가구로 가장 많고, 충북 5455가구, 세종 1800가구, 대전 2972가구로 나타났다.   수요자들의 선택폭이 넓은 많은 만큼 주요 건설사 시공 단지에 청약이 집중될 가능성이 높다. 입지가 좋고, 차별화된 상품으로 선보이고 있어서다. 실제 부동산 시장우려 속에서도 브랜드 아파트의 선전이 두드러진다. 대전에서는 올 7월 ‘중촌 SK뷰’가 22.1대 1을 기록하며 전 타입 1순위 마감에 성공했고, 제천에서도 5월 공급된 ‘제천자이 더 스카이’가 단기간 100% 계약을 마쳤다.   충청권이 거대한 경제 공동체로 묶이고 있어 지역 가치는 더욱 올라갈 전망이다. 충청권 4개 시도지사는 특별지자체 설립을 위한 합동추진단 구성에 합의하고, 이르면 내년 하반기 특별자치단체인 '충청광역청'(가칭)을 출범하기로 뜻을 모은 상태다.   부동산 전문가는 “가을 분양의 분수령으로 꼽히는 추석 연휴 이후 건설사별로 본격 분양 마케팅에 나설 것”이라며 “금리인상 등 변수가 있어 입지 여건과 분양가, 개발호재 등을 꼼꼼히 비교 분석하여 청약에 나서야 할 것”이라고 말했다.   이에 브랜드 아파트를 중심으로 청약 열기가 뜨거울 전망이다. 우선 대우건설은 11월 충남 내 2개 지역에서 아파트 분양에 나선다. 논산 강경읍에서는 ‘논산 강경 푸르지오 더 퍼스트’ 전용면적 84㎡ 총 375가구를 분양 예정이며, 연무읍에서는 ‘논산 연무 푸르지오 더 퍼스트’ 전용면적 84~103㎡, 총 433가구를 선보일 예정이다. 육군훈련소 인근 연무읍 일원에는 논산 국방국가산업단지(약 85만㎡) 조성이 추진 중이며, 논산에 수소연료전지 발전소와 수소충전소 등 수소 경제 생태계가 조성 예정인 점도 호재다.   삼성디스플레이, 아산스마트밸리 등 기반산업이 탄탄한 충남 천안과 아산에도 눈여겨볼 아파트가 많다. 9월 천안 서북구 두정동에는 롯데건설이 '천안 롯데캐슬 더 두정'을 시장에 낼 예정이다. 전용면적 59~119㎡, 584가구로 조성된다. 더블유건설과 우남건설도 같은 달 서북구 부성지구에서 ‘부성역 우남퍼스트빌’을 전용면적 84㎡ 총 316가구를 분양 예정이다.   아산에서는 GS건설이 아산시 최초 민간공원 특례사업을 통해 ‘아산자이 그랜드파크’ 총 1588가구 대단지 공급을 앞뒀다. GS건설은 충북 음성에서도 '음성자이 센트럴시티' 총 1505가구를 시장에 낸다.   대전에서도 브랜드 대단지 아파트 공급이 이어진다. 포스코건설과 계롱건설 컨소시엄은 대전 서구 용문동에 재건축 단지인 ‘둔산 더샵 엘리프’ 총 2763가구 중 전용면적 48~84㎡ 1935가구를 일반분양할 예정이다. 유성구 학하동에서는 한화건설이 9월 ‘한화 포레나 대전학하’ 분양에 나선다. 총 1754가구 중 일반분양은 872가구다.   세종에서는 6-3생활권 UR3블록에서 258가구를 비롯해 5-1생활권 L9블록에서 408가구, 5-1 생활권 L12블록에서 756가구를 각각 선보일 계획이다.		",https://n.news.naver.com/mnews/article/014/0004899395?sid=101
"GS건설, 美' IDEA 디자인 어워드 2022' 브론즈 등 2개 부문 수상",2022-09-16 09:28:06,파이낸셜뉴스," [파이낸셜뉴스] GS건설은 아파트 브랜드인 자이(Xi)가 세계 최고 권위의 미국 'IDEA 디자인 어워드 2022'에서 브론즈와 파이널리스트를 수상했다고 16일 밝혔다.   GS건설은 미국산업디자이너협회(IDSA)가 주관하는 국제 디자인 어워드인 'IDEA 디자인 어워드 2022'에서 과천자이 티하우스 '스톤클라우드'로 브론즈, '자이스케이프 파고라'로 파이널리스트를 각각 수상했다.   지난 2008년 같은 어워드에서 '자이 픽스월'로 주요상인 실버를 국내 건설사 가운데 최초로 수상한 후 두 번째다.   과천자이의 티하우스인 '스톤클라우드'는 '물위에 떠있는 구름'을 컨셉트로 코로나 팬데믹 이후 아파트 단지 내 공용 공간의 가치를 높이고 단지 내에서 휴식과 여가에 대한 입주자들의 수요를 충족시키기 위한 설계가 적용됐다.   특히 유리 외관을 통해 비치는 풍경을 통해 티하우스 자체가 조경의 일부가 되도록 했고, 단지 내 티하우스에서 유리외피 사이의 데크, 연못 위 징검다리와 산책로가 하나의 동선으로 이어지도록 공간을 구성한 것이 특징이다.   파이널리스트 수상작인 '자이스케이프-파고라'는 아파트 단지 공용 휴식공간인 파고라를 주변환경과 용도에 맞게 유닛과 모듈로 공간 맞춤형으로 확장과 재조합이 가능하도록 한 시스템이다.   GS건설 관계자는 ""iF 디자인 어워드에 이어 이번 IDEA 수상으로 자이가 차별화된 디자인을 바탕으로 국내 최고 아파트 브랜드임을 다시 한번 입증하게 됐다""며 ""앞으로 자이 아파트 단지는 건축물을 넘어 생활공간의 유기적인 연결이라는 차별화된 개념으로 주거 디자인의 새로운 기준을 제시할 것""이라고 말했다.		",https://n.news.naver.com/mnews/article/014/0004899426?sid=101
초·중·고 도보 통학 가능한 ‘아산자이 그랜드파크’ 학부모 집중,2022-09-16 09:43:01,서울경제,"[서울경제] GS건설이 10월 충청남도 아산시 용화동에 ‘아산자이 그랜드파크’를 공급하는 가운데 단지 주변으로 다수의 학교와 도서관 등이 인접해 있어 교육환경이 우수해 3040 학부모 수요자들의 이목을 사로잡는다. 실제 부동산 시장에서 학교가 가까운 학세권 아파트의 인기는 꾸준한 모습이다. 안전한 통학 환경과 주변에 학원, 독서실 등 다양한 교육시설이 형성돼 우수한 면학 분위기가 조성되기 때문이다.이 가운데서도 초·중·고교가 한 곳에 모여 있는 원스톱 학세권 단지는 자녀를 둔 3040세대가 부동산 시장 주요 수요층으로 자리잡게 되면서 더욱 인기다. 한국부동산원 자료에 따르면, 지난해 전국 아파트 매매 거래량 총 66만 9,182건 중 33만 6,119건을 3040세대가 거래한 것으로 나타났다. 전체 거래량 중 절반 가량을 차지하며 부동산 큰 손으로 자리매김하고 있는 셈이다.이에 학부모들이 자녀를 안전하게 등하교 시킬 수 있는 도보 통학 학세권 단지는 분양 시장에서도 강세다. 실제 지난 5월 경기 시흥시에 분양한 'e편한세상 시흥장현 퍼스트베뉴'는 단지 바로 맞은 편에 한여울초교가 위치한 초품아 아파트로, 67가구(특별공급 제외) 모집에 1만2726건이 접수되면서 1순위 평균 189.94대 1의 경쟁률을 기록한 바 있다. 지난 4월 인천 서구에 분양한 '힐스테이트 검단 웰카운티'도 도보로 통학 가능한 초교 부지가 예정되어 있고 중·고교도 인접한 학세권 단지로 1순위 평균 80.12대 1의 경쟁률을 기록한 바 있다.업계 관계자는 “자녀를 키우는 학부모들에게 교육 환경은 그 무엇보다 중요한 요소이기 때문에 학세권 아파트의 인기는 지속될 것”이라며 “12년간 한 곳에서 자녀의 학업을 마칠 수 있는 원스톱 학세권 단지는 희소성이 높은 만큼 프리미엄도 기대할 수 있어 주거선호도는 앞으로도 높아질 전망”이라고 전했다.GS건설이 충남 아산에 공급하는 아산자이 그랜드파크는 아산초, 용화초, 온양중, 용화중, 용화고를 도보로 통학할 수 있는 원스톱 학세권 단지로서 많은 인기가 예상된다. 특히 12년 간 이사 걱정 없이 자녀 학업을 마칠 수 있으며 유해시설 진입도 관련 법으로 차단돼 최적의 교육환경으로 손꼽히고 있다. 또한 학원가 및 아산시 중앙도서관도 인접해 탁월한 교육 여건을 제공한다.특히 단지 내에는 자녀 보육을 위한 어린이집, 작은도서관은 물론 방과 후 돌봄이 필요한 초등학생 아동에게 돌봄 서비스를 제공하는 ‘다함께 돌봄센터’도 조성돼 맞벌이 부부들이 안심하고 아이를 맡길 수 있다.아산자이 그랜드파크는 아이를 키우기 좋은 쾌적한 주거환경도 갖췄다. 아산시 첫 민간공원 특례사업 단지로 조성돼 약 16만㎡ 규모의 용화체육공원이 함께 조성될 예정이며 공원 내에는 운동, 체험, 문화 등 다양한 시설이 마련될 예정이다. 생활인프라도 다양하다. 이마트, 롯데마트, 전통시장 및 롯데시네마가 반경 2km 이내에 있고 최근 사업지 반경 500m 내 대형마트도 착공에 돌입했다. 시청, 법원 등 관공서와 이순신종합운동장, 신정호 국민관광지 등도 인접하여 편리하고 여유로운 생활을 영위할 수 있다. 한편 아산자이 그랜드파크는 충남 아산시 용화동 일원에 총 2개 단지로 구성된다. 1단지는 지하 3층~지상 35층, 5개동, 전용 74~149㎡, 739가구 규모, 2단지는 지하 4층~지상 37층, 6개동, 전용 84~149㎡, 849가구 규모다. GS건설만의 기술과 상품개발 등이 더해진 자이 브랜드 단지로 지어지는 만큼 실생활을 편리하게 해 줄 혁신 설계, 고품격 상품으로 공급될 예정이다. 아산자이 그랜드파크의 견본주택은 충청남도 아산시 일대에 마련된다. 견본주택 오픈 전까지 아산시 모종동에서 사전 예약제로 분양 홍보관을 운영한다. 홈페이지를 통한 사전 예약 후 홍보관 방문 및 상담하는 고객을 위한 이벤트도 진행 중이다.",https://n.news.naver.com/mnews/article/011/0004099504?sid=101
부산 양정1구역 ‘양정자이더샵SKVIEW’ 이달 분양,2022-09-16 11:45:01,헤럴드경제,"GS건설·포스코건설·SK에코플랜트2276 가구 중 1162 가구 일반분양GS건설·포스코건설·SK에코플랜트가 컨소시엄을 구성해 부산 양정동에 2200여가구의 대규모 단지를 공급한다. GS건설은 부산 부산진구 양정동 양정1구역 재개발에서 ‘양정자이더샵SKVIEW’(조감도)를 이달 중 분양한다고 16일 밝혔다.이 단지는 지하 5층~지상 34층, 3개단지, 22개동, 2276가구로 조성된다. 이 가운데 1162가구가 일반분양된다. 전용면적별 일반분양 가구 수는 ▷46㎡ 20가구 ▷59㎡ 218가구 ▷72㎡A 297가구 ▷72㎡B 260가구 ▷72㎡C 97가구 ▷84㎡A 166가구 ▷84㎡B 87가구 ▷84㎡C 17가구 등이다.단지에서는 도시철도 1호선 양정역을 걸어서 이용할 수 있고, 3호선 물만골역도 가깝다. 단지가 들어서는 양정동은 반경 1㎞ 이내에 부산시청 등 행정타운이 밀집해 있고, 부산에서 교육시설 밀집도가 가장 높은 지역으로 꼽힌다. 입주 예정시기는 2025년 3월이다. 양영경 기자",https://n.news.naver.com/mnews/article/016/0002041447?sid=101
[주간분양] 수도권 중심 신규 분양…전국 2771가구 청약,2022-09-16 12:39:01,데일리안,"전국 6곳 분양, 경기에만 5곳 집중모델하우스 오픈 2곳, 당첨자 발표 11곳, 계약 15곳다음주 분양 시장은 수도권을 중심으로 열린다.ⓒ데일리안 김민호 기자[데일리안 = 배수람 기자] 다음주 분양 시장은 수도권을 중심으로 열린다.16일 리얼투데이에 따르면 9월 넷째 주에는 전국 6곳에서 총 2771가구(오피스텔·공공분양·임대 포함, 행복주택 제외)가 청약 접수를 받는다.경기에 대부분의 물량(2358가구)이 몰려있지만 과반수 이상이 오피스텔로 공급된다. 아파트는 '인덕원 자이 SK VIEW'(899가구), '대곡역 두산위브 202동'(23가구, 민간임대) 등 2곳이다.인천에서는 지난해 사전청약을 진행했던 '인천검단 AA21블록'의 본청약을 시작한다.한편 모델하우스는 충남과 전남 등 지방에서만 2곳이 오픈할 예정이다. 당첨자 발표는 11곳, 정당 계약은 15곳이다.20일 GS건설과 SK에코플랜트는 경기 의왕시 내손동 683번지 일원에 짓는 '인덕원 자이 SK VIEW'의 1순위 해당지역 청약 접수를 받는다. 지하 4층~지상 29층, 20개동, 전용 39~165㎡, 총 2633가구 규모다. 이 중 전용 39~112㎡에 해당하는 899가구를 일반에 분양한다.21일 LH 인천지역본부(사업주체)는 인천 서구 불로동 210-1번지 일원에 건립하는 '인천검단 AA21블록' 공공분양주택의 1순위 청약 접수를 받는다. 지하 2층~지상 최고 20층, 13개동, 전용 74~84㎡, 총 1224가구다. 사전청약 811가구 중에서 본청약 신청을 하지 않은 물량은 일반공급으로 전환된다.23일 포스코건설은 전남 광양시 마동 348-4번지 일원에 들어서는 '더샵 광양라크포엠'의 모델하우스를 오픈할 예정이다. 지하 3층~지상 29층, 9개동, 전용 84~159㎡, 총 920가구 규모로 조성된다.같은 날 우남건설은 충남 천안시 서북구 부대동 761번지 일원에 공급하는 '부성역 우남퍼스트빌' 모델하우스를 오픈할 예정이다. 지하 2층~지상 20층, 6개동, 전용 84㎡, 총 316가구 규모로 조성된다.모델하우스는 충남과 전남 등 지방에서만 2곳이 오픈할 예정이다.ⓒ리얼투데이",https://n.news.naver.com/mnews/article/119/0002639654?sid=101
"""미분양만 피하자""…청약시장 뒤덮은 벤츠·샤넬 [김은정의 클릭 부동산]",2022-09-16 15:20:01,한국경제,"서울 여의도 63스퀘어에서 본 용산구 일대 아파트. 사진=연합뉴스청약 시장이 얼어붙으면서 벤츠 차량과 샤넬 가방까지 경품으로 등장하고 있다. 가파른 금리 인상과 맞물려 집 값 하향 조정 전망이 확산하면서 전국적으로 매수 심리가 움츠러들고 있어서다. 지방을 넘어 수도권에서까지 미분양 물량이 빠르게 쌓이면서 위기 의식을 느낀 건설사들이 경쟁적으로 고가 경품을 내걸고 있다.16일 업계에 따르면 GS건설과 SK에코플랜트는 경기도 의왕시 내손동에 들어서는 '인덕원자이SK뷰' 청약자를 대상으로 벤츠 A220 차량을 경품으로 내걸었다. 청약 접수를 한 뒤 응모하면 추첨을 통해 1명에게 벤츠 차량을 제공하는 식이다. 이 단지는 내손다구역 주택 재개발 정비사업을 통해 오는 2025년 입주를 예정하고 있다. 2633가구의 대단지 아파트로 오는 19일 특별공급을 시작해 20일엔 해당지역 1순위 청약을 진행한다.경기 하남시에 KCC건설이 선보인 주거형 오피스텔 '미사 아넬로 스위첸'은 지난달 계약자를 대상으로 추첨을 통해 BMW 미니 쿠퍼 5도어 클래식을 경품으로 주는 행사를 진행했다. 대우건설 역시 올 7월 경기 화성에 복합 오피스인 '동탄푸르지오 시티 웍스'를 분양하면서 견본주택 방문자를 대상으로 벤츠 차량을 경품으로 내세웠다.벤츠 차량 뿐만이 아니다. 대한토지신탁은 경북 칠곡에 '칠곡 왜관 월드메르디앙 웰리지'를 공급하면서 루이비통 가방을 경품으로 홍보했다. 대유산업과 한국건설이 선보인 ‘더로제아델리움 해양공원’은 분양 흥행을 위해 샤넬 핸드백을 경품으로 활용했다. 건설사들이 이처럼 고가 경품을 들고 나선 건 부동산 시장이 급격하게 위축되면서다. 한국은행이 잇따라 기준금리를 올리면서 대출이자 부담이 커진 수요자들은 매수 의지를 거둬들이고 있다. 이 때문에 유례없는 거래 절벽이 이어지고 있다.여기에 최근 2~3년 간 급등한 집 값이 일러도 내년 상반기까진 계속 하향 조정될 것이란 전망이 힘을 얻으면서 내 집 마련 시점을 늦추는 수요자들이 많아졌다. 청약 불패로 여겨지던 서울에서도 미달 사례가 나오자 건설사들이 경쟁적으로 '경품 카드'를 꺼내든 것이다. 이렇게 해서라도 수요자들의 관심을 유도해 미분양을 줄여보려는 건설사들의 고육지책인 셈이다.건설사 관계자는 ""일차원적이지만 경품 행사 규모를 크게 할수록 견본주택의 인기가 높아지는 게 사실""이라며 ""미분양에 따른 직간접적인 경제적 손실을 감안하면 경품 자체는 큰 부담이 되지 않는다""고 말했다.고가 경품만이 아니라 관리비 지원이나 현금 지원을 내 건 건설사들도 나오고 있다. 강북 수유동에서 대원이 시공을 맡은 '칸타빌 수유팰리스'는 올 3월 분양 후에도 미분양 물량이 해소되지 않자 입주자들의 관리비를 대신 내준다는 조건을 제시했다. 분양 희망자 유치를 위해 3.3㎡당 1만원 가량 관리비를 지원을 약속했다. 라인건설은 충남 아산시에 조성하는 오피스텔 ‘천안아산역 이지더원' 계약자에게 현금 100만원이나 LG전자 스타일러를 지급하고 있다.또 다른 관계자는 ""글로벌 금융위기 이후 부동산 경기가 침체된 2010년께 경품 마케팅이 활발했다""며 ""이후 부동산 경기가 살아나자 자취를 감췄는데 다시 나타나는 것을 보니 그만큼 분양 경기가 암울하다는 의미""라고 했다. ",https://n.news.naver.com/mnews/article/015/0004750460?sid=101
