date,Title,Content,tokens
2023-06-25,공사비 파열음 사리 개발 재건축 조합 백기,뉴스 기자 평균 아파트 수준 부동산 거래 플랫 통계 자료 따르 아파트 평균 가격 사진 시내 아파트 뉴스 뉴스 무단 전재 배포 금지 시민 공원 주변 정비 촉진 지구 촉진 구역 도시 환경 정비 사업 조합 조합 임시 총회 건설 계약 안건 통과 공사비 조합 건설 의견 건설 공사비 고수 반면 조합 물러서 조합 건설 계약 건설사 경기 산성 구역 주택 개발 조합 공사비 인사 갈등 건설 플랜트 계약 해지 이후 재입찰 진행 입찰 건설사 조합 공단 공사비 계약 공단 원자재 상승 이유 공사비 요구 전국 개발 재건축 현장 공사비 인상 조합 갈등 커지 계약 강수 조합 곳곳 나오 건설사 통하 카드 정비 업계 따르 산성 구역 조합 기존 공단 공사비 협상 조합원 총회 계약 절차 공식 완료 상태 번복 가능 상황 비교 이상 공사비 요구 공사 대다수 조합 대응 방안 사업 진행 겨자 공사비 인상 요구 분위기 건설사 치솟 공사비 감당 사업 수주 입장 수주 경기 재건축 사업 수주 최근 포기 조합 공사비 눈높이 맞추 어렵 판단 조합 백기 공사비 사례 경기 권선 구역 시공 사업단 플랜트 글로벌 조합 갈등 일반 분양 연기 최근 공사비 협상 마무리 기존 올리 건축 조합 공사비 기존 초반 올리 조합 요구 건설사 관계자 원가 조합 품질 아파트 원하 공사비 올리 반응 사업 진행 설명 대형 건설사 현장 옥석 가리 전망 대형 건설사 관계자 한남 집중 분위기 원자재 가격 모르 현장 피하,뉴스 평균 아파트 수준 부동산 거래 플랫 통계 자료 아파트 평균 가격 시내 아파트 뉴스 뉴스 무단 전재 배포 금지 시민 공원 주변 정비 촉진 지구 촉진 구역 도시 환경 정비 사업 조합 조합 임시 총회 계약 안건 통과 공사비 조합 의견 공사비 고수 반면 조합 물러서 조합 계약 경기 산성 구역 주택 개발 조합 공사비 인사 갈등 플랜트 계약 해지 재입찰 진행 입찰 조합 공단 공사비 계약 공단 원자재 상승 이유 공사비 요구 전국 개발 재건축 현장 공사비 인상 조합 갈등 커지 계약 강수 조합 곳곳 나오 통하 카드 정비 업계 산성 구역 조합 기존 공단 공사비 협상 조합원 총회 계약 절차 공식 완료 상태 번복 가능 상황 비교 이상 공사비 요구 공사 대다수 조합 대응 방안 사업 진행 겨자 공사비 인상 요구 분위기 치솟 공사비 감당 사업 수주 입장 수주 경기 재건축 사업 수주 포기 조합 공사비 눈높이 맞추 어렵 판단 조합 백기 공사비 사례 경기 권선 구역 시공 사업단 플랜트 글로벌 조합 갈등 일반 분양 연기 공사비 협상 마무리 기존 올리 건축 조합 공사비 기존 초반 올리 조합 요구 관계자 원가 조합 품질 아파트 원하 공사비 올리 반응 사업 진행 설명 대형 현장 옥석 가리 전망 대형 관계자 한남 집중 분위기 원자재 가격 모르 현장 피하
2023-06-25,분양 캘린더 세상 탄파 너스 전국 가구 분양,전국 가구 분양 시작 세상 탄파 너스 조감도 사진 경제 부동산 전국 단지 사전 청약 포함 가구 일반 분양 가구 분양 시작 고덕 강일 사전 청약 경기 신동 세상 탄파 너스 검단 모종 청약 진행 견본 주택 대연 디아 이엘 개관 예정 경기 도시 블록 세상 탄파 너스 회차 분양 지하 지상 가구 규모 단지 나누 분양 가구 전용 면적 가구 회차 분양 도시 위치 주변 고교 교육 시설 공원 상가 생활 기반 시설 조성 중심 예정 노선 도시 철도 예정 주변 교통 환경 개선 전망 건설 일원 위치 숭어리 주택 건축 정비 사업 분양 예정 지하 지상 최고 가구 전용 면적 가구 일반 분양 지하철 역세 단지 이용 편리 진출 공공 기관 공원 병원 백화점 대형 마트 편의 시설 생활 환경 우수,전국 가구 분양 시작 세상 탄파 너스 조감도 경제 부동산 전국 단지 사전 청약 포함 가구 일반 분양 가구 분양 시작 고덕 강일 사전 청약 경기 신동 세상 탄파 너스 검단 모종 청약 진행 견본 주택 대연 디아 이엘 개관 예정 경기 도시 블록 세상 탄파 너스 회차 분양 지하 지상 가구 규모 단지 나누 분양 가구 전용 면적 가구 회차 분양 도시 위치 주변 고교 교육 시설 공원 상가 생활 기반 시설 조성 중심 예정 노선 도시 철도 예정 주변 교통 환경 개선 전망 일원 위치 숭어리 주택 건축 정비 사업 분양 예정 지하 지상 최고 가구 전용 면적 가구 일반 분양 지하철 역세 단지 이용 편리 진출 공공 기관 공원 병원 백화점 대형 마트 편의 시설 생활 환경 우수
2023-06-25,비싸 광명,부동산 이번 부동산 이슈 부동산 확인 개포 자이 입주 고요 비싸 광명 초환 실거 개정 개포 누수 장마 어쩌 개포 개포 주공 재건축 커뮤니티 시설 지하 주차장 고임 현상 발생 논란 개포 입주 시작 신생 아파트 개포 커뮤니티 센터 금일 오픈 예정 티하 우스 건설 부실 공사 누수 침수 보수 공사 완료 이후 오픈 잠정 연기 티하 우스 개포 커뮤니티 시설 카페 건설 부실 공사 입장 건설 관계자 지하 주차장 입구 옥상 배수로 침전물 상태 고임 현상 발생 누수 피해 내부 마감재 교체 다시 발생 보완 건설 최근 검단 도시 지하 주차장 지붕 구조물 붕괴 전국 시공 아파트 건설 현장 긴급 안전 점검 진행 국토 부도 건설 사고 조사 위원회 구성 정밀 조사 시작 이번 계기 안전 경각심 사고 되풀이 비싸 광명 경기 분양 아파트 국민 평형 분양 넘기 이목 광명 구역 전용 최고 분양 책정 조합 원회 일반 분양 책정 승인 분양 최종 확정 분양 전용 전용 전용 전용 전용 전용 전용 저층 제외 업계 분양 변동 가능 부동산 규제 완화 당시 광명 분양 가상 지역 해제 분양 광명 가량 가격 당시 광명 전용 분양 광명 분양 당시 분양 논란 인근 신축 아파트 시세 책정 초기 불가 의견 지배 광명 흥행 성공 광명 분양 흥행 여부 관심 쏠리 광명 순위 청약 가구 모집 지원 평균 경쟁 기록 초기 성공 건설 원가 상승 분양 판단 수요자 분석 나오 지역 수요자 초환 실거 개정 거주 의무 재건축 초과 이익 환수 기준 개정안 불발 실거 의무 여야 입장 분위기 거주 의무 폐지안 주택 개정안 국민 의원 국민 의원 대표 발의 이후 차례 국회 국토 교통 위원회 법안 소위 상정 불발 정부 매제 기간 완화 실거 의무 폐지 매제 기간 시행령 개정 최대 수도 최대 수도 최대 주택 개정 필요 실거 의무 완화 공회전 여당 야당 깡통 전세 우려 폐지 입장 고수 시장 수요자 혼란 걱정 매제 완화 입주 아파트 매매 실거 실거 의무 위반 경우 이하 징역 이하 벌금 이날 재건축 초과 이익 환수 법률 일부 개정 법률안 초환 결국 통과 여아 건축 초과 이익 환수 기준 완화 공감대 완화 수준 이견 재건축 초과 이익 환수 제도 재건축 이익 일정 금액 이상 초과 경우 이득 일부 세금 국가 환수 현행법 따르 조합원 평균 초과 이익 부담금 면제 여당 건축 부담금 부과 면제 기준 기존 완화 주장 야당 면제 금액 상승 맞서 상황 입장 차이 합의 모르,부동산 부동산 이슈 부동산 확인 개포 자이 입주 고요 비싸 광명 초환 실거 개정 개포 누수 장마 어쩌 개포 개포 주공 재건축 커뮤니티 시설 지하 주차장 고임 현상 발생 논란 개포 입주 시작 신생 아파트 개포 커뮤니티 센터 금일 오픈 예정 티하 우스 부실 공사 누수 침수 보수 공사 완료 오픈 잠정 연기 티하 우스 개포 커뮤니티 시설 카페 부실 공사 입장 관계자 지하 주차장 입구 옥상 배수로 침전물 상태 고임 현상 발생 누수 피해 내부 마감재 교체 다시 발생 보완 검단 도시 지하 주차장 지붕 구조물 붕괴 전국 시공 아파트 현장 긴급 안전 점검 진행 국토 부도 사고 조사 위원회 구성 정밀 조사 시작 계기 안전 경각심 사고 되풀이 비싸 광명 경기 분양 아파트 국민 평형 분양 넘기 이목 광명 구역 전용 최고 분양 책정 조합 원회 일반 분양 책정 승인 분양 최종 확정 분양 전용 전용 전용 전용 전용 전용 전용 저층 제외 업계 분양 변동 가능 부동산 규제 완화 당시 광명 분양 가상 지역 해제 분양 광명 가량 가격 당시 광명 전용 분양 광명 분양 당시 분양 논란 인근 신축 아파트 시세 책정 초기 불가 의견 지배 광명 흥행 성공 광명 분양 흥행 여부 관심 쏠리 광명 청약 가구 모집 지원 평균 경쟁 기록 초기 성공 원가 상승 분양 판단 수요자 분석 나오 지역 수요자 초환 실거 개정 거주 의무 재건축 초과 이익 환수 기준 개정안 불발 실거 의무 여야 입장 분위기 거주 의무 폐지안 주택 개정안 국민 의원 국민 의원 대표 발의 차례 국회 국토 교통 위원회 법안 소위 상정 불발 정부 매제 기간 완화 실거 의무 폐지 매제 기간 시행령 개정 최대 수도 최대 수도 최대 주택 개정 필요 실거 의무 완화 공회전 여당 야당 깡통 전세 우려 폐지 입장 고수 시장 수요자 혼란 걱정 매제 완화 입주 아파트 매매 실거 실거 의무 위반 이하 징역 이하 벌금 이날 재건축 초과 이익 환수 법률 일부 개정 법률안 초환 결국 통과 여아 건축 초과 이익 환수 기준 완화 공감대 완화 수준 이견 재건축 초과 이익 환수 제도 재건축 이익 일정 금액 이상 초과 이득 일부 세금 국가 환수 현행법 조합원 평균 초과 이익 부담금 면제 여당 건축 부담금 부과 면제 기준 기존 완화 주장 야당 면제 금액 상승 맞서 상황 입장 차이 합의 모르
2023-06-25,기업 기상도 본업 기업 장대비 기업,앵커 상반기 정부 기업 하반기 경기 실적 고민 한창 시점 기업 소식 기업 기상도 살펴보 기자 기자 기업 뉴스 주간 기업 기상도 올해 상반기 마지막 기업 기상도 정부 기업 투자 독려 다음 시작 하반기 정책 무게 추가 물가 경기 부양 이동 예상 기업 기업 기상도 시작 기업 전자 상거래 악도 시장 조사 업체 국내 전자 상거래 시장 분석 자료 쇼핑 양사 인상 전자 상거래 시장 양대 강자 구도 자리 노동 조건 문제 터지 짝퉁 문제 뉴스 경영진 다음 희망 보이 손실 에너지 전기 구매 요금 역전 뒤늦 분기 요금 올리 발전사 전기 사오 떨어지 분기 분기 이익 증권가 분석 나오 시작 분기 요금 전망대 이익 손실 장대비 부슬비 기업 기업 오뚜기 식품 시작 경제 부총리 내리 어떠 압박 국제 가격 안팎 적정 일요일 아침 경제 부총리 라면 파장 라면 회사 라면 만드 재료비 원가 반영 항변 우군 절반 점유 분기 영업 이익 급증 시선 정부 하반기 물가 공언 먹거리 국면 라면 상징 생각 그렇 이번 정부 정책 압박 교육 디지털 대성 학원 메이저 사교육 기업 공교육 교과 과정 다루 분야 문제 수능 출제 배제 대통령 학원 폭풍 여론 수능 시험 수준 언급 시점 갑론을박 중산 학원 보내 수입 재벌 초호 생활 즐기 강사 부각 정부 압박 예고 대목 하루 아침 사교육 학생 수익 원천 킬러 문항 사라지 사교육 산업 정책 압박 커지 호황 힘들 다음 건설 공사 현장 체면 담당 장관 소리 검단 아파트 주차장 붕괴 네티즌 아파트 뼈대 부실 건설 전국 현장 점검 유사 사태 재발 다짐 국토 장관 일침 후진국 부실 공사 건설 셀프 점검 사회 신뢰 담보 힘들 야심 재건축 아파트 입주 커뮤니티 시설 논란 마지막 투자 미래 증권사 원회 담합 조사 수수료 금리 담합 조사 금융 과점 체제 지적 대통령 언급 은행 보험 조사 증권 형사 조사 예사 주가 폭락 사태 검찰 금융 감독원 조사 소매 동시 조사 과거 양도 예금 증서 금리 담합 조사 금융 담합 발견 위반 입증 성과 지켜보 경기 부양 정책 중심 물가 문제 체감 물가 고공 행진 금리 전망 부양 급하 급하 바늘 허리 매어 지금 주간 기업 기상도 지수 기사문 제보 라인,앵커 상반기 정부 기업 하반기 경기 실적 고민 한창 시점 기업 소식 기업 기상도 살펴보 기업 뉴스 주간 기업 기상도 상반기 마지막 기업 기상도 정부 기업 투자 독려 다음 시작 하반기 정책 무게 추가 물가 경기 부양 이동 예상 기업 기업 기상도 시작 기업 전자 상거래 악도 시장 조사 업체 국내 전자 상거래 시장 분석 자료 쇼핑 양사 인상 전자 상거래 시장 양대 강자 구도 자리 노동 조건 문제 터지 짝퉁 문제 뉴스 경영진 다음 희망 보이 손실 에너지 전기 구매 요금 역전 뒤늦 분기 요금 올리 발전사 전기 사오 떨어지 분기 분기 이익 증권가 분석 나오 시작 분기 요금 전망대 이익 손실 장대비 부슬비 기업 기업 오뚜기 식품 시작 경제 부총리 내리 어떠 압박 국제 가격 안팎 적정 일요일 아침 경제 부총리 라면 파장 라면 회사 라면 만드 재료비 원가 반영 항변 우군 절반 점유 분기 영업 이익 급증 시선 정부 하반기 물가 공언 먹거리 국면 라면 상징 생각 그렇 정부 정책 압박 교육 디지털 대성 학원 메이저 사교육 기업 공교육 교과 과정 다루 분야 문제 수능 출제 배제 대통령 학원 폭풍 여론 수능 시험 수준 언급 시점 갑론을박 중산 학원 보내 수입 재벌 초호 생활 즐기 강사 부각 정부 압박 예고 대목 하루 아침 사교육 학생 수익 원천 킬러 문항 사라지 사교육 산업 정책 압박 커지 호황 힘들 다음 공사 현장 체면 담당 장관 소리 검단 아파트 주차장 붕괴 네티즌 아파트 뼈대 부실 전국 현장 점검 유사 사태 재발 다짐 국토 장관 일침 후진국 부실 공사 셀프 점검 사회 신뢰 담보 힘들 야심 재건축 아파트 입주 커뮤니티 시설 논란 마지막 투자 미래 증권사 원회 담합 조사 수수료 금리 담합 조사 금융 과점 체제 지적 대통령 언급 은행 보험 조사 증권 형사 조사 예사 주가 폭락 사태 검찰 금융 감독원 조사 소매 동시 조사 과거 양도 예금 증서 금리 담합 조사 금융 담합 발견 위반 입증 성과 지켜보 경기 부양 정책 중심 물가 문제 체감 물가 고공 행진 금리 전망 부양 급하 급하 바늘 허리 매어 지금 주간 기업 기상도 지수 기사문 제보 라인
2023-06-25,세상 가구 분양,분양 캘린더 부동산 제공 부동산 전국 단지 사전 청약 포함 가구 일반 분양 가구 분양 시작 주요 분양 단지 고덕 강일 사전 청약 경기 신동 세상 탄파 너스 검단 모종 경기 도시 세상 탄파 너스 회차 분양 지하 지상 가구 규모 단지 나누 분양 가구 전용 면적 가구 회차 분양 도시 위치 주변 고교 교육 시설 공원 상가 생활 기반 시설 조성 중심 예정 노선 도시 철도 예정 주변 교통 환경 개선 전망 건설 일원 분양 예정 지하 지상 최고 가구 전용 면적 가구 일반 분양 지하철 역세 단지 이용 편리 진출 공공 기관 공원 병원 백화점 대형 마트 편의 시설 생활 환경 우수 평가 견본 주택 대연 디아 이엘 개관 예정,분양 캘린더 부동산 제공 부동산 전국 단지 사전 청약 포함 가구 일반 분양 가구 분양 시작 주요 분양 단지 고덕 강일 사전 청약 경기 신동 세상 탄파 너스 검단 모종 경기 도시 세상 탄파 너스 회차 분양 지하 지상 가구 규모 단지 나누 분양 가구 전용 면적 가구 회차 분양 도시 위치 주변 고교 교육 시설 공원 상가 생활 기반 시설 조성 중심 예정 노선 도시 철도 예정 주변 교통 환경 개선 전망 일원 분양 예정 지하 지상 최고 가구 전용 면적 가구 일반 분양 지하철 역세 단지 이용 편리 진출 공공 기관 공원 병원 백화점 대형 마트 편의 시설 생활 환경 우수 평가 견본 주택 대연 디아 이엘 개관 예정
2023-06-25,분양 동향 세상 탄파 너스 전국 가구 분양,견본 주택 개관 이달 전국 가구 달하 물량 분양 시장 부동산 따르 이달 전국 가구 일반 분양 가구 분양 시작 고덕 강일 사전 청약 경기 신동 세상 탄파 너스 검단 모종 청약 진행 모델 대연 디아 이엘 오픈 예정 분양 일정 사진 부동산 경기 도시 블록 세상 탄파 너스 회차 분양 지하 지상 가구 규모 단지 나누 분양 가구 전용 면적 가구 회차 분양 도시 위치 주변 고교 교육 시설 공원 상가 생활 기반 시설 조성 중심 예정 노선 도시 철도 예정 건설 일원 위치 숭어리 주택 건축 정비 사업 분양 예정 지하 지상 최고 가구 전용 면적 가구 일반 분양 지하철 역세 단지 인접 이용 편리 진출 공공 기관 공원 병원 백화점 대형 마트 편의 시설 인접,견본 주택 개관 이달 전국 가구 달하 물량 분양 시장 부동산 이달 전국 가구 일반 분양 가구 분양 시작 고덕 강일 사전 청약 경기 신동 세상 탄파 너스 검단 모종 청약 진행 모델 대연 디아 이엘 오픈 예정 분양 일정 부동산 경기 도시 블록 세상 탄파 너스 회차 분양 지하 지상 가구 규모 단지 나누 분양 가구 전용 면적 가구 회차 분양 도시 위치 주변 고교 교육 시설 공원 상가 생활 기반 시설 조성 중심 예정 노선 도시 철도 예정 일원 위치 숭어리 주택 건축 정비 사업 분양 예정 지하 지상 최고 가구 전용 면적 가구 일반 분양 지하철 역세 단지 인접 이용 편리 진출 공공 기관 공원 병원 백화점 대형 마트 편의 시설 인접
2023-06-25,건설사 해외 수주 청신호 대기,신화 수주 아람 신뢰 기반 마련 각종 대형 공사 따내 장관 외교전 측면 지원 시티 프로젝트 석유 화학 수주 기대 경제 아미 프로젝트 건설 신화 처음 진출 확보 현대 건설 수주 노하우 조성 정부 발족 지원 쾌거 평가 올해 지역 중심 해외 건설 수주 하반기 기대 현대 건설 관계 현대 건설 공사 수행 처음 해외 첫발 본격 해외 진출 국가 현대 건설 창업주 명예 회장 회장 시절 세기 최대 공사 불리 산업 수주 성공 공사 마치 건설 절정 이끌 당시 수주 금액 우리나라 국가 예산 세계 최고 기술력 기반 석유 국영 회사 아람 시간 신뢰 관계 다지 그간 액화 공장 가스 처리 시설 오일 가스 처리 공장 공사 계약 현지 국가 독보 위치 구축 현대 건설 반세기 동안 공사 현대 건설 관계자 지난해 프로그램 아람 건설 설계 조달 시공 부문 독점 협상 대상자 선정 현대 건설 아람 발주 석유 화학 관련 신사업 입찰 인센티브 독점 지위 기반 아미 프로젝트 수주 향후 아람 사업 추가 확보 수행 정부 측면 지원 이번 수주 도움 대통령 해외 수주 프로젝트 가동 인프라 건설 원전 방산 수출 동력 발표 국토 장관 이끄 주단 지난해 올해 연이 파견 시티 인프라 수주 적극 지원 아람 최고 경영자 만나 고위급 외교 전방 지원 이번 아미 프로젝트 계약 장관 현지 에너지 주택 장관 협력 확대 방안 논의 지난해 정부 기업 개발 투자 업무 협약 체결 이번 수주 이때 체결 업무 협약 포함 별개 성과 국토 관계자 올해 정부 해외 건설 수주 목표 후속 수주 기업 지원 아끼 앞줄 가운데 아람 부사장 오른쪽 사장 현지 시간 다란 위치 아람 본사 아미 프로젝트 계약 서명 뒷줄 가운데 국토 장관 계약 서명 지켜보 사진 제공 이번 수주 계기 한동안 국내 건설 업체 러시 기대감 상반기 유가 하락 글로벌 경기 둔화 산유국 발주 지연 국내 건설사 고금리 자금 조달 악화 입찰 주저 해외 건설 주액 역대 최저 수준 상반기 국내 건설 업체 해외 주액 아미 프로젝트 반영 전년 기간 감소 하반기 주요 국가 투자 여력 확대 전망 규모 시티 관련 발주 대기 물꼬 기대 현대 건설 올해 가스전 단계 입찰 마무리 가스 플랜트 입찰 추가 준비 시티 터널 관련 입찰 결과 하반기 전망 한화 건설 부문 한동안 중지 도시 사업 재개 공동 위원회 재개 공사비 미지급 문제 해결 수순 한화 건설 부문 시공 비스 도시 프로젝트 계약 금액 동안 사정 공사비 미지급 장기 공사 중단 추가 규모 도시 주거 사업 발주 방침 기업 기회 예상 건설 자회사 니마 해수 담수화 플랜트 추가 수주 노리 승전보 예상 최근 규모 초대 피스 호텔 복합 개발 사업 수주 지역 다수 석유 화학 프로젝트 계약 방침 최근 대통령 국빈 방문 현지 업무 협약 토지 주택 공사 북부 대표 지방 도시 성장 동반자 프로그램 추진 건설 개발 투자 기업 신재 에너지 사업 포괄 협력 업무 협약 체결,신화 수주 아람 신뢰 기반 마련 각종 대형 공사 따내 장관 외교전 측면 지원 시티 프로젝트 석유 화학 수주 기대 경제 아미 프로젝트 신화 처음 진출 확보 현대 수주 노하우 조성 정부 발족 지원 쾌거 평가 지역 중심 해외 수주 하반기 기대 현대 관계 현대 공사 수행 처음 해외 첫발 본격 해외 진출 국가 현대 창업주 명예 회장 회장 시절 세기 최대 공사 불리 산업 수주 성공 공사 마치 절정 이끌 당시 수주 금액 우리나라 국가 예산 세계 최고 기술력 기반 석유 국영 회사 아람 시간 신뢰 관계 다지 그간 액화 공장 가스 처리 시설 오일 가스 처리 공장 공사 계약 현지 국가 독보 위치 구축 현대 반세기 동안 공사 현대 관계자 프로그램 아람 설계 조달 시공 부문 독점 협상 대상자 선정 현대 아람 발주 석유 화학 관련 신사업 입찰 인센티브 독점 지위 기반 아미 프로젝트 수주 향후 아람 사업 추가 확보 수행 정부 측면 지원 수주 도움 대통령 해외 수주 프로젝트 가동 인프라 원전 방산 수출 동력 발표 국토 장관 이끄 주단 연이 파견 시티 인프라 수주 적극 지원 아람 최고 경영자 만나 고위급 외교 전방 지원 아미 프로젝트 계약 장관 현지 에너지 주택 장관 협력 확대 방안 논의 정부 기업 개발 투자 업무 협약 체결 수주 이때 체결 업무 협약 포함 별개 성과 국토 관계자 정부 해외 수주 목표 후속 수주 기업 지원 아끼 앞줄 가운데 아람 부사장 오른쪽 사장 현지 시간 다란 위치 아람 본사 아미 프로젝트 계약 서명 뒷줄 가운데 국토 장관 계약 서명 지켜보 제공 수주 계기 한동안 국내 업체 러시 기대감 상반기 유가 하락 글로벌 경기 둔화 산유국 발주 지연 국내 고금리 자금 조달 악화 입찰 주저 해외 주액 역대 최저 수준 상반기 국내 업체 해외 주액 아미 프로젝트 반영 전년 기간 감소 하반기 주요 국가 투자 여력 확대 전망 규모 시티 관련 발주 대기 물꼬 기대 현대 가스전 단계 입찰 마무리 가스 플랜트 입찰 추가 준비 시티 터널 관련 입찰 결과 하반기 전망 한화 부문 한동안 중지 도시 사업 재개 공동 위원회 재개 공사비 미지급 문제 해결 수순 한화 부문 시공 비스 도시 프로젝트 계약 금액 동안 사정 공사비 미지급 장기 공사 중단 추가 규모 도시 주거 사업 발주 방침 기업 기회 예상 자회사 니마 해수 담수화 플랜트 추가 수주 노리 승전보 예상 규모 초대 피스 호텔 복합 개발 사업 수주 지역 다수 석유 화학 프로젝트 계약 방침 대통령 국빈 방문 현지 업무 협약 토지 주택 공사 북부 대표 지방 도시 성장 동반자 프로그램 추진 개발 투자 기업 신재 에너지 사업 포괄 협력 업무 협약 체결
