date,Title,Content,tokens
2021-08-30,랜드 펜싱 심리 상담 로봇 대형 건설사 프리미엄 경쟁,스포츠 플랫 클러스터 디에이치 입주민 고급 피트 니스 서비스 제공 대형 건설사 아파트 입주민 대상 프리미엄 서비스 도입 차별 서비스 자체 브랜드 경쟁력 인지도 강화 건설사 과거 아파트 놀이터 커뮤니티 시설 특화 꾸미 식당 만드 차별 주거 트렌드 바뀌 프리미엄 서비스 수준 바꾸 평가 펜싱 레슨 심리 상담 사교육 번지 인근 예체능 학원 성업 주요 아파트 단지 자리 발레 각종 악기 레슨 학원 풍경 최근 귀족 전유물 승마 사격 펜싱 학원 인기 펜싱 최근 수년 사이 엄마 사이 선호 스포츠 자리매김 흔하 고급 스포츠 이미지 일부 아이비리그 입학 보이 펜싱 가르치 시간 시간 강습 펜싱 열기 뜨거워지 학원 업계 관계자 운동 자녀 스포츠 배우 궁금증 대입 유리 기대감 반영 결과 귀띔 트렌드 대형 건설사 분위기 현대 건설 최근 스포츠 플랫 디에이치 입주민 대상 피트 니스 서비스 제공 생각 헬스 퍼스널 트레이닝 펜싱 발레 피닝 요즘 스포츠 수준 인기 총출동 클러스터 마이크 스튜디오 펜싱 클럽 국내 유명 스포츠 스튜디오 브랜드 유치 현대 건설 디에이치 입주민 클러스터 보유 피트 니스 브랜드 체험 이용 제공 방침 현대 건설 최근 특이 프리미엄 서비스 내놓 심리 상담 대표 현대 건설 심리 상담 프랜차이즈 기업인 협업 검사 비교 서비스 준비 자녀 성적 올리 도움 유행 자녀 기질 검사 모양 육태 검사 부모 양육 스트레스 검사 제공 각종 대면 심리 상담 비대 상담 온라인 상담 제휴 가격 무료 제공 현대 건설 아파트 입주민 혜택 서비스 현대 건설 최상위 브랜드 요지 디에이치 거주민 제공 서비스 부동산 업계 관계자 고급 서비스 이용 각종 운영비 아파트 관리비 입주민 반대 최소 고급 스포츠 배우 디에이치 프리미엄 서비스 적용 현대 건설 늘어나 형태 서비스 고민 설명 현대 건설 관계자 재택근무 정착 머무르 시간 주거 서비스 제공 발전 디에이치 브랜드 가치 수준 주거 서비스 입주민 제공 단지 로봇 배달 서비스 시작 비대 기본 로봇 배달 비대 문화 확산 관련 서비스 마련 건설사 지난달 한화 국내 아파트 최초 실내 로봇 배달 서비스 시작 배달 주문 음식 아파트 공동 현관 도착 단지 상주 배달 로봇 해당 세대 전달 방식 배달 로봇 무선 통신 공동 현관문 엘리베이터 호출 기능 탑재 층수 입력 이동도 가능 음식 도착 주문 고객 휴대폰 도착 메시지 안내 배달 음식 시키 배달 라이더 걱정 입주민 서비스 서비스 제공 배달 민족 운영 형제 손잡 가량 연구 로봇 활용 서비스 확대 검토 신규 적용 환경 고려 서비스 제공 범위 방침 건축 사업 본부 시대 배달 로봇 서비스 입주민 주거 경험 제공 기대 재택 활동 늘어나 사물 인터넷 무장 영화관 설치 건설사 라이프 공개 라이프 관은 로봇 미래 기술 활용 식음 배송 생활 편의 서비스 트레이닝 특화 공간 갖추 세대 내부 자동화 입주민 생활 패턴 개인 맞춤 서비스 제공 라이프 중도 공간 형태 만들 설명 운동 피트 니스 영화 관람 멀티 건설 지난해 아파트 커뮤니티 통합 서비스 브랜드 장기 머무 시간 차별 생활 문화 텐트 제공 주요 내용 건설 업무 협약 영화관 구축 입주 시작 서초 랑자 규모 커뮤니티 시네마 설치 업계 관계자 배달 재택근무 비대 교육 화상 회의 과거 특화 시설 첨단 기술 적용 시설 확충 건설사 특화 서비스 경쟁 치열 느낌 기자,스포츠 플랫 클러스터 디에이치 입주민 고급 피트 니스 서비스 제공 대형 아파트 입주민 대상 프리미엄 서비스 도입 차별 서비스 자체 브랜드 경쟁력 인지도 강화 과거 아파트 놀이터 커뮤니티 시설 특화 꾸미 식당 만드 차별 주거 트렌드 바뀌 프리미엄 서비스 수준 바꾸 평가 펜싱 레슨 심리 상담 사교육 번지 인근 예체능 학원 성업 주요 아파트 단지 자리 발레 각종 악기 레슨 학원 풍경 귀족 전유물 승마 사격 펜싱 학원 인기 펜싱 수년 사이 엄마 사이 선호 스포츠 자리매김 흔하 고급 스포츠 이미지 일부 아이비리그 입학 보이 펜싱 가르치 시간 시간 강습 펜싱 열기 뜨거워지 학원 업계 관계자 운동 자녀 스포츠 배우 궁금증 대입 유리 기대감 반영 결과 귀띔 트렌드 대형 분위기 현대 스포츠 플랫 디에이치 입주민 대상 피트 니스 서비스 제공 생각 헬스 퍼스널 트레이닝 펜싱 발레 피닝 요즘 스포츠 수준 인기 총출동 클러스터 마이크 스튜디오 펜싱 클럽 국내 유명 스포츠 스튜디오 브랜드 유치 현대 디에이치 입주민 클러스터 보유 피트 니스 브랜드 체험 이용 제공 방침 현대 특이 프리미엄 서비스 내놓 심리 상담 현대 심리 상담 프랜차이즈 기업인 협업 검사 비교 서비스 준비 자녀 성적 올리 도움 유행 자녀 기질 검사 모양 육태 검사 부모 양육 스트레스 검사 제공 각종 대면 심리 상담 비대 상담 온라인 상담 제휴 가격 무료 제공 현대 아파트 입주민 혜택 서비스 현대 최상위 브랜드 요지 디에이치 거주민 제공 서비스 부동산 업계 관계자 고급 서비스 이용 각종 운영비 아파트 관리비 입주민 반대 최소 고급 스포츠 배우 디에이치 프리미엄 서비스 적용 현대 늘어나 형태 서비스 고민 설명 현대 관계자 재택근무 정착 머무르 시간 주거 서비스 제공 발전 디에이치 브랜드 가치 수준 주거 서비스 입주민 제공 단지 로봇 배달 서비스 시작 비대 기본 로봇 배달 비대 문화 확산 관련 서비스 마련 지난달 한화 국내 아파트 최초 실내 로봇 배달 서비스 시작 배달 주문 음식 아파트 공동 현관 도착 단지 상주 배달 로봇 세대 전달 방식 배달 로봇 무선 통신 공동 현관문 엘리베이터 호출 기능 탑재 층수 입력 이동도 음식 도착 주문 고객 휴대폰 도착 메시지 안내 배달 음식 시키 배달 라이더 걱정 입주민 서비스 서비스 제공 배달 민족 운영 형제 손잡 가량 연구 로봇 활용 서비스 확대 검토 신규 적용 환경 고려 서비스 제공 범위 방침 건축 본부 시대 배달 로봇 서비스 입주민 주거 경험 제공 기대 재택 활동 늘어나 사물 인터넷 무장 영화관 설치 라이프 공개 라이프 관은 로봇 미래 기술 활용 식음 배송 생활 편의 서비스 트레이닝 특화 공간 갖추 세대 내부 자동화 입주민 생활 패턴 개인 맞춤 서비스 제공 라이프 중도 공간 형태 만들 설명 운동 피트 니스 영화 관람 멀티 아파트 커뮤니티 통합 서비스 브랜드 장기 머무 시간 차별 생활 문화 텐트 제공 주요 업무 협약 영화관 구축 입주 시작 서초 랑자 규모 커뮤니티 시네마 설치 업계 관계자 배달 재택근무 비대 교육 화상 회의 과거 특화 시설 첨단 기술 적용 시설 확충 특화 서비스 경쟁 치열 느낌
2021-08-30,특징 건설 호황 사이클 전망 동반 강세 건설,건설 주가 호황 사이클 전망 동반 강세 보이 오전 현재 건설 거래일 대비 거래 강세 보이 건설 주가 호황 사이클 전망 동반 강세 보이 이날 건설 업종 비중 확대 투자 의견 재개 현대 건설 건설 제시 연구원 정비 사업 장기 실적 성장 요인 연구원 정부 공공재 개발 공공재 건축 정비 사업 주택 공급 의지 보이 최근 주거 정비 지수 폐지 개발 규제 완화 브랜드력 비교 대형 건설사 중심 정비 수주 시장 기대 분석 규제 강화 민간 재건축 규제 완화 여부 중요 판단 건축 규제 완화 대선 결과 여부 중요 작용 판단,주가 호황 사이클 전망 동반 강세 보이 오전 현재 거래일 거래 강세 보이 주가 호황 사이클 전망 동반 강세 보이 이날 업종 비중 확대 투자 의견 재개 현대 제시 연구원 정비 장기 실적 성장 요인 연구원 정부 공공재 개발 공공재 건축 정비 주택 공급 의지 보이 주거 정비 지수 폐지 개발 규제 완화 브랜드력 비교 대형 중심 정비 수주 시장 기대 분석 규제 강화 민간 재건축 규제 완화 여부 중요 판단 건축 규제 완화 대선 결과 여부 중요 작용 판단
2021-08-30,특징 건설 건자재 동반 상승 부동산 공약 영향,국민 대선 주자 검찰 총장 오전 국민 당사 부동산 공약 발표 뉴스 기자 뉴스 응진 기자 국민 대권 주자 검찰 총장 주택 공급 계획 부동산 공약 발표 초반 건설 건자재 관련 종목 주가 동반 상승세 나타내 이날 오전 기준 건설 거래일 종가 비교 거래 신세계 건설 대형 건설 주가 오르 건자재 관련 주도 상승세 전날 총장 국민 중앙 당사 부동산 공약 발표 용적 인센티브 수도 도시 전국 이상 수도 이상 신규 주택 건설 보유 소득세 부담 줄이 신혼 부부 청년층 주택 담보 대출 비율 인상 무주택 청년 가구 청년 원가 주택 공급 약속,국민 대선 주자 검찰 총장 오전 국민 당사 부동산 공약 발표 뉴스 뉴스 응진 국민 대권 주자 검찰 총장 주택 공급 계획 부동산 공약 발표 초반 건자재 관련 종목 주가 동반 상승세 나타내 이날 오전 기준 거래일 종가 비교 거래 신세계 대형 주가 오르 건자재 관련 주도 상승세 전날 총장 국민 중앙 당사 부동산 공약 발표 용적 인센티브 수도 도시 전국 이상 수도 이상 신규 주택 보유 소득세 부담 줄이 신혼 부부 청년층 주택 담보 대출 비율 인상 무주택 청년 가구 청년 원가 주택 공급 약속
2021-08-30,특징 건설업 호황 사이클 청신호 건설 강세,건설 업종 호황 사이클 본격 돌입 분석 나오 건설 주가 강세 오전 현재 기준 건설 주가 거래일 거래 건설 대표 주가 상승세 대형 건설사 건설업 호황 사이클 본격 진입 전망 증권가 리포트 나오 건설 주가 상승 풀이 연구원 리포트 국내 주택 공급 기대감 커지 가운데 유가 해외 사업 청신호 장기간 정체 본격 성장 기대 설명,업종 호황 사이클 본격 돌입 분석 나오 주가 강세 오전 현재 기준 주가 거래일 거래 주가 상승세 대형 건설업 호황 사이클 본격 진입 전망 증권가 리포트 나오 주가 상승 풀이 연구원 리포트 국내 주택 공급 기대감 커지 가운데 유가 해외 청신호 장기간 정체 본격 성장 기대 설명
2021-08-30,특징 건설 주택 공급 확대 호황 전망 강세 건설,건설 주가 정부 주택 공급 확대 정책 호황 사이클 전망 동반 강세 보이 오전 현재 건설 거래일 대비 거래 시간 현대 건설 거래일 거래 이날 건설 업종 비중 확대 투자 의견 현대 건설 건설 제시 연구원 정부 공공재 개발 공공재 건축 정비 사업 주택 공급 의지 보이 최근 주거 정비 지수 폐지 개발 규제 완화 브랜드력 비교 대형 건설사 중심 정비 수주 시장 기대 분석 규제 강화 민간 재건축 규제 완화 여부 중요 판단 건축 규제 완화 대선 결과 여부 중요 작용 판단 전망,주가 정부 주택 공급 확대 정책 호황 사이클 전망 동반 강세 보이 오전 현재 거래일 거래 시간 현대 거래일 거래 이날 업종 비중 확대 투자 의견 현대 제시 연구원 정부 공공재 개발 공공재 건축 정비 주택 공급 의지 보이 주거 정비 지수 폐지 개발 규제 완화 브랜드력 비교 대형 중심 정비 수주 시장 기대 분석 규제 강화 민간 재건축 규제 완화 여부 중요 판단 건축 규제 완화 대선 결과 여부 중요 작용 판단 전망
2021-08-30,정비 수주 클럽 구역 수주,구역 건축 사업 선정 정비 사업 수주 클럽 입성 사진 구역 건축 사업 선정 정비 사업 수주 클럽 입성 하반기 건설 클럽 주전 치열 전망 업계 따르 올해 하반기 대어 불리 정비 사업 수주 성공 구역 건축 사업 수주 정비 수주 클럽 입성 경기 선정 총회 전체 조합원 투표 인원 구역 건축 사업 시공자 최종 선정 이번 수주 주액 기록 구역 수주 정비 사업 부문 수주 확보 올해 해운대 우동 구역 재건축 거모 구역 재건축 아파트 도마 변동 구역 개발 사업 수주 상반기 정비 수주 돌파 건설 업체 건설 하반기 클럽 달성 수주 경쟁 치열 전망 선정 조합 구역 구역 개발 신림 구역 개발 개발 노원 개발,구역 건축 선정 정비 수주 클럽 입성 사진 구역 건축 선정 정비 수주 클럽 입성 하반기 클럽 주전 치열 전망 업계 하반기 대어 불리 정비 수주 성공 구역 건축 수주 정비 수주 클럽 입성 경기 선정 총회 전체 조합원 투표 인원 구역 건축 시공자 최종 선정 수주 주액 기록 구역 수주 정비 부문 수주 확보 해운대 우동 구역 재건축 거모 구역 재건축 아파트 도마 변동 구역 개발 수주 정비 수주 돌파 업체 하반기 클럽 달성 수주 경쟁 치열 전망 선정 조합 구역 구역 개발 신림 구역 개발 개발 노원 개발
2021-08-30,외국인 매도 지속 오전 상승 축소,이미지 출처 오전 오름세 보이 외국인 매도 지속 상승 오전 기준 거래일 대비 포인트 가리키 이날 거래일 대비 포인트 상승세 보이 시작 외국인 매도 세에 상승 축소 투자자 동향 개인 기관 어치 주식 외국인 어치 주식 연구원 시장 참여 실적 피크 아웃 우려 해소 상황 외국인 지속 순매도 배경 매크로 환율 이외 실적 피크 아웃 경계심 자리 수출 지표 호조 외국인 수급 여건 개선 업종 건설업 금속 광물 철강 금속 운수 장비 운수 창고 상승 건설업 상승 건설 건설 오름세 국내 주택 공급 기대감 가운데 건설업 호황 사이클 진입 전망 긍정 영향 분석 상위 종목 상승 화학 하락 시각 코스닥 지수 거래일 대비 포인트 가리키 코스닥 지수 거래일 대비 포인트 상승 시작 투자자 동향 개인 어치 주식 외국인 기관 어치 주식 업종 운송장 부품 건설 소프트웨어 통신 장비 오름세 상위 종목 상승 트리 헬스 케어 프로 트리 온제 하락,이미지 출처 오전 오름세 보이 외국인 매도 지속 상승 오전 기준 거래일 포인트 가리키 이날 거래일 포인트 상승세 보이 시작 외국인 매도 세에 상승 축소 투자자 동향 개인 기관 어치 주식 외국인 어치 주식 연구원 시장 참여 실적 피크 아웃 우려 해소 상황 외국인 지속 순매도 배경 매크로 환율 이외 실적 피크 아웃 경계심 자리 수출 지표 호조 외국인 수급 여건 개선 업종 건설업 금속 광물 철강 금속 운수 장비 운수 창고 상승 건설업 상승 오름세 국내 주택 공급 기대감 가운데 건설업 호황 사이클 진입 전망 긍정 영향 분석 상위 종목 상승 화학 하락 시각 코스닥 지수 거래일 포인트 가리키 코스닥 지수 거래일 포인트 상승 시작 투자자 동향 개인 어치 주식 외국인 기관 어치 주식 업종 운송장 부품 소프트웨어 통신 장비 오름세 상위 종목 상승 트리 헬스 케어 프로 트리 온제 하락
2021-08-30,배터리 선도 도시 순항 성과,사이클 사업 착공 전지 종합 관리 센터 준공 배터리 선도 도시 자리매김 순항 사진 준공 예정 전지 종합 관리 센터 조감도 사진 제공 뉴스 기자 배터리 산업 선도 도시 자리매김 순항 따르 관련 기업 투자 유치 인프라 조성 인재 양성 이어지 방위 노력 성과 이어지 국내 유일 건설 기업 투자 유치 대통령 방문 격려 사이클 사업 공사 착공 시작 본격 사용 배터리 산업 서막 알리 국가 건립 사용 배터리 실증 사업 연구 개발 육성 전지 종합 관리 센터 준공 앞두 막바지 점검 한창 정부 발표 배터리 발전 전략 용역 산업 통상 자원 최초 제안 배터리 파크 조성 세부 전략 연구 개발 사업 차세대 상용 지원 센터 구축 모델 반영 배터리 파크 선점 글로벌 배터리 도시 발전 복안 역점 추진 배터리 기업 유치 인프라 구축 인력 양성 다양 노력 성과 이어지 기업 폭넓 지원 공격 배터리 기업 유치 전략 계획 파크 원장 배터리 분야 최고 자문 위원 위촉 배터리 정책 방향 자문 구하 한편 배터리 글로벌 배터리 선도 도시 입지 구축 국내 전문가 구성 전지 산업 발전 전문가 위원회 구성 총력 배터리 산업 인재 양성 추진 포스 동대 우수 배터리 인재 양성 지난해 지역 대학교 기관 지속 소통 협력 대학교 소재 배터리 신설 폴리 대학 캠퍼스 하이테크 과정 신설 배터리 인력 수급 적극 협력 시장 배터리 선도 도시 산업 기반 국내 알리 역할 수행 지역 배터리 기업 안착 집적화 배터리 전용 펀드 조성 지원 내년 배터리 전용 펀드 확대 강조,사이클 착공 전지 종합 관리 센터 준공 배터리 선도 도시 자리매김 순항 사진 준공 예정 전지 종합 관리 센터 조감도 사진 제공 뉴스 배터리 산업 선도 도시 자리매김 순항 관련 기업 투자 유치 인프라 조성 인재 양성 이어지 방위 노력 성과 이어지 국내 유일 기업 투자 유치 대통령 방문 격려 사이클 공사 착공 시작 본격 사용 배터리 산업 서막 알리 국가 건립 사용 배터리 실증 연구 개발 육성 전지 종합 관리 센터 준공 앞두 막바지 점검 한창 정부 발표 배터리 발전 전략 용역 산업 통상 자원 최초 제안 배터리 파크 조성 세부 전략 연구 개발 차세대 상용 지원 센터 구축 모델 반영 배터리 파크 선점 글로벌 배터리 도시 발전 복안 역점 추진 배터리 기업 유치 인프라 구축 인력 양성 다양 노력 성과 이어지 기업 폭넓 지원 공격 배터리 기업 유치 전략 계획 파크 원장 배터리 분야 최고 자문 위원 위촉 배터리 정책 방향 자문 구하 한편 배터리 글로벌 배터리 선도 도시 입지 구축 국내 전문가 구성 전지 산업 발전 전문가 위원회 구성 총력 배터리 산업 인재 양성 추진 포스 동대 우수 배터리 인재 양성 지역 대학교 기관 지속 소통 협력 대학교 소재 배터리 신설 폴리 대학 캠퍼스 하이테크 과정 신설 배터리 인력 수급 적극 협력 시장 배터리 선도 도시 산업 기반 국내 알리 역할 수행 지역 배터리 기업 안착 집적화 배터리 전용 펀드 조성 지원 배터리 전용 펀드 확대 강조
2021-08-30,강북 대어 클럽,올해 도시 정비 사업 주액 달성 하반기 도시 정비 수주 시장 대어 大魚 꼽히 구역 건축 사업 시공 회사 기업 분할 첫해 재건축 전방 수주 성공 도시 정비 사업 수주 클럽 가입 목전 구역 건축 사업 선정 건설 치열 경합 전체 조합원 구역 공사비 투입 사업 하반기 강북 건축 대어 구역 사업 완료 가구 규모 아파트 아크 제시 상태 단지 판상 평면 세대 특화 조망권 갖추 설계 축구장 크기 중앙 광장 프리미엄 조경 세계 거장 협업 경관 디자인 적용 방침 관계자 층간 소음 저감 차별 기술력 조합원 호응 이끌 이번 수주 올해 도시 정비 사업 부문 주액 달성 업계 선두 자리 올라서 건설 기록 올해 클럽 가입 가능 전망 우동 구역 재건축 시작 거모 구역 재건축 아파트 도마 변동 구역 개발 사업 수주,도시 정비 주액 달성 하반기 도시 정비 수주 시장 대어 大魚 꼽히 구역 건축 시공 회사 기업 분할 첫해 재건축 전방 수주 성공 도시 정비 수주 클럽 가입 목전 구역 건축 선정 치열 경합 전체 조합원 구역 공사비 투입 하반기 강북 건축 대어 구역 완료 가구 규모 아파트 아크 제시 상태 단지 판상 평면 세대 특화 조망권 갖추 설계 축구장 크기 중앙 광장 프리미엄 조경 세계 거장 협업 경관 디자인 적용 방침 관계자 층간 소음 저감 차별 기술력 조합원 호응 이끌 수주 도시 정비 부문 주액 달성 업계 선두 자리 올라서 기록 클럽 가입 전망 우동 구역 재건축 시작 거모 구역 재건축 아파트 도마 변동 구역 개발 수주
2021-08-30,비둘기파 발언 증시 상승세 불안감 해소,앵커 이번 거래일 오늘 국내 증시 상승 출발 연방 준비 제도 의장 비둘기파 발언 불안감 해소 증시 상승세 보이 기자 연결 오전 흐름 기자 오전 기준 거래 개인 기관 사들이 지수 끌어올리 반면 외국인 순매도 코스닥 개인 기관 매수 거래 의장 현지 시간 지난주 금요일 미팅 연내 테이퍼 시행 시사 금리 인상 긴축 우려 완화 시장 불안 요인 작용 해소 달러 환율 지난주 거래 앵커 종목별 움직임 흐름 보이 기자 건축 제품 건설 주가 강세 보이 건설 건설 거래일 상승 부동산 정책 관련 기대감 분석 신풍 제약 치료제 개발 말라리아 치료제 임상 계획 승인 강세 보이,앵커 거래일 오늘 국내 증시 상승 출발 연방 준비 제도 의장 비둘기파 발언 불안감 해소 증시 상승세 보이 연결 오전 흐름 오전 기준 거래 개인 기관 사들이 지수 끌어올리 반면 외국인 순매도 코스닥 개인 기관 매수 거래 의장 현지 시간 지난주 금요일 미팅 연내 테이퍼 시행 시사 금리 인상 긴축 우려 완화 시장 불안 요인 작용 해소 달러 환율 지난주 거래 앵커 종목별 움직임 흐름 보이 건축 제품 주가 강세 보이 거래일 상승 부동산 정책 관련 기대감 분석 신풍 제약 치료제 개발 말라리아 치료제 임상 계획 승인 강세 보이
2021-08-30,특징 신규 공공 택지 입지 확정 건설,기자 정부 신규 공공 택지 가구 입지 확정 발표 건설 관련 들썩이 건설 경기 활성 기대 포인트 따르 이날 오후 기준 시멘트 관련 거래일 대비 상승 건설 주도 거래일 대비 시멘트 거래일 거래 성신 양회 거래일 현대 시멘트 거래일 거래 건설 주도 개주 상승세 건설 거래일 거래 건설 거래 상승세 이날 발표 주택 공급 영향 국토 가구 규모 신규 공공 택지 추가 발표 의왕 군포 안산 화성 진안 도시 규모 주택 공급 계획 구월 화성 신규 택지 지정 전죽 동고 연기 가구 조성 규모 의왕 군포 안산 화성 진안 가구 공급 이상 규모 추가 도시 평가 국토 관계자 별도 분류 나누 추가 기신 도시 가깝 설명 구월 화성 양주장 구리 교문 가구 규모 택지 조성 지방 연기 가구 공급 국토 관계자 접근성 도심 인근 지역 안정 주택 공급 기반 구축 주변 지역 상생 발전 복합 자족 도시 조성 계획 강조,정부 신규 공공 택지 가구 입지 확정 발표 관련 들썩이 경기 활성 기대 포인트 이날 기준 시멘트 관련 거래일 상승 주도 거래일 시멘트 거래일 거래 성신 양회 거래일 현대 시멘트 거래일 거래 주도 개주 상승세 거래일 거래 거래 상승세 이날 발표 주택 공급 영향 국토 가구 규모 신규 공공 택지 추가 발표 의왕 군포 안산 화성 진안 도시 규모 주택 공급 계획 구월 화성 신규 택지 지정 전죽 동고 연기 가구 조성 규모 의왕 군포 안산 화성 진안 가구 공급 이상 규모 추가 도시 평가 국토 관계자 별도 분류 나누 추가 기신 도시 가깝 설명 구월 화성 양주장 구리 교문 가구 규모 택지 조성 지방 연기 가구 공급 국토 관계자 접근성 도심 인근 지역 안정 주택 공급 기반 구축 주변 지역 상생 발전 복합 자족 도시 조성 계획 강조
