date,Title,Content,tokens
2021-08-09,관료 출신 사외 이사 공식 대표 이사,기업 외부 출신 외부 출신 관료 출신 사관 학교 자리 관료 기자 국내 기업 대표 이사 외부 영입 조사 외부 출신 관료 과거 관료 거수기 불리 사외 이사 발탁 이제 전문 경영인 인정받 사례 기업 분석 연구소 인덱스 기준 매출 상위 기업 현직 이력 공개 대상 조사 결과 외부 영입 전체 차지 승진 총수 일가 출신 외부 영입 비중 늘어나 반면 총수 일가 출신 비율 줄어드 추세 외부 영입 비중 올해 치솟 승진 포인트 소폭 상승 반면 총수 일가 비율 포인트 감소 총수 일가 이사회 의장 일상 경영 전문 맡기 지배 구조 형태 확산 풀이 외부 영입 경우 관료 출신 대표 사관 학교 불리 출신 비중 차지 정도 비중 반면 관료 출신 비중 전자 대표 이사 부사장 대표 관료 출신 전자 대표 이사 부사장 국세청 출신 건설 대표 이사 부회장 검찰 출신 조석 에너지 시스템 대표 지식 경제 산업 통상 자원 출신 부영 주택 대표 재정 경제 출신 손해 보험 대표 출신 투자 증권 대표 재부 출신 부사장 국세청 출신 국제 조세 탄탄대로 보장 관료 실무 경제 전자 상무 자리 해외 법인 관리 세무 통상 담당 담당 통상 관세 업무 세탁기 긴급 수입 조치 보호 무역 강화 이슈 리스크 관리 능력 인정받 인덱스 대표 기존 관료 출신 사외 이사 총수 일가 방패막이 역할 최근 데이터 관료 출신 대표 이사 자리 꿰차 능력 인정받 경우 관료 출신 전문 네트워크 바탕 총수 신뢰 여성 오너 일가 전문 경영 증가 유리 천장 평가 기업 출신 대학교 비중 소폭 감소 절반 차지 출신,기업 외부 출신 외부 출신 관료 출신 사관 학교 자리 관료 국내 기업 외부 영입 조사 외부 출신 관료 과거 관료 거수기 불리 사외 발탁 이제 전문 경영인 인정받 사례 기업 분석 연구소 인덱스 기준 매출 상위 기업 현직 이력 공개 대상 조사 결과 외부 영입 전체 차지 총수 일가 출신 외부 영입 비중 늘어나 반면 총수 일가 출신 비율 줄어드 추세 외부 영입 비중 치솟 포인트 소폭 상승 반면 총수 일가 비율 포인트 감소 총수 일가 이사회 의장 일상 경영 전문 맡기 지배 구조 형태 확산 풀이 외부 영입 경우 관료 출신 사관 학교 불리 출신 비중 차지 정도 비중 반면 관료 출신 비중 전자 관료 출신 전자 국세청 출신 부회장 검찰 출신 조석 에너지 시스템 지식 경제 산업 통상 자원 출신 부영 주택 재정 경제 출신 손해 보험 출신 투자 증권 재부 출신 국세청 출신 국제 조세 탄탄대로 보장 관료 실무 경제 전자 자리 해외 법인 관리 세무 통상 담당 담당 통상 관세 업무 세탁기 긴급 수입 조치 보호 무역 강화 이슈 리스크 관리 능력 인정받 인덱스 관료 출신 사외 총수 일가 방패막이 역할 데이터 관료 출신 자리 꿰차 능력 인정받 경우 관료 출신 전문 네트워크 바탕 총수 신뢰 여성 오너 일가 전문 경영 증가 유리 천장 평가 기업 출신 대학교 비중 소폭 감소 절반 차지 출신
2021-08-09,수주 현대 건설 건설,목표 이상 달성 건설 목표치 저조 국내 건설사 시공 능력 평가 부동 현대 건설 신규 수주 부문 존재감 입증 연간 목표치 이상 달성 경쟁사 걸음 반면 건설 연간 목표치 절반 채우 상태 하반기 잰걸음 필요 상황 신규 수주 지운 분기 신규 수주 추산 상반기 누적 기준 기록 연간 목표치 반기 올해 곳간 이상 건축 주택 사업 전체 주액 절반 달하 어치 일감 하반기 철도 항만 원전 수주 기대 연간 목표치 달성 파란불 평가 분기 해외 사업장 일회성 비용 발생 기대 이하 영업 이익 기록 아쉬움 현대 건설 작년 올해 신규 수주 부문 기대 이상 성과 보이 만회 그래픽 기자 신규 수주 이하 상반기 누적 기준 기록 격차 연간 목표치 숫자 분기 어치 일감 확보 분기 수준 분기 집중 아쉬움 신규 수주 속도 지난해 인수 합병 휩싸이 저조 실적 올해 인명 사고 사고 상황 상반기 규모 신규 수주 작년 연간 기록 분기 의왕 초평 지식 산업 센터 오피스텔 신축 공사 수주 목표 달성 발걸음 상반기 어치 일감 확보 목표치 주력 화공 플랜트 부문 신규 수주 전년 대비 가량 고무 시장 국제 유가 상승 발주 환경 개선 하반기 입찰 시기 사업장 구체 성과 기대 건설 실적 고공 행진 명성 되찾 신규 수주 기록 목표치 절반 미치 상황 상반기 선정 도시 정비 사업 확보 자체 사업 민간 사업 연내 수주 실적 반영 예정 해외 플랜트 사업 수주 앞두 수주 목표 달성 회사 설명 반면 건설 상대 일감 확보 어려움 목표 달성 분할 이후 건설 경쟁력 키우 실적 시장 기대치 웃돈 신규 수주 연간 목표치 주택 플랜트 사업 부문 수익 개선 보수 수주 전략 일감 확보 관계자 수익 주택 사업 비중 사업자 성장 전략 설명 상반기 실적 부진 이어지 건설 수주 부문 아쉬움 규모 일감 확보 목표치 기록 상반기 하반기 수주 가능 사업장 대기 향후 목표 달성 가능 관심,목표 이상 달성 목표치 저조 국내 시공 능력 평가 부동 현대 신규 수주 부문 존재감 입증 연간 목표치 이상 달성 경쟁사 걸음 반면 연간 목표치 절반 채우 상태 하반기 잰걸음 필요 상황 신규 수주 지운 신규 수주 추산 누적 기준 기록 연간 목표치 반기 곳간 이상 건축 주택 전체 주액 절반 달하 어치 일감 하반기 철도 항만 원전 수주 기대 연간 목표치 달성 파란불 평가 해외 사업장 일회성 비용 발생 기대 이하 영업 이익 기록 아쉬움 현대 작년 신규 수주 부문 기대 이상 성과 보이 만회 그래픽 신규 수주 이하 누적 기준 기록 격차 연간 목표치 숫자 어치 일감 확보 수준 집중 아쉬움 신규 수주 속도 인수 합병 휩싸이 저조 실적 인명 사고 사고 상황 규모 신규 수주 작년 연간 기록 의왕 초평 지식 산업 센터 오피스텔 신축 공사 수주 목표 달성 발걸음 어치 일감 확보 목표치 주력 화공 플랜트 부문 신규 수주 전년 가량 고무 시장 국제 유가 상승 발주 환경 개선 하반기 입찰 시기 사업장 구체 성과 기대 실적 고공 행진 명성 되찾 신규 수주 기록 목표치 절반 미치 상황 선정 도시 정비 확보 자체 민간 연내 수주 실적 반영 예정 해외 플랜트 수주 앞두 수주 목표 달성 회사 설명 반면 상대 일감 확보 어려움 목표 달성 분할 경쟁력 키우 실적 시장 기대치 웃돈 신규 수주 연간 목표치 주택 플랜트 부문 수익 개선 보수 수주 전략 일감 확보 관계자 수익 주택 비중 사업자 성장 전략 설명 실적 부진 이어지 수주 부문 아쉬움 규모 일감 확보 목표치 기록 하반기 수주 사업장 대기 향후 목표 달성 관심
2021-08-09,건설 최대 개발 수주,규모 금사 구역 건설 컨소시엄 올해 최대 개발 사업 규모 서금 재정 촉진 구역 투시도 선정 따르 서금 재정 촉진 구역 개발 사업 조합 선정 총회 조합원 찬반 투표 건설 컨소시엄 최종 선정 컨소시엄 명칭 자이 제안 조합 차례 입찰 진행 건설 컨소시엄 단독 참여 자동 유찰 이후 조합 계약 전환 건설 컨소시엄 입찰 참여 향서 입찰 제안서 제출 협상 대상자 선정 서금 구역 공사비 달하 올해 최대 규모 개발 사업 서동 개발 최고 개동 가구 규모 아파트 단지 개발 예정 건설 대안 설계 제안 커튼 입면 특화 스카이라운지 실내 수영장 프라이빗 영화관 차별 커뮤니티 시설 제시 학원 길이 연도 상가 특화 제안 기존 교육 여건 상가 환경 개선 제안 기자,규모 금사 구역 컨소시엄 최대 개발 규모 서금 재정 촉진 구역 투시도 선정 서금 재정 촉진 구역 개발 조합 선정 총회 조합원 찬반 투표 컨소시엄 최종 선정 컨소시엄 명칭 자이 제안 조합 차례 입찰 진행 컨소시엄 단독 참여 자동 유찰 조합 계약 전환 컨소시엄 입찰 참여 향서 입찰 제안서 제출 협상 대상자 선정 서금 구역 공사비 달하 최대 규모 개발 서동 개발 최고 개동 가구 규모 아파트 단지 개발 예정 대안 설계 제안 커튼 입면 특화 스카이라운지 실내 수영장 프라이빗 영화관 차별 커뮤니티 시설 제시 학원 길이 연도 상가 특화 제안 교육 여건 상가 환경 개선 제안
2021-08-09,기업 공시,경제 유가 증권 현대 자동차 신차 생산 준비 공사 완료 공장 생산 재개 한화 재생 에너지 개발 사업 확장 목적 지분 취득 건설 규모 정비 촉진 구역 개발 정비 사업 시공자 선정 지방 법원 회생 계획안 결정 방위 사업 주관 근접 방어 무기 체계 체계 개발 사업 협상 대상 업체 선정 남광 토건 아씨 규모 문경 주상 복합 신축 공사 계약 체결 주강 메탈 규모 공급 계약 체결 일양 약품 부사장 장내 매수 취득 투자 증권 송정 지구 신축 공사 행사 사업비 규모 대출 지급 보증 결정 플러스 종속 회사 에이 플러스 리얼 유동 확보 토지 건물 처분 코스닥 코스 복합 히아 함유 화장료 조성물 관련 특허 취득 법인 전지 활성 장비 공급 계약 체결 카페 인수 보도 사실 여부 조회 공시 요구 에스 법인 규모 전지 제조 장비 계약 체결 이오 규모 무상 증자 결정 브이 첨단 소재 주당 무상 증자 결정 대화 제약 보통주 현금 배당 결정 대창 스틸 종속 회사 대창 이티 재무 구조 개선 목적 토지 건축물 처분 대표 이사 경영 지배인 관련 배임 혐의 고소 종합 건설 주식회사 규모 풍력 발전기 기자재 공급 계약 체결,경제 유가 증권 현대 자동차 신차 생산 준비 공사 완료 공장 생산 재개 한화 재생 에너지 개발 확장 목적 지분 취득 규모 정비 촉진 구역 개발 정비 시공자 선정 지방 법원 회생 계획안 결정 방위 주관 근접 방어 무기 체계 체계 개발 협상 대상 업체 선정 남광 토건 아씨 규모 문경 주상 복합 신축 공사 계약 체결 주강 메탈 규모 공급 계약 체결 일양 약품 장내 매수 취득 투자 증권 송정 지구 신축 공사 행사 사업비 규모 대출 지급 보증 결정 플러스 종속 회사 에이 플러스 리얼 유동 확보 토지 건물 처분 코스닥 코스 복합 히아 함유 화장료 조성물 관련 특허 취득 법인 전지 활성 장비 공급 계약 체결 카페 인수 보도 사실 여부 조회 공시 요구 에스 법인 규모 전지 제조 장비 계약 체결 이오 규모 무상 증자 결정 브이 첨단 소재 주당 무상 증자 결정 대화 제약 보통주 현금 배당 결정 대창 스틸 종속 회사 대창 이티 재무 구조 개선 목적 토지 건축물 처분 경영 지배인 관련 배임 혐의 고소 종합 주식회사 규모 풍력 발전기 기자재 공급 계약 체결
2021-08-09,건설 규모 개발 수주,아파트 개동 상가 규모 건설 서금 재정 촉진 구역 개발 사업 선정 정비 업계 따르 서금 재정 촉진 구역 개발 사업 조합 선정 총회 조합원 찬반 투표 진행 건설 최종 선정 서금 구역 공사비 달하 올해 최대 규모 개발 사업 건설 서동 주택 상가 부지 개발 최고 개동 규모 가구 아파트 단지 탈바꿈 예정 건설 사업단 관계자 사업단 지지 조합원 감사 최고 명품 단지,아파트 개동 상가 규모 서금 재정 촉진 구역 개발 선정 정비 업계 서금 재정 촉진 구역 개발 조합 선정 총회 조합원 찬반 투표 진행 최종 선정 서금 구역 공사비 달하 최대 규모 개발 서동 주택 상가 부지 개발 최고 개동 규모 가구 아파트 단지 탈바꿈 예정 사업단 관계자 사업단 지지 조합원 감사 최고 명품 단지
2021-08-09,서금 재개발 건설,경제 건설 서금 재정 촉진 구역 개발 사업 조감도 선정 조합 차례 입찰 진행 건설 사업단 단독 참여 자동 유찰 이후 조합 계약 전환 건설 사업단 입찰 참여 향서 입찰 제안서 제출 협상 대상자 선정 서금 구역 공사비 달하 올해 최대 규모 개발 사업 건설 개발 최고 가구 아파트 단지 탈바꿈 예정 건설 대안 설계 제안 커튼 입면 특화 스카이라운지 차별 커뮤니티 시설 제시 관계자 지지 조합원 감사 최고 명품 단지,경제 서금 재정 촉진 구역 개발 조감도 선정 조합 차례 입찰 진행 사업단 단독 참여 자동 유찰 조합 계약 전환 사업단 입찰 참여 향서 입찰 제안서 제출 협상 대상자 선정 서금 구역 공사비 달하 최대 규모 개발 개발 최고 가구 아파트 단지 탈바꿈 예정 대안 설계 제안 커튼 입면 특화 스카이라운지 차별 커뮤니티 시설 제시 관계자 지지 조합원 감사 최고 명품 단지
2021-08-09,건설 규모 개발 수주,서금 구역 투시도 건설 제공 건설 서금 재정 촉진 구역 개발 사업 선정 서금 재정 촉진 구역 개발 사업 조합 선정 총회 조합원 찬반 투표 진행 건설 최종 선정 조합 차례 입찰 진행 건설 사업단 단독 참여 자동 유찰 이후 조합 계약 전환 건설 사업단 입찰 참여 향서 입찰 제안서 제출 협상 대상자 선정 서금 구역 공사비 달하 올해 최대 규모 개발 사업 지이 건설 서동 주택 상가 부지 개발 최고 개동 규모 가구 아파트 단지 탈바꿈 예정 건설 대안 설계 제안 커튼 입면 특화 스카이라운지 실내 수영장 프라이빗 영화관 차별 커뮤니티 시설 제시 조합원 호평 학원 유치 길이 연도 상가 특화 제안 기존 교육 상가 환경 개선 제안 최근 주안 구역 영통 지구 갈산 구역 수지 초교 획지 규모 개발 사업 수주 정비 사업 분야 입지 다지 건설 사업단 관계자 사업단 지지 조합원 감사 최고 명품 단지,서금 구역 투시도 제공 서금 재정 촉진 구역 개발 선정 서금 재정 촉진 구역 개발 조합 선정 총회 조합원 찬반 투표 진행 최종 선정 조합 차례 입찰 진행 사업단 단독 참여 자동 유찰 조합 계약 전환 사업단 입찰 참여 향서 입찰 제안서 제출 협상 대상자 선정 서금 구역 공사비 달하 최대 규모 개발 지이 서동 주택 상가 부지 개발 최고 개동 규모 가구 아파트 단지 탈바꿈 예정 대안 설계 제안 커튼 입면 특화 스카이라운지 실내 수영장 프라이빗 영화관 차별 커뮤니티 시설 제시 조합원 호평 학원 유치 길이 연도 상가 특화 제안 교육 상가 환경 개선 제안 주안 구역 영통 지구 갈산 구역 수지 초교 획지 규모 개발 수주 정비 분야 입지 다지 사업단 관계자 사업단 지지 조합원 감사 최고 명품 단지
2021-08-09,건설 규모 서금 구역 개발 수주,건설 서금 재정 촉진 구역 개발 사업 선정 따르 서금 재정 촉진 구역 개발 사업 조합 선정 총회 조합원 찬반 투표 진행 건설 최종 선정 서금 재정 촉진 구역 투시도 사진 조합 차례 입찰 진행 건설 사업단 단독 참여 자동 유찰 이후 조합 계약 전환 건설 사업단 입찰 참여 향서 입찰 제안서 제출 협상 대상자 선정 서금 구역 공사비 달하 올해 최대 규모 개발 사업 지로 건설 서동 주택 상가 부지 개발 최고 개동 규모 세대 아파트 단지 탈바꿈 예정 건설 대안 설계 제안 커튼 입면 특화 스카이라운지 실내 수영장 프라이빗 영화관 차별 커뮤니티 시설 제시 조합원 호평 학원 유치 길이 연도 상가 특화 제안 기존 교육 상가 환경 개선 제안 최근 주안 구역 영통 지구 갈산 구역 수지 초교 획지 규모 개발 사업 수주 정비 사업 분야 입지 다지 건설 사업단 관계자 사업단 지지 조합원 감사 최고 명품 단지,서금 재정 촉진 구역 개발 선정 서금 재정 촉진 구역 개발 조합 선정 총회 조합원 찬반 투표 진행 최종 선정 서금 재정 촉진 구역 투시도 사진 조합 차례 입찰 진행 사업단 단독 참여 자동 유찰 조합 계약 전환 사업단 입찰 참여 향서 입찰 제안서 제출 협상 대상자 선정 서금 구역 공사비 달하 최대 규모 개발 지로 서동 주택 상가 부지 개발 최고 개동 규모 세대 아파트 단지 탈바꿈 예정 대안 설계 제안 커튼 입면 특화 스카이라운지 실내 수영장 프라이빗 영화관 차별 커뮤니티 시설 제시 조합원 호평 학원 유치 길이 연도 상가 특화 제안 교육 상가 환경 개선 제안 주안 구역 영통 지구 갈산 구역 수지 초교 획지 규모 개발 수주 정비 분야 입지 다지 사업단 관계자 사업단 지지 조합원 감사 최고 명품 단지
2021-08-09,최대 재개발,서금 구역 건설 최대 개발 사업 지인 서금 구역 투시도 선정 서동 일대 주택 상가 부지 개발 서금 구역 최고 가구 규모 아파트 탈바꿈 예정 공사비 달하 규모 개발 사업 금사 구역 건설 플랜트 건설사 구성 컨소시엄 시공 조합 계약 해지 결정 조합 컨소시엄 제시 사업 떨어지 조합원 특화 설계 부족 이유 선정 조합 차례 입찰 진행 건설 컨소시엄 단독 참여 자동 유찰 이후 조합 계약 전환 컨소시엄 입찰 참여 향서 입찰 제안서 제출 협상 대상자 선정 컨소시엄 커튼 통유리 입면 특화 스카이라운지 설계 제안 더불 실내 수영장 영화관 고급 커뮤니티 시설 제시 조합원 호평 학원 길이 연도 상가 대로변 보행자 동선 조성 상가 제안,서금 구역 최대 개발 지인 서금 구역 투시도 선정 서동 일대 주택 상가 부지 개발 서금 구역 최고 가구 규모 아파트 탈바꿈 예정 공사비 달하 규모 개발 금사 구역 플랜트 구성 컨소시엄 시공 조합 계약 해지 결정 조합 컨소시엄 제시 떨어지 조합원 특화 설계 부족 이유 선정 조합 차례 입찰 진행 컨소시엄 단독 참여 자동 유찰 조합 계약 전환 컨소시엄 입찰 참여 향서 입찰 제안서 제출 협상 대상자 선정 컨소시엄 커튼 통유리 입면 특화 스카이라운지 설계 제안 더불 실내 수영장 영화관 고급 커뮤니티 시설 제시 조합원 호평 학원 길이 연도 상가 대로변 보행자 동선 조성 상가 제안
2021-08-09,건설 서금 구역 개발 수주,건설 서금 재정 촉진 구역 개발 사업 투시도 선정 서금 재정 촉진 구역 개발 사업 조합 선정 총회 조합원 찬반 투표 진행 건설 최종 선정 진행 차례 입찰 건설 사업단 단독 참여 자동 유찰 이후 조합 계약 전환 건설 사업단 입찰 참여 향서 입찰 제안서 제출 협상 대상자 선정 서금 구역 공사비 달하 올해 최대 규모 개발 사업 건설 서동 번지 일대 개발 최고 개동 규모 가구 아파트 공급 예정,서금 재정 촉진 구역 개발 투시도 선정 서금 재정 촉진 구역 개발 조합 선정 총회 조합원 찬반 투표 진행 최종 선정 진행 차례 입찰 사업단 단독 참여 자동 유찰 조합 계약 전환 사업단 입찰 참여 향서 입찰 제안서 제출 협상 대상자 선정 서금 구역 공사비 달하 최대 규모 개발 서동 번지 일대 개발 최고 개동 규모 가구 아파트 공급 예정
