date,Title,Content,tokens
2023-06-16,지분 늘리 오너 차기 회장 후보,세대 지주사 지분 승계 준비 본격 후계 구도 관심 기자 그룹 오너 지주사 지분 연이 늘리 동안 그룹 이끌 오너 경영 일선 시기 경영 승계 작업 풀이 가족 공동 경영 방식 유지 그룹 오너 회장 이어받 인물 관심 업계 따르 그룹 오너 일가 미래 사업 팀장 부사장 그룹 회장 장남 테일 부회장 자녀 지난달 지주사 주식 어치 통상 회장 장녀 허정 장남 양통 대표 이사 사장 지난달 투자 지분 사장 어치 주식 매입 지분 기존 돌림 오너 일가 오너 세대 다음 세대 오너 세대 공통점 그룹 전체 참여 가족 경영 방식 유지 오너 세대 경영 주도 지주사 지분 에너지 사장 명예 회장 건설 회장 인터내셔널 회장 그룹 회장 통상 회장 오너 비중 그룹 경영 회장 정년 앞두 슬하 아들 고려 그룹 차기 회장 오너 세대 가능 관측 회장 후보 텍스 회장 장남 텍스 사장 회장 장남 건설 사장 회장 차남 부사장 사장 그룹 주력 계열사 텍스 이끌 경영 경험 경륜 사장 부사장 그룹 이끌 경험 부족 목소리 오너 조부 손자 차기 회장 관심사 지분 계파 창업자 장남 통상 명예 회장 자녀 손자 보유 형제 회장 건설 명예 회장 지분 정도 그룹 회장 계파 연이 배출 그룹 영향력 분석 오너 세대 차세대 회장 거론 양통 사장 창업주 장손 텍스 통상 대표 이사 취임 그룹 회장 재계 관계자 그룹 경영 성과 차기 회장 승계 차기 회장 자체 논하 이르 가족 지분 관계 보이 회장 오너 경영인 경쟁 치열,세대 지주사 지분 승계 준비 본격 후계 구도 관심 그룹 오너 지주사 지분 연이 늘리 동안 그룹 이끌 오너 경영 일선 시기 경영 승계 작업 풀이 가족 공동 경영 방식 유지 그룹 오너 회장 이어받 인물 관심 업계 그룹 오너 일가 미래 사업 팀장 부사장 그룹 회장 장남 테일 부회장 자녀 지난달 지주사 주식 어치 통상 회장 장녀 허정 장남 양통 대표 이사 사장 지난달 투자 지분 사장 어치 주식 매입 지분 기존 돌림 오너 일가 오너 세대 다음 세대 오너 세대 공통점 그룹 전체 참여 가족 경영 방식 유지 오너 세대 경영 주도 지주사 지분 에너지 사장 명예 회장 회장 인터내셔널 회장 그룹 회장 통상 회장 오너 비중 그룹 경영 회장 정년 앞두 슬하 아들 고려 그룹 차기 회장 오너 세대 가능 관측 회장 후보 텍스 회장 장남 텍스 사장 회장 장남 사장 회장 차남 부사장 사장 그룹 주력 계열사 텍스 이끌 경영 경험 경륜 사장 부사장 그룹 이끌 경험 부족 목소리 오너 조부 손자 차기 회장 관심사 지분 계파 창업자 장남 통상 명예 회장 자녀 손자 보유 형제 회장 명예 회장 지분 정도 그룹 회장 계파 연이 배출 그룹 영향력 분석 오너 세대 차세대 회장 거론 양통 사장 창업주 장손 텍스 통상 대표 이사 취임 그룹 회장 재계 관계자 그룹 경영 성과 차기 회장 승계 차기 회장 자체 논하 이르 가족 지분 관계 보이 회장 오너 경영인 경쟁 치열
2023-06-16,노후 주택 비율 지방 아파트 선호 현상,전국 아파트 시장 입주 노후 아파트 절반 육박 새롭 선보이 단지 이목 쏠리 실제 부동산 자료 기준 전국 아파트 임대 제외 가구 입주 이상 노후 단지 가구 가구 가구 입주 이상 노후 아파트 수도 대비 신규 아파트 공급 지방 광역시 아파트 노후화 부동산 자료 따르 지방 광역시 노후 아파트 이상 비율 기준 전국 아파트 노후 비율 대비 모습 지방 광역시 노후화 지역 기록 광역시 지역 상황 이렇 광역시 분양 신규 단지 관심 수요자 일례 올해 분양 상무 자이 가구 특별 공급 제외 모집 수요자 몰리 평균 경쟁 기록 올해 분양 델타 시티 푸르 가구 특별 공급 제외 모집 청약 몰리 평균 청약 경쟁 기록 업계 관계자 지방 광역시 아파트 후도 심화 환경 아파트 선호 수요자 직주 근접 조건 갖추 주변 인프라 지역 입지 단지 관심 투시도 가운데 건설 일대 분양 예정 건설 공동 시공 지하 지상 전용 면적 가구 규모 조성 중심 불리 산신 도시 생활 편리 주거 생활 가능 갤러리 백화점 백화점 트레이더 박스 다양 시설 이용 생활 편리 행정 타운 시청 교육청 검찰청 경찰청 각종 공공 기관 금융 기관 이용 대학교 병원 가깝 보라매 공원 공원 공원 생활 여가 생활 운초 괴정 학교 도보 위치 전국 인기 학원 이용 우수 교육 여건 편리 교통 환경 기대 이용 편리 지하철 방역 이용 역세 입지 지선 고속도 진입 인근 공공 기관 다수 대학교 직주 근접 입지 평가 국가 후보지 지정 국가 개발 완료 주거 배후 수요 예상 입주민 편의 커뮤니티 시설 예정 계절 편리 이용 가능 영장 실내 골프 연습장 피트 니스 클럽 탁구장 스포츠 시설 자녀 도서관 독서실 교육 시설 입주민 카페테리아 마련 예정 상품 기대 남향 위주 남동 남서 배치 채광 일부 타입 양면 개방 개방 특화 설계 적용 개방 극대 한편 입주 예정 홍보 일원 운영,전국 아파트 시장 입주 노후 아파트 절반 육박 새롭 선보이 단지 이목 쏠리 실제 부동산 자료 기준 전국 아파트 임대 제외 가구 입주 이상 노후 단지 가구 가구 가구 입주 이상 노후 아파트 수도 대비 신규 아파트 공급 지방 광역시 아파트 노후화 부동산 자료 지방 광역시 노후 아파트 이상 비율 기준 전국 아파트 노후 비율 대비 모습 지방 광역시 노후화 지역 기록 광역시 지역 상황 이렇 광역시 분양 신규 단지 관심 수요자 일례 분양 상무 자이 가구 특별 공급 제외 모집 수요자 몰리 평균 경쟁 기록 분양 델타 시티 푸르 가구 특별 공급 제외 모집 청약 몰리 평균 청약 경쟁 기록 업계 관계자 지방 광역시 아파트 후도 심화 환경 아파트 선호 수요자 직주 근접 조건 갖추 주변 인프라 지역 입지 단지 관심 투시도 가운데 일대 분양 예정 공동 시공 지하 지상 전용 면적 가구 규모 조성 중심 불리 산신 도시 생활 편리 주거 생활 가능 갤러리 백화점 백화점 트레이더 박스 다양 시설 이용 생활 편리 행정 타운 시청 교육청 검찰청 경찰청 각종 공공 기관 금융 기관 이용 대학교 병원 가깝 보라매 공원 공원 공원 생활 여가 생활 운초 괴정 학교 도보 위치 전국 인기 학원 이용 우수 교육 여건 편리 교통 환경 기대 이용 편리 지하철 방역 이용 역세 입지 지선 고속도 진입 인근 공공 기관 다수 대학교 직주 근접 입지 평가 국가 후보지 지정 국가 개발 완료 주거 배후 수요 예상 입주민 편의 커뮤니티 시설 예정 계절 편리 이용 가능 영장 실내 골프 연습장 피트 니스 클럽 탁구장 스포츠 시설 자녀 도서관 독서실 교육 시설 입주민 카페테리아 마련 예정 상품 기대 남향 위주 남동 남서 배치 채광 일부 양면 개방 개방 특화 설계 적용 개방 극대 한편 입주 예정 홍보 일원 운영
2023-06-16,트리 세대 분리 평면 실용 특화 설계 경쟁,천편일률 구조 탈피 실수요자 겨냥 공간 효율 주거 만족 조감도 사진 건설 제공 기자 실수요자 겨냥 아파트 특화 설계 경쟁 치열 실용 높이 설계 평면 첨단 시스템 주거 만족도 끌어올리 모습 분양 업계 따르 최근 특화 설계 천편일률 구조 탈피 공간 효율 알파 개방 극대 층고 트리 드레스 수납공간 라이프 스타일 평면 타입 실수요자 높이 주력 모습 분양 시장 특화 설계 단지 관심 산원 청약 자료 따르 이달 일원 분양 가구 가구 독립 거주 세대 분리 타입 개방 활용 옥외 공간 오픈 발코니 타입 독립 형태 거주 가능 타입 선택 단지 평균 경쟁 기록 순위 마감 성공 일원 분양 절역 산위 수납 공간 공간 활용 높이 드레스 트리 단지 순위 평균 기록 정당 계약 기간 동안 성공 특화 설계 단지 분양 침체기 두각 지난해 일원 공급 저감 특화 설계 클린 최초 가구 독립 거주 프라이버시 보호 가능 세대 분리 평면 적용 단지 순위 청약 타입 마감 성공 업계 관계자 특화 설계 입주민 편의 만족도 직접 영향 끼치 주거지 선택 요소 최근 실내 공간 니즈 건설사 특화 설계 승부수 던지 차별 신규 단지 필요 가운데 특화 설계 적용 신규 단지 눈길 건설 이달 일원 자양 재정 촉진 구역 도시 정비 개발 정비 사업 분양 예정 수요자 다양 생활 패턴 테라스 특화 타입 달하 주택 건설 이달 일원 분양 예정 남향 위주 남동 남서 배치 채광 일부 타입 양면 개방 개방 특화 설계 적용 개방 극대 커뮤니티 시설 수영장 실내 골프 연습장 피트 니스 클럽 탁구장 도서관 독서실 카페테리아 이달 일원 세상 원주 프리 모원 분양 예정 최초 세상 기술 상품 디자인 철학 집약 주거 플랫폼 특화 설계 적용 외부 스마트 클린 도입 공기 유지 스테이션 설치 상태 확인 가능 현대 건설 컨소시엄 탕정 지구 일원 분양 타입 알파 복도 주방 트리 구성 라이프 스타일 공간 활용 가능 특화 평면 타입 소형 타입 이상 트리 구성 수납공간 구성 타입 최대 트리 구성 공간 활용 극대,천편일률 구조 탈피 실수요자 겨냥 공간 효율 주거 만족 조감도 제공 실수요자 겨냥 아파트 특화 설계 경쟁 치열 실용 높이 설계 평면 첨단 시스템 주거 만족도 끌어올리 모습 분양 업계 특화 설계 천편일률 구조 탈피 공간 효율 알파 개방 극대 층고 트리 드레스 수납공간 라이프 스타일 평면 실수요자 높이 주력 모습 분양 시장 특화 설계 단지 관심 산원 청약 자료 이달 일원 분양 가구 가구 독립 거주 세대 분리 개방 활용 옥외 공간 오픈 발코니 독립 형태 거주 가능 선택 단지 평균 경쟁 기록 마감 성공 일원 분양 절역 산위 수납 공간 공간 활용 높이 드레스 트리 단지 평균 기록 정당 계약 기간 동안 성공 특화 설계 단지 분양 침체기 두각 일원 공급 저감 특화 설계 클린 최초 가구 독립 거주 프라이버시 보호 가능 세대 분리 평면 적용 단지 청약 마감 성공 업계 관계자 특화 설계 입주민 편의 만족도 직접 영향 끼치 주거지 선택 요소 실내 공간 니즈 특화 설계 승부수 던지 차별 신규 단지 필요 가운데 특화 설계 적용 신규 단지 눈길 이달 일원 자양 재정 촉진 구역 도시 정비 개발 정비 사업 분양 예정 수요자 다양 생활 패턴 테라스 특화 달하 주택 이달 일원 분양 예정 남향 위주 남동 남서 배치 채광 일부 양면 개방 개방 특화 설계 적용 개방 극대 커뮤니티 시설 수영장 실내 골프 연습장 피트 니스 클럽 탁구장 도서관 독서실 카페테리아 이달 일원 세상 원주 프리 모원 분양 예정 최초 세상 기술 상품 디자인 철학 집약 주거 플랫폼 특화 설계 적용 외부 스마트 클린 도입 공기 유지 스테이션 설치 상태 확인 가능 현대 컨소시엄 탕정 지구 일원 분양 알파 복도 주방 트리 구성 라이프 스타일 공간 활용 가능 특화 평면 소형 이상 트리 구성 수납공간 구성 최대 트리 구성 공간 활용 극대
2023-06-16,실수요자 주거 만족 높이 특화 설계 경쟁,테라스 수납공간 신규 청약 시장 인기 수요자 취향 편의 고려 설계 중요 요소 자리매김 오희 기자 실수요자 주거 트렌드 특화 설계 아파트 분양 시장 눈길 조감도 사진 건설 산원 청약 자료 따르 이달 일원 분양 가구 가구 독립 거주 세대 분리 타입 개방 활용 옥외 공간 오픈 발코니 타입 독립 형태 거주 가능 타입 선택 단지 평균 경쟁 기록 순위 마감 성공 일원 분양 절역 산위 수납 공간 공간 활용 높이 드레스 트리 단지 순위 평균 기록 정당 계약 기간 동안 성공 가운데 특화 설계 적용 신규 건설 이달 일원 자양 재정 촉진 구역 도시 정비 개발 정비 사업 분양 예정 지하 지상 최고 가구 규모 전용 면적 가구 일반 분양 수요자 다양 생활 패턴 테라스 특화 타입 달하 주택 건설 숭어리 주택 건축 정비 사업 일원 분양 예정 지하 지상 전용 면적 가구 규모 조성 남향 위주 남동 남서 배치 채광 일부 타입 양면 개방 개방 특화 설계 적용 개방 극대 일원 세상 원주 프리 모원 분양 예정 지하 지상 전용 면적 가구 규모 이번 회차 분양 전용 면적 가구 구성 현대 건설 컨소시엄 탕정 지구 일원 분양 타입 소형 타입 이상 트리 구성 수납공간 구성 타입 최대 트리 구성 공간 활용 극대 업계 관계자 특화 설계 입주민 편의 만족도 직접 영향 끼치 주거지 선택 요소 최근 실내 공간 니즈 건설사 특화 설계 승부수 던지 차별 신규 단지 필요,테라스 수납공간 신규 청약 시장 인기 수요자 취향 편의 고려 설계 중요 요소 자리매김 오희 실수요자 주거 트렌드 특화 설계 아파트 분양 시장 눈길 조감도 산원 청약 자료 이달 일원 분양 가구 가구 독립 거주 세대 분리 개방 활용 옥외 공간 오픈 발코니 독립 형태 거주 가능 선택 단지 평균 경쟁 기록 마감 성공 일원 분양 절역 산위 수납 공간 공간 활용 높이 드레스 트리 단지 평균 기록 정당 계약 기간 동안 성공 가운데 특화 설계 적용 신규 이달 일원 자양 재정 촉진 구역 도시 정비 개발 정비 사업 분양 예정 지하 지상 최고 가구 규모 전용 면적 가구 일반 분양 수요자 다양 생활 패턴 테라스 특화 달하 주택 숭어리 주택 건축 정비 사업 일원 분양 예정 지하 지상 전용 면적 가구 규모 조성 남향 위주 남동 남서 배치 채광 일부 양면 개방 개방 특화 설계 적용 개방 극대 일원 세상 원주 프리 모원 분양 예정 지하 지상 전용 면적 가구 규모 회차 분양 전용 면적 가구 구성 현대 컨소시엄 탕정 지구 일원 분양 소형 이상 트리 구성 수납공간 구성 최대 트리 구성 공간 활용 극대 업계 관계자 특화 설계 입주민 편의 만족도 직접 영향 끼치 주거지 선택 요소 실내 공간 니즈 특화 설계 승부수 던지 차별 신규 단지 필요
2023-06-16,교통망 혁신 수혜 누리 북천 전용 계약,건설 북천 분양 가운데 최근 규모 교통망 혁신 계획 발표 수혜 단지 주목 건설 따르 국도 국지 계획 발표 국도 국지 계획 사업 예산 투입 도로 접근성 개선 사업 사업비 편성 국도 국지 구간 도로망 빠르 신설 확충 예정 지난해 설계 용역 착수 성거 목천 신설 사업 추진 목천 청삼 교차로 구간 확장 그간 경사 교통사고 위험 북면 입장 국지 사업 투입 구간 개량 북천 투시도 국지 착공 시작 완공 예정 장면 도로 이달 착공 국지 우회 내년 완공 목표 공사 이번 도로 계획 사업 이동 편의 지역 전반 가치 기대 업계 전문가 수도 맞닿 지리 이점 가지 토대 빠르 발전 이번 도로 계획 수도 접근성 개선 수도 직장 출퇴근 수요 기업 유입 도로 사업 완공 북천 가치 전망 서북 성거 우회 도로 개통 예정 연결 주요 도심 접근성 향상 상습 정체 구간 지방도 교통량 분산 효과 기대 망향 지방도 도로 교통망 형성 시내 이동 가능 수도 지하철 정역 수도 이동 편리 이용 서초 심지 이동 가능 이용 대면 도착 가능 활용 최소 이동 가능 북천 주변 대학교 위치 달하 배후 수요 서북 성거 우회 도로 도로 개발 사업 개통 직주 근접 범위 확대 보이 임차 수요 대부분 소형 평형 선호 투자자 사이 전용 인기 예상 일반 산업 파크 산업 디스플레이 가깝 거리 성거 일반 조성 비용 투입 성거 목재 나무 제품 제조업 화학 물질 화학제품 제조업 금속 제조업 다양 업종 입주 가능 인구 유입 경제 활성 효과 기대 상황 최근 이전 종축장 부지 국가 신규 국가 최종 선정 시선 미래 모빌리티 국가 산단 사업비 투입 첨단 예정 가운데 북천 의무 임대 종료 전환 계약 임대차 기간 종료 분양 자격 미달 세대 발생 잔여 물량 일부 분양 현재 전용 타입 잔여 세대 선착순 지정 계약 진행 이번 분양 분양 분양 장점 단지 평균 분양 지난해 아파트 평균 분양 비교 절반 수준 공급 경쟁력 분양 임대 사업자 투자 상품 초반 공급 전용 타입 경우 공시 가격 미만 취득세 대상 배제 기본 세율 적용 이상 주택 법인 명의 취득 취득세 적용 비교 세율 계약 전매 가능 잔금 납부 입주 가능 북천 사항 홈페이지 안내 생활 경제,북천 분양 가운데 규모 교통망 혁신 계획 발표 수혜 단지 주목 국도 국지 계획 발표 국도 국지 계획 사업 예산 투입 도로 접근성 개선 사업 사업비 편성 국도 국지 구간 도로망 빠르 신설 확충 예정 설계 용역 착수 성거 목천 신설 사업 추진 목천 청삼 교차로 구간 확장 그간 경사 교통사고 위험 북면 입장 국지 사업 투입 구간 개량 북천 투시도 국지 착공 시작 완공 예정 장면 도로 이달 착공 국지 우회 내년 완공 목표 공사 도로 계획 사업 이동 편의 지역 전반 가치 기대 업계 전문가 수도 맞닿 지리 이점 가지 토대 빠르 발전 도로 계획 수도 접근성 개선 수도 직장 출퇴근 수요 기업 유입 도로 사업 완공 북천 가치 전망 서북 성거 우회 도로 개통 예정 연결 주요 도심 접근성 향상 상습 정체 구간 지방도 교통량 분산 효과 기대 망향 지방도 도로 교통망 형성 시내 이동 가능 수도 지하철 정역 수도 이동 편리 이용 서초 심지 이동 가능 이용 대면 도착 가능 활용 최소 이동 가능 북천 주변 대학교 위치 달하 배후 수요 서북 성거 우회 도로 도로 개발 사업 개통 직주 근접 범위 확대 보이 임차 수요 대부분 소형 평형 선호 투자자 사이 전용 인기 예상 일반 산업 파크 산업 디스플레이 가깝 거리 성거 일반 조성 비용 투입 성거 목재 나무 제품 제조업 화학 물질 화학제품 제조업 금속 제조업 다양 업종 입주 가능 인구 유입 경제 활성 효과 기대 상황 이전 종축장 부지 국가 신규 국가 최종 선정 시선 미래 모빌리티 국가 산단 사업비 투입 첨단 예정 가운데 북천 의무 임대 종료 전환 계약 임대차 기간 종료 분양 자격 미달 세대 발생 잔여 물량 일부 분양 현재 전용 잔여 세대 선착순 지정 계약 진행 분양 분양 분양 장점 단지 평균 분양 아파트 평균 분양 비교 절반 수준 공급 경쟁력 분양 임대 사업자 투자 상품 초반 공급 전용 공시 가격 미만 취득세 대상 배제 기본 세율 적용 이상 주택 법인 명의 취득 취득세 적용 비교 세율 계약 전매 가능 잔금 납부 입주 가능 북천 사항 홈페이지 안내 생활 경제
2023-06-16,단독 최대 광장 극동 안전 진단 통과 대형 건설사 각축장 예고,대장 평가 광장 극동 아파트 건축 신호탄 구청 따르 이날 광장 극동 아파트 정밀 안전 진단 용역 시행 결과 평가 등급 등급 성능 점수 재건축 확정 정밀 안전 진단 적정 검토 차례 고배 이후 국토 안전 진단 기준 변경 이후 최종 안전 진단 통과 최초 지역 강변 아파트 단지 준공 준공 조성 가구 단지 지하철 연결 역세 입지 다수 가구 조망 누리 남초 이어지 학군 광장 극동 아파트 재건축 추진 준비 위원회 위원장 통합 재건축 진행 기준 재건축 절차 주민 건축 의지 강하 정부 정비 사업 활성 지원 환경 개선 빠르 기대 정비 구역 신청 다음 도시 계획 회사 설계 건축 회사 법인 참여 명회 안전 진단 추진 비용 모금 완료 정비 구역 신청서 빠르 제출 내다보 단지 지난달 전용 면적 거래 지난해 최고가 대비 하락 직전 비교 가량 수준 호가 형성 현대 건설 건설 플랜트 대형 건설사 관심 보이 현대 건설 브랜드 디에이치 적용 홍보전 예정 플랜트 구획 맞대 광장 아파트 연계 강변 브랜드 타운 형성 계획 밝히 수주 적극 예상,대장 평가 광장 극동 아파트 건축 신호탄 구청 이날 광장 극동 아파트 정밀 안전 진단 용역 시행 결과 평가 등급 등급 성능 점수 재건축 확정 정밀 안전 진단 적정 검토 차례 고배 국토 안전 진단 기준 변경 최종 안전 진단 통과 최초 지역 강변 아파트 단지 준공 준공 조성 가구 단지 지하철 연결 역세 입지 다수 가구 조망 누리 남초 이어지 학군 광장 극동 아파트 재건축 추진 준비 위원회 위원장 통합 재건축 진행 기준 재건축 절차 주민 건축 의지 강하 정부 정비 사업 활성 지원 환경 개선 빠르 기대 정비 구역 신청 다음 도시 계획 회사 설계 건축 회사 법인 참여 명회 안전 진단 추진 비용 모금 완료 정비 구역 신청서 빠르 제출 내다보 단지 지난달 전용 면적 거래 최고가 대비 하락 직전 비교 가량 수준 호가 형성 현대 플랜트 대형 관심 보이 현대 브랜드 디에이치 적용 홍보전 예정 플랜트 구획 맞대 광장 아파트 연계 강변 브랜드 타운 형성 계획 밝히 수주 적극 예상
2023-06-16,트리 실용 특화 설계 경쟁,자이 오픈 발코니 절역 산위 드레스 설계 차별 공급 건설업 아파트 브랜드 특화 설계 경쟁 치열 편의 수납공간 오픈 발코니 구조 변형 가변 설계 선택지 제시 입주자 취향 적극 반영 노력 산원 청약 따르 지난달 순위 청약 경기 가구 모집 평균 경쟁 기록 동안 상대 분양 성적 부진 파주 정신 도시 공급 단지 청약 화제 개통 수도 노선 호재 다양 특화 설계 영향 풀이 가구 독립 거주 세대 분리 타입 개방 활용 옥외 공간 타입 오픈 발코니 타입 다양 평면 제시 지난달 공급 절역 산위 순위 청약 경쟁 수납 공간 공간 활용 높이 드레스 트리 수납공간 주효 분석 이달 특화 설계 적용 신규 단지 잇달 분양 건설 가구 가구 전용 일반 분양 수요자 다양 요구 테라스 특화 타입 주택 구성 세상 원주 프리 모원 투시도 내놓 세상 특화 설계 적용 안방 주방 화장실 최소한 내력벽 공간 자유 가변 구조 특징 방과 사이 거실 수요자 구조 건설 이달 분양 예정 개방 일부 타입 양면 개방 개방 특화 설계 적용,자이 오픈 발코니 절역 산위 드레스 설계 차별 공급 건설업 아파트 브랜드 특화 설계 경쟁 치열 편의 수납공간 오픈 발코니 구조 변형 가변 설계 선택지 제시 입주자 취향 적극 반영 노력 산원 청약 지난달 청약 경기 가구 모집 평균 경쟁 기록 동안 상대 분양 성적 부진 파주 정신 도시 공급 단지 청약 화제 개통 수도 노선 호재 다양 특화 설계 영향 풀이 가구 독립 거주 세대 분리 개방 활용 옥외 공간 오픈 발코니 다양 평면 제시 지난달 공급 절역 산위 청약 경쟁 수납 공간 공간 활용 높이 드레스 트리 수납공간 주효 분석 이달 특화 설계 적용 신규 단지 잇달 분양 가구 가구 전용 일반 분양 수요자 다양 요구 테라스 특화 주택 구성 세상 원주 프리 모원 투시도 내놓 세상 특화 설계 적용 안방 주방 화장실 최소한 내력벽 공간 자유 가변 구조 특징 방과 사이 거실 수요자 구조 이달 분양 예정 개방 일부 양면 개방 개방 특화 설계 적용
