date,Title,Content,tokens
2021-08-19,재건축 대어 맨션 사업 시행 임박,이달 다음 대형 건설사 시공 경쟁 치열 가구 재건축 대어 꼽히 맨션 빠르 이달 사업 시행 단지 대형 건설사 시공 확보 경쟁 치열 촌동 최근 이슈 가격 급등 추세 구청 따르 맨션 이르 이달 내달 사업 시행 앞두 구청 관계자 각종 영향 평가 마무리 부서 협의 협의 빠르 진행 이달 정상 진행 다음 사업 시행 단지 사업 시행 계획 주민 공람 공원 조성 계획 열람 공고 마치 사업 시행 예상 예정 부서 협의 사업 지체 공해 올해 입주 단지 분양 우리나라 최초 중산 아파트 남쪽 북쪽 공원 최고 입지 평가 최고 입지 재건축 추진 위원회 결성 주민 갈등 조합 설립 어린이 놀이터 공유지 문제 일몰 적용 문제 발목 이후 놀이터 소송 소유주 승소 일몰 적용 제외 해석 나오 사업 탄력 시작 맨션 용적 재건축 사업 재건축 완료 개동 가구 가구 탄생 재건축 속도 기존 주택 가격 인근 중개업 대표 맨션 전용 올해 거래 호가 매물 한편 시공 대형 건설사 경쟁 치열 진행 사업 명회 건설 현대 엔지니어링 건설 참석 인근 중개업 관계자 건설 관계자 선정 열의 실제 채널 맨션 개설 올해 수주 전략 맨션 최우선 순위 건설 선정 차별 적극 참여 예정 일대 아파트 바람 변모 꾀하 맨션 이주 시작 가구 전망 아파트 조합 설립 단지 통합 준비 강촌 아파트 주민 동의 조합 창립 총회 예정 뒤늦 사업 뛰어들 최근 동의 사업 추진 속도 인근 중개업 대표 강촌 아파트 전용 거래 호가가 웃돌 뒤늦 시작 지난달 직전 거래,이달 다음 대형 시공 경쟁 치열 가구 재건축 대어 꼽히 맨션 빠르 이달 시행 단지 대형 시공 확보 경쟁 치열 촌동 이슈 가격 급등 추세 구청 맨션 이르 이달 내달 시행 앞두 구청 관계자 각종 영향 평가 마무리 부서 협의 협의 빠르 진행 이달 정상 진행 다음 시행 단지 시행 계획 주민 공람 공원 조성 계획 열람 공고 마치 시행 예상 예정 부서 협의 지체 공해 입주 단지 분양 우리나라 최초 중산 아파트 남쪽 북쪽 공원 최고 입지 평가 최고 입지 재건축 추진 위원회 결성 주민 갈등 조합 설립 어린이 놀이터 공유지 문제 일몰 적용 문제 발목 놀이터 소송 소유주 승소 일몰 적용 제외 해석 나오 탄력 시작 맨션 용적 재건축 재건축 완료 개동 가구 가구 탄생 재건축 속도 주택 가격 인근 중개업 맨션 전용 거래 호가 매물 한편 시공 대형 경쟁 치열 진행 명회 현대 엔지니어링 참석 인근 중개업 관계자 관계자 선정 열의 실제 채널 맨션 개설 수주 전략 맨션 최우선 순위 선정 차별 적극 참여 예정 일대 아파트 바람 변모 꾀하 맨션 이주 시작 가구 전망 아파트 조합 설립 단지 통합 준비 강촌 아파트 주민 동의 조합 창립 총회 예정 뒤늦 뛰어들 동의 추진 속도 인근 중개업 강촌 아파트 전용 거래 호가가 웃돌 뒤늦 시작 지난달 직전 거래
2021-08-20,명예 회장 퇴직금 비밀,재벌 총수 재직 연봉 현직 보수 은퇴 노후 자금 일반인 경우 근속 경우 수준 총수 기본 자릿수 퇴직금 수령 일반인 마법 퇴직금 계산법 적용 은퇴 총수 퇴직금 역대 기업 분기 보고서 따르 그룹 명예 회장 퇴직금 올해 상반기 급여 퇴직 소득 수령 지급 퇴직금 명예 회장 지난해 아들 회장 바통 넘기 경영 일선 올해 마지막 등기 이사 내려놓 그룹 경영 부족 노후 자금 보통 일반인 자리 연연 그룹 명예 회장 명예 회장 경영 승계 그룹 일반인 오랫동안 근속 연수 이상 근속 퇴직금 재계 그룹 명예 회장 역대 최대 퇴직금 기록 경신 종전 최대 퇴직금 그룹 회장 회장 퇴직금 근속 연수 육박 은퇴 선언 회장 역대 퇴직금 액수 기록 회장 트리 생명 과학 글로벌 퇴직금 수령 보사 사태 발목 생명 과학 퇴직금 논란 일기 그룹 계열사 근속 기간 글로벌 대표 이사 재직 기간 트리 퇴직 소득 임기 자리 그룹 회장 퇴직금 회장 근속 연수 일반 총수 건설 회장 재직 향후 최소 퇴직금 추가 전망 그룹 회장 이어받 회장 쇼핑 직함 퇴직금 동안 몸담 쇼핑 수령 일반인 마법 퇴직금 계산법 총수 한도 제한 퇴직금 계산법 적용 천문학 퇴직금 챙기 일반인 경우 법정 퇴직금 적용 퇴사 직전 평균 임금 근속 연수 계산 은퇴 평균 임금 근속 퇴직금 상무 이상 임원 직급 지급 일반인 월급 퇴직금 정산 오너 경우 임원 직급 지급 이상 계산 마법 지급 덕분 퇴직금 액수 상상 초월 명예 회장 경우 평균 급여 기간 지급 계산 경영진 인사 처우 규정 의거 직급 지급 산출 설명 직급 지급 그룹 명예 회장 일반인 연봉 총수 직급 지급 퇴직금 눈덩이 불어나 직급 지급 퇴직금 수령 한도 총수 장악 이사회 승인 결정 근로 기준 적용 퇴직금 지급 방식 마법 지급 가능 직급 지급 기업 오너 경우 최소 이상 책정 회장 경우 기준 급여 재임 기간 이사회 승인 직위 지급 결정 설명 회장 지급 회장 회장 퇴직금 과하 지적 트리 경우 임원 퇴직금 규정 보수 재직 기간 직급 지급 배수 퇴직금 지급 트리 분할 설립 회장 재직 기간 트리 이상 직급 지급 퇴직금 정산 논란 월급 이상 월급 퇴직금 쌓이 기자,재벌 총수 재직 연봉 현직 보수 은퇴 노후 자금 일반인 경우 근속 경우 수준 총수 기본 자릿수 퇴직금 수령 일반인 마법 퇴직금 계산법 적용 은퇴 총수 퇴직금 역대 기업 보고서 그룹 명예 퇴직금 급여 퇴직 소득 수령 지급 퇴직금 명예 아들 바통 넘기 경영 일선 마지막 등기 내려놓 그룹 경영 부족 노후 자금 보통 일반인 자리 연연 그룹 명예 명예 경영 승계 그룹 일반인 오랫동안 근속 연수 이상 근속 퇴직금 재계 그룹 명예 역대 최대 퇴직금 기록 경신 종전 최대 퇴직금 그룹 퇴직금 근속 연수 육박 은퇴 선언 역대 퇴직금 액수 기록 트리 생명 과학 글로벌 퇴직금 수령 보사 사태 발목 생명 과학 퇴직금 논란 일기 그룹 계열사 근속 기간 글로벌 재직 기간 트리 퇴직 소득 임기 자리 그룹 퇴직금 근속 연수 총수 재직 향후 최소 퇴직금 추가 전망 그룹 이어받 쇼핑 직함 퇴직금 동안 몸담 쇼핑 수령 일반인 마법 퇴직금 계산법 총수 한도 제한 퇴직금 계산법 적용 천문학 퇴직금 챙기 일반인 경우 법정 퇴직금 적용 퇴사 직전 평균 임금 근속 연수 계산 은퇴 평균 임금 근속 퇴직금 이상 직급 지급 일반인 월급 퇴직금 정산 오너 경우 직급 지급 이상 계산 마법 지급 덕분 퇴직금 액수 상상 초월 명예 경우 평균 급여 기간 지급 계산 경영진 인사 처우 규정 의거 직급 지급 산출 설명 직급 지급 그룹 명예 일반인 연봉 총수 직급 지급 퇴직금 눈덩이 불어나 직급 지급 퇴직금 수령 한도 총수 장악 이사회 승인 결정 근로 기준 적용 퇴직금 지급 방식 마법 지급 직급 지급 기업 오너 경우 최소 이상 책정 경우 기준 급여 재임 기간 이사회 승인 직위 지급 결정 설명 지급 퇴직금 과하 지적 트리 경우 퇴직금 규정 보수 재직 기간 직급 지급 배수 퇴직금 지급 트리 분할 설립 재직 기간 트리 이상 직급 지급 퇴직금 정산 논란 월급 이상 월급 퇴직금 쌓이
2021-08-20,연간 상승 대부분 반납 대형 건설사 주가 낙폭 과도,투자 증권 보고서 분양 전환 공사 매출 미치 영향 유준 기자 건설업 지수 이후 가운데 금속 다음 낙폭 기록 최근 시장 약세 감안 대형 건설사 주가 하락 전문가 분석 투자 증권 연구원 지수 대비 포인트 추가 하락 건설 건설업 지수 구성 일부 형사 주가 올해 연간 상승 대부분 반납 최근 시장 약세 여건 감안 주가 하락 과도 국내 주택 공급 우상 국면 진입 유가 상승 발주 시장 회복 상반기 건설사 주가 강세 이끌 주요 투자 포인트 현재 유효 분석 대형 건설사 외형 증가 수익 개선 주도 국내 주택 건설 부문 중심 시장 우려 요소 분양 전환 공사 매출 미치 영향 견해 연구원 최근 일부 정비 사업 중심 분양 방식 공급 논의 결론 조합 부담 리스크 고려 경우 분양 가능 판단 분양 전환 경우 시행 공사 매출 영향 설명 분양 상한 적용 정비 사업 분양 전환 검토 이유 택지 상승 일반 분양 분양 시점 책정 기대감 연구원 설명 분양 공급 시기 골조 공사 이상 진행 시점 원가 투입 필수 일반 분양 차이 공사 매출 발생 준공 미분양 해소 가능 최근 공급 일부 단지 순위 청약률 미달 미분양 리스크 대두 연구원 아파트 준공 발생 미분양 사례 이번 발생 준공 미분양 세대 해소 가능 순위 약자 추첨제 방식 수분 양자 선정 과정 사례 분류 준공 미분양 세대 발생 해석,투자 증권 보고서 분양 전환 공사 매출 미치 영향 유준 건설업 지수 가운데 금속 다음 낙폭 기록 시장 약세 감안 대형 주가 하락 전문가 분석 투자 증권 연구원 지수 포인트 추가 하락 건설업 지수 구성 일부 형사 주가 연간 상승 대부분 반납 시장 약세 여건 감안 주가 하락 과도 국내 주택 공급 우상 국면 진입 유가 상승 발주 시장 회복 주가 강세 이끌 주요 투자 포인트 현재 유효 분석 대형 외형 증가 수익 개선 주도 국내 주택 부문 중심 시장 우려 요소 분양 전환 공사 매출 미치 영향 견해 연구원 일부 정비 중심 분양 방식 공급 논의 결론 조합 부담 리스크 고려 경우 분양 판단 분양 전환 경우 시행 공사 매출 영향 설명 분양 상한 적용 정비 분양 전환 검토 이유 택지 상승 분양 분양 시점 책정 기대감 연구원 설명 분양 공급 시기 골조 공사 이상 진행 시점 원가 투입 필수 분양 차이 공사 매출 발생 준공 미분양 해소 공급 일부 단지 순위 청약률 미달 미분양 리스크 대두 연구원 아파트 준공 발생 미분양 사례 발생 준공 미분양 세대 해소 순위 약자 추첨제 방식 수분 양자 선정 과정 사례 분류 준공 미분양 세대 발생 해석
2021-08-20,규제 지역 아파트 희소가치 기대 홍성 자이 공급,지방 도시 노후 주택 비율 아파트 수요자 관심 노후 주택 비율 지역 아파트 기존 아파트 특화 설계 조경 규모 커뮤니티 시설 적용 경우 프리미엄 기대 지방 도시 입주 초과 아파트 비율 노후 주택 밀집 지역 신규 분양 아파트 성적 거두 지난해 일대 분양 양학 신원 아침 도시 시아 순위 청약 평균 최고 경쟁 기록 단지 노후 단지 지역 준공 이상 노후 아파트 비율 전체 가구 대비 초과 노후 아파트 비율 수준 지역 규제 수혜 지역 관심 신규 분양 아파트 경쟁 기록 공급 모종 순위 청약 평균 최고 경쟁 기록 분양 평균 경쟁 마감 성공 아파트 선호도 입주 미만 아파트 프리미엄 형성 리브 자료 따르 입주 장성 전용 시세 중위 평균 기준 매매 비교 상승 업계 관계자 노후 아파트 지역 아파트 갈아타 원하 대기 수요 아파트 희소가치 향후 지역 시세 이끄 자리매김 가능 홍성 자이 조감도 가운데 건설 홍성 자이 아파트 홍성 자이 분양 소식 단지 지하 지상 가구 규모 전용 면적 구성 이상 노후 비율 육박 아파트 관심 장항선 복선 전철 개통 예정 홍성 역세 도시 개발 사업 공동 주택 계획 홍성 자이 사업 지와 입지 자리 역세 개발 수혜 전망 단지 도보 남초 홍주 홍성 도서관 학원 학부모 수요자 관심 인근 홍성 의료 홍성 전통 시장 각종 편의 시설 홍성 군청 지방 법원 홍성 세무서 행정 시설 차량 빠르 이용 홍성군 부동산 규제 지역 청약 조건 까다롭 청약 통장 가입 기간 이상 주택 예치금 기준 충족 세대주 주택 소유 여부 관계 순위 청약 당첨 제한 전매 제한 계약 전매 주택 담보 대출 비율 최대 적용 업체 청약 지역 고객 홍성 청약 상담 예약 운영 청약 상담 마련,지방 도시 노후 주택 비율 아파트 수요자 관심 노후 주택 비율 지역 아파트 아파트 특화 설계 조경 규모 커뮤니티 시설 적용 경우 프리미엄 기대 지방 도시 입주 초과 아파트 비율 노후 주택 밀집 지역 신규 분양 아파트 성적 거두 일대 분양 양학 신원 아침 도시 시아 순위 청약 평균 최고 경쟁 기록 단지 노후 단지 지역 준공 이상 노후 아파트 비율 전체 가구 초과 노후 아파트 비율 수준 지역 규제 수혜 지역 관심 신규 분양 아파트 경쟁 기록 공급 모종 순위 청약 평균 최고 경쟁 기록 분양 평균 경쟁 마감 성공 아파트 선호도 입주 미만 아파트 프리미엄 형성 리브 자료 입주 장성 전용 시세 중위 평균 기준 매매 비교 상승 업계 관계자 노후 아파트 지역 아파트 갈아타 원하 대기 수요 아파트 희소가치 향후 지역 시세 이끄 자리매김 홍성 자이 조감도 가운데 홍성 자이 아파트 홍성 자이 분양 소식 단지 지하 지상 가구 규모 전용 면적 구성 이상 노후 비율 육박 아파트 관심 장항선 복선 전철 개통 예정 홍성 역세 도시 개발 공동 주택 계획 홍성 자이 지와 입지 자리 역세 개발 수혜 전망 단지 도보 남초 홍주 홍성 도서관 학원 학부모 수요자 관심 인근 홍성 의료 홍성 전통 시장 각종 편의 시설 홍성 군청 지방 법원 홍성 세무서 행정 시설 차량 빠르 이용 홍성군 부동산 규제 지역 청약 조건 까다롭 청약 통장 가입 기간 이상 주택 예치금 기준 충족 세대주 주택 소유 여부 관계 순위 청약 당첨 제한 전매 제한 계약 전매 주택 담보 대출 비율 최대 적용 업체 청약 지역 고객 홍성 청약 상담 예약 운영 청약 상담 마련
2021-08-20,규제 지역 홍성 자이 분양 수요자 관심,홍성 자이 투시도 청약 열기 수도 지방 확대 부동산 시장 분석 업체 부동산 인포 산원 청약 분양 정보 청약률 분석 결과 올해 전국 가구 특별 공급 제외 입주자 모집 순위 통장 몰리 평균 경쟁 기록 전년 동기 분양 가구 가구 증가 순위 청약 지난해 수준 지난해 평균 경쟁 기록 경쟁 권역 온도 올해 청약 열기 지방 도시 수도 광역시 제외 순위 지난해 이상 수준 분양 단지 단지 증가 분양 시장 분위기 수도 평균 경쟁 지난해 경쟁 치열 반면 지방 광역시 순위 청약 지난해 절반 수준 미치 평균 경쟁 기록 청약 경쟁 치열 지방 도시 민간 아파트 초기 분양 최고 기록 주택 도시 보증 공사 따르 올해 분기 기타 지방 광역시 종시 제외 초기 분양 전년 동기 웃돌 지방 도시 약진 지난해 지방 광역시 포함 일부 지방 도시 규제 지역 확대 지정 영향 분석 지난해 지방 광역시 일부 지역 지방 도시 다수 조정 대상 지역 지정 수요자 규제 지역 이동 부동산 리서치 팀장 규제 지역 수요자 움직이 청약 자유 광역 도시 가격 치솟 가격 메리트 인프라 개선 개발 환경 선택 중요 요소 규제 지역 지방 도시 계속 약진 예상 가운데 홍성 건설 홍성 자이 분양 지하 지상 전용 면적 가구 규모 조성 홍성군 부동산 규제 지역 청약 조건 까다롭 청약 통장 가입 기간 이상 주택 예치금 기준 충족 세대주 주택 소유 여부 순위 청약 당첨 제한 전매 제한 계약 전매 가능 주택 담보 대출 비율 최대 적용 진행 홍성 역세 도시 개발 사업 인근 규모 주거 상업 업무 시설 용지 개발 사업 조성 완료 지역 향후 교통 중심 지역 경제 활성 주거 환경 개선 기대 인근 자리 첨단 산업 단지 자리 이어지 진입 도로 완공 앞두 도로 개통 차량 이동 전망 한편 청약 지역 고객 홍성 청약 상담 예약 운영 청약 상담 마련,홍성 자이 투시도 청약 열기 수도 지방 확대 부동산 시장 분석 업체 부동산 인포 산원 청약 분양 정보 청약률 분석 결과 전국 가구 특별 공급 제외 입주자 모집 순위 통장 몰리 평균 경쟁 기록 전년 동기 분양 가구 가구 증가 순위 청약 수준 평균 경쟁 기록 경쟁 권역 온도 청약 열기 지방 도시 수도 광역시 제외 순위 이상 수준 분양 단지 단지 증가 분양 시장 분위기 수도 평균 경쟁 경쟁 치열 반면 지방 광역시 순위 청약 절반 수준 미치 평균 경쟁 기록 청약 경쟁 치열 지방 도시 민간 아파트 초기 분양 최고 기록 주택 도시 보증 공사 기타 지방 광역시 종시 제외 초기 분양 전년 동기 웃돌 지방 도시 약진 지방 광역시 포함 일부 지방 도시 규제 지역 확대 지정 영향 분석 지방 광역시 일부 지역 지방 도시 다수 조정 대상 지역 지정 수요자 규제 지역 이동 부동산 리서치 팀장 규제 지역 수요자 움직이 청약 자유 광역 도시 가격 치솟 가격 메리트 인프라 개선 개발 환경 선택 중요 요소 규제 지역 지방 도시 계속 약진 예상 가운데 홍성 홍성 자이 분양 지하 지상 전용 면적 가구 규모 조성 홍성군 부동산 규제 지역 청약 조건 까다롭 청약 통장 가입 기간 이상 주택 예치금 기준 충족 세대주 주택 소유 여부 순위 청약 당첨 제한 전매 제한 계약 전매 주택 담보 대출 비율 최대 적용 진행 홍성 역세 도시 개발 인근 규모 주거 상업 업무 시설 용지 개발 조성 완료 지역 향후 교통 중심 지역 경제 활성 주거 환경 개선 기대 인근 자리 첨단 산업 단지 자리 이어지 진입 도로 완공 앞두 도로 개통 차량 이동 전망 한편 청약 지역 고객 홍성 청약 상담 예약 운영 청약 상담 마련
2021-08-20,건설 공동 주택 개발 사업 공사 수주,기자 건설 토지 신탁 대상 공원 공동 주택 개발 사업 공사 수주 공시 계약 금액 지난해 매출액 대비,토지 신탁 대상 공원 공동 주택 개발 공사 수주 공시 계약 금액 매출액
2021-08-20,건설 상당 공원 공동 주택 개발 사업 수주,기자 건설 상당 공원 공동 주택 개발 사업 주식회사 하국 토지 신탁 수주 공시 지난해 매출액 대비 해당 규모,상당 공원 공동 주택 개발 주식회사 하국 토지 신탁 수주 공시 매출액 규모
2021-08-20,건설 상당 공원 공동 주택 개발 사업 수주,기자 건설 상당 공원 공동 주택 개발 사업 주식회사 하국 토지 신탁 수주 공시 지난해 매출액 대비 해당 규모,상당 공원 공동 주택 개발 주식회사 하국 토지 신탁 수주 공시 매출액 규모
2021-08-20,건설 규모 공동 주택 개발 사업 수주,경제 증권 건설 토지 신탁 공원 공동 주택 개발 사업 계약 체결 공시 계약 금액 매출 대비 해당 규모 계약 기간 공사 착수,경제 증권 토지 신탁 공원 공동 주택 개발 계약 체결 공시 계약 금액 매출 규모 계약 기간 공사 착수
2021-08-20,기업 공시,경제 한미 반도체 규모 수주 계약 체결 규모 반도체 제조 장비 수주 계약 체결 미래 에프 브이 채무 보증 결정 임시 주총 결과 대표 이사 선임 건설 토지 신탁 규모 개발 사업 공사 수주 계약 체결 규모 센터 공사 수주 동성 제약 주식 취득 결정 지역 주택 조합 규모 아파트 신축 사업 공사 수주 계약 체결 코스닥 디바이스 벤처 기업 중견 기업 소속 변경 트리 규모 공급 계약 신신 제약 과민성 방광 증상 치료제 임상 시험 종료 보고서 제출 항공 종속 회사 자산 운용 주식 처분 결정 신주 주식 매수 선택 행사 프로 종속 회사 프로 규모 양극 증설 투자 결정 임시 주총 결과 정관 일부 변경 포함 원안 가결 종속 회사 지분 취득 결정 픽셀 플러스 자동차 부품 전자 부품 상사 규모 차량 이미지 센서 공급 계약 체결 서한 동부 시장 정비 사업 조합 규모 정비 사업 계약 체결 규모 주식 취득 신탁 계약 체결 결정 코스 나인 회계 장부 열림 가처분 소송 소취 전환 청구 행사 와이더 규모 무기명식 보증 사모 발행 결정 규모 무기명식 보증 사모 발행 결정,경제 한미 반도체 규모 수주 계약 체결 규모 반도체 제조 장비 수주 계약 체결 미래 에프 브이 채무 보증 결정 임시 주총 결과 선임 토지 신탁 규모 개발 공사 수주 계약 체결 규모 센터 공사 수주 동성 제약 주식 취득 결정 지역 주택 조합 규모 아파트 신축 공사 수주 계약 체결 코스닥 디바이스 벤처 기업 중견 기업 소속 변경 트리 규모 공급 계약 신신 제약 과민성 방광 증상 치료제 임상 시험 종료 보고서 제출 항공 종속 회사 자산 운용 주식 처분 결정 신주 주식 매수 선택 행사 프로 종속 회사 프로 규모 양극 증설 투자 결정 임시 주총 결과 정관 일부 변경 포함 원안 가결 종속 회사 지분 취득 결정 픽셀 플러스 자동차 부품 전자 부품 상사 규모 차량 이미지 센서 공급 계약 체결 서한 동부 시장 정비 조합 규모 정비 계약 체결 규모 주식 취득 신탁 계약 체결 결정 코스 나인 회계 장부 열림 가처분 소송 소취 전환 청구 행사 와이더 규모 무기명식 보증 사모 발행 결정 규모 무기명식 보증 사모 발행 결정
2021-08-20,회장 상반기 보수,그룹 회장 올해 상반기 보수 그룹 반기 보고서 따르 회장 그룹 지주 회사 급여 상여 그룹 명예 회장 막냇동생 회장 지난해 취임 상반기 올해 가량 사장 급여 상여 상반기 수령 그룹 직위 임원 연봉 테이블 기본급 지급 당기 순이익 지표 국내외 경기 경쟁사 대비 성과 위기 대응 능력 종합 고려 연간 급여 이내 상여금 지급 설명 한편 그룹 명예 회장 건설 회장 상반기 급여 상여,그룹 보수 그룹 반기 보고서 그룹 지주 회사 급여 상여 그룹 명예 막냇동생 취임 가량 급여 상여 수령 그룹 직위 연봉 테이블 기본급 지급 당기 순이익 지표 국내외 경기 경쟁사 성과 위기 대응 능력 종합 고려 연간 급여 이내 상여금 지급 설명 한편 그룹 명예 급여 상여
2021-08-21,기업 공시 원화,원화 폴리우레탄 필름 제조 방법 관련 특허 취득 동성 제약 어치 취득 결정 건설 규모 공동 주택 개발 사업 공사 수주,원화 폴리우레탄 필름 제조 방법 관련 특허 취득 동성 제약 어치 취득 결정 규모 공동 주택 개발 공사 수주
