date,Title,Content,tokens
2023-06-08,건설 미래 항공 모빌리티 산업 생태 조성 업무 협약,건설 진주 기업가 정신 센터 시장 건설 미래 혁신 대표 참석 가운데 미래 항공 모빌리티 산업 생태 조성 업무 협약 체결 진주 기업가 정신 센터 업무 약식 시장 오른쪽 건설 미래 혁신 대표 사장 오른쪽 관계자 기념 촬영 사진 제공 건설 미래 항공 모빌리티 최근 연구 진행 도심 항공 교통 지역 항공 교통 확장 범위 개념 이번 약식 건설 경상 국립 대학교 경상 국립 대학교 병원 텍스 참석 이번 업무 협약 권역 책임 의료 기관 경상 국립 대학교 병원 거점 진주 인근 지역 응급 의료 운송 서비스 제공 기반 조성 계획 건설 이번 업무 협약 수직 착륙장 구축 운용 기술 연구 시스템 개발 산업 생태 조성 행정 재정 지원 경상 국립 대학교 분야 전문 인력 양성 경상 국립 대학교 병원 시범 도시 사업 인프라 활용 응급 의료 서비스 운영 자문 기체 개발 교통 관리 플랫 연구 실증 사업 수행 텍스 활용 지역 주유소 부지 제공 예정 한편 건설 사업 관련 포트 설계 운영 아우르 확보 포트 기반 다양 비즈니스 모델 발굴 적극 추진 계획 건설 지난해 조기 상용 올해 토부 챌린지 실증 사업 단계 협약 체결 건설 미래 혁신 대표 사장 이번 업무 협약 친환경 항공 모빌리티 영역 확장 지역 이동 가능 기술 응급 의료 운송 문제 해결 활용 의료 서비스 개선 기대 건설 사업 추진 시민 이용 공공 확보 노력,진주 기업가 정신 센터 시장 미래 혁신 대표 참석 가운데 미래 항공 모빌리티 산업 생태 조성 업무 협약 체결 진주 기업가 정신 센터 업무 약식 시장 오른쪽 미래 혁신 대표 사장 오른쪽 관계자 기념 촬영 제공 미래 항공 모빌리티 연구 진행 도심 항공 교통 지역 항공 교통 확장 범위 개념 약식 경상 국립 대학교 경상 국립 대학교 병원 텍스 참석 업무 협약 권역 책임 의료 기관 경상 국립 대학교 병원 거점 진주 인근 지역 응급 의료 운송 서비스 제공 기반 조성 계획 업무 협약 수직 착륙장 구축 운용 기술 연구 시스템 개발 산업 생태 조성 행정 재정 지원 경상 국립 대학교 분야 전문 인력 양성 경상 국립 대학교 병원 시범 도시 사업 인프라 활용 응급 의료 서비스 운영 자문 기체 개발 교통 관리 플랫 연구 실증 사업 수행 텍스 활용 지역 주유소 부지 제공 예정 한편 사업 관련 포트 설계 운영 아우르 확보 포트 기반 다양 비즈니스 모델 발굴 적극 추진 계획 조기 상용 토부 챌린지 실증 사업 단계 협약 체결 미래 혁신 대표 사장 업무 협약 친환경 항공 모빌리티 영역 확장 지역 이동 가능 기술 응급 의료 운송 문제 해결 활용 의료 서비스 개선 기대 사업 추진 시민 이용 공공 확보 노력
2023-06-08,건설 미래 항공 모빌리티 산업 생태 업무 협약,오른쪽 건설 미래 혁신 대표 사장 오른쪽 진주 시장 진주 기업가 정신 센터 미래 항공 모빌리티 산업 생태 조성 업무 협약 체결 사진 제공 건설 경제 건설 미래 항공 모빌리티 분야 적극 협력 건설 진주 기업가 정신 센터 미래 항공 모빌리티 산업 생태 조성 업무 협약 체결 미래 항공 모빌리티 최근 연구 진행 도심 항공 교통 지역 항공 교통 확장 범위 개념 이번 약식 건설 경상 국립대 경상 국립대 병원 텍스 참석 이번 업무 협약 권역 책임 의료 기관 경상 국립대 병원 거점 인근 지역 응급 의료 운송 서비스 제공 기반 조성 계획 건설 이번 업무 협약 수직 착륙장 구축 운용 기술 연구 시스템 개발 산업 생태 조성 행정 재정 지원 담당 경상 국립대 분야 전문 인력 양성 경상 국립대 병원 시범 도시 사업 인프라 활용 응급 의료 서비스 운영 자문 기체 개발 교통 관리 플랫 연구 실증 사업 수행 텍스 활용 지역 주유소 부지 제공 예정 건설 미래 혁신 대표 사장 이번 업무 협약 친환경 항공 모빌리티 영역 확장 지역 이동 가능 기술 응급 의료 운송 문제 해결 활용 의료 서비스 개선 기대 건설 사업 추진 시민 이용 공공 확보 노력,오른쪽 미래 혁신 대표 사장 오른쪽 진주 시장 진주 기업가 정신 센터 미래 항공 모빌리티 산업 생태 조성 업무 협약 체결 제공 경제 미래 항공 모빌리티 분야 적극 협력 진주 기업가 정신 센터 미래 항공 모빌리티 산업 생태 조성 업무 협약 체결 미래 항공 모빌리티 연구 진행 도심 항공 교통 지역 항공 교통 확장 범위 개념 약식 경상 국립대 경상 국립대 병원 텍스 참석 업무 협약 권역 책임 의료 기관 경상 국립대 병원 거점 인근 지역 응급 의료 운송 서비스 제공 기반 조성 계획 업무 협약 수직 착륙장 구축 운용 기술 연구 시스템 개발 산업 생태 조성 행정 재정 지원 담당 경상 국립대 분야 전문 인력 양성 경상 국립대 병원 시범 도시 사업 인프라 활용 응급 의료 서비스 운영 자문 기체 개발 교통 관리 플랫 연구 실증 사업 수행 텍스 활용 지역 주유소 부지 제공 예정 미래 혁신 대표 사장 업무 협약 친환경 항공 모빌리티 영역 확장 지역 이동 가능 기술 응급 의료 운송 문제 해결 활용 의료 서비스 개선 기대 사업 추진 시민 이용 공공 확보 노력
2023-06-08,건설 미래 항공 모빌리티 산업 생태 업무 협약,건설 진주 기업가 정신 센터 시장 건설 미래 혁신 대표 참석 가운데 미래 항공 모빌리티 산업 생태 조성 업무 협약 체결 미래 항공 모빌리티 최근 연구 진행 도심 항공 교통 지역 항공 교통 확장 범위 개념 이번 약식 건설 경상 국립 대학교 경상 국립 대학교 병원 텍스 참석 이번 업무 협약 권역 책임 의료 기관 경상 국립 대학교 병원 거점 진주 인근 지역 응급 의료 운송 서비스 제공 기반 조성 계획 건설 이번 업무 협약 수직 착륙장 구축 운용 기술 연구 시스템 개발 산업 생태 조성 행정 재정 지원 경상 국립 대학교 분야 전문 인력 양성 경상 국립 대학교 병원 시범 도시 사업 인프라 활용 응급 의료 서비스 운영 자문 기체 개발 교통 관리 플랫 연구 실증 사업 수행 텍스 활용 지역 주유소 부지 제공 예정 한편 건설 사업 관련 포트 설계 운영 아우르 확보 포트 기반 다양 비즈니스 모델 발굴 적극 추진 계획 건설 지난해 조기 상용 올해 토부 챌린지 실증 사업 단계 협약 체결 건설 미래 혁신 대표 사장 이번 업무 협약 친환경 항공 모빌리티 영역 확장 지역 이동 가능 기술 응급 의료 운송 문제 해결 활용 의료 서비스 개선 기대 건설 사업 추진 시민 이용 공공 확보 노력,진주 기업가 정신 센터 시장 미래 혁신 대표 참석 가운데 미래 항공 모빌리티 산업 생태 조성 업무 협약 체결 미래 항공 모빌리티 연구 진행 도심 항공 교통 지역 항공 교통 확장 범위 개념 약식 경상 국립 대학교 경상 국립 대학교 병원 텍스 참석 업무 협약 권역 책임 의료 기관 경상 국립 대학교 병원 거점 진주 인근 지역 응급 의료 운송 서비스 제공 기반 조성 계획 업무 협약 수직 착륙장 구축 운용 기술 연구 시스템 개발 산업 생태 조성 행정 재정 지원 경상 국립 대학교 분야 전문 인력 양성 경상 국립 대학교 병원 시범 도시 사업 인프라 활용 응급 의료 서비스 운영 자문 기체 개발 교통 관리 플랫 연구 실증 사업 수행 텍스 활용 지역 주유소 부지 제공 예정 한편 사업 관련 포트 설계 운영 아우르 확보 포트 기반 다양 비즈니스 모델 발굴 적극 추진 계획 조기 상용 토부 챌린지 실증 사업 단계 협약 체결 미래 혁신 대표 사장 업무 협약 친환경 항공 모빌리티 영역 확장 지역 이동 가능 기술 응급 의료 운송 문제 해결 활용 의료 서비스 개선 기대 사업 추진 시민 이용 공공 확보 노력
2023-06-08,미래 항공 모빌리티 산업 생태 조성 앞장,왼쪽 미래 융합 기술 원장 경상 국립대 병원장 경상 국립대 총장 시장 건설 사장 플러스 텍스 상무 기념 사진 촬영 사진 제공 산업 경상 국립 대학교 경상 국립 대학교 병원 건설 텍스 플러스 미래 항공 모빌리티 산업 생태 조성 업무 협약 체결 단거리 수송 사용 도심 항공 교통 장거리 수송 가능 지역 항공 교통 포괄 개념 이번 협약 의료 시설 활용 응급 의료 서비스 분야 시범 도시 공동 협력 인프라 구축 활용 사업 추진 미래 항공 기체 실증 센터 활용 체계 검증 산업 생태 구축 목적 참여 기관 산업 생태 조성 공동 목표 효율 추진 약속 교통망 실질 운송 수단 사용 미래 항공 기체 연구 개발 산업 생태 조성 행정 재정 지원 담당 경상 국립 대학교 전문 인력 양성 경상 국립 대학교 병원 시범 도시 사업 의료 시설 활용 운영 분야 기술 자문 제공 텍스 주유소 부지 포트 활용 예정 건설 이착륙 충전 정비 가능 포트 구축 교통 관리 플랫 연구 담당 원장 약식 지자체 기체 건설 통신 분야 전문 민간 기업 산업 생태 구축 상당 시너지 기대 개발 독자 모델 미래 항공 모빌리티 발전 핵심 역할 힘쓰 제안 미래형 항공 기체 가상 비행 장면 사진 제공 한편 지난해 미래 에어 모빌리티 사업 추진 결정 비전 핵심 미래 사업 선정 핵심 기술 확보 나서 토부 추진 도심 항공 교통 챌린지 사업 단계 수행 역기 운용 기술 지원 용역 참여 연과 비행 절차 구체 협력 올해 상반기 소기 시험 비행 비행 로직 시뮬레이션 기술 고도 계획 파크 실증 센터 구축 업무 협약 체결 개발 필요 연구 센터 공역 확보 예정,왼쪽 미래 융합 기술 원장 경상 국립대 병원장 경상 국립대 총장 시장 사장 플러스 텍스 상무 기념 촬영 제공 산업 경상 국립 대학교 경상 국립 대학교 병원 텍스 플러스 미래 항공 모빌리티 산업 생태 조성 업무 협약 체결 단거리 수송 사용 도심 항공 교통 장거리 수송 가능 지역 항공 교통 포괄 개념 협약 의료 시설 활용 응급 의료 서비스 분야 시범 도시 공동 협력 인프라 구축 활용 사업 추진 미래 항공 기체 실증 센터 활용 체계 검증 산업 생태 구축 목적 참여 기관 산업 생태 조성 공동 목표 효율 추진 약속 교통망 실질 운송 수단 사용 미래 항공 기체 연구 개발 산업 생태 조성 행정 재정 지원 담당 경상 국립 대학교 전문 인력 양성 경상 국립 대학교 병원 시범 도시 사업 의료 시설 활용 운영 분야 기술 자문 제공 텍스 주유소 부지 포트 활용 예정 이착륙 충전 정비 가능 포트 구축 교통 관리 플랫 연구 담당 원장 약식 지자체 기체 통신 분야 전문 민간 기업 산업 생태 구축 상당 시너지 기대 개발 독자 모델 미래 항공 모빌리티 발전 핵심 역할 힘쓰 제안 미래형 항공 기체 가상 비행 장면 제공 한편 미래 에어 모빌리티 사업 추진 결정 비전 핵심 미래 사업 선정 핵심 기술 확보 나서 토부 추진 도심 항공 교통 챌린지 사업 단계 수행 역기 운용 기술 지원 용역 참여 연과 비행 절차 구체 협력 상반기 소기 시험 비행 비행 로직 시뮬레이션 기술 고도 계획 파크 실증 센터 구축 업무 협약 체결 개발 필요 연구 센터 공역 확보 예정
2023-06-08,파주 자이 순위 청약 접수,투시도 건설 제공 건설 도시 분양 자릿수 달하 평균 경쟁 기록 순위 마감 분양 인근 시세 차익 수요 분석 산원 청약 따르 가구 모집 순위 청약 접수 파주 역대 최다 접수 건수 평균 경쟁 올해 최고 수준 최고 경쟁 주택 가구 모집 지원 경쟁 자릿수 경쟁 기록 이외 주택 자릿수 경쟁 보이 청약 흥행 단지 지구 블록 주택 중소형 중대 분양 주택 책정 반면 노선 인근 아파트 실거 기준 정신 도시 퍼스트 면적 주택 정신 도시 거래 주변 시세 비교 분양 이상,투시도 제공 도시 분양 자릿수 달하 평균 경쟁 기록 마감 분양 인근 시세 차익 수요 분석 산원 청약 가구 모집 청약 접수 파주 역대 최다 접수 건수 평균 경쟁 최고 수준 최고 경쟁 주택 가구 모집 지원 경쟁 자릿수 경쟁 기록 이외 주택 자릿수 경쟁 보이 청약 흥행 단지 지구 블록 주택 중소형 중대 분양 주택 책정 반면 노선 인근 아파트 실거 기준 정신 도시 퍼스트 면적 주택 정신 도시 거래 주변 시세 비교 분양 이상
2023-06-08,활용 응급 환자 이송,경상 국립대 경상 국립대 병원 산업 생태 조성 업무 협약 경상 국립대 경상 국립대 병원 산업 건설 텍스 미래 항공 모빌리티 산업 생태 조성 업무 협약 체결 발표 도심 항공 교통 지역 항공 교통 포함 광의 개념 글로벌 시장 조사 업체 프리 리서치 따르 세계 시장 규모 지난해 가량 성장 전망 이번 업무 협약 협의 의료 시설 거점 활용 응급 의료 서비스 분야 시범 도시 사업 기반 마련 미래 항공 기체 실증 센터 구축 운용 체계 검증 산업 생태계 조성 상호 협력 방침 활용 경상 유일 대학 병원 경상 국립대 병원 남해안 지역 수요 효과 대응 기반 마련 계획 상용 산간 오지 발생 수요 대응 가능 거리 이동 자동차 최소 시간 소요 활용 단축 심장 마비 호흡 정지 대량 출혈 응급 상황 인명 구조 골든아워 의료 서비스 설명 운용 체계 검증 상공 통신 기반 데이터 전송 기술 교통 관리 시스템 행정 제도 재정 지원 경상 국립대 경상 국립대 병원 분야 전문 인력 분야 시범 도시 사업 인프라 기술 자문 제공 기체 건설 포트 구축 운용 기술 시스템 텍스 지역 주유소 부지 포트 제공 예정 파크 가산 일반 기체 연구 실증 시험 비행 시험 운용 체계 검증 가능 실증 센터 구축 사업 추진 향후 교통 관리 플랫 실증 센터 연동 통합 운영 체계 실증 계획 기업 서비스 개발 협력 낙도 응급 환자 이송 진주 지역 의료 서비스 개선 기여 의료 서비스 사회 가치 서비스 모델 구축 시민 이동 경험 지속 혁신,경상 국립대 경상 국립대 병원 산업 생태 조성 업무 협약 경상 국립대 경상 국립대 병원 산업 텍스 미래 항공 모빌리티 산업 생태 조성 업무 협약 체결 발표 도심 항공 교통 지역 항공 교통 포함 광의 개념 글로벌 시장 조사 업체 프리 리서치 세계 시장 규모 가량 성장 전망 업무 협약 협의 의료 시설 거점 활용 응급 의료 서비스 분야 시범 도시 사업 기반 마련 미래 항공 기체 실증 센터 구축 운용 체계 검증 산업 생태계 조성 상호 협력 방침 활용 경상 유일 대학 병원 경상 국립대 병원 남해안 지역 수요 효과 대응 기반 마련 계획 상용 산간 오지 발생 수요 대응 가능 거리 이동 자동차 최소 시간 소요 활용 단축 심장 마비 호흡 정지 대량 출혈 응급 상황 인명 구조 골든아워 의료 서비스 설명 운용 체계 검증 상공 통신 기반 데이터 전송 기술 교통 관리 시스템 행정 제도 재정 지원 경상 국립대 경상 국립대 병원 분야 전문 인력 분야 시범 도시 사업 인프라 기술 자문 제공 기체 포트 구축 운용 기술 시스템 텍스 지역 주유소 부지 포트 제공 예정 파크 가산 일반 기체 연구 실증 시험 비행 시험 운용 체계 검증 가능 실증 센터 구축 사업 추진 향후 교통 관리 플랫 실증 센터 연동 통합 운영 체계 실증 계획 기업 서비스 개발 협력 낙도 응급 환자 이송 진주 지역 의료 서비스 개선 기여 의료 서비스 사회 가치 서비스 모델 구축 시민 이동 경험 지속 혁신
2023-06-08,경험 혁신 미래 항공 교통 생태,경상 국립대 병원 응급 의료 서비스 수요 대응 협업 왼쪽 산업 전무 경상 국립대 병원 병원장 경상 국립대 총장 시장 건설 사장 플러스 전무 텍스 상무 사진 촬영 플러스 제공 플러스 시민 이동 경험 혁신 미래 항공 모빌리티 생태 구축 공력 경상 국립 대학교 경상 국립 대학교 병원 산업 건설 텍스 산업 생태 조성 업무 협약 체결 차원 공중 교통 체계 활용 기존 항공 운송 생태 도심 항공 교통 지역 항공 교통 포함 개념 글로벌 시장 조사 업체 리서치 따르 세계 시장 규모 지난해 한화 가량 성장 전망 국내외 기업 먹거리 이번 업무 협약 협의 의료 시설 거점 활용 응급 의료 서비스 분야 시범 도시 사업 기반 마련 미래 항공 기체 실증 센터 구축 운용 체계 검증 산업 생태 조성 협의 활용 경상 유일 대학 병원 경상 국립 대학교 병원 남해안 지역 응급 의료 서비스 수요 대응 방침 통영 지역 응급 의료 서비스 수요 증가 하동군 신마 산간 오지 수요 지속 발생 응급 시설 도시 진주 가량 응급 의료 서비스 소외 지역 분류 상용 산간 오지 발생 응급 의료 대응 가능 기대 자동차 거리 이동 최소 시간 소요 활용 직선 이동 가능 단축 운용 체계 검증 고품질 상공 통신 기반 데이터 전송 기술 교통 관리 시스템 제공 지난해 플러스 연구 개발 교통 관리 시스템 비행 계획서 분석 승인 충돌 회랑 이탈 교통 흐름 관리 상공 통신 품질 관리 자동 지능 플랫 조종사 관제 실시간 교신 돌발 상황 대처 행정 제도 재정 지원 경상 국립 대학교 분야 전문 인력 양성 경상 국립 대학교 병원 분야 시범 도시 사업 인프라 기술 자문 협력 기체 건설 포트 구축 운용 기술 시스템 텍스 지역 주유소 부지 포트 제공 예정 기업 서비스 개발 담당 협력 낙도 오지 지역 응급 환자 이송 진주 지역 의료 서비스 개선 기여 의료 서비스 사회 가치 서비스 모델 구축 시민 이동 경험 지속 혁신 한편 지난해 생태 조성 업무 협약 국토 주최 챌린지 단계 실증 사업 협약 체결 기체 스타트업 통신 기반 데이터 전송 기술 공동 연구 교통 공사 지하철 교통 인프라 활용 복합 환승 센터 조성 협력 기자,경상 국립대 병원 응급 의료 서비스 수요 대응 협업 왼쪽 산업 전무 경상 국립대 병원 병원장 경상 국립대 총장 시장 사장 플러스 전무 텍스 상무 촬영 플러스 제공 플러스 시민 이동 경험 혁신 미래 항공 모빌리티 생태 구축 공력 경상 국립 대학교 경상 국립 대학교 병원 산업 텍스 산업 생태 조성 업무 협약 체결 차원 공중 교통 체계 활용 기존 항공 운송 생태 도심 항공 교통 지역 항공 교통 포함 개념 글로벌 시장 조사 업체 리서치 세계 시장 규모 한화 가량 성장 전망 국내외 기업 먹거리 업무 협약 협의 의료 시설 거점 활용 응급 의료 서비스 분야 시범 도시 사업 기반 마련 미래 항공 기체 실증 센터 구축 운용 체계 검증 산업 생태 조성 협의 활용 경상 유일 대학 병원 경상 국립 대학교 병원 남해안 지역 응급 의료 서비스 수요 대응 방침 통영 지역 응급 의료 서비스 수요 증가 하동군 신마 산간 오지 수요 지속 발생 응급 시설 도시 진주 가량 응급 의료 서비스 소외 지역 분류 상용 산간 오지 발생 응급 의료 대응 가능 기대 자동차 거리 이동 최소 시간 소요 활용 직선 이동 가능 단축 운용 체계 검증 고품질 상공 통신 기반 데이터 전송 기술 교통 관리 시스템 제공 플러스 연구 개발 교통 관리 시스템 비행 계획서 분석 승인 충돌 회랑 이탈 교통 흐름 관리 상공 통신 품질 관리 자동 지능 플랫 조종사 관제 실시간 교신 돌발 상황 대처 행정 제도 재정 지원 경상 국립 대학교 분야 전문 인력 양성 경상 국립 대학교 병원 분야 시범 도시 사업 인프라 기술 자문 협력 기체 포트 구축 운용 기술 시스템 텍스 지역 주유소 부지 포트 제공 예정 기업 서비스 개발 담당 협력 낙도 오지 지역 응급 환자 이송 진주 지역 의료 서비스 개선 기여 의료 서비스 사회 가치 서비스 모델 구축 시민 이동 경험 지속 혁신 한편 생태 조성 업무 협약 국토 주최 챌린지 단계 실증 사업 협약 체결 기체 스타트업 통신 기반 데이터 전송 기술 공동 연구 교통 공사 지하철 교통 인프라 활용 복합 환승 센터 조성 협력
2023-06-08,산업 생태 조성 협약,기업가 정신 센터 경상 국립대 경상 국립대 병원 산업 건설 텍스 미래 항공 모빌리티 산업 생태 조성 업무 협약 전무 사진 왼쪽 경상 국립대 병원장 경상 국립대 총장 시장 건설 사장 최고 기술 책임자 텍스 상무 협약 체결 기념 촬영,기업가 정신 센터 경상 국립대 경상 국립대 병원 산업 텍스 미래 항공 모빌리티 산업 생태 조성 업무 협약 전무 왼쪽 경상 국립대 병원장 경상 국립대 총장 시장 사장 최고 기술 책임자 텍스 상무 협약 체결 기념 촬영
2023-06-08,미래 항공 모빌리티 산업 생태 조성 업무 약식,기업가 정신 센터 미래 항공 모빌리티 산업 생태 조성 업무 약식 경상 국립 대학교 경상 국립 대학교 병원 산업 건설 텍스 관계자 협약 체결 기념 촬영 약식 시장 경상 국립 대학교 총장 경상 국립 대학교 병원장 전무 건설 사장 텍스 상무 플러스 참석 플러스 제공 재판매 금지,기업가 정신 센터 미래 항공 모빌리티 산업 생태 조성 업무 약식 경상 국립 대학교 경상 국립 대학교 병원 산업 텍스 관계자 협약 체결 기념 촬영 약식 시장 경상 국립 대학교 총장 경상 국립 대학교 병원장 전무 사장 텍스 상무 플러스 참석 플러스 제공 재판매 금지
