date,Title,Content,tokens
2021-08-01,분양 동향 계양 전국 가구 분양,견본 주택 전국 개관 예정 분양 일정 사진 부동산 이달 전국 가구 달하 신규 분양 물량 공급 부동산 따르 이달 전국 단지 가구 일반 분양 사전 청약 포함 분양 시작 계양 경기 자이 화성 파크 드림 분양 예정 모델 경기 포천 포천 오픈 앞두 현대 건설 건설 일원 계양 분양 지하 지상 최고 전용 가구 이중 전용 가구 일반 분양 공급 지하철 작전 역과 간선 급행 버스 정류장 이용 부평 수도 순환고 속도 서운 수도 각지 차량 이동도 주변 효성 동초 명현 성고 밀집 반경 계양 구청 병원 다양 기반 시설 공원 환경 라인 건설 블록 분양 지하 지상 전용 가구 규모 아파트 국도 고덕 진입 가능 이용 교육 시설 어린이집 유치원 노중 주변 근린공원 호수 공원 용남 녹지 시설,견본 주택 전국 개관 예정 분양 일정 사진 부동산 이달 전국 가구 달하 신규 분양 물량 공급 부동산 이달 전국 단지 가구 분양 사전 청약 포함 분양 시작 계양 경기 자이 화성 파크 드림 분양 예정 모델 경기 포천 포천 오픈 앞두 현대 일원 계양 분양 지하 지상 최고 전용 가구 이중 전용 가구 분양 공급 지하철 작전 역과 간선 급행 버스 정류장 이용 부평 수도 순환고 속도 서운 수도 각지 차량 이동도 주변 효성 동초 명현 성고 밀집 반경 계양 구청 병원 다양 기반 시설 공원 환경 라인 블록 분양 지하 지상 전용 가구 규모 아파트 국도 고덕 진입 이용 교육 시설 어린이집 유치원 노중 주변 근린공원 호수 공원 용남 녹지 시설
2021-08-01,플랫 고도 악어 메타 버스 알고리즘 개발 추진,악어 서비스 대표 이미지 아이 서비스 악어 첨단 기술 활용 서비스 고도 방문 선생 애플리케이션 플랫폼 알고리즘 메타 버스 기술 적용 추진 악어 구조 모델링 기업 모티브 협력 아이 발달 상태 파악 선생 추천 기술 개발 모티브 인지 구조 실시간 모델링 분석 아동 주의력 결핍 과잉 행동 장애 진단 치료 디지털 데이터 제공 회사 이때 게임 주요 매개체 이용자 상태 자연 파악 진단 관련 데이터 서비스 지원 전문 기업 악어 모티브 인지 모델링 아이 발달 상태 파악 기술 개발 하반기 아동 교사 추천 알고리즘 적용 계획 악어 사업 가능 인정받 이달 과학 기술 정보 통신부 민관 협력 기반 스타트업 육성 사업 선정 동안 플랫 데이터 양사 기술 접목 예정 이르 올해 서비스 적용 악어 대표 서비스 이용 아이 게임 아이 발달 상태 파악 예정 단기 연결 그치 상태 데이터 기반 정확 파악 선생 추천 목표 설명 악어 대표 에스 비대 캐릭터 교육 플랫 메타 버스 사업 추진 악어 지난해 시범 박스 서비스 비대 영상 아이 대상 선생 일대다 놀이 교육 교육 제공 서비스 악어 메타 버스 기술 선생 가상 공간 아이 애니메이션 캐릭터 등장 제공 서비스 준비 대표 아이 선생 만나 또래 경험 필요 검증 선생 만나 메타 버스 공간 선생 아이 상호 작용 경험 교육 효과 기대 강조 악어 올해 기준 누적 다운로드 이상 누적 회원 이상 가입 서비스 월간 활성 이상 올해 작년 동기 대비 매출 평균 이상 성장 온라인 서비스 오프라인 공간 지난해 오픈 이후 일산 차병 원점 판교 파미 어스 확대 성공 바탕 건설 건설사 다양 업무 협약 아파트 커뮤니티 센터 서비스 제공 관련 사업 확대,악어 서비스 이미지 아이 서비스 악어 첨단 기술 활용 서비스 고도 방문 선생 애플리케이션 플랫폼 알고리즘 메타 버스 기술 적용 추진 악어 구조 모델링 기업 모티브 협력 아이 발달 상태 파악 선생 추천 기술 개발 모티브 인지 구조 실시간 모델링 분석 아동 주의력 결핍 과잉 행동 장애 진단 치료 디지털 데이터 제공 회사 이때 게임 주요 매개체 이용자 상태 자연 파악 진단 관련 데이터 서비스 지원 전문 기업 악어 모티브 인지 모델링 아이 발달 상태 파악 기술 개발 하반기 아동 교사 추천 알고리즘 적용 계획 악어 인정받 이달 과학 기술 정보 통신부 민관 협력 기반 스타트업 육성 선정 동안 플랫 데이터 양사 기술 접목 예정 이르 서비스 적용 악어 서비스 이용 아이 게임 아이 발달 상태 파악 예정 단기 연결 그치 상태 데이터 기반 정확 파악 선생 추천 목표 설명 악어 에스 비대 캐릭터 교육 플랫 메타 버스 추진 악어 시범 박스 서비스 비대 영상 아이 대상 선생 일대다 놀이 교육 교육 제공 서비스 악어 메타 버스 기술 선생 가상 공간 아이 애니메이션 캐릭터 등장 제공 서비스 준비 아이 선생 만나 또래 경험 필요 검증 선생 만나 메타 버스 공간 선생 아이 상호 작용 경험 교육 효과 기대 강조 악어 기준 누적 다운로드 이상 누적 회원 이상 가입 서비스 월간 활성 이상 작년 동기 매출 평균 이상 성장 온라인 서비스 오프라인 공간 오픈 일산 차병 원점 판교 파미 어스 확대 성공 바탕 다양 업무 협약 아파트 커뮤니티 센터 서비스 제공 관련 확대
2021-08-01,계양 가구 분양 예정,분양 캘린더 전국 가구 분양 전국 가구 분양 예정 부동산 따르 전국 단지 가구 사전 청약 포함 분양 시작 일반 분양 가구 계양 경기 자이 화성 파크 드림 분양 예정 현대 건설 건설 번지 일원 계양 분양 지하 지상 최고 전용 가구 전용 가구 일반 분양 공급 지하철 작전 역과 간선 급행 버스 정류장 이용 주변 효성 동초 명현 성고 밀집 반경 계양 구청 병원 다양 기반 시설 자리 공원 환경 건설 경기 도시 개발 지구 블록 자이 공급 예정 지하 지상 전용 면적 가구 구성 환승역 도보 도시 이동 배후 수요 반경 거리 캠퍼스 전자 업종 입주 예정 진위 디지털 파크 일반 산업 브레인 시티 일반 예정 규모 모델 경기 포천 오픈 앞두 라인 건설 견본 주택 오픈 들어서 지하 지상 전용 가구 규모 아파트 국도 고덕 진입 가능 이용,분양 캘린더 전국 가구 분양 전국 가구 분양 예정 부동산 전국 단지 가구 사전 청약 포함 분양 시작 분양 가구 계양 경기 자이 화성 파크 드림 분양 예정 현대 번지 일원 계양 분양 지하 지상 최고 전용 가구 전용 가구 분양 공급 지하철 작전 역과 간선 급행 버스 정류장 이용 주변 효성 동초 명현 성고 밀집 반경 계양 구청 병원 다양 기반 시설 자리 공원 환경 경기 도시 개발 지구 블록 자이 공급 예정 지하 지상 전용 면적 가구 구성 환승역 도보 도시 이동 배후 수요 반경 거리 캠퍼스 전자 업종 입주 예정 진위 디지털 파크 산업 브레인 시티 예정 규모 모델 경기 포천 오픈 앞두 라인 견본 주택 오픈 들어서 지하 지상 전용 가구 규모 아파트 국도 고덕 진입 이용
2021-08-01,가점 마련 가능 추첨제 분양,오전 부동산 중개 업소 월세 매물 정보 사진 올해 하반기 도시 사전 청약 분양 관심 커지 가점 사회 초년생 마련 기대 소득 무주택 기간 부양가족 가점 기준 당첨 방법 추첨제 수요자 마련 최적 기회 부동산 전문 리서치 업체 따르 올해 상반기 전국 청약 당첨 가점 최저 최고 평균 지역 살펴보 평균 지방 경우 평균 청약 당첨 가점 신규 분양 아파트 청약 당첨 불리 수요자 추첨제 적극 활용 필요 전문가 조언 추첨제 가점 무작위 추첨 청약 당첨자 선별 방식 전용 면적 초과 주택 기준 투기 지구 전체 공급 물량 청약 지역 추첨제 적용 전용 면적 이하 경우 청약 지역 추첨제 적용 규제 지역 전용 면적 이하 물량 추첨제 당첨자 선정 전용 면적 초과 추첨제 고덕 강일 지구 지구 블록 세상 강일 분양 예정 지하 지상 전용 면적 가구 규모 전용 면적 물량 추첨제 적용 효성 중공업 번지 일원 분양 예정 지하 지상 최고 전용 면적 가구 규모 조성 전용 면적 추첨제 적용 건설 번지 일원 자이 분양 예정 지하 지상 최고 전용 가구 규모 규제 지역 공급 추첨제 적용 한편 지난주 종시 아파트 청약 인원 몰리 추첨제 위력 확인 산원 청약 따르 순위 청약 자이 시티 아파트 가구 모집 청약 신청 평균 경쟁 기록 가구 전용 면적 초과 물량 전체 가구 구성 특별 공급 물량 제외 일반 공급 물량 해당 가구 추첨제 물량 배정 추첨제 물량 주택 기존 주택 처분 서약 당첨 가능 점자 기존 주택 처분 고려 주택 풀이,오전 부동산 중개 업소 월세 매물 정보 사진 하반기 도시 사전 청약 분양 관심 커지 가점 사회 초년생 마련 기대 소득 무주택 기간 부양가족 가점 기준 당첨 방법 추첨제 수요자 마련 최적 기회 부동산 전문 리서치 업체 전국 청약 당첨 가점 최저 최고 평균 지역 살펴보 평균 지방 경우 평균 청약 당첨 가점 신규 분양 아파트 청약 당첨 불리 수요자 추첨제 적극 활용 필요 전문가 조언 추첨제 가점 무작위 추첨 청약 당첨자 선별 방식 전용 면적 초과 주택 기준 투기 지구 전체 공급 물량 청약 지역 추첨제 적용 전용 면적 이하 경우 청약 지역 추첨제 적용 규제 지역 전용 면적 이하 물량 추첨제 당첨자 선정 전용 면적 초과 추첨제 고덕 강일 지구 지구 블록 세상 강일 분양 예정 지하 지상 전용 면적 가구 규모 전용 면적 물량 추첨제 적용 효성 중공업 번지 일원 분양 예정 지하 지상 최고 전용 면적 가구 규모 조성 전용 면적 추첨제 적용 번지 일원 자이 분양 예정 지하 지상 최고 전용 가구 규모 규제 지역 공급 추첨제 적용 한편 지난주 종시 아파트 청약 인원 몰리 추첨제 위력 확인 산원 청약 순위 청약 자이 시티 아파트 가구 모집 청약 신청 평균 경쟁 기록 가구 전용 면적 초과 물량 전체 가구 구성 특별 공급 물량 제외 공급 물량 가구 추첨제 물량 배정 추첨제 물량 주택 주택 처분 서약 당첨 점자 주택 처분 고려 주택 풀이
2021-08-01,도시 수도 지방 청약 시장 풍성,규모 주목 도시 사전 청약 열기 수도 지방 청약 시장 부동산 전문 리서치 업체 리얼 따르 이번 전국 가구 오피스텔 도시 생활 주택 공공 분양 공공 지원 민간 임대 포함 청약 접수 진행 가구 도시 지구 복정 지구 계양 지구 물량 포함 도시 물량 반영 가구 웃도 올해 최대 물량 전체 물량 가운데 절반 이상 가구 수도 분양 예정 지방 규모 단지 공급 예정 수요자 관심 전망 현대 건설 건설 컨소시엄 계양 구역 주택 개발 정비 사업 공급 계양 순위 청약 접수 진행 전용 면적 가구 규모 단지 가구 일반 분양 예정 부동산업 관계자 규모 브랜드 단지 희소성 단지 피트 니스 센터 실내 골프 연습장 연습장 건식 사우 시설 조성 예정 주변 노후 단지 밀집 신축 아파트 수요 조감도 건설 순위 청약 접수 단지 인근 교동 공원 조성 민간 공원 특례 사업 민간 공원 특례 사업 이상 도시 공원 계획 부지 이상 공원 조성 지자체 기부 채납 나머지 주거 시설 조성 사업 단지 제공 규모 교동 공원 테마 예정 전용 면적 가구 규모 일반 분양 물량 인근 강릉 이용 시간 이동 가능 인근 국도 이용 양양 고속도 고속도 이동도 일원 공급 한화 신부 순위 청약 접수 진행 단지 전용 면적 가구 규모 전체 물량 가량 지역 희소성 중대 구성 수요자 관심 전망 단지 도심 위치 교통 여건 뛰어나 평가 차량 이용 번국 수도 이동 수도 전철 정역 이용 가능 자이 조감도 건설 도시 개발 지구 블록 공급 자이 순위 청약 접수 진행 단지 가구 규모 일반 분양 공급 단지 순위 기타 지역 전국구 청약 가능 건설 따르 순위 해당 지역 이상 연속 거주 사람 청약 기타 지역 미만 거주자 전국 지역 거주자 순위 해당 지역 미달 나오 기타 지역 기회 분양 책정 인근 위치 파크 블록 전용 면적 거래 당첨 가량 시세 차익 예상 도시 개발 지구 번지 일대 규모 조성 가구 공급 가량 수용 예정 공원 학교 유치원 주차장 복지 시설 공공 청사 기반 시설 기자,규모 주목 도시 사전 청약 열기 수도 지방 청약 시장 부동산 전문 리서치 업체 리얼 전국 가구 오피스텔 도시 생활 주택 공공 분양 공공 지원 민간 임대 포함 청약 접수 진행 가구 도시 지구 복정 지구 계양 지구 물량 포함 도시 물량 반영 가구 웃도 최대 물량 전체 물량 가운데 절반 이상 가구 수도 분양 예정 지방 규모 단지 공급 예정 수요자 관심 전망 현대 컨소시엄 계양 구역 주택 개발 정비 공급 계양 순위 청약 접수 진행 전용 면적 가구 규모 단지 가구 분양 예정 부동산업 관계자 규모 브랜드 단지 희소성 단지 피트 니스 센터 실내 골프 연습장 연습장 건식 사우 시설 조성 예정 주변 노후 단지 밀집 신축 아파트 수요 조감도 순위 청약 접수 단지 인근 교동 공원 조성 민간 공원 특례 민간 공원 특례 이상 도시 공원 계획 부지 이상 공원 조성 지자체 기부 채납 나머지 주거 시설 조성 단지 제공 규모 교동 공원 테마 예정 전용 면적 가구 규모 분양 물량 인근 강릉 이용 시간 이동 인근 국도 이용 양양 고속도 고속도 이동도 일원 공급 한화 신부 순위 청약 접수 진행 단지 전용 면적 가구 규모 전체 물량 가량 지역 희소성 중대 구성 수요자 관심 전망 단지 도심 위치 교통 여건 뛰어나 평가 차량 이용 번국 수도 이동 수도 전철 정역 이용 자이 조감도 도시 개발 지구 블록 공급 자이 순위 청약 접수 진행 단지 가구 규모 분양 공급 단지 순위 기타 지역 전국구 청약 순위 지역 이상 연속 거주 사람 청약 기타 지역 미만 거주자 전국 지역 거주자 순위 지역 미달 나오 기타 지역 기회 분양 책정 인근 위치 파크 블록 전용 면적 거래 당첨 가량 시세 차익 예상 도시 개발 지구 번지 일대 규모 조성 가구 공급 가량 수용 예정 공원 학교 유치원 주차장 복지 시설 공공 청사 기반 시설
2021-08-01,재건축 기다리 바람,수도 노후 규제 재건축 눈길 대치 특화 설계 적용 전문가 미래 가치 물론 수지 경기 지역 노후 단지 중심 바람 초반 단지 전진단 기준 초과 이익 환수 분양 상한 규제 재건축 추진 상대 규제 모델링 아파트 버금가 단지 바꾸 시도 잇따르 전문가 경우 재건축 사업 떨어지 미래 가치 조언 추진 부동산 따르 추진 단지 문정 시영 가구 가구 가구 강변 가구 가구 목동 우성 가구 가구 중구 남산 타운 가구 대부분 초반 준공 사업 가능 건축 연한 준공 재건축 건축 주요 단지 재건축 사업 상황 준공 안팎 단지 돌리 이유 사업 기간 재건축 전문가 건축 사업 평균 소요 기간 사업 정도 예상 기본 계획 수립 추진 위원회 설립 주민 동의 조합 설립 구조 이후 선정 안전 진단 통과 도시 계획 건축 심의 철거 착공 단계 거치 고덕 조감도 주요 추진 가운데 아파트 조합 선정 사업 속도 높이 준공 단지 지하철 거리 기존 지상 가구 전용 지하 지상 가구 탈바꿈 예정 지명 클레프 제안 독창 외관 디자인 스카이라운지 커뮤니티 조경 특화 설계 적용 투시도 준공 조합 설립 건설 선정 단지 지하 지상 가구 지하 지상 최고 가구 바뀌 안전 진단 등급 수평 증축 전진단 등급 이상 수직 증축 등급 이상 면적 늘리 별동 수평 증축 가능 수평 증축 전진단 수직 증축 안전 진단 사업 기간 정도 컨소시엄 공사비 들어가 규모 준공 단지 지하 지상 가구 규모 향후 수직 증축 지하 지상 가구 일반 분양 가구 탈바꿈 전망 일반 분양 물량 사업 수지 현대 조감도 경기 안양 추진 올해 재건축 연한 도시 단지 경우 대부분 용적 사업 돌리 도시 마을 준공 최근 건축 심의 통과 사업 계획 승인 단계 앞두 수평 증축 가구 가구 가구 전망 수지 현대 아파트 사업 속도 높이 전문가 마련 재건축 단지 장단점 파악 부동산 인포 리서치 팀장 단지 수익 입지 일반 분양 물량 영향 미치 준공 규모,수도 노후 규제 재건축 눈길 대치 특화 설계 적용 전문가 미래 가치 물론 수지 경기 지역 노후 단지 중심 바람 초반 단지 전진단 기준 초과 이익 환수 분양 상한 규제 재건축 추진 상대 규제 모델링 아파트 버금가 단지 바꾸 시도 잇따르 전문가 경우 재건축 떨어지 미래 가치 조언 추진 부동산 추진 단지 문정 시영 가구 가구 가구 강변 가구 가구 목동 우성 가구 가구 중구 남산 타운 가구 대부분 초반 준공 건축 연한 준공 재건축 건축 주요 단지 재건축 상황 준공 안팎 단지 돌리 이유 기간 재건축 전문가 건축 평균 소요 기간 정도 예상 기본 계획 수립 추진 위원회 설립 주민 동의 조합 설립 구조 선정 안전 진단 통과 도시 계획 건축 심의 철거 착공 단계 거치 고덕 조감도 주요 추진 가운데 아파트 조합 선정 속도 높이 준공 단지 지하철 거리 지상 가구 전용 지하 지상 가구 탈바꿈 예정 지명 클레프 제안 독창 외관 디자인 스카이라운지 커뮤니티 조경 특화 설계 적용 투시도 준공 조합 설립 선정 단지 지하 지상 가구 지하 지상 최고 가구 바뀌 안전 진단 등급 수평 증축 전진단 등급 이상 수직 증축 등급 이상 면적 늘리 별동 수평 증축 수평 증축 전진단 수직 증축 안전 진단 기간 정도 컨소시엄 공사비 들어가 규모 준공 단지 지하 지상 가구 규모 향후 수직 증축 지하 지상 가구 분양 가구 탈바꿈 전망 분양 물량 수지 현대 조감도 경기 안양 추진 재건축 연한 도시 단지 경우 대부분 용적 돌리 도시 마을 준공 건축 심의 통과 계획 승인 단계 앞두 수평 증축 가구 가구 가구 전망 수지 현대 아파트 속도 높이 전문가 마련 재건축 단지 장단점 파악 부동산 인포 리서치 팀장 단지 수익 입지 분양 물량 영향 미치 준공 규모
2021-08-01,영상 문화 탄력 경제 도약 계기,도시 첨단 산단 완공 구도심 균형 개발 가능 연결 정부 요청 기초 단체장 시장 미래 각종 사업 착수 앞두 성과 높이 부족 채우 다음 시장 선거 도전 시장 지난달 경제 인터뷰 재선 도전 공식 아끼 정치인 행보 인상 시장 시민 잘사 경제 시민 체감 문화 시민 걱정 안전 목표 지휘봉 성과 센터 목표 대비 취업률 폐쇄 회로 감지 가능 지능 선별 관제 시스템 전환 안전망 강화 기초 단체 최초 데이터 기반 대응 서비스 구축 저감 미래 이끌 사업 순항 영상 문화 조성 사업 건설 컨소시엄 최종 사업 협약 탄력 문화 산업 복합 센터 타워 다양 문화 시설 문화 도시 선도 기대 모으 대장 공공 주택 지구 로봇 산업 유치 자족 기능 일자리 창출 도시 첨단 조성 방안 추진 시장 영상 문화 산업 종합 운동장 일대 지식 첨단 거점 개발 사업 완성 구도심 균형 발전 가능 고부 가치 산업 지역 경제 활성 일자리 창출 경제 도약 계기 시장 고령 사회 대비 통합 강화 전담 조직 만들 건강 보건소 종합 복지 연결 건강 의료 요양 서비스 스톱 지원 시장 통합 대상자 통합 서비스 제공 시장 도시 검단 수도 노선 종합 운동장 축소 실망감 나타내 원안 추진 중앙 정부 지속 요청 시장 지역 현안 자원 순환 센터 광역화 사업 필요 확인 수도 매립지 폐쇄 앞두 폐기물 전처리 시설 노후 운영 중단 예정 시민 피해 해결 강조 기자,도시 첨단 산단 완공 구도심 균형 개발 연결 정부 요청 기초 단체장 시장 미래 각종 착수 앞두 성과 높이 부족 채우 다음 시장 선거 도전 시장 지난달 경제 인터뷰 재선 도전 공식 아끼 정치인 행보 인상 시장 시민 잘사 경제 시민 체감 문화 시민 걱정 안전 목표 지휘봉 성과 센터 목표 취업률 폐쇄 회로 감지 지능 선별 관제 시스템 전환 안전망 강화 기초 단체 최초 데이터 기반 대응 서비스 구축 저감 미래 이끌 순항 영상 문화 조성 컨소시엄 최종 협약 탄력 문화 산업 복합 센터 타워 다양 문화 시설 문화 도시 선도 기대 모으 대장 공공 주택 지구 로봇 산업 유치 자족 기능 일자리 창출 도시 첨단 조성 방안 추진 시장 영상 문화 산업 종합 운동장 일대 지식 첨단 거점 개발 완성 구도심 균형 발전 고부 가치 산업 지역 경제 활성 일자리 창출 경제 도약 계기 시장 고령 사회 통합 강화 전담 조직 만들 건강 보건소 종합 복지 연결 건강 의료 요양 서비스 스톱 지원 시장 통합 대상자 통합 서비스 제공 시장 도시 검단 수도 노선 종합 운동장 축소 실망감 나타내 원안 추진 중앙 정부 지속 요청 시장 지역 현안 자원 순환 센터 광역화 필요 확인 수도 매립지 폐쇄 앞두 폐기물 전처리 시설 노후 운영 중단 예정 시민 피해 해결 강조
2021-08-01,수도 지방 청약 시장 풍성 규모 단지,도시 사전 청약 열기 수도 지방 청약 시장 부동산 전문 리서치 업체 리얼 따르 전국 가구 오피스텔 도시 생활 주택 공공 분양 공공 지원 민간 임대 포함 청약 접수 진행 가구 도시 지구 복정 지구 계양 지구 물량 포함 전체 물량 가운데 절반 이상 가구 수도권 분양 예정 현대 건설 건설 컨소시엄 계양 구역 주택 개발 정비 사업 공급 계양 순위 청약 접수 진행 건설 도시 개발 지구 블록 공급 자이 순위 청약 접수 진행 단지 개동 가구 규모 일반 분양 공급 분양 책정 인근 위치 파크 블록 전용 면적 거래 당첨 가량 시세 차익 예상 건설 순위 청약 접수 기자,도시 사전 청약 열기 수도 지방 청약 시장 부동산 전문 리서치 업체 리얼 전국 가구 오피스텔 도시 생활 주택 공공 분양 공공 지원 민간 임대 포함 청약 접수 진행 가구 도시 지구 복정 지구 계양 지구 물량 포함 전체 물량 가운데 절반 이상 가구 수도권 분양 예정 현대 컨소시엄 계양 구역 주택 개발 정비 공급 계양 순위 청약 접수 진행 도시 개발 지구 블록 공급 자이 순위 청약 접수 진행 단지 개동 가구 규모 분양 공급 분양 책정 인근 위치 파크 블록 전용 면적 거래 당첨 가량 시세 차익 예상 순위 청약 접수
2021-08-01,건설 홍성 자이 분양 장항선 개통 예정,건설 번지 일원 홍성 자이 분양 홍성 자이 지하 지상 가구 규모 건설 전용 면적 타입 분양 전용 면적 가구 가구 가구 가구 단지 도보 이용 경기 화성 복선 전철 개통 예정 장항선 대야 복선 전철 사업 완공 예정 인근 홍성 터미널 홍장 북로 홍성 예산 수덕사 이동 인근 홍성 의료 홍성 전통 시장 남초 홍주 학교 도보 통학 입주 하반기,번지 일원 홍성 자이 분양 홍성 자이 지하 지상 가구 규모 전용 면적 타입 분양 전용 면적 가구 가구 가구 가구 단지 도보 이용 경기 화성 복선 전철 개통 예정 장항선 대야 복선 전철 완공 예정 인근 홍성 터미널 홍장 북로 홍성 예산 수덕사 이동 인근 홍성 의료 홍성 전통 시장 남초 홍주 학교 도보 통학 입주 하반기
